publish_time,Video ID,Title,Comment,updatedAt,likeCount
2017-06-11T22:30:06.000Z,oBI0MU73nlc,"DRAGON BALL FighterZ - E3 2017 Trailer  | XB1, PS4, PC","The only thing i don't like from this game is the 3v3, if you can play 2v2 or 1v1.... TAKE MY FILTHY MONEY !!",2017-06-12T01:19:57.000Z,0
2017-06-11T22:30:06.000Z,oBI0MU73nlc,"DRAGON BALL FighterZ - E3 2017 Trailer  | XB1, PS4, PC",THIS IS WHAT MVC INFINITE SHOULD HAVE BEEN I CAN'T WAIT FOR THIS HYYYYYYPPPPPPPPE!!!!!,2017-06-12T01:19:49.000Z,0
2017-06-11T22:30:06.000Z,oBI0MU73nlc,"DRAGON BALL FighterZ - E3 2017 Trailer  | XB1, PS4, PC",Marvel vs capcom,2017-06-12T01:19:01.000Z,0
2017-06-11T22:30:06.000Z,oBI0MU73nlc,"DRAGON BALL FighterZ - E3 2017 Trailer  | XB1, PS4, PC",This is just a couple steps away from perfectly mimicking 2D animation.,2017-06-12T01:18:40.000Z,0
2017-06-11T22:30:06.000Z,oBI0MU73nlc,"DRAGON BALL FighterZ - E3 2017 Trailer  | XB1, PS4, PC",#TeamFrieza,2017-06-12T01:18:21.000Z,0
2017-06-11T22:30:06.000Z,oBI0MU73nlc,"DRAGON BALL FighterZ - E3 2017 Trailer  | XB1, PS4, PC","One of the very, very, very few games I'll buy early.",2017-06-12T01:18:08.000Z,1
2017-06-11T22:30:06.000Z,oBI0MU73nlc,"DRAGON BALL FighterZ - E3 2017 Trailer  | XB1, PS4, PC",Dragon Ball Fighters Z looks so fucking clean!!!!!!!!!!!!!!! Xenoverse where u at!!!?????!!??!,2017-06-12T01:18:05.000Z,3
2017-06-11T22:30:06.000Z,oBI0MU73nlc,"DRAGON BALL FighterZ - E3 2017 Trailer  | XB1, PS4, PC",fuck marvel vs Capcom!,2017-06-12T01:17:55.000Z,0
2017-06-11T22:30:06.000Z,oBI0MU73nlc,"DRAGON BALL FighterZ - E3 2017 Trailer  | XB1, PS4, PC",Could we call this the spiritual successor to Burst Limit?,2017-06-12T01:17:51.000Z,0
2017-06-11T22:30:06.000Z,oBI0MU73nlc,"DRAGON BALL FighterZ - E3 2017 Trailer  | XB1, PS4, PC",メテオ路線で頼むぞぉぉ,2017-06-12T01:16:33.000Z,0
2017-06-11T22:30:06.000Z,oBI0MU73nlc,"DRAGON BALL FighterZ - E3 2017 Trailer  | XB1, PS4, PC",WHY NO SWITCH SUPPORT?,2017-06-12T01:15:52.000Z,0
2017-06-11T22:30:06.000Z,oBI0MU73nlc,"DRAGON BALL FighterZ - E3 2017 Trailer  | XB1, PS4, PC","THIS GAME LOOKS FUCKING HYPE! This is gonna be GREAT!

we'll rip xenoverse series.

Also can anyone tell me what the song that was playing in the background of the video was?",2017-06-12T01:12:50.000Z,3
2017-06-11T22:30:06.000Z,oBI0MU73nlc,"DRAGON BALL FighterZ - E3 2017 Trailer  | XB1, PS4, PC",is this  Budokai 3 With New graphic + super characters,2017-06-12T01:12:48.000Z,4
2017-06-11T22:30:06.000Z,oBI0MU73nlc,"DRAGON BALL FighterZ - E3 2017 Trailer  | XB1, PS4, PC",street fighter v re skin,2017-06-12T01:11:12.000Z,0
2017-06-11T22:30:06.000Z,oBI0MU73nlc,"DRAGON BALL FighterZ - E3 2017 Trailer  | XB1, PS4, PC","Awesome. Hopefully it's a modest sized roster. No need for a bunch of characters no one will even touch, just to say ""We got a lot characters ya'll!"". Focus on making a modest number balanced, and actually feel different to use.",2017-06-12T01:10:35.000Z,0
2017-06-11T22:30:06.000Z,oBI0MU73nlc,"DRAGON BALL FighterZ - E3 2017 Trailer  | XB1, PS4, PC",I came and I didnt even touch myself.,2017-06-12T01:10:20.000Z,1
2017-06-11T22:30:06.000Z,oBI0MU73nlc,"DRAGON BALL FighterZ - E3 2017 Trailer  | XB1, PS4, PC",the hype is truly insaiyan for this trailer. other than that it just makes me miss kid teen gohan,2017-06-12T01:09:56.000Z,0
2017-06-11T22:30:06.000Z,oBI0MU73nlc,"DRAGON BALL FighterZ - E3 2017 Trailer  | XB1, PS4, PC","Eat your heart out, Marvel Infinite",2017-06-12T01:09:43.000Z,0
2017-06-11T22:30:06.000Z,oBI0MU73nlc,"DRAGON BALL FighterZ - E3 2017 Trailer  | XB1, PS4, PC",Better be crossplatform!!,2017-06-12T01:09:13.000Z,1
2017-06-11T22:30:06.000Z,oBI0MU73nlc,"DRAGON BALL FighterZ - E3 2017 Trailer  | XB1, PS4, PC",THIS LOOKS SO GOOD I WANT IT NOT!,2017-06-12T01:08:44.000Z,0
2017-06-11T22:30:06.000Z,oBI0MU73nlc,"DRAGON BALL FighterZ - E3 2017 Trailer  | XB1, PS4, PC",Capcom can keep MVCI,2017-06-12T01:07:58.000Z,7
2017-06-11T22:30:06.000Z,oBI0MU73nlc,"DRAGON BALL FighterZ - E3 2017 Trailer  | XB1, PS4, PC",Now this... this is the Dragon Ball Z game we wanted!!!!! Thank you!!!! Day one purchase for me!,2017-06-12T01:07:37.000Z,0
2017-06-11T22:30:06.000Z,oBI0MU73nlc,"DRAGON BALL FighterZ - E3 2017 Trailer  | XB1, PS4, PC",when the hell we gonna get a new budokai tenkaichi?,2017-06-12T01:07:22.000Z,0
2017-06-11T22:30:06.000Z,oBI0MU73nlc,"DRAGON BALL FighterZ - E3 2017 Trailer  | XB1, PS4, PC",Thank you.,2017-06-12T01:06:35.000Z,0
2017-06-11T22:30:06.000Z,oBI0MU73nlc,"DRAGON BALL FighterZ - E3 2017 Trailer  | XB1, PS4, PC",ehhh and swicht versión?,2017-06-12T01:06:51.000Z,0
2017-06-11T22:30:06.000Z,oBI0MU73nlc,"DRAGON BALL FighterZ - E3 2017 Trailer  | XB1, PS4, PC",Finally a real Nex Gen DBZ fighting game!,2017-06-12T01:06:04.000Z,0
2017-06-11T22:30:06.000Z,oBI0MU73nlc,"DRAGON BALL FighterZ - E3 2017 Trailer  | XB1, PS4, PC",OMFG DAY 1,2017-06-12T01:05:36.000Z,0
2017-06-11T22:30:06.000Z,oBI0MU73nlc,"DRAGON BALL FighterZ - E3 2017 Trailer  | XB1, PS4, PC","Just make tenkaichi budokai 3 remaster and HD, no negative vibes but DBZ is not a streetfigher kind game.",2017-06-12T01:04:50.000Z,0
2017-06-11T22:30:06.000Z,oBI0MU73nlc,"DRAGON BALL FighterZ - E3 2017 Trailer  | XB1, PS4, PC","My only complain is the roster, it seems too ""Z focused"" :(
Us Super fans havent got a proper game yet ! other than that, I feel like this game is going to be better than Budokai 3. for real.",2017-06-12T01:04:38.000Z,0
2017-06-11T22:30:06.000Z,oBI0MU73nlc,"DRAGON BALL FighterZ - E3 2017 Trailer  | XB1, PS4, PC","Don't get me wrong, this looks dope AF, but why 3v3? Dragonball has always been about one fighter overcoming another. Mashing 6 fighters together sort of defies the spirit of DBZ.",2017-06-12T01:03:56.000Z,0
2017-06-11T22:30:06.000Z,oBI0MU73nlc,"DRAGON BALL FighterZ - E3 2017 Trailer  | XB1, PS4, PC",color me curious BN,2017-06-12T01:03:35.000Z,0
2017-06-11T22:30:06.000Z,oBI0MU73nlc,"DRAGON BALL FighterZ - E3 2017 Trailer  | XB1, PS4, PC",can I get a *#HYPE*,2017-06-12T01:03:10.000Z,0
2017-06-11T22:30:06.000Z,oBI0MU73nlc,"DRAGON BALL FighterZ - E3 2017 Trailer  | XB1, PS4, PC","Looks so fucking cool. The logo is trash though, and I hope we have an option for the american voice actors. Don't want to listen to grandma Goku yelling ""hahahahahahaha!""",2017-06-12T01:03:29.000Z,0
2017-06-11T22:30:06.000Z,oBI0MU73nlc,"DRAGON BALL FighterZ - E3 2017 Trailer  | XB1, PS4, PC",Why is the animation so choppy and gross,2017-06-12T01:02:50.000Z,2
2017-06-11T22:30:06.000Z,oBI0MU73nlc,"DRAGON BALL FighterZ - E3 2017 Trailer  | XB1, PS4, PC",Top !!!!!!!,2017-06-12T01:01:39.000Z,0
2017-06-11T22:30:06.000Z,oBI0MU73nlc,"DRAGON BALL FighterZ - E3 2017 Trailer  | XB1, PS4, PC",this game...... it's over 9000!!!!!!!!!,2017-06-12T00:59:58.000Z,0
2017-06-11T22:30:06.000Z,oBI0MU73nlc,"DRAGON BALL FighterZ - E3 2017 Trailer  | XB1, PS4, PC",Gimme Gimme,2017-06-12T00:59:49.000Z,0
2017-06-11T22:30:06.000Z,oBI0MU73nlc,"DRAGON BALL FighterZ - E3 2017 Trailer  | XB1, PS4, PC",what about dbz xenoverse 3,2017-06-12T00:57:50.000Z,0
2017-06-11T22:30:06.000Z,oBI0MU73nlc,"DRAGON BALL FighterZ - E3 2017 Trailer  | XB1, PS4, PC",so...no love for the switch xD. oh boy I can see nintendo going wii u again...with third party not giving a crap about the switch once ps4 pro and Xbox 1x comes out...nintend should have adjusted the hardware to be compatible to the latest engines. Guess I will have to switch back to sony or xbox...sorry nintendo zelda is very good  but I wont be playing zelda forever ya know,2017-06-12T00:57:08.000Z,0
2017-06-11T22:30:06.000Z,oBI0MU73nlc,"DRAGON BALL FighterZ - E3 2017 Trailer  | XB1, PS4, PC",I love Street Fighter like games. This is AWESOME!,2017-06-12T00:57:03.000Z,0
2017-06-11T22:30:06.000Z,oBI0MU73nlc,"DRAGON BALL FighterZ - E3 2017 Trailer  | XB1, PS4, PC",for n switch?,2017-06-12T00:57:02.000Z,0
2017-06-11T22:30:06.000Z,oBI0MU73nlc,"DRAGON BALL FighterZ - E3 2017 Trailer  | XB1, PS4, PC",i think db xenoverse will be better even so it didn't come out i don't like games with 2d fighting,2017-06-12T00:55:38.000Z,0
2017-06-11T22:30:06.000Z,oBI0MU73nlc,"DRAGON BALL FighterZ - E3 2017 Trailer  | XB1, PS4, PC",ohhhhhhhh myyyyyyyyy GOOOOOOOOOOOOOOOOOOOOOOOD!!!!!!!!!!!!!!!!!!!!!!!!!!!!!!!!!!!!! thx Arc System ¬ Namcom Bandai,2017-06-12T00:54:04.000Z,0
2017-06-11T22:30:06.000Z,oBI0MU73nlc,"DRAGON BALL FighterZ - E3 2017 Trailer  | XB1, PS4, PC",I'm just commenting to make the comments an even 700 cuz I have OCD....bye :-),2017-06-12T00:54:00.000Z,2
2017-06-11T22:30:06.000Z,oBI0MU73nlc,"DRAGON BALL FighterZ - E3 2017 Trailer  | XB1, PS4, PC","I bet as soon as XV3 gets confirmed everyones gonna be back on the XV hype train like ""oOGZHNZDANLLGfjjv THIS IS SOOOOO CLEEEANNN XV3 IS SO LITTTTTTTT"" just no.",2017-06-12T00:53:20.000Z,0
2017-06-11T22:30:06.000Z,oBI0MU73nlc,"DRAGON BALL FighterZ - E3 2017 Trailer  | XB1, PS4, PC","This reminds me of the good ol Budokai series, this is going to be awesome!",2017-06-12T00:52:50.000Z,9
2017-06-11T22:30:06.000Z,oBI0MU73nlc,"DRAGON BALL FighterZ - E3 2017 Trailer  | XB1, PS4, PC",God bless Arc System Works,2017-06-12T00:52:22.000Z,0
2017-06-11T22:30:06.000Z,oBI0MU73nlc,"DRAGON BALL FighterZ - E3 2017 Trailer  | XB1, PS4, PC",THE MOST WONDERFUL THING OF THIS WORLD,2017-06-12T00:52:18.000Z,0
2017-06-11T22:30:06.000Z,oBI0MU73nlc,"DRAGON BALL FighterZ - E3 2017 Trailer  | XB1, PS4, PC",But where's my create a character...,2017-06-12T00:52:02.000Z,0
2017-06-11T22:30:06.000Z,oBI0MU73nlc,"DRAGON BALL FighterZ - E3 2017 Trailer  | XB1, PS4, PC",shout outs to all my mr satan mains out there,2017-06-12T00:51:53.000Z,0
2017-06-11T22:30:06.000Z,oBI0MU73nlc,"DRAGON BALL FighterZ - E3 2017 Trailer  | XB1, PS4, PC",I have a boner,2017-06-12T00:49:41.000Z,0
2017-06-11T22:30:06.000Z,oBI0MU73nlc,"DRAGON BALL FighterZ - E3 2017 Trailer  | XB1, PS4, PC",is a 3ds game,2017-06-12T00:48:29.000Z,0
2017-06-11T22:30:06.000Z,oBI0MU73nlc,"DRAGON BALL FighterZ - E3 2017 Trailer  | XB1, PS4, PC",Totally not MvC DBZ Edition.,2017-06-12T00:46:56.000Z,0
2017-06-11T22:30:06.000Z,oBI0MU73nlc,"DRAGON BALL FighterZ - E3 2017 Trailer  | XB1, PS4, PC",Please have Limitbreak X Survivor be a theme in this game,2017-06-12T00:44:11.000Z,1
2017-06-11T22:30:06.000Z,oBI0MU73nlc,"DRAGON BALL FighterZ - E3 2017 Trailer  | XB1, PS4, PC",DAY 1 LETS GO!,2017-06-12T00:43:17.000Z,0
2017-06-11T22:30:06.000Z,oBI0MU73nlc,"DRAGON BALL FighterZ - E3 2017 Trailer  | XB1, PS4, PC","LETS GOOOOOOO , GET MYDBZ BACK ON",2017-06-12T00:42:57.000Z,0
2017-06-11T22:30:06.000Z,oBI0MU73nlc,"DRAGON BALL FighterZ - E3 2017 Trailer  | XB1, PS4, PC","ohhh weon, me acabo de masturbar viendo este vídeo<3 hype total 1000%",2017-06-12T00:42:42.000Z,0
2017-06-11T22:30:06.000Z,oBI0MU73nlc,"DRAGON BALL FighterZ - E3 2017 Trailer  | XB1, PS4, PC",SOOOO HYPED!!!,2017-06-12T00:42:19.000Z,0
2017-06-11T22:30:06.000Z,oBI0MU73nlc,"DRAGON BALL FighterZ - E3 2017 Trailer  | XB1, PS4, PC",I wonder how much of the game is done already,2017-06-12T00:41:57.000Z,0
2017-06-11T22:30:06.000Z,oBI0MU73nlc,"DRAGON BALL FighterZ - E3 2017 Trailer  | XB1, PS4, PC",This looks like a terrible fanmade flash game. 😂😂,2017-06-12T00:41:22.000Z,0
2017-06-11T22:30:06.000Z,oBI0MU73nlc,"DRAGON BALL FighterZ - E3 2017 Trailer  | XB1, PS4, PC",this is some guilty gear and blazeblue shit here,2017-06-12T00:41:05.000Z,0
2017-06-11T22:30:06.000Z,oBI0MU73nlc,"DRAGON BALL FighterZ - E3 2017 Trailer  | XB1, PS4, PC",FINALLY!!!!!!!!!.plz dont fuck this up.i've been waiting all my life.my body is ready.,2017-06-12T00:39:16.000Z,11
2017-06-11T22:30:06.000Z,oBI0MU73nlc,"DRAGON BALL FighterZ - E3 2017 Trailer  | XB1, PS4, PC","This is glorious. I wish there was a Switch version, but I'll be happy playing on my PC too.
GJ, Bandai Namco",2017-06-12T00:38:07.000Z,0
2017-06-11T22:30:06.000Z,oBI0MU73nlc,"DRAGON BALL FighterZ - E3 2017 Trailer  | XB1, PS4, PC",OMG 2018 COME ON!!! PLease TAKE MY MONEY!!!,2017-06-12T00:36:16.000Z,0
2017-06-11T22:30:06.000Z,oBI0MU73nlc,"DRAGON BALL FighterZ - E3 2017 Trailer  | XB1, PS4, PC",O..MY..GOD!!! This is a day one buy for me.,2017-06-12T00:35:58.000Z,1
2017-06-11T22:30:06.000Z,oBI0MU73nlc,"DRAGON BALL FighterZ - E3 2017 Trailer  | XB1, PS4, PC",Waiting for English dubs like \ o / ... NEED MAH CHRIS SABAT AND SEAN SCHEMMEL!,2017-06-12T00:34:24.000Z,0
2017-06-11T22:30:06.000Z,oBI0MU73nlc,"DRAGON BALL FighterZ - E3 2017 Trailer  | XB1, PS4, PC",this looks like Dragon Ball Z ultimate battle 22 meets Marvel vs. Capcom😉😎🐇,2017-06-12T00:33:52.000Z,4
2017-06-11T22:30:06.000Z,oBI0MU73nlc,"DRAGON BALL FighterZ - E3 2017 Trailer  | XB1, PS4, PC","Guilty Gear based Dragon Ball Z?
Arc System Works too?
:O",2017-06-12T00:33:14.000Z,0
2017-06-11T22:30:06.000Z,oBI0MU73nlc,"DRAGON BALL FighterZ - E3 2017 Trailer  | XB1, PS4, PC",Pre-order now and get Dragon Ball Xenoverse 2 completely remastered,2017-06-12T00:31:05.000Z,0
2017-06-11T22:30:06.000Z,oBI0MU73nlc,"DRAGON BALL FighterZ - E3 2017 Trailer  | XB1, PS4, PC",This looks better than the past Dragon Ball Z games but I'm not that impressed to a point of buying this game.,2017-06-12T00:30:43.000Z,0
2017-06-11T22:30:06.000Z,oBI0MU73nlc,"DRAGON BALL FighterZ - E3 2017 Trailer  | XB1, PS4, PC",It ain't Xenoverse 3 but it's still fucking awesome,2017-06-12T00:27:09.000Z,0
2017-06-11T22:30:06.000Z,oBI0MU73nlc,"DRAGON BALL FighterZ - E3 2017 Trailer  | XB1, PS4, PC",Hypeness Can't be Held in for A Year m8 but I'll wait,2017-06-12T00:26:38.000Z,0
2017-06-11T22:30:06.000Z,oBI0MU73nlc,"DRAGON BALL FighterZ - E3 2017 Trailer  | XB1, PS4, PC",HHHHHHYYYYYYYYYPPPPPPPPPEEEEEEEEEEE YYYYYEEEEEESSSSSSS,2017-06-12T00:26:25.000Z,0
2017-06-11T22:30:06.000Z,oBI0MU73nlc,"DRAGON BALL FighterZ - E3 2017 Trailer  | XB1, PS4, PC",Will it be for PS4?,2017-06-12T00:25:58.000Z,0
2017-06-11T22:30:06.000Z,oBI0MU73nlc,"DRAGON BALL FighterZ - E3 2017 Trailer  | XB1, PS4, PC",Easily the game of the show so far.,2017-06-12T00:25:41.000Z,0
2017-06-11T22:30:06.000Z,oBI0MU73nlc,"DRAGON BALL FighterZ - E3 2017 Trailer  | XB1, PS4, PC",Gonna say it once more if you do not play/like guilty gear or blazblue this game is not for you 😏it's too hype 🔥🔥🔥🔥🔥🔥💥💥💥💥💥,2017-06-12T00:25:20.000Z,0
2017-06-11T22:30:06.000Z,oBI0MU73nlc,"DRAGON BALL FighterZ - E3 2017 Trailer  | XB1, PS4, PC",is this gonna play like street fighter?   ;_;,2017-06-12T00:25:12.000Z,0
2017-06-11T22:30:06.000Z,oBI0MU73nlc,"DRAGON BALL FighterZ - E3 2017 Trailer  | XB1, PS4, PC",Who else loved the way Goku transformed at the beginning,2017-06-12T00:24:34.000Z,0
2017-06-11T22:30:06.000Z,oBI0MU73nlc,"DRAGON BALL FighterZ - E3 2017 Trailer  | XB1, PS4, PC",YES!!! Day one!,2017-06-12T00:22:38.000Z,0
2017-06-11T22:30:06.000Z,oBI0MU73nlc,"DRAGON BALL FighterZ - E3 2017 Trailer  | XB1, PS4, PC",This makes me want to get into Dragon Ball.,2017-06-12T00:22:07.000Z,0
2017-06-11T22:30:06.000Z,oBI0MU73nlc,"DRAGON BALL FighterZ - E3 2017 Trailer  | XB1, PS4, PC",the frame rate is giving me anxiety :c,2017-06-12T00:21:58.000Z,0
2017-06-11T22:30:06.000Z,oBI0MU73nlc,"DRAGON BALL FighterZ - E3 2017 Trailer  | XB1, PS4, PC","Looks damn near perfect, can't wait!!",2017-06-12T00:20:45.000Z,0
2017-06-11T22:30:06.000Z,oBI0MU73nlc,"DRAGON BALL FighterZ - E3 2017 Trailer  | XB1, PS4, PC",OH MAN I AM PUMPED!! NOW THIS I AM MASTERING,2017-06-12T00:20:22.000Z,0
2017-06-11T22:30:06.000Z,oBI0MU73nlc,"DRAGON BALL FighterZ - E3 2017 Trailer  | XB1, PS4, PC",Games that have 2d graphics and are fighters are becoming obsolete,2017-06-12T00:20:08.000Z,0
2017-06-11T22:30:06.000Z,oBI0MU73nlc,"DRAGON BALL FighterZ - E3 2017 Trailer  | XB1, PS4, PC",No switch?,2017-06-12T00:18:22.000Z,0
2017-06-11T22:30:06.000Z,oBI0MU73nlc,"DRAGON BALL FighterZ - E3 2017 Trailer  | XB1, PS4, PC",I CAN'T STOP PLAYING THIS TRAILER!! IT SO GOODDDDD,2017-06-12T00:18:14.000Z,1
2017-06-11T22:30:06.000Z,oBI0MU73nlc,"DRAGON BALL FighterZ - E3 2017 Trailer  | XB1, PS4, PC",Yes!!,2017-06-12T00:18:09.000Z,0
2017-06-11T22:30:06.000Z,oBI0MU73nlc,"DRAGON BALL FighterZ - E3 2017 Trailer  | XB1, PS4, PC",When Bandai gives their licence to a good team.,2017-06-12T00:17:57.000Z,0
2017-06-11T22:30:06.000Z,oBI0MU73nlc,"DRAGON BALL FighterZ - E3 2017 Trailer  | XB1, PS4, PC",is it for ps4 too the conference for Xbox made it sound like an exclusive?,2017-06-12T00:17:43.000Z,0
2017-06-11T22:30:06.000Z,oBI0MU73nlc,"DRAGON BALL FighterZ - E3 2017 Trailer  | XB1, PS4, PC",WHY 2D WHY,2017-06-12T00:16:51.000Z,0
2017-06-11T22:30:06.000Z,oBI0MU73nlc,"DRAGON BALL FighterZ - E3 2017 Trailer  | XB1, PS4, PC",sou o único,2017-06-12T00:16:35.000Z,0
2017-06-11T22:30:06.000Z,oBI0MU73nlc,"DRAGON BALL FighterZ - E3 2017 Trailer  | XB1, PS4, PC",Dragon Ball Fighter Z > Xenoverse,2017-06-12T00:16:35.000Z,298
2017-06-11T22:30:06.000Z,oBI0MU73nlc,"DRAGON BALL FighterZ - E3 2017 Trailer  | XB1, PS4, PC",Oh yes this is the new dragon ball game we been waiting for.,2017-06-12T00:16:17.000Z,0
2017-06-11T22:30:06.000Z,oBI0MU73nlc,"DRAGON BALL FighterZ - E3 2017 Trailer  | XB1, PS4, PC",This is the one i been waiting for since i was a kid.,2017-06-12T00:16:08.000Z,0
2017-06-11T22:30:06.000Z,oBI0MU73nlc,"DRAGON BALL FighterZ - E3 2017 Trailer  | XB1, PS4, PC",When will we have another Berserk game?,2017-06-12T00:16:01.000Z,0
2017-06-11T22:30:06.000Z,oBI0MU73nlc,"DRAGON BALL FighterZ - E3 2017 Trailer  | XB1, PS4, PC",This looks hypeua and a bit like dragon Ball z budokai and ultimate battle 22. I like it.,2017-06-12T00:15:38.000Z,1
2017-06-11T22:30:06.000Z,oBI0MU73nlc,"DRAGON BALL FighterZ - E3 2017 Trailer  | XB1, PS4, PC","finally a dragon ball game that looks good and goes back to traditional 2d fighting mechanics. congratulations. and please, no more of that xenoverse create your fantasy fighter bullshit",2017-06-12T00:14:43.000Z,0
2017-06-11T22:30:06.000Z,oBI0MU73nlc,"DRAGON BALL FighterZ - E3 2017 Trailer  | XB1, PS4, PC","About time they made a DBZ game like this. A 2D ""sprite"" fighting game. Should have been done a long time ago.",2017-06-12T00:13:30.000Z,0
2017-06-11T22:30:06.000Z,oBI0MU73nlc,"DRAGON BALL FighterZ - E3 2017 Trailer  | XB1, PS4, PC",SSJ3 still looks the most powerful to me in terms of looks compared to SSJGOD and even the now defunct SSJ4. Must be the nostalgia glasses,2017-06-12T00:12:49.000Z,0
2017-06-11T22:30:06.000Z,oBI0MU73nlc,"DRAGON BALL FighterZ - E3 2017 Trailer  | XB1, PS4, PC","shit my pants,  changed my pants then pissed myself",2017-06-12T00:12:29.000Z,0
2017-06-11T22:30:06.000Z,oBI0MU73nlc,"DRAGON BALL FighterZ - E3 2017 Trailer  | XB1, PS4, PC",It looks like an arcade game man i wish they can just go back to the budakai tenchachi 3 days thats my favorite game out the dbz series,2017-06-12T00:12:13.000Z,0
2017-06-11T22:30:06.000Z,oBI0MU73nlc,"DRAGON BALL FighterZ - E3 2017 Trailer  | XB1, PS4, PC",yea kill that god mode crap!!! lets goooooo!!!!,2017-06-12T00:10:57.000Z,0
2017-06-11T22:30:06.000Z,oBI0MU73nlc,"DRAGON BALL FighterZ - E3 2017 Trailer  | XB1, PS4, PC",I'M SO FUCKING HAPPY!!! THANK YOU RED TEAM!! YOU'RE THE FUCKING BEEEEST!!!!!!,2017-06-12T00:11:24.000Z,0
2017-06-11T22:30:06.000Z,oBI0MU73nlc,"DRAGON BALL FighterZ - E3 2017 Trailer  | XB1, PS4, PC",take my soul,2017-06-12T00:09:42.000Z,0
2017-06-11T22:30:06.000Z,oBI0MU73nlc,"DRAGON BALL FighterZ - E3 2017 Trailer  | XB1, PS4, PC","Switch version, DO IT BANDAI!",2017-06-12T00:09:24.000Z,91
2017-06-11T22:30:06.000Z,oBI0MU73nlc,"DRAGON BALL FighterZ - E3 2017 Trailer  | XB1, PS4, PC",i need this in my Nintendo Switch please!,2017-06-12T00:09:16.000Z,69
2017-06-11T22:30:06.000Z,oBI0MU73nlc,"DRAGON BALL FighterZ - E3 2017 Trailer  | XB1, PS4, PC",i'm breathless right now.,2017-06-12T00:08:55.000Z,1
2017-06-11T22:30:06.000Z,oBI0MU73nlc,"DRAGON BALL FighterZ - E3 2017 Trailer  | XB1, PS4, PC","Meh, will try it but not impressed, Xenoverse is still my favorite",2017-06-12T00:08:10.000Z,0
2017-06-11T22:30:06.000Z,oBI0MU73nlc,"DRAGON BALL FighterZ - E3 2017 Trailer  | XB1, PS4, PC",THANK YOU BAMCO!!!!!!!!! THANK YOU ARCSYS!!!!!!!,2017-06-12T00:08:01.000Z,0
2017-06-11T22:30:06.000Z,oBI0MU73nlc,"DRAGON BALL FighterZ - E3 2017 Trailer  | XB1, PS4, PC",58 Naruto fans watched this video.,2017-06-12T00:07:59.000Z,3
2017-06-11T22:30:06.000Z,oBI0MU73nlc,"DRAGON BALL FighterZ - E3 2017 Trailer  | XB1, PS4, PC","trash, i want budaikai tenkenshi 3 or 4 on a ps4",2017-06-12T00:07:25.000Z,0
2017-06-11T22:30:06.000Z,oBI0MU73nlc,"DRAGON BALL FighterZ - E3 2017 Trailer  | XB1, PS4, PC",ALL MY YES!!!,2017-06-12T00:07:10.000Z,1
2017-06-11T22:30:06.000Z,oBI0MU73nlc,"DRAGON BALL FighterZ - E3 2017 Trailer  | XB1, PS4, PC",Game looks great but I swear to God if it doesn't get English voices I'll be very dissapointed. The last two DBZ games weren't translated for some reason.,2017-06-12T00:07:09.000Z,0
2017-06-11T22:30:06.000Z,oBI0MU73nlc,"DRAGON BALL FighterZ - E3 2017 Trailer  | XB1, PS4, PC",Early 2018. That sounds so familiar.,2017-06-12T00:06:15.000Z,0
2017-06-11T22:30:06.000Z,oBI0MU73nlc,"DRAGON BALL FighterZ - E3 2017 Trailer  | XB1, PS4, PC",i'll play it on my ps2,2017-06-12T00:05:39.000Z,0
2017-06-11T22:30:06.000Z,oBI0MU73nlc,"DRAGON BALL FighterZ - E3 2017 Trailer  | XB1, PS4, PC","""Early""",2017-06-12T00:02:54.000Z,0
2017-06-11T22:30:06.000Z,oBI0MU73nlc,"DRAGON BALL FighterZ - E3 2017 Trailer  | XB1, PS4, PC",HOLY FUCK DUDE! THIS GAME LOOKS SO FUCKING SICK!!,2017-06-12T00:02:12.000Z,0
2017-06-11T22:30:06.000Z,oBI0MU73nlc,"DRAGON BALL FighterZ - E3 2017 Trailer  | XB1, PS4, PC",THANK YOU FOR MAKING/FUNDING THIS GAME!,2017-06-12T00:00:50.000Z,0
2017-06-11T22:30:06.000Z,oBI0MU73nlc,"DRAGON BALL FighterZ - E3 2017 Trailer  | XB1, PS4, PC","whens the funeral for xenoverse 2? lol who am i kidding, once this is released, most of you will flock back to xenoverse once you realize this game will take actual skill to win and gets flooded by the FGC, still hyped for this tho",2017-06-12T00:01:32.000Z,0
2017-06-11T22:30:06.000Z,oBI0MU73nlc,"DRAGON BALL FighterZ - E3 2017 Trailer  | XB1, PS4, PC",YEEEEEESSSSSSSSS THIS IS WHAT I WANT,2017-06-11T23:59:58.000Z,0
2017-06-11T22:30:06.000Z,oBI0MU73nlc,"DRAGON BALL FighterZ - E3 2017 Trailer  | XB1, PS4, PC",2.5D????,2017-06-11T23:59:51.000Z,0
2017-06-11T22:30:06.000Z,oBI0MU73nlc,"DRAGON BALL FighterZ - E3 2017 Trailer  | XB1, PS4, PC","It's running on unreal engine, WHY isn't there a switch port Bandai?! smh",2017-06-11T23:59:13.000Z,0
2017-06-11T22:30:06.000Z,oBI0MU73nlc,"DRAGON BALL FighterZ - E3 2017 Trailer  | XB1, PS4, PC",I bet its gonna be better than XenoAss!,2017-06-11T23:59:10.000Z,0
2017-06-11T22:30:06.000Z,oBI0MU73nlc,"DRAGON BALL FighterZ - E3 2017 Trailer  | XB1, PS4, PC",I'm moist,2017-06-11T23:57:41.000Z,0
2017-06-11T22:30:06.000Z,oBI0MU73nlc,"DRAGON BALL FighterZ - E3 2017 Trailer  | XB1, PS4, PC",CLOSED BETA THIS SUMMER! RELEASE BY EARLY 2018! WHAT THE **** I LOVE YOU GuyZ!,2017-06-11T23:57:39.000Z,0
2017-06-11T22:30:06.000Z,oBI0MU73nlc,"DRAGON BALL FighterZ - E3 2017 Trailer  | XB1, PS4, PC",<3,2017-06-11T23:57:05.000Z,0
2017-06-11T22:30:06.000Z,oBI0MU73nlc,"DRAGON BALL FighterZ - E3 2017 Trailer  | XB1, PS4, PC",There better be a Nintendo Switch version!!!!! >:(,2017-06-11T23:55:46.000Z,34
2017-06-11T22:30:06.000Z,oBI0MU73nlc,"DRAGON BALL FighterZ - E3 2017 Trailer  | XB1, PS4, PC",Come on Bandai!! Bring this to Nintendo Switch as well.,2017-06-11T23:55:38.000Z,0
2017-06-11T22:30:06.000Z,oBI0MU73nlc,"DRAGON BALL FighterZ - E3 2017 Trailer  | XB1, PS4, PC",I hope the game is not as stupidly hectic as the trailer makes it out to be. And the framerate / lack of fluidity here makes me puke.,2017-06-11T23:56:39.000Z,0
2017-06-11T22:30:06.000Z,oBI0MU73nlc,"DRAGON BALL FighterZ - E3 2017 Trailer  | XB1, PS4, PC",The Zero Xenoverse Plan has just begun.,2017-06-12T03:11:25.000Z,0
2017-06-11T22:30:06.000Z,oBI0MU73nlc,"DRAGON BALL FighterZ - E3 2017 Trailer  | XB1, PS4, PC",This looks like the most savage DBZ game in YEARS.,2017-06-11T23:53:08.000Z,0
2017-06-11T22:30:06.000Z,oBI0MU73nlc,"DRAGON BALL FighterZ - E3 2017 Trailer  | XB1, PS4, PC","This is too much 2d, a perfect DB Game for me is a 3D Graphics in 2D camera angle like Budokai Series or Burst Limit.",2017-06-11T23:48:37.000Z,0
2017-06-11T22:30:06.000Z,oBI0MU73nlc,"DRAGON BALL FighterZ - E3 2017 Trailer  | XB1, PS4, PC",This is going to take over the fighting game scene,2017-06-11T23:48:27.000Z,0
2017-06-11T22:30:06.000Z,oBI0MU73nlc,"DRAGON BALL FighterZ - E3 2017 Trailer  | XB1, PS4, PC",I just can't believe it. I like xenoverse...but... An actual fighting game? a real fighter? I can't believe it. MY DREAM HAS FINALY COME TRUE I CAN'T FUCKING BELIEVE ITTTT!!!!!!,2017-06-11T23:48:15.000Z,0
2017-06-11T22:30:06.000Z,oBI0MU73nlc,"DRAGON BALL FighterZ - E3 2017 Trailer  | XB1, PS4, PC",why this isn't coming to Switch,2017-06-11T23:48:11.000Z,26
2017-06-11T22:30:06.000Z,oBI0MU73nlc,"DRAGON BALL FighterZ - E3 2017 Trailer  | XB1, PS4, PC",I love the name. Simple and to the point.,2017-06-11T23:47:54.000Z,0
2017-06-11T22:30:06.000Z,oBI0MU73nlc,"DRAGON BALL FighterZ - E3 2017 Trailer  | XB1, PS4, PC",I'll buy only if master roshi and yamcha are playable,2017-06-11T23:47:50.000Z,0
2017-06-11T22:30:06.000Z,oBI0MU73nlc,"DRAGON BALL FighterZ - E3 2017 Trailer  | XB1, PS4, PC",this looks like shit,2017-06-11T23:47:21.000Z,0
2017-06-11T22:30:06.000Z,oBI0MU73nlc,"DRAGON BALL FighterZ - E3 2017 Trailer  | XB1, PS4, PC",THE HYPE IS REAL!!!!!,2017-06-11T23:46:49.000Z,0
2017-06-11T22:30:06.000Z,oBI0MU73nlc,"DRAGON BALL FighterZ - E3 2017 Trailer  | XB1, PS4, PC","Xenoverse 2 just came out few months ago and now this?
hell yea this looks promising
XENO 2 was a comeplete disapointment",2017-06-11T23:46:20.000Z,2
