publish_time,Video ID,Title,Comment,updatedAt,likeCount
2017-06-11T22:30:06.000Z,oBI0MU73nlc,"DRAGON BALL FighterZ - E3 2017 Trailer  | XB1, PS4, PC",This is a really good trailer.,2019-10-01T04:22:24.000Z,0
2017-06-11T22:30:06.000Z,oBI0MU73nlc,"DRAGON BALL FighterZ - E3 2017 Trailer  | XB1, PS4, PC","can someone tell me the ethos, pathos, and logos for this ad",2019-09-03T23:08:28.000Z,0
2017-06-11T22:30:06.000Z,oBI0MU73nlc,"DRAGON BALL FighterZ - E3 2017 Trailer  | XB1, PS4, PC",True rating of game: TV-PG : (V) (L) and version PC new rating: PC-PG.,2019-09-06T22:07:34.000Z,0
2017-06-11T22:30:06.000Z,oBI0MU73nlc,"DRAGON BALL FighterZ - E3 2017 Trailer  | XB1, PS4, PC","“Wow this hyper dbz game sure is cool.”
“Yeah but what about a shitty 3d version that costs full price. Oh and dlc”",2019-08-10T01:25:15.000Z,0
2017-06-11T22:30:06.000Z,oBI0MU73nlc,"DRAGON BALL FighterZ - E3 2017 Trailer  | XB1, PS4, PC",Imagine they played Rock the Dragon over this trailer,2019-06-28T01:58:33.000Z,0
2017-06-11T22:30:06.000Z,oBI0MU73nlc,"DRAGON BALL FighterZ - E3 2017 Trailer  | XB1, PS4, PC",mortal combat and dragon ball combined,2019-02-28T15:50:28.000Z,0
2017-06-11T22:30:06.000Z,oBI0MU73nlc,"DRAGON BALL FighterZ - E3 2017 Trailer  | XB1, PS4, PC",This game was so shit,2019-02-03T16:20:25.000Z,0
2017-06-11T22:30:06.000Z,oBI0MU73nlc,"DRAGON BALL FighterZ - E3 2017 Trailer  | XB1, PS4, PC","I honestly never got into the franchise (Although I do have a lot of respect on Akira Toriyama due to him doing art style for games such as Dragon Quest series, Chrono Trigger, and Blue Dragon.), but I still think this game looks sick and awesome, that's why I ordered it from Amazon yesterday. Besides, I knew the game is made by the same company that made the Guilty Gear series and the BlazBlue series. :D",2019-02-03T00:20:34.000Z,0
2017-06-11T22:30:06.000Z,oBI0MU73nlc,"DRAGON BALL FighterZ - E3 2017 Trailer  | XB1, PS4, PC",This sucks! Looks like a game of the 80s..,2019-01-28T22:49:03.000Z,0
2017-06-11T22:30:06.000Z,oBI0MU73nlc,"DRAGON BALL FighterZ - E3 2017 Trailer  | XB1, PS4, PC",Amazing first year,2019-01-25T16:03:55.000Z,2
2017-06-11T22:30:06.000Z,oBI0MU73nlc,"DRAGON BALL FighterZ - E3 2017 Trailer  | XB1, PS4, PC",a bigger waste of money than burst limit,2019-01-14T04:19:29.000Z,1
2017-06-11T22:30:06.000Z,oBI0MU73nlc,"DRAGON BALL FighterZ - E3 2017 Trailer  | XB1, PS4, PC","I MISSED BUDOKAI 1,2,3 THANKS FOR THIS! (i hateed xnoverse and tencaichi and watever else)",2019-01-03T17:04:39.000Z,1
2017-06-11T22:30:06.000Z,oBI0MU73nlc,"DRAGON BALL FighterZ - E3 2017 Trailer  | XB1, PS4, PC",Aye it won fighting game of the year 2018,2018-12-07T22:36:08.000Z,1
2017-06-11T22:30:06.000Z,oBI0MU73nlc,"DRAGON BALL FighterZ - E3 2017 Trailer  | XB1, PS4, PC",YYYYYEEEAH! This is a fite’n game done right!,2018-11-28T17:34:11.000Z,0
2017-06-11T22:30:06.000Z,oBI0MU73nlc,"DRAGON BALL FighterZ - E3 2017 Trailer  | XB1, PS4, PC","you elitist dbz fans are so annoying. everyone doesn't have to be in love with this game and think it's the best thing ever. people can like xenoverse and similar games better. it's called an opinion, learn to deal with someone having one that differs from yours. expressing an opinion that's different from yours isn't 'whining'.",2018-11-21T23:01:14.000Z,0
2017-06-11T22:30:06.000Z,oBI0MU73nlc,"DRAGON BALL FighterZ - E3 2017 Trailer  | XB1, PS4, PC",1 year later,2018-11-02T17:21:13.000Z,0
2017-06-11T22:30:06.000Z,oBI0MU73nlc,"DRAGON BALL FighterZ - E3 2017 Trailer  | XB1, PS4, PC",i have no problem if any next dragon ball anime uses 3d like this,2018-10-08T04:42:39.000Z,0
2017-06-11T22:30:06.000Z,oBI0MU73nlc,"DRAGON BALL FighterZ - E3 2017 Trailer  | XB1, PS4, PC",I wish goku family had more powerful voice like U.S. version,2018-10-05T15:41:18.000Z,0
2017-06-11T22:30:06.000Z,oBI0MU73nlc,"DRAGON BALL FighterZ - E3 2017 Trailer  | XB1, PS4, PC",Still want this music track to come to the game,2018-08-22T19:58:21.000Z,3
2017-06-11T22:30:06.000Z,oBI0MU73nlc,"DRAGON BALL FighterZ - E3 2017 Trailer  | XB1, PS4, PC",But why didn’t they put this music in the actual game?,2018-08-04T17:33:31.000Z,5
2017-06-11T22:30:06.000Z,oBI0MU73nlc,"DRAGON BALL FighterZ - E3 2017 Trailer  | XB1, PS4, PC","Should improve the connections when one is going to make an online game, because I tried to fight against others with the signal in 2 lines and I cut the game in the middle of the fight, it has happened to me several times.",2018-07-18T05:20:19.000Z,0
2017-06-11T22:30:06.000Z,oBI0MU73nlc,"DRAGON BALL FighterZ - E3 2017 Trailer  | XB1, PS4, PC",Came here just to delete the jump force trailer of my mind,2018-06-11T06:00:06.000Z,14
2017-06-11T22:30:06.000Z,oBI0MU73nlc,"DRAGON BALL FighterZ - E3 2017 Trailer  | XB1, PS4, PC",awesome video!!,2018-05-07T06:28:12.000Z,0
2017-06-11T22:30:06.000Z,oBI0MU73nlc,"DRAGON BALL FighterZ - E3 2017 Trailer  | XB1, PS4, PC",This game looks like THE BEST GAME of Dragon Ball Z,2018-04-26T15:19:50.000Z,1
2017-06-11T22:30:06.000Z,oBI0MU73nlc,"DRAGON BALL FighterZ - E3 2017 Trailer  | XB1, PS4, PC",We wont dragon ball z budoki teknashi 4 who agrees,2018-04-24T12:47:35.000Z,1
2017-06-11T22:30:06.000Z,oBI0MU73nlc,"DRAGON BALL FighterZ - E3 2017 Trailer  | XB1, PS4, PC",Ma invece di questo che è brutto fate xenoverse 3,2018-04-24T07:56:47.000Z,0
2017-06-11T22:30:06.000Z,oBI0MU73nlc,"DRAGON BALL FighterZ - E3 2017 Trailer  | XB1, PS4, PC",I want to punch a hole into the sun. Who`s with me?,2018-04-09T16:17:57.000Z,1
2017-06-11T22:30:06.000Z,oBI0MU73nlc,"DRAGON BALL FighterZ - E3 2017 Trailer  | XB1, PS4, PC",trailer that KILLED MVC:I hype,2018-03-23T20:16:17.000Z,0
2017-06-11T22:30:06.000Z,oBI0MU73nlc,"DRAGON BALL FighterZ - E3 2017 Trailer  | XB1, PS4, PC",this honstly looks shit :(,2018-03-22T13:02:03.000Z,0
2017-06-11T22:30:06.000Z,oBI0MU73nlc,"DRAGON BALL FighterZ - E3 2017 Trailer  | XB1, PS4, PC",WHATS THE FUCKING SOOONG?!?!?!?!,2018-03-16T11:18:33.000Z,0
2017-06-11T22:30:06.000Z,oBI0MU73nlc,"DRAGON BALL FighterZ - E3 2017 Trailer  | XB1, PS4, PC","This game is horrible. I can't believe people like this crap. People are only saying this game is good because they are bandwagoning because of all the hype this crap got. Just stop being brainless morons who have no opinion of their own and just say their ""opinions "" are coincidentally always whatever gets a lot of hype and if it gets hype that automatically means it's good. It's sad to think something as amazing as Dragon Ball Z is being ruined by Fighterz, Super and the thing that originally ruined Dragon Ball by ruining it's fan base Dragon Ball AF.",2018-03-11T13:26:53.000Z,0
2017-06-11T22:30:06.000Z,oBI0MU73nlc,"DRAGON BALL FighterZ - E3 2017 Trailer  | XB1, PS4, PC",Dragon Ball FighterZ - 2018  http://dbfgame.net/,2018-03-10T01:28:31.000Z,0
2017-06-11T22:30:06.000Z,oBI0MU73nlc,"DRAGON BALL FighterZ - E3 2017 Trailer  | XB1, PS4, PC",the game is very very cool my brother,2018-03-07T15:43:43.000Z,0
2017-06-11T22:30:06.000Z,oBI0MU73nlc,"DRAGON BALL FighterZ - E3 2017 Trailer  | XB1, PS4, PC","This is a joke right?  That was literally ""1.27"" of what the fuck is going on...  Lol wtf??!",2018-03-03T21:57:50.000Z,0
2017-06-11T22:30:06.000Z,oBI0MU73nlc,"DRAGON BALL FighterZ - E3 2017 Trailer  | XB1, PS4, PC",better nerf cancer goku...no balance in this shit,2018-03-01T17:31:51.000Z,0
2017-06-11T22:30:06.000Z,oBI0MU73nlc,"DRAGON BALL FighterZ - E3 2017 Trailer  | XB1, PS4, PC","Have 1,000,000 Zeni",2018-02-27T18:33:31.000Z,0
2017-06-11T22:30:06.000Z,oBI0MU73nlc,"DRAGON BALL FighterZ - E3 2017 Trailer  | XB1, PS4, PC",What is the name of the music played?,2018-02-24T22:09:55.000Z,0
2017-06-11T22:30:06.000Z,oBI0MU73nlc,"DRAGON BALL FighterZ - E3 2017 Trailer  | XB1, PS4, PC","I think this ost is not released, is it?",2018-02-24T18:04:00.000Z,0
2017-06-11T22:30:06.000Z,oBI0MU73nlc,"DRAGON BALL FighterZ - E3 2017 Trailer  | XB1, PS4, PC",Easiest Method of Summoning – One button – DBFZ http://dbfgame.net/,2018-02-24T07:49:59.000Z,0
2017-06-11T22:30:06.000Z,oBI0MU73nlc,"DRAGON BALL FighterZ - E3 2017 Trailer  | XB1, PS4, PC",Wtf???? People love this game????? Seriously??,2018-02-17T07:34:19.000Z,0
2017-06-11T22:30:06.000Z,oBI0MU73nlc,"DRAGON BALL FighterZ - E3 2017 Trailer  | XB1, PS4, PC",I didn't know Marvel vs Capcom had this mod.,2018-02-13T00:40:52.000Z,0
2017-06-11T22:30:06.000Z,oBI0MU73nlc,"DRAGON BALL FighterZ - E3 2017 Trailer  | XB1, PS4, PC",wow this is the best cel shade i've ever seen,2018-02-10T20:59:46.000Z,2
2017-06-11T22:30:06.000Z,oBI0MU73nlc,"DRAGON BALL FighterZ - E3 2017 Trailer  | XB1, PS4, PC",WE WANT SWITCH!,2018-02-06T09:16:16.000Z,0
2017-06-11T22:30:06.000Z,oBI0MU73nlc,"DRAGON BALL FighterZ - E3 2017 Trailer  | XB1, PS4, PC","the moment MVC:I was dead
also RIP Xenoverse",2018-02-04T15:36:20.000Z,1
2017-06-11T22:30:06.000Z,oBI0MU73nlc,"DRAGON BALL FighterZ - E3 2017 Trailer  | XB1, PS4, PC",amazing,2018-02-02T15:58:04.000Z,0
2017-06-11T22:30:06.000Z,oBI0MU73nlc,"DRAGON BALL FighterZ - E3 2017 Trailer  | XB1, PS4, PC",Based Arc System Works,2018-02-02T14:42:41.000Z,2
2017-06-11T22:30:06.000Z,oBI0MU73nlc,"DRAGON BALL FighterZ - E3 2017 Trailer  | XB1, PS4, PC",Can this be ported over to the switch pls? Looks really good and idc if there's a graphical downgrade I just wanna buy,2018-01-27T04:02:35.000Z,0
2017-06-11T22:30:06.000Z,oBI0MU73nlc,"DRAGON BALL FighterZ - E3 2017 Trailer  | XB1, PS4, PC",Marvel vs Capcom + DBZ?,2018-01-26T20:06:13.000Z,0
2017-06-11T22:30:06.000Z,oBI0MU73nlc,"DRAGON BALL FighterZ - E3 2017 Trailer  | XB1, PS4, PC",Visit my website for more information on the heroes of the dragon-ball game http://dbfgame.net/,2018-01-26T02:09:31.000Z,0
2017-06-11T22:30:06.000Z,oBI0MU73nlc,"DRAGON BALL FighterZ - E3 2017 Trailer  | XB1, PS4, PC",The new Marvel vs Capcom looks good,2018-01-24T03:33:24.000Z,0
2017-06-11T22:30:06.000Z,oBI0MU73nlc,"DRAGON BALL FighterZ - E3 2017 Trailer  | XB1, PS4, PC","Play the new DragonBall game its FREE BETA OPEN, PLay  Now!     https://youtu.be/x0q7_UUPrpo    Juegas El nuevo juego de dragon ball z es GRATIS por tiempo limitado  https://youtu.be/x0q7_UUPrpo   (y)",2018-01-23T23:45:16.000Z,0
2017-06-11T22:30:06.000Z,oBI0MU73nlc,"DRAGON BALL FighterZ - E3 2017 Trailer  | XB1, PS4, PC",Copia a marvel vs capcom,2018-01-23T22:30:15.000Z,0
2017-06-11T22:30:06.000Z,oBI0MU73nlc,"DRAGON BALL FighterZ - E3 2017 Trailer  | XB1, PS4, PC",Fucking universe is sick!!,2018-01-23T19:12:40.000Z,0
2017-06-11T22:30:06.000Z,oBI0MU73nlc,"DRAGON BALL FighterZ - E3 2017 Trailer  | XB1, PS4, PC",60 bucks lol never.,2018-01-22T07:27:16.000Z,0
2017-06-11T22:30:06.000Z,oBI0MU73nlc,"DRAGON BALL FighterZ - E3 2017 Trailer  | XB1, PS4, PC",Yawn. No one that played BT3 will care about this. Re-master BT3 and clean up the controls a bit and you'll have a real masterpiece.,2018-01-21T07:32:00.000Z,0
2017-06-11T22:30:06.000Z,oBI0MU73nlc,"DRAGON BALL FighterZ - E3 2017 Trailer  | XB1, PS4, PC",when it will be released in pc ?????????,2018-01-20T19:01:27.000Z,0
2017-06-11T22:30:06.000Z,oBI0MU73nlc,"DRAGON BALL FighterZ - E3 2017 Trailer  | XB1, PS4, PC",Please allow for multiple skins like EG ssj4?,2018-01-19T08:01:19.000Z,0
2017-06-11T22:30:06.000Z,oBI0MU73nlc,"DRAGON BALL FighterZ - E3 2017 Trailer  | XB1, PS4, PC",Budokai tenkaichi 4 please. Full Story from dragonball to dragonball z with dragonball gt and super. Thats My Dream,2018-01-19T01:20:26.000Z,1
2017-06-11T22:30:06.000Z,oBI0MU73nlc,"DRAGON BALL FighterZ - E3 2017 Trailer  | XB1, PS4, PC","when will this guys invest in seriously in a open world kind of game man. dragonball is amazing and has such a potantial. just make at least a 3d game. i would love to see an open world 4 player (couch) dragon ball game. but i know that thats only a dream, but a REAL  3d game should be a must by now.",2018-01-18T12:08:10.000Z,0
2017-06-11T22:30:06.000Z,oBI0MU73nlc,"DRAGON BALL FighterZ - E3 2017 Trailer  | XB1, PS4, PC",♥♥,2018-01-18T06:26:35.000Z,0
2017-06-11T22:30:06.000Z,oBI0MU73nlc,"DRAGON BALL FighterZ - E3 2017 Trailer  | XB1, PS4, PC","Doesn't look as good as Xenoverse  1 or 2 , from what the showed the fighter list seems a bit limited",2018-01-18T00:00:19.000Z,0
2017-06-11T22:30:06.000Z,oBI0MU73nlc,"DRAGON BALL FighterZ - E3 2017 Trailer  | XB1, PS4, PC",jogo lindo,2018-01-17T23:14:09.000Z,0
2017-06-11T22:30:06.000Z,oBI0MU73nlc,"DRAGON BALL FighterZ - E3 2017 Trailer  | XB1, PS4, PC",Cadê os br,2018-01-17T02:22:21.000Z,1
2017-06-11T22:30:06.000Z,oBI0MU73nlc,"DRAGON BALL FighterZ - E3 2017 Trailer  | XB1, PS4, PC",Trailer looks fire!,2018-01-16T19:30:17.000Z,0
2017-06-11T22:30:06.000Z,oBI0MU73nlc,"DRAGON BALL FighterZ - E3 2017 Trailer  | XB1, PS4, PC",Can we just get budokai tenkaichi 4 or 3 remastered?,2018-01-15T08:54:07.000Z,0
2017-06-11T22:30:06.000Z,oBI0MU73nlc,"DRAGON BALL FighterZ - E3 2017 Trailer  | XB1, PS4, PC",I'm definitely getting this video game ;  I used to be a major DBZ  animated film fan .,2018-01-14T22:37:02.000Z,0
2017-06-11T22:30:06.000Z,oBI0MU73nlc,"DRAGON BALL FighterZ - E3 2017 Trailer  | XB1, PS4, PC",Is Android 21 playable because I have been wondering about that? Does anyone know?,2018-01-14T21:47:24.000Z,0
2017-06-11T22:30:06.000Z,oBI0MU73nlc,"DRAGON BALL FighterZ - E3 2017 Trailer  | XB1, PS4, PC",WE WANT THE SWITCH VERSION,2018-01-13T12:17:39.000Z,0
2017-06-11T22:30:06.000Z,oBI0MU73nlc,"DRAGON BALL FighterZ - E3 2017 Trailer  | XB1, PS4, PC",617 people who disliked this are Xenotards.,2018-01-12T18:35:12.000Z,0
2017-06-11T22:30:06.000Z,oBI0MU73nlc,"DRAGON BALL FighterZ - E3 2017 Trailer  | XB1, PS4, PC",pc download r.i.p /watch?v=DwX1qqKadIo,2018-01-08T17:39:07.000Z,0
2017-06-11T22:30:06.000Z,oBI0MU73nlc,"DRAGON BALL FighterZ - E3 2017 Trailer  | XB1, PS4, PC",MAN JUST MAKE TENKAICHI 4!,2018-01-06T11:42:12.000Z,0
2017-06-11T22:30:06.000Z,oBI0MU73nlc,"DRAGON BALL FighterZ - E3 2017 Trailer  | XB1, PS4, PC",Where is the Switch version ?,2018-01-06T02:15:29.000Z,0
2017-06-11T22:30:06.000Z,oBI0MU73nlc,"DRAGON BALL FighterZ - E3 2017 Trailer  | XB1, PS4, PC",it looks like a king of fighter,2018-01-05T18:48:41.000Z,0
2017-06-11T22:30:06.000Z,oBI0MU73nlc,"DRAGON BALL FighterZ - E3 2017 Trailer  | XB1, PS4, PC",Epic,2018-01-04T20:49:33.000Z,0
2017-06-11T22:30:06.000Z,oBI0MU73nlc,"DRAGON BALL FighterZ - E3 2017 Trailer  | XB1, PS4, PC",Banday namco is it coming for the switch ????,2018-01-04T02:12:35.000Z,0
2017-06-11T22:30:06.000Z,oBI0MU73nlc,"DRAGON BALL FighterZ - E3 2017 Trailer  | XB1, PS4, PC",I'm looking for details if this will support 2 player or 3 player local coop. Itll be a shame if it doesn't.,2018-01-03T12:09:38.000Z,0
2017-06-11T22:30:06.000Z,oBI0MU73nlc,"DRAGON BALL FighterZ - E3 2017 Trailer  | XB1, PS4, PC",fuck why steam??,2018-01-03T10:19:40.000Z,0
2017-06-11T22:30:06.000Z,oBI0MU73nlc,"DRAGON BALL FighterZ - E3 2017 Trailer  | XB1, PS4, PC","Will this game feature a classic story mode? Or is it just about fighting with all the characters, and playing online, arcade modes and so on... And what do you guys thing about xenoverse 2? does it worth it? i am looking for a DBZ Game with classic story modes :)",2018-01-02T15:14:18.000Z,0
2017-06-11T22:30:06.000Z,oBI0MU73nlc,"DRAGON BALL FighterZ - E3 2017 Trailer  | XB1, PS4, PC",Extreme butoden for Xbox PC and PlayStation,2018-01-02T06:28:45.000Z,0
2017-06-11T22:30:06.000Z,oBI0MU73nlc,"DRAGON BALL FighterZ - E3 2017 Trailer  | XB1, PS4, PC","No thanks, I'll take my DBZ Budokai Tenkaichi 3",2018-01-01T14:56:37.000Z,0
2017-06-11T22:30:06.000Z,oBI0MU73nlc,"DRAGON BALL FighterZ - E3 2017 Trailer  | XB1, PS4, PC","can destroy my DS4? if can, i wont play it",2017-12-31T17:42:35.000Z,0
2017-06-11T22:30:06.000Z,oBI0MU73nlc,"DRAGON BALL FighterZ - E3 2017 Trailer  | XB1, PS4, PC",Remember the last dragon Ball game I bought was Budokai 2 waaay back in the day but will definitely be picking this up!,2017-12-30T16:44:47.000Z,0
2017-06-11T22:30:06.000Z,oBI0MU73nlc,"DRAGON BALL FighterZ - E3 2017 Trailer  | XB1, PS4, PC",2d,2017-12-28T04:16:35.000Z,0
2017-06-11T22:30:06.000Z,oBI0MU73nlc,"DRAGON BALL FighterZ - E3 2017 Trailer  | XB1, PS4, PC","Dumb Name
Cool Game",2017-12-26T09:48:38.000Z,0
2017-06-11T22:30:06.000Z,oBI0MU73nlc,"DRAGON BALL FighterZ - E3 2017 Trailer  | XB1, PS4, PC",Thanks for sharing. http://dbfgame.net/,2017-12-26T09:27:28.000Z,0
2017-06-11T22:30:06.000Z,oBI0MU73nlc,"DRAGON BALL FighterZ - E3 2017 Trailer  | XB1, PS4, PC",Too bad Super can't look this good.,2017-12-25T08:05:40.000Z,0
2017-06-11T22:30:06.000Z,oBI0MU73nlc,"DRAGON BALL FighterZ - E3 2017 Trailer  | XB1, PS4, PC","WIth How Big the Switch is Now, i wonder if they plan on Releasing it on there too?",2017-12-25T01:05:05.000Z,0
2017-06-11T22:30:06.000Z,oBI0MU73nlc,"DRAGON BALL FighterZ - E3 2017 Trailer  | XB1, PS4, PC",DBZ > Naruto,2017-12-24T13:15:20.000Z,0
2017-06-11T22:30:06.000Z,oBI0MU73nlc,"DRAGON BALL FighterZ - E3 2017 Trailer  | XB1, PS4, PC",this shit looks like its supposed to be on a Gameboy,2017-12-23T15:41:58.000Z,1
2017-06-11T22:30:06.000Z,oBI0MU73nlc,"DRAGON BALL FighterZ - E3 2017 Trailer  | XB1, PS4, PC","man its gonna be a busy first couple months! God of War 4 , Monster Hunter World , and now THIS?! Ima be a busy bee lol",2017-12-22T23:50:45.000Z,0
2017-06-11T22:30:06.000Z,oBI0MU73nlc,"DRAGON BALL FighterZ - E3 2017 Trailer  | XB1, PS4, PC",I hate that this game isn't coming to the switch,2017-12-20T17:29:36.000Z,0
2017-06-11T22:30:06.000Z,oBI0MU73nlc,"DRAGON BALL FighterZ - E3 2017 Trailer  | XB1, PS4, PC","I NEED THE MUSIC, ANY SOURCE ?",2017-12-20T14:21:43.000Z,0
2017-06-11T22:30:06.000Z,oBI0MU73nlc,"DRAGON BALL FighterZ - E3 2017 Trailer  | XB1, PS4, PC",this may become the best Dragon ball game ever made,2017-12-20T14:21:29.000Z,0
2017-06-11T22:30:06.000Z,oBI0MU73nlc,"DRAGON BALL FighterZ - E3 2017 Trailer  | XB1, PS4, PC","JUST WANT TO TAKE A SECOND TO THANK JANYA MOTOMURA, TOMOKO HIROKI & the Developers of ARC SYSTEM WORKS  for making a guys Dream finnaly come TRUE! This game is definitly a life Goal Masterpiece!",2017-12-20T09:03:17.000Z,0
2017-06-11T22:30:06.000Z,oBI0MU73nlc,"DRAGON BALL FighterZ - E3 2017 Trailer  | XB1, PS4, PC",Shit concole graphics. Don't release it on PC pls.,2017-12-19T13:48:05.000Z,0
2017-06-11T22:30:06.000Z,oBI0MU73nlc,"DRAGON BALL FighterZ - E3 2017 Trailer  | XB1, PS4, PC",This brings back memories of the style that dragonball final bout had... Gosh...i'm so damn excited ! ! !,2017-12-19T07:19:03.000Z,1
2017-06-11T22:30:06.000Z,oBI0MU73nlc,"DRAGON BALL FighterZ - E3 2017 Trailer  | XB1, PS4, PC",The manga is better.,2017-12-18T03:02:48.000Z,0
2017-06-11T22:30:06.000Z,oBI0MU73nlc,"DRAGON BALL FighterZ - E3 2017 Trailer  | XB1, PS4, PC",I really hope that this releases on the ps vita,2017-12-17T09:32:01.000Z,0
2017-06-11T22:30:06.000Z,oBI0MU73nlc,"DRAGON BALL FighterZ - E3 2017 Trailer  | XB1, PS4, PC",THIS IS GONNA BE LIT COZ THERE WILL BE ULTRA INSTINCT BOIII,2017-12-16T20:27:35.000Z,0
2017-06-11T22:30:06.000Z,oBI0MU73nlc,"DRAGON BALL FighterZ - E3 2017 Trailer  | XB1, PS4, PC",Looks like shit,2017-12-15T05:12:10.000Z,0
2017-06-11T22:30:06.000Z,oBI0MU73nlc,"DRAGON BALL FighterZ - E3 2017 Trailer  | XB1, PS4, PC","http://www.DBRB3Project.com/

ho was like to be next game of dbz is osom",2017-12-14T17:49:48.000Z,0
2017-06-11T22:30:06.000Z,oBI0MU73nlc,"DRAGON BALL FighterZ - E3 2017 Trailer  | XB1, PS4, PC",dbz dizing blast iz betterthen dbz figher z,2017-12-14T17:45:37.000Z,0
2017-06-11T22:30:06.000Z,oBI0MU73nlc,"DRAGON BALL FighterZ - E3 2017 Trailer  | XB1, PS4, PC","Yay pre release dlc
I'll be getting the full game in a couple of years discounted, thanks",2017-12-14T15:29:02.000Z,0
2017-06-11T22:30:06.000Z,oBI0MU73nlc,"DRAGON BALL FighterZ - E3 2017 Trailer  | XB1, PS4, PC","Why not make a DBZ game like dragon ball budokai tenkaichi 3 but add SSJB, Ultra Instinct, The Tournament of Power, and basically all other aspects of Dragon Ball Super? Especially Krillin's unlocked potential. In my opinion, there is no DBZ game that is better than Dragon Ball Budokai Tenkaichi 3. Of course, this is my opinion. It would be nice to have another game like that which would be Budokai Tenkaichi 4 and I think many others agree as well.",2017-12-13T09:36:39.000Z,0
2017-06-11T22:30:06.000Z,oBI0MU73nlc,"DRAGON BALL FighterZ - E3 2017 Trailer  | XB1, PS4, PC",We will play online with other people??,2017-12-12T20:40:58.000Z,1
2017-06-11T22:30:06.000Z,oBI0MU73nlc,"DRAGON BALL FighterZ - E3 2017 Trailer  | XB1, PS4, PC",page bandai like you,2017-12-12T14:47:29.000Z,0
2017-06-11T22:30:06.000Z,oBI0MU73nlc,"DRAGON BALL FighterZ - E3 2017 Trailer  | XB1, PS4, PC",Guys please remake budokai tenkaichi 3 with better graphics and updated roster! Bt3 is the best.,2017-12-12T09:40:31.000Z,0
2017-06-11T22:30:06.000Z,oBI0MU73nlc,"DRAGON BALL FighterZ - E3 2017 Trailer  | XB1, PS4, PC","Amazing art style, they fucking Nail-ed it;",2017-12-10T07:32:19.000Z,0
2017-06-11T22:30:06.000Z,oBI0MU73nlc,"DRAGON BALL FighterZ - E3 2017 Trailer  | XB1, PS4, PC","Looks like paper cut outs fighting!
This is just marvel vs capcom reskinned......... so it will suck real bad",2017-12-09T06:26:26.000Z,0
2017-06-11T22:30:06.000Z,oBI0MU73nlc,"DRAGON BALL FighterZ - E3 2017 Trailer  | XB1, PS4, PC",Finally they have brought back 2d. The tenkaichi saga was poo. I hope they also keep the in fight language in Japanese as well on its way to America it’s sounds way more vintage and cool.,2017-12-06T22:03:21.000Z,0
2017-06-11T22:30:06.000Z,oBI0MU73nlc,"DRAGON BALL FighterZ - E3 2017 Trailer  | XB1, PS4, PC","As long as they somehow put Dragon Ball GT Pan and Bra in the game I'm all good! Plus, it's funny how Pan keeps beating up Giru!",2017-12-03T19:15:27.000Z,0
2017-06-11T22:30:06.000Z,oBI0MU73nlc,"DRAGON BALL FighterZ - E3 2017 Trailer  | XB1, PS4, PC","this look like mugen,  with better graph",2017-12-02T12:59:55.000Z,0
2017-06-11T22:30:06.000Z,oBI0MU73nlc,"DRAGON BALL FighterZ - E3 2017 Trailer  | XB1, PS4, PC",1st the video game to get right now its the real life movie lol dragon ball z getting popular again,2017-11-29T16:48:40.000Z,0
2017-06-11T22:30:06.000Z,oBI0MU73nlc,"DRAGON BALL FighterZ - E3 2017 Trailer  | XB1, PS4, PC",Please make Android 21 playable!,2017-11-29T03:06:59.000Z,0
2017-06-11T22:30:06.000Z,oBI0MU73nlc,"DRAGON BALL FighterZ - E3 2017 Trailer  | XB1, PS4, PC",this kind of graphics with BUDOKAI TENKAICHI 3 please! the DBZ community expects that for years!!,2017-11-28T23:32:56.000Z,0
2017-06-11T22:30:06.000Z,oBI0MU73nlc,"DRAGON BALL FighterZ - E3 2017 Trailer  | XB1, PS4, PC",This is beautiful for a 9 year old I fished xenoverse 1 and 2,2017-11-28T05:22:02.000Z,0
2017-06-11T22:30:06.000Z,oBI0MU73nlc,"DRAGON BALL FighterZ - E3 2017 Trailer  | XB1, PS4, PC",japanese goku voice sucks so bad lol,2017-11-27T22:11:01.000Z,0
2017-06-11T22:30:06.000Z,oBI0MU73nlc,"DRAGON BALL FighterZ - E3 2017 Trailer  | XB1, PS4, PC",4/10 for now,2017-11-26T22:55:32.000Z,0
2017-06-11T22:30:06.000Z,oBI0MU73nlc,"DRAGON BALL FighterZ - E3 2017 Trailer  | XB1, PS4, PC",How in the hell did they manage to get the game to actually look like the anime. I mean they’ve done good with Super Dragon Ball Z and others but I kinda got confused if I was watching an anime at times. That’s crazy.,2017-11-23T19:21:44.000Z,0
2017-06-11T22:30:06.000Z,oBI0MU73nlc,"DRAGON BALL FighterZ - E3 2017 Trailer  | XB1, PS4, PC","hopefully there is a roster with like 70 people since its a side scroller
but it looks amazing",2017-11-23T17:33:23.000Z,0
2017-06-11T22:30:06.000Z,oBI0MU73nlc,"DRAGON BALL FighterZ - E3 2017 Trailer  | XB1, PS4, PC","Seriously, I wanna play as Chi Chi",2017-11-23T08:56:16.000Z,10
2017-06-11T22:30:06.000Z,oBI0MU73nlc,"DRAGON BALL FighterZ - E3 2017 Trailer  | XB1, PS4, PC",Omg 2.5D sucks i miss Budokai Tenkaichi 3,2017-11-21T09:42:42.000Z,0
2017-06-11T22:30:06.000Z,oBI0MU73nlc,"DRAGON BALL FighterZ - E3 2017 Trailer  | XB1, PS4, PC",yes cause we needed another mortal combat type game,2017-11-18T06:51:09.000Z,0
2017-06-11T22:30:06.000Z,oBI0MU73nlc,"DRAGON BALL FighterZ - E3 2017 Trailer  | XB1, PS4, PC",The worst Dbz game ever.,2017-11-16T11:11:05.000Z,0
2017-06-11T22:30:06.000Z,oBI0MU73nlc,"DRAGON BALL FighterZ - E3 2017 Trailer  | XB1, PS4, PC",Это просто охуенно.,2017-11-14T14:49:01.000Z,0
2017-06-11T22:30:06.000Z,oBI0MU73nlc,"DRAGON BALL FighterZ - E3 2017 Trailer  | XB1, PS4, PC",Please don't put Mr. Satan in the game he would be too overpowered.,2017-11-14T07:50:26.000Z,0
2017-06-11T22:30:06.000Z,oBI0MU73nlc,"DRAGON BALL FighterZ - E3 2017 Trailer  | XB1, PS4, PC",Hello Bandai Namco please create the game Dragon ball Z budokai tenkaichi 3 for PS4 XBOX It is the best game of Dragon ball,2017-11-14T02:34:36.000Z,0
2017-06-11T22:30:06.000Z,oBI0MU73nlc,"DRAGON BALL FighterZ - E3 2017 Trailer  | XB1, PS4, PC",PUT THIS SHIT ON SWITCH,2017-11-13T21:44:14.000Z,0
2017-06-11T22:30:06.000Z,oBI0MU73nlc,"DRAGON BALL FighterZ - E3 2017 Trailer  | XB1, PS4, PC",WOW,2017-11-12T04:25:11.000Z,0
2017-06-11T22:30:06.000Z,oBI0MU73nlc,"DRAGON BALL FighterZ - E3 2017 Trailer  | XB1, PS4, PC",This is going to be shot compared to dbx2,2017-11-10T23:55:32.000Z,0
2017-06-11T22:30:06.000Z,oBI0MU73nlc,"DRAGON BALL FighterZ - E3 2017 Trailer  | XB1, PS4, PC","Tendríais que actualizar la fecha de salida a 2019 que es cuando sacareis el juego completo, ya que para 2018 lo unico que habeis anunciado con vuestra basura de dlc es medio juego",2017-11-10T14:40:20.000Z,0
2017-06-11T22:30:06.000Z,oBI0MU73nlc,"DRAGON BALL FighterZ - E3 2017 Trailer  | XB1, PS4, PC",Raging blast 1-2 > any others,2017-11-09T21:29:02.000Z,0
2017-06-11T22:30:06.000Z,oBI0MU73nlc,"DRAGON BALL FighterZ - E3 2017 Trailer  | XB1, PS4, PC",Wow,2017-11-09T13:26:27.000Z,0
