publish_time,Video ID,Title,Comment,updatedAt,likeCount
2017-03-08T19:00:05.000Z,oIB4jNYeRY4,ROUGH NIGHT - Official Restricted Trailer (HD),I only clicked this video because Ilana from Broad city is on here,2017-03-09T18:37:12.000Z,0
2017-03-08T19:00:05.000Z,oIB4jNYeRY4,ROUGH NIGHT - Official Restricted Trailer (HD),"So, a female version of dirty work?",2017-03-09T18:35:25.000Z,0
2017-03-08T19:00:05.000Z,oIB4jNYeRY4,ROUGH NIGHT - Official Restricted Trailer (HD),Discount Bridesmaids...,2017-03-09T18:34:46.000Z,0
2017-03-08T19:00:05.000Z,oIB4jNYeRY4,ROUGH NIGHT - Official Restricted Trailer (HD),Fuckin trash,2017-03-09T18:33:55.000Z,0
2017-03-08T19:00:05.000Z,oIB4jNYeRY4,ROUGH NIGHT - Official Restricted Trailer (HD),I'm surprised Amy Schumer isn't in this tbh. Seems like the type of thing she'd be typecast in.,2017-03-09T18:33:36.000Z,0
2017-03-08T19:00:05.000Z,oIB4jNYeRY4,ROUGH NIGHT - Official Restricted Trailer (HD),Very bad things 2,2017-03-09T18:32:52.000Z,0
2017-03-08T19:00:05.000Z,oIB4jNYeRY4,ROUGH NIGHT - Official Restricted Trailer (HD),bootleg hangover,2017-03-09T18:31:27.000Z,0
2017-03-08T19:00:05.000Z,oIB4jNYeRY4,ROUGH NIGHT - Official Restricted Trailer (HD),So it's a female hangover. Real original.,2017-03-09T18:30:48.000Z,0
2017-03-08T19:00:05.000Z,oIB4jNYeRY4,ROUGH NIGHT - Official Restricted Trailer (HD),Why would Scarlett do such a D list film,2017-03-09T18:30:40.000Z,0
2017-03-08T19:00:05.000Z,oIB4jNYeRY4,ROUGH NIGHT - Official Restricted Trailer (HD),"Maybe islam is right...western women are coke filled sluts...? Or is this how ""feminists"" prove they are better than men?",2017-03-09T18:29:56.000Z,0
2017-03-08T19:00:05.000Z,oIB4jNYeRY4,ROUGH NIGHT - Official Restricted Trailer (HD),yeah...the whole dead sex worker thing?,2017-03-09T18:29:44.000Z,0
2017-03-08T19:00:05.000Z,oIB4jNYeRY4,ROUGH NIGHT - Official Restricted Trailer (HD),This gives me Bad Moms vibes,2017-03-09T18:29:38.000Z,0
2017-03-08T19:00:05.000Z,oIB4jNYeRY4,ROUGH NIGHT - Official Restricted Trailer (HD),it might be funny,2017-03-09T18:29:32.000Z,0
2017-03-08T19:00:05.000Z,oIB4jNYeRY4,ROUGH NIGHT - Official Restricted Trailer (HD),SNL level script,2017-03-09T18:29:12.000Z,0
2017-03-08T19:00:05.000Z,oIB4jNYeRY4,ROUGH NIGHT - Official Restricted Trailer (HD),Poor man's version of the the hangover?,2017-03-09T18:29:27.000Z,0
2017-03-08T19:00:05.000Z,oIB4jNYeRY4,ROUGH NIGHT - Official Restricted Trailer (HD),All of the actors look out of place,2017-03-09T18:22:19.000Z,0
2017-03-08T19:00:05.000Z,oIB4jNYeRY4,ROUGH NIGHT - Official Restricted Trailer (HD),"This looks like an SNL skit and show remain as one, not a full length movie.",2017-03-09T18:22:12.000Z,0
2017-03-08T19:00:05.000Z,oIB4jNYeRY4,ROUGH NIGHT - Official Restricted Trailer (HD),Hangover: Female version.,2017-03-09T18:19:24.000Z,0
2017-03-08T19:00:05.000Z,oIB4jNYeRY4,ROUGH NIGHT - Official Restricted Trailer (HD),"This looks like a terrible sequel to ""bridesmaids""",2017-03-09T18:19:19.000Z,0
2017-03-08T19:00:05.000Z,oIB4jNYeRY4,ROUGH NIGHT - Official Restricted Trailer (HD),why is black widow in this?,2017-03-09T18:18:31.000Z,0
2017-03-08T19:00:05.000Z,oIB4jNYeRY4,ROUGH NIGHT - Official Restricted Trailer (HD),Please stop  this madness,2017-03-09T18:17:11.000Z,0
2017-03-08T19:00:05.000Z,oIB4jNYeRY4,ROUGH NIGHT - Official Restricted Trailer (HD),What's the point of the movie when we already know the story from the trailer. Boring.,2017-03-09T18:16:58.000Z,0
2017-03-08T19:00:05.000Z,oIB4jNYeRY4,ROUGH NIGHT - Official Restricted Trailer (HD),hangover woman version? still love scar jo,2017-03-09T18:15:31.000Z,0
2017-03-08T19:00:05.000Z,oIB4jNYeRY4,ROUGH NIGHT - Official Restricted Trailer (HD),"The movie ""very bad things"" redone",2017-03-09T18:15:05.000Z,0
2017-03-08T19:00:05.000Z,oIB4jNYeRY4,ROUGH NIGHT - Official Restricted Trailer (HD),Just like that lady said....let's make movies that star men and make the cast women....first it was Ghostbusters and now The Hangover because that is such a good movie sarcasm by the way.........this is stupid.,2017-03-09T18:14:22.000Z,0
2017-03-08T19:00:05.000Z,oIB4jNYeRY4,ROUGH NIGHT - Official Restricted Trailer (HD),Well. Haven't we all wasted 2 minutes and 41 seconds of our lives?😂🔫,2017-03-09T18:12:49.000Z,0
2017-03-08T19:00:05.000Z,oIB4jNYeRY4,ROUGH NIGHT - Official Restricted Trailer (HD),Very Bad Things remade with not funny women who try too hard to act like dudes. scar jo is still hot tho.,2017-03-09T18:10:46.000Z,0
2017-03-08T19:00:05.000Z,oIB4jNYeRY4,ROUGH NIGHT - Official Restricted Trailer (HD),The shitty woman version of the hangover?,2017-03-09T18:09:48.000Z,3
2017-03-08T19:00:05.000Z,oIB4jNYeRY4,ROUGH NIGHT - Official Restricted Trailer (HD),what is the music in background ?,2017-03-09T18:09:35.000Z,1
2017-03-08T19:00:05.000Z,oIB4jNYeRY4,ROUGH NIGHT - Official Restricted Trailer (HD),,2017-03-09T18:08:21.000Z,0
2017-03-08T19:00:05.000Z,oIB4jNYeRY4,ROUGH NIGHT - Official Restricted Trailer (HD),Sjsjsjsj,2017-03-09T18:08:08.000Z,0
2017-03-08T19:00:05.000Z,oIB4jNYeRY4,ROUGH NIGHT - Official Restricted Trailer (HD),"This is like a guy movie, except the cast was replaced with women, and every joke is about how slutty the women are.... oh lord",2017-03-09T18:08:01.000Z,0
2017-03-08T19:00:05.000Z,oIB4jNYeRY4,ROUGH NIGHT - Official Restricted Trailer (HD),Hangover is better,2017-03-09T18:07:03.000Z,0
2017-03-08T19:00:05.000Z,oIB4jNYeRY4,ROUGH NIGHT - Official Restricted Trailer (HD),Looks like a terriblevmovie degrading both genders. Disgusting how can this even be humor..oh that's right! To feminist and brainwashed pussies this is humor,2017-03-09T18:06:43.000Z,1
2017-03-08T19:00:05.000Z,oIB4jNYeRY4,ROUGH NIGHT - Official Restricted Trailer (HD),Why though?,2017-03-09T18:05:36.000Z,0
2017-03-08T19:00:05.000Z,oIB4jNYeRY4,ROUGH NIGHT - Official Restricted Trailer (HD),"This looks so good! I cracked up so many times in just the trailer, can't wait to see it!",2017-03-09T18:05:08.000Z,0
2017-03-08T19:00:05.000Z,oIB4jNYeRY4,ROUGH NIGHT - Official Restricted Trailer (HD),😂😂😂,2017-03-09T18:03:34.000Z,0
2017-03-08T19:00:05.000Z,oIB4jNYeRY4,ROUGH NIGHT - Official Restricted Trailer (HD),I'll watch it.,2017-03-09T18:03:27.000Z,0
2017-03-08T19:00:05.000Z,oIB4jNYeRY4,ROUGH NIGHT - Official Restricted Trailer (HD),"Scarlett Johansson is the only one worth watching, but not in this horrid piece of junk.  Rule of thumb, the best stuff goes in the trailer.  So, if it sucks, so will the movie.",2017-03-09T18:02:41.000Z,0
2017-03-08T19:00:05.000Z,oIB4jNYeRY4,ROUGH NIGHT - Official Restricted Trailer (HD),Sony do you even know how to movie anymore?,2017-03-09T18:00:02.000Z,0
2017-03-08T19:00:05.000Z,oIB4jNYeRY4,ROUGH NIGHT - Official Restricted Trailer (HD),This looks Very funny,2017-03-09T17:59:07.000Z,0
2017-03-08T19:00:05.000Z,oIB4jNYeRY4,ROUGH NIGHT - Official Restricted Trailer (HD),"You know what, I was about to post ""So, it's Bridesmaids then"" .. then I saw the second half of the trailer. Actually a little curious to see it now",2017-03-09T17:58:34.000Z,0
2017-03-08T19:00:05.000Z,oIB4jNYeRY4,ROUGH NIGHT - Official Restricted Trailer (HD),nice try Sony but you've died,2017-03-09T17:55:08.000Z,0
2017-03-08T19:00:05.000Z,oIB4jNYeRY4,ROUGH NIGHT - Official Restricted Trailer (HD),0-100 REAL QUICK,2017-03-09T17:55:03.000Z,6
2017-03-08T19:00:05.000Z,oIB4jNYeRY4,ROUGH NIGHT - Official Restricted Trailer (HD),"ok so ""the hangover""  with women.  this movie looks dumd.  not because its women I really liked brides maids.  just movies like this seem to be trying too hard.",2017-03-09T17:53:08.000Z,0
2017-03-08T19:00:05.000Z,oIB4jNYeRY4,ROUGH NIGHT - Official Restricted Trailer (HD),this is so wrong.,2017-03-09T17:52:50.000Z,0
2017-03-08T19:00:05.000Z,oIB4jNYeRY4,ROUGH NIGHT - Official Restricted Trailer (HD),Gonna ruin it like ghostbusters,2017-03-09T17:52:29.000Z,0
2017-03-08T19:00:05.000Z,oIB4jNYeRY4,ROUGH NIGHT - Official Restricted Trailer (HD),Just realise the new furious 8 trailer is funnier than this,2017-03-09T17:51:39.000Z,0
2017-03-08T19:00:05.000Z,oIB4jNYeRY4,ROUGH NIGHT - Official Restricted Trailer (HD),Like to move in Reno? we have an Open House this coming Monday at 2300 Painted River Trail... Great home near golf course community...https://www.zillow.com/homedetails/2300-Painted-River-Trl-Reno-NV-89523/97539282_zpid/?view=public,2017-03-09T17:50:45.000Z,0
2017-03-08T19:00:05.000Z,oIB4jNYeRY4,ROUGH NIGHT - Official Restricted Trailer (HD),Still waiting for the tiger to appear from the bathroom.,2017-03-09T17:49:04.000Z,63
2017-03-08T19:00:05.000Z,oIB4jNYeRY4,ROUGH NIGHT - Official Restricted Trailer (HD),Where's all the feminists at? You've got you Hangover movie. BAHAHAHAHHAHAHAHAHAHAHA,2017-03-09T17:48:54.000Z,0
2017-03-08T19:00:05.000Z,oIB4jNYeRY4,ROUGH NIGHT - Official Restricted Trailer (HD),and this is how fox finished off Sony,2017-03-09T17:48:39.000Z,0
2017-03-08T19:00:05.000Z,oIB4jNYeRY4,ROUGH NIGHT - Official Restricted Trailer (HD),"WTF, did I just watch?!",2017-03-09T17:48:33.000Z,0
2017-03-08T19:00:05.000Z,oIB4jNYeRY4,ROUGH NIGHT - Official Restricted Trailer (HD),Scarlett 😍😍😍😍,2017-03-09T17:48:25.000Z,1
2017-03-08T19:00:05.000Z,oIB4jNYeRY4,ROUGH NIGHT - Official Restricted Trailer (HD),I feel like I just watched the entire movie in that trailer.,2017-03-09T17:48:25.000Z,715
2017-03-08T19:00:05.000Z,oIB4jNYeRY4,ROUGH NIGHT - Official Restricted Trailer (HD),This makes Adam Sandler look like Leonardo DiCaprio,2017-03-09T17:46:13.000Z,0
2017-03-08T19:00:05.000Z,oIB4jNYeRY4,ROUGH NIGHT - Official Restricted Trailer (HD),Maaan! do this actors/actress have a dignity when it comes to making horrible movies?,2017-03-09T17:46:00.000Z,0
2017-03-08T19:00:05.000Z,oIB4jNYeRY4,ROUGH NIGHT - Official Restricted Trailer (HD),hangover female style,2017-03-09T17:45:36.000Z,4
2017-03-08T19:00:05.000Z,oIB4jNYeRY4,ROUGH NIGHT - Official Restricted Trailer (HD),This looks hilarious. I need to see this.,2017-03-09T17:44:38.000Z,39
2017-03-08T19:00:05.000Z,oIB4jNYeRY4,ROUGH NIGHT - Official Restricted Trailer (HD),Fuckin retarded,2017-03-09T17:44:27.000Z,0
2017-03-08T19:00:05.000Z,oIB4jNYeRY4,ROUGH NIGHT - Official Restricted Trailer (HD),"I had to sign in, forgot password, verified password, signed in to make this comment !!
""This movie is a shitter female version of the hangover"". 

It was worth the log in.",2017-03-09T17:44:16.000Z,0
2017-03-08T19:00:05.000Z,oIB4jNYeRY4,ROUGH NIGHT - Official Restricted Trailer (HD),"Even if this would probably get a lot of dislikes, I don't let that stop me from seeing a good comedy.",2017-03-09T17:43:20.000Z,0
2017-03-08T19:00:05.000Z,oIB4jNYeRY4,ROUGH NIGHT - Official Restricted Trailer (HD),Hasn't this been done like 10 times now?,2017-03-09T17:42:28.000Z,0
2017-03-08T19:00:05.000Z,oIB4jNYeRY4,ROUGH NIGHT - Official Restricted Trailer (HD),boy if 1:17 was turned around and it was five men and one woman. all the femenist would rip their hair apart. #InternationalWomensDay,2017-03-09T17:41:33.000Z,318
2017-03-08T19:00:05.000Z,oIB4jNYeRY4,ROUGH NIGHT - Official Restricted Trailer (HD),"This is just the woman version of 3 different movies combined: The Hangover, The Loft, and My Cousin Vinny
DUMB!",2017-03-09T17:37:10.000Z,0
2017-03-08T19:00:05.000Z,oIB4jNYeRY4,ROUGH NIGHT - Official Restricted Trailer (HD),Here for Ilana,2017-03-09T17:35:19.000Z,0
2017-03-08T19:00:05.000Z,oIB4jNYeRY4,ROUGH NIGHT - Official Restricted Trailer (HD),Scarlett Johansson with this movie has lost all of her sex appeal.,2017-03-09T17:34:47.000Z,0
2017-03-08T19:00:05.000Z,oIB4jNYeRY4,ROUGH NIGHT - Official Restricted Trailer (HD),flop movie of the year .,2017-03-09T17:34:38.000Z,0
2017-03-08T19:00:05.000Z,oIB4jNYeRY4,ROUGH NIGHT - Official Restricted Trailer (HD),Let the dislike flow through you!,2017-03-09T17:29:55.000Z,0
2017-03-08T19:00:05.000Z,oIB4jNYeRY4,ROUGH NIGHT - Official Restricted Trailer (HD),so is this a sequel to Hangover or Bachelorette Party?,2017-03-09T17:29:49.000Z,0
2017-03-08T19:00:05.000Z,oIB4jNYeRY4,ROUGH NIGHT - Official Restricted Trailer (HD),Why all the hate? This is a solid Tuesday afternoon 5 years from now.,2017-03-09T17:28:42.000Z,309
2017-03-08T19:00:05.000Z,oIB4jNYeRY4,ROUGH NIGHT - Official Restricted Trailer (HD),A feminists version of The Hangover,2017-03-09T17:28:32.000Z,0
2017-03-08T19:00:05.000Z,oIB4jNYeRY4,ROUGH NIGHT - Official Restricted Trailer (HD),Women's film promotes drug use and murder as laughing matter. Yea we can write headlines too.,2017-03-09T17:28:24.000Z,0
2017-03-08T19:00:05.000Z,oIB4jNYeRY4,ROUGH NIGHT - Official Restricted Trailer (HD),straight to DVD.,2017-03-09T17:28:20.000Z,0
2017-03-08T19:00:05.000Z,oIB4jNYeRY4,ROUGH NIGHT - Official Restricted Trailer (HD),looks like Bad moms sequel..,2017-03-09T17:28:35.000Z,0
2017-03-08T19:00:05.000Z,oIB4jNYeRY4,ROUGH NIGHT - Official Restricted Trailer (HD),This is the weirdest Black Widow spin off movie ever,2017-03-09T17:28:07.000Z,0
2017-03-08T19:00:05.000Z,oIB4jNYeRY4,ROUGH NIGHT - Official Restricted Trailer (HD),To be honest what's more than likely Gonna be the plot twist is that he only passed out and isn't dead another useless fucking movie trope  and I could honestly care less for the same useless plot that's been overused,2017-03-09T17:28:24.000Z,0
2017-03-08T19:00:05.000Z,oIB4jNYeRY4,ROUGH NIGHT - Official Restricted Trailer (HD),Everyday you all do something to stray further from my light. This just puts you so much farther.,2017-03-09T17:27:45.000Z,0
2017-03-08T19:00:05.000Z,oIB4jNYeRY4,ROUGH NIGHT - Official Restricted Trailer (HD),"Pretty much saw the whole movie in this preview. Girls leave there families,  party, something goes wrong, someone has a convenient family member in the law field, they try to fix it, something goes wrong again, they resolve the issue and go back home like nothing happened",2017-03-09T17:25:46.000Z,0
2017-03-08T19:00:05.000Z,oIB4jNYeRY4,ROUGH NIGHT - Official Restricted Trailer (HD),"WEEKEND AT BERNIES 2.    
LAME",2017-03-09T17:25:46.000Z,0
2017-03-08T19:00:05.000Z,oIB4jNYeRY4,ROUGH NIGHT - Official Restricted Trailer (HD),Jewish Feminist bullshit,2017-03-09T17:24:45.000Z,0
2017-03-08T19:00:05.000Z,oIB4jNYeRY4,ROUGH NIGHT - Official Restricted Trailer (HD),"""Does anybody know CPR?"" ""I'll look it up on YouTube!""",2017-03-09T17:24:20.000Z,0
2017-03-08T19:00:05.000Z,oIB4jNYeRY4,ROUGH NIGHT - Official Restricted Trailer (HD),Feminist directors idea of a very bad things/hangover type movie,2017-03-09T17:23:59.000Z,0
2017-03-08T19:00:05.000Z,oIB4jNYeRY4,ROUGH NIGHT - Official Restricted Trailer (HD),"yuck, no thanks",2017-03-09T17:23:40.000Z,26
2017-03-08T19:00:05.000Z,oIB4jNYeRY4,ROUGH NIGHT - Official Restricted Trailer (HD),где наши?,2017-03-09T17:22:43.000Z,0
2017-03-08T19:00:05.000Z,oIB4jNYeRY4,ROUGH NIGHT - Official Restricted Trailer (HD),This movie looks like it's going to be a very bad thing,2017-03-09T17:21:29.000Z,409
2017-03-08T19:00:05.000Z,oIB4jNYeRY4,ROUGH NIGHT - Official Restricted Trailer (HD),prediction 4.3 imdb,2017-03-09T17:20:48.000Z,0
2017-03-08T19:00:05.000Z,oIB4jNYeRY4,ROUGH NIGHT - Official Restricted Trailer (HD),Can somebody please just buy Sony Pictures. This is painful.,2017-03-09T17:19:52.000Z,42
2017-03-08T19:00:05.000Z,oIB4jNYeRY4,ROUGH NIGHT - Official Restricted Trailer (HD),Awesome,2017-03-09T17:15:44.000Z,0
2017-03-08T19:00:05.000Z,oIB4jNYeRY4,ROUGH NIGHT - Official Restricted Trailer (HD),When there are the writers from Broad City and even Ilana herself is playing a role in it. Why this looks so generic?,2017-03-09T17:15:10.000Z,0
2017-03-08T19:00:05.000Z,oIB4jNYeRY4,ROUGH NIGHT - Official Restricted Trailer (HD),omg this looks stupid,2017-03-09T17:15:00.000Z,0
2017-03-08T19:00:05.000Z,oIB4jNYeRY4,ROUGH NIGHT - Official Restricted Trailer (HD),"Dear Sony, you make little profit off of a film such as this one. Make a blockbuster.",2017-03-09T17:14:44.000Z,0
2017-03-08T19:00:05.000Z,oIB4jNYeRY4,ROUGH NIGHT - Official Restricted Trailer (HD),Does anyone know the name of the last song?,2017-03-09T17:14:05.000Z,0
2017-03-08T19:00:05.000Z,oIB4jNYeRY4,ROUGH NIGHT - Official Restricted Trailer (HD),This looks like shite tbh,2017-03-09T17:13:14.000Z,0
2017-03-08T19:00:05.000Z,oIB4jNYeRY4,ROUGH NIGHT - Official Restricted Trailer (HD),Can they make a funny movie without drugs for once ? God .,2017-03-09T17:12:33.000Z,0
2017-03-08T19:00:05.000Z,oIB4jNYeRY4,ROUGH NIGHT - Official Restricted Trailer (HD),"Yet another ""comedy"" movie about a bunch of friends gettin' back together to have a party until things turn south. This movie's below Scarlett Johansson to have her in it, maybe even Kate McKinnon.",2017-03-09T17:11:58.000Z,0
2017-03-08T19:00:05.000Z,oIB4jNYeRY4,ROUGH NIGHT - Official Restricted Trailer (HD),"Anyone else think scar jo's hair is not working? It makes her head look huge. Why is it so trendy to chop your hair? Jennifer Lawrence, Anne Hathaway, Michelle Williams, Ginnifer Goodwin, Charlize Theron, Lena Dunham, Miley Cyrus, etc. We get it, your breaking norms and barriers, blah, blah, blah. The thing is though, some can really pull it off but most CANNOT.",2017-03-09T17:11:17.000Z,137
2017-03-08T19:00:05.000Z,oIB4jNYeRY4,ROUGH NIGHT - Official Restricted Trailer (HD),So the Hangover then?,2017-03-09T17:09:45.000Z,0
2017-03-08T19:00:05.000Z,oIB4jNYeRY4,ROUGH NIGHT - Official Restricted Trailer (HD),trash,2017-03-09T17:09:01.000Z,0
2017-03-08T19:00:05.000Z,oIB4jNYeRY4,ROUGH NIGHT - Official Restricted Trailer (HD),MGM Is the best for those who don't know,2017-03-09T17:07:11.000Z,1
2017-03-08T19:00:05.000Z,oIB4jNYeRY4,ROUGH NIGHT - Official Restricted Trailer (HD),Let's make this comment trending,2017-03-09T17:06:45.000Z,0
2017-03-08T19:00:05.000Z,oIB4jNYeRY4,ROUGH NIGHT - Official Restricted Trailer (HD),Is that Bo Burnham at 2.09?,2017-03-09T17:06:25.000Z,2
2017-03-08T19:00:05.000Z,oIB4jNYeRY4,ROUGH NIGHT - Official Restricted Trailer (HD),i see a trash movie,2017-03-09T17:06:20.000Z,0
2017-03-08T19:00:05.000Z,oIB4jNYeRY4,ROUGH NIGHT - Official Restricted Trailer (HD),So a bunch of wannabeboys.. pathetic.,2017-03-09T17:05:23.000Z,0
2017-03-08T19:00:05.000Z,oIB4jNYeRY4,ROUGH NIGHT - Official Restricted Trailer (HD),"K, can we just talk about how unrealistic it is that a girl jumping on that very very fit guy's lap makes him go  into cardiac arrest?",2017-03-09T17:03:28.000Z,0
2017-03-08T19:00:05.000Z,oIB4jNYeRY4,ROUGH NIGHT - Official Restricted Trailer (HD),Um no.,2017-03-09T17:02:29.000Z,0
2017-03-08T19:00:05.000Z,oIB4jNYeRY4,ROUGH NIGHT - Official Restricted Trailer (HD),"wow, such an original film. its almost like sony have made a fourth installment of the hangover, but genderswapped all the original cast with some of the unfunniest women on the planet. sick.",2017-03-09T16:58:33.000Z,0
2017-03-08T19:00:05.000Z,oIB4jNYeRY4,ROUGH NIGHT - Official Restricted Trailer (HD),OZ at 02:11,2017-03-09T16:57:56.000Z,0
2017-03-08T19:00:05.000Z,oIB4jNYeRY4,ROUGH NIGHT - Official Restricted Trailer (HD),They shot the bar scene in Hermosa Beach.,2017-03-09T16:57:32.000Z,0
2017-03-08T19:00:05.000Z,oIB4jNYeRY4,ROUGH NIGHT - Official Restricted Trailer (HD),Scar jo and her man have the same haircut in this movie.,2017-03-09T16:57:14.000Z,0
2017-03-08T19:00:05.000Z,oIB4jNYeRY4,ROUGH NIGHT - Official Restricted Trailer (HD),It says RESTRICTED but its on YouTube Trending,2017-03-09T16:57:12.000Z,0
2017-03-08T19:00:05.000Z,oIB4jNYeRY4,ROUGH NIGHT - Official Restricted Trailer (HD),what the song called,2017-03-09T16:56:54.000Z,0
2017-03-08T19:00:05.000Z,oIB4jNYeRY4,ROUGH NIGHT - Official Restricted Trailer (HD),I don't know what to feel anymore,2017-03-09T16:53:05.000Z,0
2017-03-08T19:00:05.000Z,oIB4jNYeRY4,ROUGH NIGHT - Official Restricted Trailer (HD),nah,2017-03-09T16:50:18.000Z,0
2017-03-08T19:00:05.000Z,oIB4jNYeRY4,ROUGH NIGHT - Official Restricted Trailer (HD),This movie has written 'Ghostbusters' remake all over it.,2017-03-09T16:49:22.000Z,0
2017-03-08T19:00:05.000Z,oIB4jNYeRY4,ROUGH NIGHT - Official Restricted Trailer (HD),"So it's a female-driven version of ""Weekend at Bernie's""?",2017-03-09T16:48:19.000Z,0
2017-03-08T19:00:05.000Z,oIB4jNYeRY4,ROUGH NIGHT - Official Restricted Trailer (HD),WTF would I watch this for? Not even 5 hot chicks to real me in to watch lol -_-,2017-03-09T16:43:53.000Z,0
2017-03-08T19:00:05.000Z,oIB4jNYeRY4,ROUGH NIGHT - Official Restricted Trailer (HD),girls are smart and funny - eric cartman,2017-03-09T16:43:25.000Z,0
2017-03-08T19:00:05.000Z,oIB4jNYeRY4,ROUGH NIGHT - Official Restricted Trailer (HD),Jillian bell got fat..,2017-03-09T16:42:27.000Z,1
2017-03-08T19:00:05.000Z,oIB4jNYeRY4,ROUGH NIGHT - Official Restricted Trailer (HD),"Another movie where: being a gross slut = empowerment. This such an obvious attempt at a female version on ""The Hangover"" haha so ducking stupid",2017-03-09T16:39:56.000Z,0
2017-03-08T19:00:05.000Z,oIB4jNYeRY4,ROUGH NIGHT - Official Restricted Trailer (HD),holy molly this is so bad.,2017-03-09T16:38:26.000Z,0
2017-03-08T19:00:05.000Z,oIB4jNYeRY4,ROUGH NIGHT - Official Restricted Trailer (HD),"It is truly a bullshit movie, the plots are fucking obivious but I would tap the big girl though (sarcasm).",2017-03-09T16:34:49.000Z,0
2017-03-08T19:00:05.000Z,oIB4jNYeRY4,ROUGH NIGHT - Official Restricted Trailer (HD),So a shitty fem remake of Very Bad Things...,2017-03-09T16:34:30.000Z,0
2017-03-08T19:00:05.000Z,oIB4jNYeRY4,ROUGH NIGHT - Official Restricted Trailer (HD),So they Remade Weekend at Bernies and Very Bad Things? Isn't there a way for women to be funny without ripping off everything men do Sony?,2017-03-09T16:34:53.000Z,0
2017-03-08T19:00:05.000Z,oIB4jNYeRY4,ROUGH NIGHT - Official Restricted Trailer (HD),scarlett johansson is going through that phase of giving 0 fucks cause she's beautiful and she can do whatever the hell she wants,2017-03-09T16:34:03.000Z,0
2017-03-08T19:00:05.000Z,oIB4jNYeRY4,ROUGH NIGHT - Official Restricted Trailer (HD),"So liberals are supposed to be the sensitive cry babies, right? I don't know, this comment section seems to prove otherwise.....",2017-03-09T16:33:50.000Z,0
2017-03-08T19:00:05.000Z,oIB4jNYeRY4,ROUGH NIGHT - Official Restricted Trailer (HD),Weekend at Bernie's meets The Hangover meets Bridesmaids.,2017-03-09T16:32:59.000Z,13
2017-03-08T19:00:05.000Z,oIB4jNYeRY4,ROUGH NIGHT - Official Restricted Trailer (HD),lol this movie looks fucking awesome. and funny af,2017-03-09T16:32:44.000Z,0
2017-03-08T19:00:05.000Z,oIB4jNYeRY4,ROUGH NIGHT - Official Restricted Trailer (HD),is this another feminist movie?,2017-03-09T16:31:45.000Z,0
2017-03-08T19:00:05.000Z,oIB4jNYeRY4,ROUGH NIGHT - Official Restricted Trailer (HD),So they remade the hangover with chicks. Just like they remade ghostbusters...with chicks. And they'll remake THE REMAKE of Oceans 11 (not a typo)...WITH...Chicks. Hate to say it. This is why Trump won.,2017-03-09T16:30:57.000Z,0
2017-03-08T19:00:05.000Z,oIB4jNYeRY4,ROUGH NIGHT - Official Restricted Trailer (HD),thank god it wasn't in vegas this time.,2017-03-09T16:30:33.000Z,0
2017-03-08T19:00:05.000Z,oIB4jNYeRY4,ROUGH NIGHT - Official Restricted Trailer (HD),Very bad things,2017-03-09T16:30:17.000Z,0
2017-03-08T19:00:05.000Z,oIB4jNYeRY4,ROUGH NIGHT - Official Restricted Trailer (HD),why is scarlett in it,2017-03-09T16:29:42.000Z,0
2017-03-08T19:00:05.000Z,oIB4jNYeRY4,ROUGH NIGHT - Official Restricted Trailer (HD),women's hangover,2017-03-09T16:29:15.000Z,0
2017-03-08T19:00:05.000Z,oIB4jNYeRY4,ROUGH NIGHT - Official Restricted Trailer (HD),Subscribe to my channel or die,2017-03-09T16:29:07.000Z,0
2017-03-08T19:00:05.000Z,oIB4jNYeRY4,ROUGH NIGHT - Official Restricted Trailer (HD),"Kate Mckinnon is playing THE SAME CHARACTER EVERYTIME.
I love Scarlett though
is this what happen she got divorce?",2017-03-09T16:28:37.000Z,0
2017-03-08T19:00:05.000Z,oIB4jNYeRY4,ROUGH NIGHT - Official Restricted Trailer (HD),"""Very Bad Things""  with vagina 

hollywood needs to stop promoting vagina  movies  to make or tap into a titz and azz market 

all vagina films that try to be "" ALL or Nothing CRAZY "" never work - women are fucking azzholes when it comes to morality. having issues ,  with literally the most basic tasks in life ...

thigh gap or not to thigh gap   , Side boob or not to side boob .. this years hand bag ,   duck faces , walking , heels , breathing 

women need to admit they are fucking useless and boring - unable to do anything without inflating it into some kind of drama or ""pat on the back  for having a vagina "" exercise  

so when these films put women in wreck-less environment it's hardily believable - most women can't even EAT food without a glossy magazine or other media telling them what and how to do it . And even then they get it wrong ( obesity and anorexia ) 

the only films women should be in is PORNOGRAPHY",2017-03-09T16:28:22.000Z,0
2017-03-08T19:00:05.000Z,oIB4jNYeRY4,ROUGH NIGHT - Official Restricted Trailer (HD),"This just looks awful...and I'm not saying that because it's an all female cast, I'm just saying that it looks awful because it looks awful.",2017-03-09T16:26:49.000Z,0
2017-03-08T19:00:05.000Z,oIB4jNYeRY4,ROUGH NIGHT - Official Restricted Trailer (HD),Good ole American sluts,2017-03-09T16:26:48.000Z,0
2017-03-08T19:00:05.000Z,oIB4jNYeRY4,ROUGH NIGHT - Official Restricted Trailer (HD),Sign up with uber to make some extra cash https://partners.uber.com/i/zpr5kdm8ue,2017-03-09T16:26:45.000Z,0
2017-03-08T19:00:05.000Z,oIB4jNYeRY4,ROUGH NIGHT - Official Restricted Trailer (HD),"This just seems like the hangover, with a slight change in plot.",2017-03-09T16:25:29.000Z,0
2017-03-08T19:00:05.000Z,oIB4jNYeRY4,ROUGH NIGHT - Official Restricted Trailer (HD),bridesmaid copy,2017-03-09T16:23:59.000Z,0
