publish_time,Video ID,Title,Comment,updatedAt,likeCount
2017-03-08T19:00:05.000Z,oIB4jNYeRY4,ROUGH NIGHT - Official Restricted Trailer (HD),I've just seen the entire movie.  a 4 min trailer.....,2019-11-01T10:34:19.000Z,1
2017-03-08T19:00:05.000Z,oIB4jNYeRY4,ROUGH NIGHT - Official Restricted Trailer (HD),Film Four girl,2019-10-21T15:45:15.000Z,0
2017-03-08T19:00:05.000Z,oIB4jNYeRY4,ROUGH NIGHT - Official Restricted Trailer (HD),1:38 OMFG HAHAHAHAHAHA,2019-10-20T08:30:33.000Z,0
2017-03-08T19:00:05.000Z,oIB4jNYeRY4,ROUGH NIGHT - Official Restricted Trailer (HD),"i mean, are drugs really that common? i dont get it, every hollywood movie these days make it seem like everyone and their mother is a drug junkie of somesort...",2019-10-02T01:38:20.000Z,0
2017-03-08T19:00:05.000Z,oIB4jNYeRY4,ROUGH NIGHT - Official Restricted Trailer (HD),"For people who love drama, suspense type movies😍",2019-09-30T11:39:44.000Z,0
2017-03-08T19:00:05.000Z,oIB4jNYeRY4,ROUGH NIGHT - Official Restricted Trailer (HD),Alice is annoying,2019-09-28T12:49:29.000Z,0
2017-03-08T19:00:05.000Z,oIB4jNYeRY4,ROUGH NIGHT - Official Restricted Trailer (HD),"i’m sad that this movie gets so many dislikes, i actually think this is really funny and great, idk why do yall hate on it so much...",2019-09-23T19:07:44.000Z,0
2017-03-08T19:00:05.000Z,oIB4jNYeRY4,ROUGH NIGHT - Official Restricted Trailer (HD),Bruh! I gotta watch this movie!,2019-09-21T19:42:16.000Z,0
2017-03-08T19:00:05.000Z,oIB4jNYeRY4,ROUGH NIGHT - Official Restricted Trailer (HD),scarlett’s acting oh,2019-09-07T18:37:48.000Z,0
2017-03-08T19:00:05.000Z,oIB4jNYeRY4,ROUGH NIGHT - Official Restricted Trailer (HD),They just showed the entire movie in this trailer,2019-08-18T04:55:39.000Z,0
2017-03-08T19:00:05.000Z,oIB4jNYeRY4,ROUGH NIGHT - Official Restricted Trailer (HD),This is just like girls trip..😑,2019-08-11T12:04:00.000Z,0
2017-03-08T19:00:05.000Z,oIB4jNYeRY4,ROUGH NIGHT - Official Restricted Trailer (HD),I've seen this movie twice and it's still one of the most fun movie I've ever watched!,2019-08-10T10:53:13.000Z,1
2017-03-08T19:00:05.000Z,oIB4jNYeRY4,ROUGH NIGHT - Official Restricted Trailer (HD),Its better then girls trip its my favourite movie yeah whatever it just is,2019-08-02T21:20:23.000Z,0
2017-03-08T19:00:05.000Z,oIB4jNYeRY4,ROUGH NIGHT - Official Restricted Trailer (HD),I am still wondering if the diamonds is in the toilet where the guy goes before stripped,2019-07-26T16:59:17.000Z,0
2017-03-08T19:00:05.000Z,oIB4jNYeRY4,ROUGH NIGHT - Official Restricted Trailer (HD),🤢🤮,2019-07-25T09:00:50.000Z,0
2017-03-08T19:00:05.000Z,oIB4jNYeRY4,ROUGH NIGHT - Official Restricted Trailer (HD),What's the song at 0:53,2019-07-22T19:51:23.000Z,0
2017-03-08T19:00:05.000Z,oIB4jNYeRY4,ROUGH NIGHT - Official Restricted Trailer (HD),Tried making hangover,2019-07-19T19:13:45.000Z,1
2017-03-08T19:00:05.000Z,oIB4jNYeRY4,ROUGH NIGHT - Official Restricted Trailer (HD),Kate Mckinnon is fookin hilar.,2019-07-16T04:51:55.000Z,0
2017-03-08T19:00:05.000Z,oIB4jNYeRY4,ROUGH NIGHT - Official Restricted Trailer (HD),Great movie,2019-07-09T16:47:01.000Z,0
2017-03-08T19:00:05.000Z,oIB4jNYeRY4,ROUGH NIGHT - Official Restricted Trailer (HD),Just watch it on Netflix and this movie is really really bad but in the way that you can yell at it with your friend.,2019-07-08T03:31:38.000Z,0
2017-03-08T19:00:05.000Z,oIB4jNYeRY4,ROUGH NIGHT - Official Restricted Trailer (HD),The biggest pile of shite!! Avoid at all cost!!! Scarlett Johanson only decent actor.,2019-07-06T06:35:05.000Z,0
2017-03-08T19:00:05.000Z,oIB4jNYeRY4,ROUGH NIGHT - Official Restricted Trailer (HD),What garbage!,2019-06-12T01:57:42.000Z,0
2017-03-08T19:00:05.000Z,oIB4jNYeRY4,ROUGH NIGHT - Official Restricted Trailer (HD),0:55 That is scaring me. I'm sleeping with the light on tonight.,2019-06-11T06:27:09.000Z,6
2017-03-08T19:00:05.000Z,oIB4jNYeRY4,ROUGH NIGHT - Official Restricted Trailer (HD),It's like girls trip,2019-06-07T07:06:07.000Z,0
2017-03-08T19:00:05.000Z,oIB4jNYeRY4,ROUGH NIGHT - Official Restricted Trailer (HD),I actually loved the movie. I never laughed so hard😂😂,2019-06-05T07:20:30.000Z,14
2017-03-08T19:00:05.000Z,oIB4jNYeRY4,ROUGH NIGHT - Official Restricted Trailer (HD),Queefs,2019-06-02T04:11:50.000Z,0
2017-03-08T19:00:05.000Z,oIB4jNYeRY4,ROUGH NIGHT - Official Restricted Trailer (HD),Hilarious. Weekend at Bernie's female version,2019-05-30T22:56:34.000Z,0
2017-03-08T19:00:05.000Z,oIB4jNYeRY4,ROUGH NIGHT - Official Restricted Trailer (HD),I watched this movie 5 times. I love it!,2019-05-30T16:44:33.000Z,1
2017-03-08T19:00:05.000Z,oIB4jNYeRY4,ROUGH NIGHT - Official Restricted Trailer (HD),So this is the feminist version of Hangover meets Very Bad Things.,2019-05-28T17:19:32.000Z,0
2017-03-08T19:00:05.000Z,oIB4jNYeRY4,ROUGH NIGHT - Official Restricted Trailer (HD),Why on Earth would that fat girl jump on that striper. She is the reason why he is dead,2019-05-26T04:06:03.000Z,0
2017-03-08T19:00:05.000Z,oIB4jNYeRY4,ROUGH NIGHT - Official Restricted Trailer (HD),This movie was worse than the WNBA,2019-05-22T03:04:36.000Z,0
2017-03-08T19:00:05.000Z,oIB4jNYeRY4,ROUGH NIGHT - Official Restricted Trailer (HD),2:00 that song worked very well,2019-05-21T04:19:02.000Z,0
2017-03-08T19:00:05.000Z,oIB4jNYeRY4,ROUGH NIGHT - Official Restricted Trailer (HD),Hangout with sex,2019-05-17T09:09:55.000Z,0
2017-03-08T19:00:05.000Z,oIB4jNYeRY4,ROUGH NIGHT - Official Restricted Trailer (HD),So Black Widow is here all along,2019-05-12T08:01:08.000Z,0
2017-03-08T19:00:05.000Z,oIB4jNYeRY4,ROUGH NIGHT - Official Restricted Trailer (HD),The best joke was the human centipede,2019-05-11T10:11:12.000Z,0
2017-03-08T19:00:05.000Z,oIB4jNYeRY4,ROUGH NIGHT - Official Restricted Trailer (HD),Everyone thats preaching how bad and trash the humour is can you suggest me a good comedy movie     thank you,2019-05-07T18:27:22.000Z,0
2017-03-08T19:00:05.000Z,oIB4jNYeRY4,ROUGH NIGHT - Official Restricted Trailer (HD),I'm livin' for scarlett 😍,2019-04-29T13:40:35.000Z,6
2017-03-08T19:00:05.000Z,oIB4jNYeRY4,ROUGH NIGHT - Official Restricted Trailer (HD),This movie is so funny !!,2019-04-29T02:19:25.000Z,0
2017-03-08T19:00:05.000Z,oIB4jNYeRY4,ROUGH NIGHT - Official Restricted Trailer (HD),not as bad as I thought it was gonna be...,2019-04-28T18:32:25.000Z,0
2017-03-08T19:00:05.000Z,oIB4jNYeRY4,ROUGH NIGHT - Official Restricted Trailer (HD),So just a chick version of Very bad things....,2019-04-25T06:44:30.000Z,0
2017-03-08T19:00:05.000Z,oIB4jNYeRY4,ROUGH NIGHT - Official Restricted Trailer (HD),This is the worst piece of garbage made by mankind.,2019-04-20T17:07:48.000Z,0
2017-03-08T19:00:05.000Z,oIB4jNYeRY4,ROUGH NIGHT - Official Restricted Trailer (HD),Staycone mental mrcury.,2019-04-15T00:55:08.000Z,0
2017-03-08T19:00:05.000Z,oIB4jNYeRY4,ROUGH NIGHT - Official Restricted Trailer (HD),"This is so ugly, and it normalizes drugs !!!!!!!",2019-04-14T14:20:18.000Z,0
2017-03-08T19:00:05.000Z,oIB4jNYeRY4,ROUGH NIGHT - Official Restricted Trailer (HD),Scarlet Johansson’s boyfriend in the movie is obviously fucking gay in real life and can’t play straight. Unless he’s a closet homo in the movie. I only watched about 10 minutes of it.,2019-04-06T00:41:45.000Z,0
2017-03-08T19:00:05.000Z,oIB4jNYeRY4,ROUGH NIGHT - Official Restricted Trailer (HD),Am I the only one who loves watching this movie?,2019-03-14T07:28:37.000Z,7
2017-03-08T19:00:05.000Z,oIB4jNYeRY4,ROUGH NIGHT - Official Restricted Trailer (HD),Is it only me who thinks this movie was a flop,2019-03-12T15:49:34.000Z,0
2017-03-08T19:00:05.000Z,oIB4jNYeRY4,ROUGH NIGHT - Official Restricted Trailer (HD),You probably won’t believe me but one of the girls in this movie is my tutor 😂,2019-02-26T03:42:39.000Z,0
2017-03-08T19:00:05.000Z,oIB4jNYeRY4,ROUGH NIGHT - Official Restricted Trailer (HD),The accent is soooooo gooooddddddddd!!!!!!!,2019-02-25T14:15:47.000Z,0
2017-03-08T19:00:05.000Z,oIB4jNYeRY4,ROUGH NIGHT - Official Restricted Trailer (HD),Now there is a remake of this movie in India..called 90ml,2019-02-21T09:14:49.000Z,0
2017-03-08T19:00:05.000Z,oIB4jNYeRY4,ROUGH NIGHT - Official Restricted Trailer (HD),Now 90ml in tamil movie,2019-02-21T07:50:46.000Z,0
2017-03-08T19:00:05.000Z,oIB4jNYeRY4,ROUGH NIGHT - Official Restricted Trailer (HD),"What is that awesome killer REGGAE song that starts in at the 2:00 time of this trailer clip?? It is NOT in the movie, but in this trailer and I need to know please!!",2019-02-18T06:18:39.000Z,0
2017-03-08T19:00:05.000Z,oIB4jNYeRY4,ROUGH NIGHT - Official Restricted Trailer (HD),Who wants to watch a film about middle age woman partying?,2019-02-12T01:49:41.000Z,2
2017-03-08T19:00:05.000Z,oIB4jNYeRY4,ROUGH NIGHT - Official Restricted Trailer (HD),La leona,2019-02-01T03:08:20.000Z,0
2017-03-08T19:00:05.000Z,oIB4jNYeRY4,ROUGH NIGHT - Official Restricted Trailer (HD),Nice ending,2019-01-26T13:01:15.000Z,0
2017-03-08T19:00:05.000Z,oIB4jNYeRY4,ROUGH NIGHT - Official Restricted Trailer (HD),Nice movie,2019-01-26T13:01:02.000Z,0
2017-03-08T19:00:05.000Z,oIB4jNYeRY4,ROUGH NIGHT - Official Restricted Trailer (HD),"i don’t get it now, everyone’s saying that this flopped a lot. but this is my freaking fav movie and it’s the best movie i’ve ever seen. why y’all sayin’ it is a flop?",2019-01-07T20:58:37.000Z,0
2017-03-08T19:00:05.000Z,oIB4jNYeRY4,ROUGH NIGHT - Official Restricted Trailer (HD),Bad trailer.. But a good movie🤗,2019-01-03T14:46:40.000Z,0
2017-03-08T19:00:05.000Z,oIB4jNYeRY4,ROUGH NIGHT - Official Restricted Trailer (HD),진짜 재밌는데 악플 오지네....,2018-12-29T14:42:25.000Z,0
2017-03-08T19:00:05.000Z,oIB4jNYeRY4,ROUGH NIGHT - Official Restricted Trailer (HD),why all the hate? it was a great movie. Not all movies should be scifi lol,2018-12-27T20:29:47.000Z,4
2017-03-08T19:00:05.000Z,oIB4jNYeRY4,ROUGH NIGHT - Official Restricted Trailer (HD),id probably watch it because scarlett johansson was in it,2018-12-27T02:25:37.000Z,0
2017-03-08T19:00:05.000Z,oIB4jNYeRY4,ROUGH NIGHT - Official Restricted Trailer (HD),"Dope movie.  Not what you expect.  Hella funny too. 👍🏽👍🏽
/bklyn💯",2018-12-18T10:08:14.000Z,2
2017-03-08T19:00:05.000Z,oIB4jNYeRY4,ROUGH NIGHT - Official Restricted Trailer (HD),This is a white version of girls trip 😂,2018-12-09T10:52:04.000Z,0
2017-03-08T19:00:05.000Z,oIB4jNYeRY4,ROUGH NIGHT - Official Restricted Trailer (HD),I. Came here after watching the movie!! It's actually funny.. had a good amount of laughs in this..,2018-11-13T19:21:15.000Z,0
2017-03-08T19:00:05.000Z,oIB4jNYeRY4,ROUGH NIGHT - Official Restricted Trailer (HD),Can't be as bad as Disney Star Wars movies!,2018-11-05T01:36:17.000Z,0
2017-03-08T19:00:05.000Z,oIB4jNYeRY4,ROUGH NIGHT - Official Restricted Trailer (HD),I watched it tonight trust me its amazing just try plz 😍😍😍😍,2018-11-03T23:35:26.000Z,0
2017-03-08T19:00:05.000Z,oIB4jNYeRY4,ROUGH NIGHT - Official Restricted Trailer (HD),The movie actually wasn’t bad BUT I CANNOT deal with the fat chick..,2018-10-17T23:23:27.000Z,0
2017-03-08T19:00:05.000Z,oIB4jNYeRY4,ROUGH NIGHT - Official Restricted Trailer (HD),"Female reboot of Very Bad Things, which was a cool movie back in the day!",2018-10-16T04:21:22.000Z,0
2017-03-08T19:00:05.000Z,oIB4jNYeRY4,ROUGH NIGHT - Official Restricted Trailer (HD),"19:10 (in the movie)
  Frankie returns from the restroom excited she score the highly addictive (omitted) & illegal drug, cocaine. 
The busboy sells drugs to parents without a bit of responsibility for harming parents' children (also steadfastly omitted.)
She purchases from the dealer.
Frankie is excited she supports harming children through the busboy.
Why doesn't she come back excited she scored ""kiddie stag films?""

She is sewage scum. She harms more children retail than does a pedophile. There are more drug abusers/dealers in prison than sex offenders (also omitted.)
The producers spends thousands on each scene. Where do you think they get the money for the following scene to introduce innocent kids how to use cocaine? 
Cartel funding/paid advertising.
Hollywood is the most organized drug-pusher in all of reality.

Bring reality to light, pushing drugs is not ""entertainment."" 

Drug abuse is child abuse.

If you can't tolerate advertising preteen sex, then why are you tolerating a more open, prolific, aggressive type of child abuse from Hollywood? 

Drug abuse is child abuse.",2018-10-14T02:35:08.000Z,0
2017-03-08T19:00:05.000Z,oIB4jNYeRY4,ROUGH NIGHT - Official Restricted Trailer (HD),I watched it for Scarlett Johansson but then I loved the movie with Kate and the rest of the girls,2018-10-06T22:59:09.000Z,0
2017-03-08T19:00:05.000Z,oIB4jNYeRY4,ROUGH NIGHT - Official Restricted Trailer (HD),"Jess:Those anyone know CPR?!?!
Me: I will find it on youtube 🤣🤣😂😂",2018-09-22T08:19:16.000Z,1
2017-03-08T19:00:05.000Z,oIB4jNYeRY4,ROUGH NIGHT - Official Restricted Trailer (HD),"I rewatch it like too much and laugh harder everytime.
😂😂😂😂",2018-09-14T16:04:57.000Z,3
2017-03-08T19:00:05.000Z,oIB4jNYeRY4,ROUGH NIGHT - Official Restricted Trailer (HD),so this is girls trip pretty much??,2018-09-06T15:27:49.000Z,0
2017-03-08T19:00:05.000Z,oIB4jNYeRY4,ROUGH NIGHT - Official Restricted Trailer (HD),Can't believe that black widow look alike girl is really her in the movie. after seeing an actor/actress as super hero; it is getting tough to see them as normal human being in normal movies.,2018-09-01T04:37:43.000Z,0
2017-03-08T19:00:05.000Z,oIB4jNYeRY4,ROUGH NIGHT - Official Restricted Trailer (HD),M.I.A BGS is awesome,2018-08-31T06:08:06.000Z,0
2017-03-08T19:00:05.000Z,oIB4jNYeRY4,ROUGH NIGHT - Official Restricted Trailer (HD),A shared universe with Very Bad Things. 😝,2018-08-27T21:56:30.000Z,0
2017-03-08T19:00:05.000Z,oIB4jNYeRY4,ROUGH NIGHT - Official Restricted Trailer (HD),"Brilliantly written and directed. Great chemistry and great pace, laugh out loud funny! Finger on the pulse of today's women. Saw it 4 times!! Almost all new released movies and serials u can find using boxxy software!",2018-08-22T13:18:57.000Z,0
2017-03-08T19:00:05.000Z,oIB4jNYeRY4,ROUGH NIGHT - Official Restricted Trailer (HD),Dont waste your time.,2018-08-13T19:37:53.000Z,0
2017-03-08T19:00:05.000Z,oIB4jNYeRY4,ROUGH NIGHT - Official Restricted Trailer (HD),"I didn't expect much, so it wasn't that bad.",2018-08-13T05:28:06.000Z,0
2017-03-08T19:00:05.000Z,oIB4jNYeRY4,ROUGH NIGHT - Official Restricted Trailer (HD),"Bad film title name, needed revision.",2018-08-06T03:43:13.000Z,0
2017-03-08T19:00:05.000Z,oIB4jNYeRY4,ROUGH NIGHT - Official Restricted Trailer (HD),I only watched it because bob the drag queen was in it ✋😥🤡☕,2018-08-01T02:43:22.000Z,0
2017-03-08T19:00:05.000Z,oIB4jNYeRY4,ROUGH NIGHT - Official Restricted Trailer (HD),HEY this is actually a really good movie! I mean I laughed a lot while watching it😂❤ the plot was unexpected! so you guys better stop saying bad things about this movie.,2018-07-29T12:58:01.000Z,0
2017-03-08T19:00:05.000Z,oIB4jNYeRY4,ROUGH NIGHT - Official Restricted Trailer (HD),This movie is everything. ive seen it,2018-07-26T08:15:12.000Z,0
2017-03-08T19:00:05.000Z,oIB4jNYeRY4,ROUGH NIGHT - Official Restricted Trailer (HD),Any One can Say 0:54 to 1:07 which song it is??,2018-07-22T05:00:00.000Z,0
2017-03-08T19:00:05.000Z,oIB4jNYeRY4,ROUGH NIGHT - Official Restricted Trailer (HD),Lesson learn from this movie people never ever go over the limit! Once u are over the limit u are bound into trouble,2018-07-17T16:35:41.000Z,0
2017-03-08T19:00:05.000Z,oIB4jNYeRY4,ROUGH NIGHT - Official Restricted Trailer (HD),This is literally a exact example of my friend group 🤣,2018-07-02T10:48:23.000Z,0
2017-03-08T19:00:05.000Z,oIB4jNYeRY4,ROUGH NIGHT - Official Restricted Trailer (HD),What is the second song's title? The Da di du song one? 😂,2018-07-01T22:52:59.000Z,0
2017-03-08T19:00:05.000Z,oIB4jNYeRY4,ROUGH NIGHT - Official Restricted Trailer (HD),this is cringing to watch ..My God..,2018-07-01T18:49:41.000Z,0
2017-03-08T19:00:05.000Z,oIB4jNYeRY4,ROUGH NIGHT - Official Restricted Trailer (HD),This movie is sooo good,2018-06-30T07:39:57.000Z,0
2017-03-08T19:00:05.000Z,oIB4jNYeRY4,ROUGH NIGHT - Official Restricted Trailer (HD),That man using keraoin he is not dead,2018-06-28T12:00:10.000Z,0
2017-03-08T19:00:05.000Z,oIB4jNYeRY4,ROUGH NIGHT - Official Restricted Trailer (HD),Girls trip ripoff,2018-06-27T18:42:04.000Z,0
2017-03-08T19:00:05.000Z,oIB4jNYeRY4,ROUGH NIGHT - Official Restricted Trailer (HD),Is this veere d wedding part 2??😂😂,2018-06-20T08:58:05.000Z,0
2017-03-08T19:00:05.000Z,oIB4jNYeRY4,ROUGH NIGHT - Official Restricted Trailer (HD),Look like indian movie veere di wedding😍😘,2018-06-20T07:48:10.000Z,0
2017-03-08T19:00:05.000Z,oIB4jNYeRY4,ROUGH NIGHT - Official Restricted Trailer (HD),The torrent is on the free sites now ..excellent flick ..I was roaring laughing alone ...,2018-06-17T01:39:52.000Z,0
2017-03-08T19:00:05.000Z,oIB4jNYeRY4,ROUGH NIGHT - Official Restricted Trailer (HD),Oh that's really amazing trailer😆,2018-06-16T12:24:13.000Z,0
2017-03-08T19:00:05.000Z,oIB4jNYeRY4,ROUGH NIGHT - Official Restricted Trailer (HD),He died bcz she jumped on him?????????,2018-06-15T19:25:07.000Z,0
2017-03-08T19:00:05.000Z,oIB4jNYeRY4,ROUGH NIGHT - Official Restricted Trailer (HD),yeah!!!!!!!!!!!!!!!!!!!!!!!!!!!!!!,2018-06-15T02:00:06.000Z,0
2017-03-08T19:00:05.000Z,oIB4jNYeRY4,ROUGH NIGHT - Official Restricted Trailer (HD),Did Anyone see Iphonex ad before  this trailor starts,2018-06-14T17:24:58.000Z,0
2017-03-08T19:00:05.000Z,oIB4jNYeRY4,ROUGH NIGHT - Official Restricted Trailer (HD),Black widow before avengers lol,2018-06-13T19:54:26.000Z,0
2017-03-08T19:00:05.000Z,oIB4jNYeRY4,ROUGH NIGHT - Official Restricted Trailer (HD),This must be inspired from Tamil movie #panchathandhiram😍😍😍,2018-06-13T18:08:26.000Z,0
2017-03-08T19:00:05.000Z,oIB4jNYeRY4,ROUGH NIGHT - Official Restricted Trailer (HD),Love u SJ,2018-06-13T16:57:03.000Z,0
2017-03-08T19:00:05.000Z,oIB4jNYeRY4,ROUGH NIGHT - Official Restricted Trailer (HD),Tamil movie  old magalir mattum ahh,2018-06-13T15:34:23.000Z,0
2017-03-08T19:00:05.000Z,oIB4jNYeRY4,ROUGH NIGHT - Official Restricted Trailer (HD),It's the remake of famous tamil movie 'Panchathanthiram' ❤️ kamal & crazy mohan combo😎,2018-06-13T15:19:18.000Z,0
2017-03-08T19:00:05.000Z,oIB4jNYeRY4,ROUGH NIGHT - Official Restricted Trailer (HD),"It's similar like "" Sex in the city "" movie",2018-06-13T12:06:50.000Z,0
2017-03-08T19:00:05.000Z,oIB4jNYeRY4,ROUGH NIGHT - Official Restricted Trailer (HD),This movie has a collection of all my favorite actors..hope the story is nt dissappointing,2018-06-13T09:43:10.000Z,0
2017-03-08T19:00:05.000Z,oIB4jNYeRY4,ROUGH NIGHT - Official Restricted Trailer (HD),Panjathandhiram 😀tamil movie remix,2018-06-13T07:30:04.000Z,0
2017-03-08T19:00:05.000Z,oIB4jNYeRY4,ROUGH NIGHT - Official Restricted Trailer (HD),"Mr director neenga intha padatha yenga irunthu eduthumea nu yenaku nalla therium.......
MAGALEER MATUM😎😎😎😎
Neenga yaravanalum yemathalam aana yenna yemathavea mudiyathu✌️😎😎✌️✌️",2018-06-13T05:04:43.000Z,0
2017-03-08T19:00:05.000Z,oIB4jNYeRY4,ROUGH NIGHT - Official Restricted Trailer (HD),Vere ki wedding hollywood version,2018-06-13T03:56:15.000Z,1
2017-03-08T19:00:05.000Z,oIB4jNYeRY4,ROUGH NIGHT - Official Restricted Trailer (HD),Whole world is worried about the next avengers part and here black widow is having fun. Wtf....,2018-06-13T03:42:42.000Z,0
2017-03-08T19:00:05.000Z,oIB4jNYeRY4,ROUGH NIGHT - Official Restricted Trailer (HD),Indians copied this as veer di wedding,2018-06-13T02:39:37.000Z,0
2017-03-08T19:00:05.000Z,oIB4jNYeRY4,ROUGH NIGHT - Official Restricted Trailer (HD),Hollywood's Veere di Wedding xD,2018-06-12T19:22:42.000Z,0
2017-03-08T19:00:05.000Z,oIB4jNYeRY4,ROUGH NIGHT - Official Restricted Trailer (HD),Typical douchebaggery,2018-06-10T21:22:14.000Z,0
2017-03-08T19:00:05.000Z,oIB4jNYeRY4,ROUGH NIGHT - Official Restricted Trailer (HD),Awesome movie,2018-06-07T08:28:46.000Z,0
2017-03-08T19:00:05.000Z,oIB4jNYeRY4,ROUGH NIGHT - Official Restricted Trailer (HD),Only gonna watch cos ScarJo is there,2018-06-06T13:59:35.000Z,0
2017-03-08T19:00:05.000Z,oIB4jNYeRY4,ROUGH NIGHT - Official Restricted Trailer (HD),Kollywood panjathanthiram,2018-06-05T05:18:21.000Z,1
2017-03-08T19:00:05.000Z,oIB4jNYeRY4,ROUGH NIGHT - Official Restricted Trailer (HD),jahahahahahah so funny,2018-06-02T12:53:35.000Z,0
2017-03-08T19:00:05.000Z,oIB4jNYeRY4,ROUGH NIGHT - Official Restricted Trailer (HD),"I think black widow easily handle this situation ,",2018-06-02T10:07:54.000Z,0
2017-03-08T19:00:05.000Z,oIB4jNYeRY4,ROUGH NIGHT - Official Restricted Trailer (HD),This is like Very Bad Things,2018-06-02T04:28:57.000Z,0
2017-03-08T19:00:05.000Z,oIB4jNYeRY4,ROUGH NIGHT - Official Restricted Trailer (HD),I think this movie's remake in hindi is veerey di wedding...,2018-06-01T06:32:51.000Z,0
2017-03-08T19:00:05.000Z,oIB4jNYeRY4,ROUGH NIGHT - Official Restricted Trailer (HD),Veere Di Wedding english dubbing I guess...😂😂,2018-05-27T06:15:43.000Z,0
2017-03-08T19:00:05.000Z,oIB4jNYeRY4,ROUGH NIGHT - Official Restricted Trailer (HD),👎🏼,2018-05-23T11:46:17.000Z,0
2017-03-08T19:00:05.000Z,oIB4jNYeRY4,ROUGH NIGHT - Official Restricted Trailer (HD),I will never send my Girlfriend to a vacation if she has such crazy bitches as friends,2018-05-23T07:31:51.000Z,0
2017-03-08T19:00:05.000Z,oIB4jNYeRY4,ROUGH NIGHT - Official Restricted Trailer (HD),It was a bad movie,2018-05-21T01:40:07.000Z,0
2017-03-08T19:00:05.000Z,oIB4jNYeRY4,ROUGH NIGHT - Official Restricted Trailer (HD),Bollywood is good at coping things,2018-05-20T22:54:55.000Z,0
2017-03-08T19:00:05.000Z,oIB4jNYeRY4,ROUGH NIGHT - Official Restricted Trailer (HD),Veeri do wedding,2018-05-20T22:54:33.000Z,0
2017-03-08T19:00:05.000Z,oIB4jNYeRY4,ROUGH NIGHT - Official Restricted Trailer (HD),Watched the film yesterday and it was bullshit. Wtf just wtf. Crappy film and some comedy were funny with the f words that's it. This film was disgusting in a way a divorced women has lovely son and yet just to get the security tapes she has threesome with men and women. Really having a stripper you call that fucking fun. Doing Illegal staff like Kocin. Who does that. This my reaction burning in hell and upsetting GOD,2018-05-12T10:16:25.000Z,0
2017-03-08T19:00:05.000Z,oIB4jNYeRY4,ROUGH NIGHT - Official Restricted Trailer (HD),"I like Scarlett Johansson but the other 4 I hardly even know (aside from seeing Jillian Bell in 22 Jump Street and Goosebumps). They should've got Jessica Alba, Jennifer Garner, Natalie Portman & Gwyneth Paltrow for this movie. GNO Marvel Style, Natasha Romanoff with Susan Storm, Elektra Natchios, Jane Foster & Pepper Potts !!!",2018-05-08T17:21:27.000Z,0
2017-03-08T19:00:05.000Z,oIB4jNYeRY4,ROUGH NIGHT - Official Restricted Trailer (HD),This movie is very low class. It's not funny. What happens with Scarlet? Why she decided to movie like that? For money? OMG!,2018-05-05T19:05:19.000Z,0
2017-03-08T19:00:05.000Z,oIB4jNYeRY4,ROUGH NIGHT - Official Restricted Trailer (HD),That shot at 1:01 is just about the only reason I might consider watching this movie.  Gotta appreciate Johansson spreading her butt cheeks for the camera.  That woman's derriere is the key to lasting world peace...,2018-04-25T03:38:55.000Z,0
2017-03-08T19:00:05.000Z,oIB4jNYeRY4,ROUGH NIGHT - Official Restricted Trailer (HD),I can never watch modern family the same,2018-04-21T23:21:12.000Z,0
2017-03-08T19:00:05.000Z,oIB4jNYeRY4,ROUGH NIGHT - Official Restricted Trailer (HD),GIRLS NIGHT OUT COCAINE AND DEAD BODYS LOOOKS LIKE A RIOT GUS COUNT ME IN CHA CHING BEST MOVIE OF THE YEAR 5 STARS LETS DO THIS ~,2018-04-18T11:05:35.000Z,0
2017-03-08T19:00:05.000Z,oIB4jNYeRY4,ROUGH NIGHT - Official Restricted Trailer (HD),Girls trip 2.0,2018-04-03T18:39:03.000Z,0
2017-03-08T19:00:05.000Z,oIB4jNYeRY4,ROUGH NIGHT - Official Restricted Trailer (HD),movie sounds good,2018-04-01T17:22:41.000Z,0
2017-03-08T19:00:05.000Z,oIB4jNYeRY4,ROUGH NIGHT - Official Restricted Trailer (HD),Horrible movie. Don't waste your miserable time watching this garbage,2018-03-30T01:24:01.000Z,0
2017-03-08T19:00:05.000Z,oIB4jNYeRY4,ROUGH NIGHT - Official Restricted Trailer (HD),Humans born to hate,2018-03-29T21:05:04.000Z,0
2017-03-08T19:00:05.000Z,oIB4jNYeRY4,ROUGH NIGHT - Official Restricted Trailer (HD),When they try to compete with Girls Trip,2018-03-29T00:47:41.000Z,1
2017-03-08T19:00:05.000Z,oIB4jNYeRY4,ROUGH NIGHT - Official Restricted Trailer (HD),2 part plz 😍😍😍😍😍😍😍😍😍😍😍😍😍😍😍😍😍😍😍😍,2018-03-26T12:02:51.000Z,1
2017-03-08T19:00:05.000Z,oIB4jNYeRY4,ROUGH NIGHT - Official Restricted Trailer (HD),BAD MOVIE seriously do not waste your time go watch girls trip instead,2018-03-23T19:27:31.000Z,0
2017-03-08T19:00:05.000Z,oIB4jNYeRY4,ROUGH NIGHT - Official Restricted Trailer (HD),"well, not gonna lie but I enjoy de movie XD the girls  trying to hide the body is the best part XD",2018-03-20T16:02:24.000Z,0
2017-03-08T19:00:05.000Z,oIB4jNYeRY4,ROUGH NIGHT - Official Restricted Trailer (HD),"I'm watching this and thinking where have I seen this plot before?
Eureka!   ""  Very bad things"" 1998

For a mintute I thought hollywood had an original idea",2018-03-19T04:40:36.000Z,0
2017-03-08T19:00:05.000Z,oIB4jNYeRY4,ROUGH NIGHT - Official Restricted Trailer (HD),So you put a bunch of girls and do a hangover type of movie... didnt work,2018-03-17T10:12:10.000Z,0
2017-03-08T19:00:05.000Z,oIB4jNYeRY4,ROUGH NIGHT - Official Restricted Trailer (HD),Remind me of girl trip,2018-03-16T06:10:46.000Z,0
