publish_time,Video ID,Title,Comment,updatedAt,likeCount
2017-03-08T19:00:05.000Z,oIB4jNYeRY4,ROUGH NIGHT - Official Restricted Trailer (HD),"Why do I get the feeling that Hollywood is constantly trying to remake the hangover with women. Bottom line, women aren't funny in those roles.",2017-03-10T11:23:42.000Z,0
2017-03-08T19:00:05.000Z,oIB4jNYeRY4,ROUGH NIGHT - Official Restricted Trailer (HD),Eric Cartman from South Park was right. Women aren't funny.,2017-03-10T11:22:44.000Z,0
2017-03-08T19:00:05.000Z,oIB4jNYeRY4,ROUGH NIGHT - Official Restricted Trailer (HD),Why can't males and females stick with the abilities nature/God has bestowed upon each gender. There is only Male and Female. Nothing else! Males are created with certain traits that allow for Man to do certain things. The same applies to the beautiful way Women are created with extra love and care. To nurture and care for the Human Race.,2017-03-10T11:21:40.000Z,0
2017-03-08T19:00:05.000Z,oIB4jNYeRY4,ROUGH NIGHT - Official Restricted Trailer (HD),The Hangover/Weekend at Bernies crossover huh?,2017-03-10T11:20:59.000Z,0
2017-03-08T19:00:05.000Z,oIB4jNYeRY4,ROUGH NIGHT - Official Restricted Trailer (HD),"finally, black widow got her own movie",2017-03-10T11:20:24.000Z,0
2017-03-08T19:00:05.000Z,oIB4jNYeRY4,ROUGH NIGHT - Official Restricted Trailer (HD),Women are funny. Yes. Hilarious.,2017-03-10T11:07:39.000Z,1
2017-03-08T19:00:05.000Z,oIB4jNYeRY4,ROUGH NIGHT - Official Restricted Trailer (HD),Why not just put the movie up,2017-03-10T11:00:41.000Z,1
2017-03-08T19:00:05.000Z,oIB4jNYeRY4,ROUGH NIGHT - Official Restricted Trailer (HD),female hangover?,2017-03-10T10:51:49.000Z,2
2017-03-08T19:00:05.000Z,oIB4jNYeRY4,ROUGH NIGHT - Official Restricted Trailer (HD),"pretty much just seen the best bits (sarc) of the movie, so no need to actually see it now.
trailers nowadays  just give everything away!",2017-03-10T10:47:35.000Z,1
2017-03-08T19:00:05.000Z,oIB4jNYeRY4,ROUGH NIGHT - Official Restricted Trailer (HD),Scarlet is making really stupid movies,2017-03-10T10:45:52.000Z,1
2017-03-08T19:00:05.000Z,oIB4jNYeRY4,ROUGH NIGHT - Official Restricted Trailer (HD),I hope this isn't as bad as it looks.,2017-03-10T10:42:42.000Z,2
2017-03-08T19:00:05.000Z,oIB4jNYeRY4,ROUGH NIGHT - Official Restricted Trailer (HD),do i spot an Eric Andre at 2:08 ?,2017-03-10T10:40:23.000Z,0
2017-03-08T19:00:05.000Z,oIB4jNYeRY4,ROUGH NIGHT - Official Restricted Trailer (HD),it's been a while since I watched Very Bad Things,2017-03-10T10:38:04.000Z,0
2017-03-08T19:00:05.000Z,oIB4jNYeRY4,ROUGH NIGHT - Official Restricted Trailer (HD),oh look its hangover/bridesmaids but with an  R  rating! ooohh edgy!    ugh...,2017-03-10T10:35:40.000Z,0
2017-03-08T19:00:05.000Z,oIB4jNYeRY4,ROUGH NIGHT - Official Restricted Trailer (HD),I sense a lot of yeast in this.,2017-03-10T10:35:05.000Z,0
2017-03-08T19:00:05.000Z,oIB4jNYeRY4,ROUGH NIGHT - Official Restricted Trailer (HD),This is why sony movies are plummeting,2017-03-10T10:32:00.000Z,0
2017-03-08T19:00:05.000Z,oIB4jNYeRY4,ROUGH NIGHT - Official Restricted Trailer (HD),"Well I watched the entire trailer and thought it was funny, when I saw the first 5 seconds I was thinking 'The hangover'  and expected it to escalate quicker. But a woman jumping on a stripper and 'that' happened! hahah! well I'll be watching this with the gf and it'll be a laugh!",2017-03-10T10:20:39.000Z,0
2017-03-08T19:00:05.000Z,oIB4jNYeRY4,ROUGH NIGHT - Official Restricted Trailer (HD),Stupid,2017-03-10T10:17:24.000Z,0
2017-03-08T19:00:05.000Z,oIB4jNYeRY4,ROUGH NIGHT - Official Restricted Trailer (HD),I will watch it for the one scene with Bo Burnham wine tasting. That is all,2017-03-10T10:16:07.000Z,0
2017-03-08T19:00:05.000Z,oIB4jNYeRY4,ROUGH NIGHT - Official Restricted Trailer (HD),"When does Mike Tyson come in for a cameo?? Guess for this movies sake, when does Ronda Rousey come in for her Mike Tysonesque cameo?",2017-03-10T10:16:04.000Z,0
2017-03-08T19:00:05.000Z,oIB4jNYeRY4,ROUGH NIGHT - Official Restricted Trailer (HD),"god, the cringe....",2017-03-10T10:09:29.000Z,0
2017-03-08T19:00:05.000Z,oIB4jNYeRY4,ROUGH NIGHT - Official Restricted Trailer (HD),"Why all the hate? If you don't like the trailer then don't watch the movie, simple lol. It's supposed to be stupid, lighten up 😂",2017-03-10T10:03:49.000Z,0
2017-03-08T19:00:05.000Z,oIB4jNYeRY4,ROUGH NIGHT - Official Restricted Trailer (HD),looks pretty good,2017-03-10T09:58:47.000Z,0
2017-03-08T19:00:05.000Z,oIB4jNYeRY4,ROUGH NIGHT - Official Restricted Trailer (HD),The loft women version,2017-03-10T09:50:32.000Z,0
2017-03-08T19:00:05.000Z,oIB4jNYeRY4,ROUGH NIGHT - Official Restricted Trailer (HD),"Be careful people, this is sony we are dealing with here. If you don't like the movie you are a nazi, remember XD",2017-03-10T09:43:07.000Z,3
2017-03-08T19:00:05.000Z,oIB4jNYeRY4,ROUGH NIGHT - Official Restricted Trailer (HD),"so people are hating on this movie because...? its just a movie ffs lol you don't like it, don't watch it. it really is that simple.",2017-03-10T09:42:49.000Z,0
2017-03-08T19:00:05.000Z,oIB4jNYeRY4,ROUGH NIGHT - Official Restricted Trailer (HD),OMG Hollywood please ENOUGH movies about bachelorettes and bachelors night.. we have enough!!!,2017-03-10T09:41:35.000Z,1
2017-03-08T19:00:05.000Z,oIB4jNYeRY4,ROUGH NIGHT - Official Restricted Trailer (HD),I love Scarlett Johansson and Zoë Zravitz but they seem very out of place in this movie.,2017-03-10T09:36:13.000Z,0
2017-03-08T19:00:05.000Z,oIB4jNYeRY4,ROUGH NIGHT - Official Restricted Trailer (HD),"I liked it better the first time (aka: Very Bad Things)....and for the record, I liked Bridesmaids and Bad Moms...so none of that ""He hates women"" bullshit",2017-03-10T09:37:05.000Z,0
2017-03-08T19:00:05.000Z,oIB4jNYeRY4,ROUGH NIGHT - Official Restricted Trailer (HD),"I don't understand why so many people are saying this is a Hangover remake. So any movie with the theme of a bachelor or bachelorette party is automatically copying The Hangover? Like please, it's an experience most people have had in this thing called life, and it's allowed to be expressed comedically in more than one movie.",2017-03-10T09:33:17.000Z,0
2017-03-08T19:00:05.000Z,oIB4jNYeRY4,ROUGH NIGHT - Official Restricted Trailer (HD),So this is what Natasha got up to in Budapest? Sounds like a blast.,2017-03-10T09:32:03.000Z,0
2017-03-08T19:00:05.000Z,oIB4jNYeRY4,ROUGH NIGHT - Official Restricted Trailer (HD),when i discreetly smelling my armpit 0:56,2017-03-10T09:28:34.000Z,0
2017-03-08T19:00:05.000Z,oIB4jNYeRY4,ROUGH NIGHT - Official Restricted Trailer (HD),look people chicks can do dude stuff too and be gross. go Hollywood. down with gender.,2017-03-10T09:26:52.000Z,43
2017-03-08T19:00:05.000Z,oIB4jNYeRY4,ROUGH NIGHT - Official Restricted Trailer (HD),It is a little messed up that this movie trailer was released on international woman's day but this movie has nothing to do with politics. I don't see this movie deserving hate at all besides what's mention prior. This movie seems like a goof and everybody is taking it like a new amendment. Everybody just relax and eat a slice of pizza. Papa bless,2017-03-10T09:24:04.000Z,0
2017-03-08T19:00:05.000Z,oIB4jNYeRY4,ROUGH NIGHT - Official Restricted Trailer (HD),Glad everyone else is saying 'Very bad things'.,2017-03-10T09:16:50.000Z,4
2017-03-08T19:00:05.000Z,oIB4jNYeRY4,ROUGH NIGHT - Official Restricted Trailer (HD),wow...just horrific. ...and vacant beyond measure.,2017-03-10T09:12:46.000Z,1
2017-03-08T19:00:05.000Z,oIB4jNYeRY4,ROUGH NIGHT - Official Restricted Trailer (HD),"I seen Bo Burnham and Eric Andre.


hey, thats pretty good!",2017-03-10T09:11:27.000Z,0
2017-03-08T19:00:05.000Z,oIB4jNYeRY4,ROUGH NIGHT - Official Restricted Trailer (HD),"Guys, The Hangover was not the world's first movie about a bachelor party. This film is not taking an original concept/property and repeating it with women (unlike Ghostbusters). It's just a movie with women it. If you don't like it, get over it. Don't go and see it. Live your life. There's something more malicious than that going on here and all it does is inflame a political debate that doesn't need to be had over this fucking movie.",2017-03-10T09:08:29.000Z,1
2017-03-08T19:00:05.000Z,oIB4jNYeRY4,ROUGH NIGHT - Official Restricted Trailer (HD),I'm a women and can admit this looks embarrassingly bad...,2017-03-10T09:08:13.000Z,4
2017-03-08T19:00:05.000Z,oIB4jNYeRY4,ROUGH NIGHT - Official Restricted Trailer (HD),"Had me at ""from the writers of Broad City""",2017-03-10T09:05:25.000Z,0
2017-03-08T19:00:05.000Z,oIB4jNYeRY4,ROUGH NIGHT - Official Restricted Trailer (HD),This looks awful and annoying. Scarlett Johansson is too much of a good actress to be downgraded to this bullshit.,2017-03-10T09:04:49.000Z,1
2017-03-08T19:00:05.000Z,oIB4jNYeRY4,ROUGH NIGHT - Official Restricted Trailer (HD),"If you're old enough to remember Very Bad Things then ur not the target audience for this movie... it's really sad that all these ""party"" movies are promoting drugs as something good and fun while it's not the case at all...",2017-03-10T09:03:01.000Z,0
2017-03-08T19:00:05.000Z,oIB4jNYeRY4,ROUGH NIGHT - Official Restricted Trailer (HD),what is the song in the beginning?,2017-03-10T09:00:33.000Z,0
2017-03-08T19:00:05.000Z,oIB4jNYeRY4,ROUGH NIGHT - Official Restricted Trailer (HD),So 'Very Bad Things' with an all female cast? This should go well.,2017-03-10T08:56:48.000Z,0
2017-03-08T19:00:05.000Z,oIB4jNYeRY4,ROUGH NIGHT - Official Restricted Trailer (HD),love the major lazer track though.,2017-03-10T08:54:02.000Z,0
2017-03-08T19:00:05.000Z,oIB4jNYeRY4,ROUGH NIGHT - Official Restricted Trailer (HD),"i feel like people are actually hating this just because it is an all female cast. . . . . . (and i hated ghostbuster)
not everything involving woman has to do with feminist. . . . .",2017-03-10T08:51:42.000Z,0
2017-03-08T19:00:05.000Z,oIB4jNYeRY4,ROUGH NIGHT - Official Restricted Trailer (HD),Kate McKinnon plays the same fucking character in every goddamn movie.,2017-03-10T08:38:53.000Z,1
2017-03-08T19:00:05.000Z,oIB4jNYeRY4,ROUGH NIGHT - Official Restricted Trailer (HD),*Why?!!!!????*,2017-03-10T08:30:53.000Z,1
2017-03-08T19:00:05.000Z,oIB4jNYeRY4,ROUGH NIGHT - Official Restricted Trailer (HD),Fucking hell mate...Women are fucking unfunny as hell!,2017-03-10T08:16:43.000Z,59
2017-03-08T19:00:05.000Z,oIB4jNYeRY4,ROUGH NIGHT - Official Restricted Trailer (HD),"1:19 It was at this moment the stripper knew, he fucked up.",2017-03-10T08:04:39.000Z,0
2017-03-08T19:00:05.000Z,oIB4jNYeRY4,ROUGH NIGHT - Official Restricted Trailer (HD),"Zoe kravitz has no energy, like she really doesn't need to even be there, or wants to.",2017-03-10T08:03:44.000Z,1
2017-03-08T19:00:05.000Z,oIB4jNYeRY4,ROUGH NIGHT - Official Restricted Trailer (HD),Ha! stupid drunk bitches,2017-03-10T08:00:37.000Z,1
2017-03-08T19:00:05.000Z,oIB4jNYeRY4,ROUGH NIGHT - Official Restricted Trailer (HD),"yakışmadı scarlett 
sen bu filmlere düşecek kadar neler yaşadın",2017-03-10T07:59:28.000Z,0
2017-03-08T19:00:05.000Z,oIB4jNYeRY4,ROUGH NIGHT - Official Restricted Trailer (HD),umm so killing someone is funny now...,2017-03-10T07:58:40.000Z,0
2017-03-08T19:00:05.000Z,oIB4jNYeRY4,ROUGH NIGHT - Official Restricted Trailer (HD),"Very bad things meets Girls trip, the white girl version heeeeyyy I'm feelin' it!",2017-03-10T07:54:28.000Z,0
2017-03-08T19:00:05.000Z,oIB4jNYeRY4,ROUGH NIGHT - Official Restricted Trailer (HD),this movie looks dumb and stupid they made a bad choice on an all female cast if only they were males i can laugh at the same reused humor and plot hollywood has been pumping out forever but i refuse to sucked their dicks because feminism is cancer and ugly i think family guy is a good show,2017-03-10T07:50:07.000Z,0
2017-03-08T19:00:05.000Z,oIB4jNYeRY4,ROUGH NIGHT - Official Restricted Trailer (HD),Movie looks ok. Trailer probably could of done without glorifying cocaine use tho. The kids are watching.,2017-03-10T07:45:33.000Z,0
2017-03-08T19:00:05.000Z,oIB4jNYeRY4,ROUGH NIGHT - Official Restricted Trailer (HD),"Didn't even smile when watching it..... not even a 'heh'..... cringed a bit though....



How's the bottom of the barrel Hollywood?",2017-03-10T07:38:49.000Z,0
2017-03-08T19:00:05.000Z,oIB4jNYeRY4,ROUGH NIGHT - Official Restricted Trailer (HD),"feminazis always emphasize equality, yet movies like this cast 4 white women and LIght skinned zoe kravitz. they couldve casted an asian,hispanics,etc but Nope. white hollywood actresses that complain about equality only care about themselves.",2017-03-10T07:38:46.000Z,28
2017-03-08T19:00:05.000Z,oIB4jNYeRY4,ROUGH NIGHT - Official Restricted Trailer (HD),why we're you involved with this movie Scarlett Jo? why?!?!?,2017-03-10T07:36:01.000Z,0
2017-03-08T19:00:05.000Z,oIB4jNYeRY4,ROUGH NIGHT - Official Restricted Trailer (HD),This movie looks unfunny.,2017-03-10T07:23:14.000Z,0
2017-03-08T19:00:05.000Z,oIB4jNYeRY4,ROUGH NIGHT - Official Restricted Trailer (HD),Scarlett looks kind of like Emma Thompson,2017-03-10T07:22:58.000Z,0
2017-03-08T19:00:05.000Z,oIB4jNYeRY4,ROUGH NIGHT - Official Restricted Trailer (HD),"The Hangover meets Very Bad Things meets Bridesmaids meets 21 Jump Street meets whatever else had been done before. I'm all for women led movies, just not unoriginal rehashing. ",2017-03-10T07:22:13.000Z,0
2017-03-08T19:00:05.000Z,oIB4jNYeRY4,ROUGH NIGHT - Official Restricted Trailer (HD),Hhahahahahahaha! ...that's all i can say,2017-03-10T07:20:15.000Z,1
2017-03-08T19:00:05.000Z,oIB4jNYeRY4,ROUGH NIGHT - Official Restricted Trailer (HD),Wait! Wait! Wait! They made a ghostbusters with a female cast?! Was it any good? Where's the nearest blockbuster!,2017-03-10T07:14:24.000Z,0
2017-03-08T19:00:05.000Z,oIB4jNYeRY4,ROUGH NIGHT - Official Restricted Trailer (HD),"Men literally just can't handle women being in the dominating role. If this were the Hangover 4 or whatever (and it easily could be), people would be laughing at Zach whatever his name is vomiting on a baby.",2017-03-10T07:12:55.000Z,66
2017-03-08T19:00:05.000Z,oIB4jNYeRY4,ROUGH NIGHT - Official Restricted Trailer (HD),"Looks fucken dumb. It's like the hangover, weekend at bernies, and bad moms all rolled up into a shitty movie that was even shittier that the original movies that was  mentioned before.",2017-03-10T07:09:34.000Z,0
2017-03-08T19:00:05.000Z,oIB4jNYeRY4,ROUGH NIGHT - Official Restricted Trailer (HD),Yeah we get it women can do what men already did but the main question is can they be original.,2017-03-10T07:08:13.000Z,1
2017-03-08T19:00:05.000Z,oIB4jNYeRY4,ROUGH NIGHT - Official Restricted Trailer (HD),Isnt there an already upcoming women night out  movie?,2017-03-10T07:07:51.000Z,0
2017-03-08T19:00:05.000Z,oIB4jNYeRY4,ROUGH NIGHT - Official Restricted Trailer (HD),"Pisses me off that people hate this movie because it's an all female cast… based on this trailer, I don't think gender matters. This movie would have sucked with an all male cast.",2017-03-10T07:05:42.000Z,0
2017-03-08T19:00:05.000Z,oIB4jNYeRY4,ROUGH NIGHT - Official Restricted Trailer (HD),"is like weekend bernie + hangover but w/Girls, Nice.",2017-03-10T07:04:11.000Z,0
2017-03-08T19:00:05.000Z,oIB4jNYeRY4,ROUGH NIGHT - Official Restricted Trailer (HD),Did anyone else see colton hayes?,2017-03-10T07:02:20.000Z,0
2017-03-08T19:00:05.000Z,oIB4jNYeRY4,ROUGH NIGHT - Official Restricted Trailer (HD),Am I the only one annoyed by Jillian Bell's character?,2017-03-10T06:56:49.000Z,0
2017-03-08T19:00:05.000Z,oIB4jNYeRY4,ROUGH NIGHT - Official Restricted Trailer (HD),Looks good!,2017-03-10T06:55:12.000Z,0
2017-03-08T19:00:05.000Z,oIB4jNYeRY4,ROUGH NIGHT - Official Restricted Trailer (HD),It's just cringe because of the lack of originality and the use of shock factor rather than wit. Hangover had Zac Galifinacos riffing and lots of funny subplots. This looks like a film poorly copying that but doing it for the girls to liberate them? It's not just men that see through this condescending crap.,2017-03-10T06:54:15.000Z,0
2017-03-08T19:00:05.000Z,oIB4jNYeRY4,ROUGH NIGHT - Official Restricted Trailer (HD),tbh CAN'T WAIT FOR THIS!~,2017-03-10T06:53:05.000Z,0
2017-03-08T19:00:05.000Z,oIB4jNYeRY4,ROUGH NIGHT - Official Restricted Trailer (HD),"""Ok someone tell me what to do...and i will do it...huuAAH""",2017-03-10T06:48:18.000Z,0
2017-03-08T19:00:05.000Z,oIB4jNYeRY4,ROUGH NIGHT - Official Restricted Trailer (HD),Oh boy manufactured controversy from Sony,2017-03-10T06:46:33.000Z,1
2017-03-08T19:00:05.000Z,oIB4jNYeRY4,ROUGH NIGHT - Official Restricted Trailer (HD),OMF ITS JACKSON AHAHAHA,2017-03-10T06:44:58.000Z,0
2017-03-08T19:00:05.000Z,oIB4jNYeRY4,ROUGH NIGHT - Official Restricted Trailer (HD),I just want to see scarlett johanson,2017-03-10T06:43:05.000Z,0
2017-03-08T19:00:05.000Z,oIB4jNYeRY4,ROUGH NIGHT - Official Restricted Trailer (HD),watch rooki and dump dumb and ice cream cake music video by red velvet for wtf moments.,2017-03-10T06:38:28.000Z,0
2017-03-08T19:00:05.000Z,oIB4jNYeRY4,ROUGH NIGHT - Official Restricted Trailer (HD),The only redeeming quality about this is that they have the instrumental to Double Bubble Trouble. Why not just share THAT,2017-03-10T06:38:05.000Z,0
2017-03-08T19:00:05.000Z,oIB4jNYeRY4,ROUGH NIGHT - Official Restricted Trailer (HD),I assume it has 7.5k dislikes because 7.5k men cannot relate to a all women cast. So just chill no one is hating here...,2017-03-10T06:27:04.000Z,1
2017-03-08T19:00:05.000Z,oIB4jNYeRY4,ROUGH NIGHT - Official Restricted Trailer (HD),For all of you saying this is a female remake of Very Bad Things - DID YOU JUST ASSUME THEIR GENDERS?!,2017-03-10T06:26:50.000Z,0
2017-03-08T19:00:05.000Z,oIB4jNYeRY4,ROUGH NIGHT - Official Restricted Trailer (HD),"Hangover!? wait... Girl version this time!?


Wait...

Didn't they make one of those already!? 😂",2017-03-10T06:26:07.000Z,343
2017-03-08T19:00:05.000Z,oIB4jNYeRY4,ROUGH NIGHT - Official Restricted Trailer (HD),"Yes boys, women can make middle of the road, studio mandated comedies just like us! Who knew?? (This movie actually looks okay, I'll watch it).",2017-03-10T06:25:16.000Z,0
2017-03-08T19:00:05.000Z,oIB4jNYeRY4,ROUGH NIGHT - Official Restricted Trailer (HD),Really? -.-,2017-03-10T06:21:18.000Z,0
2017-03-08T19:00:05.000Z,oIB4jNYeRY4,ROUGH NIGHT - Official Restricted Trailer (HD),"the word of the day is ""Legs"".
spread the word!",2017-03-10T06:18:59.000Z,2
2017-03-08T19:00:05.000Z,oIB4jNYeRY4,ROUGH NIGHT - Official Restricted Trailer (HD),"Starring ""that girl you saw in that thing"" and Scarlett Johansson",2017-03-10T06:17:26.000Z,2
2017-03-08T19:00:05.000Z,oIB4jNYeRY4,ROUGH NIGHT - Official Restricted Trailer (HD),"this movie honestly just doesn't look interesting to me. I'm sort of tired of these comedies where something extreme happens and the cast tries to fix it, but it turns out that they were blowing things out of proportion.",2017-03-10T06:16:51.000Z,0
2017-03-08T19:00:05.000Z,oIB4jNYeRY4,ROUGH NIGHT - Official Restricted Trailer (HD),H,2017-03-10T06:15:31.000Z,0
2017-03-08T19:00:05.000Z,oIB4jNYeRY4,ROUGH NIGHT - Official Restricted Trailer (HD),Everyone knows girls aren't funny.....,2017-03-10T06:12:07.000Z,1
2017-03-08T19:00:05.000Z,oIB4jNYeRY4,ROUGH NIGHT - Official Restricted Trailer (HD),I LOVE IT ! I LIKE IT ! I NEED TOO SEE THIS !  ..now view my warpainted videos.,2017-03-10T06:10:34.000Z,0
2017-03-08T19:00:05.000Z,oIB4jNYeRY4,ROUGH NIGHT - Official Restricted Trailer (HD),"It's been a while since I saw the hangover so remind me, when exactly did they murder a stripper and you know, remember the whole night and not loose the groom?? Because I'm pretty sure that's what happened in the hangover, I may be misremembering tho",2017-03-10T06:10:23.000Z,0
2017-03-08T19:00:05.000Z,oIB4jNYeRY4,ROUGH NIGHT - Official Restricted Trailer (HD),when ever movies have a male cast women complain but when its all women they get mad at men for complaining? r u dumb or something?,2017-03-10T06:07:29.000Z,0
2017-03-08T19:00:05.000Z,oIB4jNYeRY4,ROUGH NIGHT - Official Restricted Trailer (HD),Yeah most of the comments are about how we compare female videos to male videos. Does NOT matter in this case. This move looks really really stupid.,2017-03-10T06:03:46.000Z,1
2017-03-08T19:00:05.000Z,oIB4jNYeRY4,ROUGH NIGHT - Official Restricted Trailer (HD),"To all those people dismissing the negative opinions by saying it's from men who don't like an all female cast - do you like it ONLY because it has an all female cast?

I personally don't like this because it substitutes vulgarity and sociopathic behavior for humor.

And I said the same thing about Very Bad Things - the movie this one obviously ripped off.  And that had an all-male cast.",2017-03-10T06:03:44.000Z,4
2017-03-08T19:00:05.000Z,oIB4jNYeRY4,ROUGH NIGHT - Official Restricted Trailer (HD),What's up with the like to dislike ratio? What's with all of the negativity?,2017-03-10T06:03:29.000Z,1
2017-03-08T19:00:05.000Z,oIB4jNYeRY4,ROUGH NIGHT - Official Restricted Trailer (HD),Just like ghostbusters people who are criticising the film are being called sexist AND just like ghostbusters this will flop as a result,2017-03-10T06:02:19.000Z,3
2017-03-08T19:00:05.000Z,oIB4jNYeRY4,ROUGH NIGHT - Official Restricted Trailer (HD),2;18 roman Atwood reference,2017-03-10T06:00:30.000Z,0
2017-03-08T19:00:05.000Z,oIB4jNYeRY4,ROUGH NIGHT - Official Restricted Trailer (HD),"I'm glad studios can get away with plagiarism, by copying Very Bad Night and Weekend at Bernie's. 
The whole female main cast thing could've been done for a few reasons.
Either it was pandering for some sort of feminist ""agenda"" (actually somewhat likely)
Or the writers just wanted women.
I just hope this wasn't done for some bullshit feminist purposes.",2017-03-10T05:59:56.000Z,52
2017-03-08T19:00:05.000Z,oIB4jNYeRY4,ROUGH NIGHT - Official Restricted Trailer (HD),I like how they tell us who to blame for this movie.,2017-03-10T05:58:48.000Z,3
2017-03-08T19:00:05.000Z,oIB4jNYeRY4,ROUGH NIGHT - Official Restricted Trailer (HD),was there seriously a Roman Atwood reference in this trailer? Lol xD,2017-03-10T05:57:36.000Z,0
2017-03-08T19:00:05.000Z,oIB4jNYeRY4,ROUGH NIGHT - Official Restricted Trailer (HD),Women ruin everything,2017-03-10T05:56:53.000Z,0
2017-03-08T19:00:05.000Z,oIB4jNYeRY4,ROUGH NIGHT - Official Restricted Trailer (HD),Should have hired women who are actually funny like that negative chick from Brooklyn 5-0 or that fat amy or anybody else,2017-03-10T05:48:51.000Z,0
2017-03-08T19:00:05.000Z,oIB4jNYeRY4,ROUGH NIGHT - Official Restricted Trailer (HD),I'm calling it right now. this movie is going to flop just like ghost busters did with all female cast. all movies that push the feminist agenda will flop!!!,2017-03-10T05:47:46.000Z,64
2017-03-08T19:00:05.000Z,oIB4jNYeRY4,ROUGH NIGHT - Official Restricted Trailer (HD),Who's the stripper ?,2017-03-10T05:46:21.000Z,0
2017-03-08T19:00:05.000Z,oIB4jNYeRY4,ROUGH NIGHT - Official Restricted Trailer (HD),Jilian has been getting a lot of roles lately good for her,2017-03-10T05:44:19.000Z,0
2017-03-08T19:00:05.000Z,oIB4jNYeRY4,ROUGH NIGHT - Official Restricted Trailer (HD),lmao why is Scarlett getting so worked up by the stripper like shes not a 10,2017-03-10T05:42:12.000Z,0
2017-03-08T19:00:05.000Z,oIB4jNYeRY4,ROUGH NIGHT - Official Restricted Trailer (HD),Women aren't funny. Next.,2017-03-10T05:36:44.000Z,1
2017-03-08T19:00:05.000Z,oIB4jNYeRY4,ROUGH NIGHT - Official Restricted Trailer (HD),this movie is going to stink not because of the stars but of the feminist cockroaches latching onto it like a tick sucking the fun right out of the movie..smfh remember feminism made Donald Trump a reality,2017-03-10T05:35:11.000Z,1
2017-03-08T19:00:05.000Z,oIB4jNYeRY4,ROUGH NIGHT - Official Restricted Trailer (HD),"This could have almost been a good plot, but the goofy, over-the-top acting is putting me off.",2017-03-10T05:31:40.000Z,1
2017-03-08T19:00:05.000Z,oIB4jNYeRY4,ROUGH NIGHT - Official Restricted Trailer (HD),Scarlett Johansson midlife crisis movie lmao this is just sad...,2017-03-10T05:31:01.000Z,0
2017-03-08T19:00:05.000Z,oIB4jNYeRY4,ROUGH NIGHT - Official Restricted Trailer (HD),they always have the DUFF  who takes things too far in order to overcompensate for her need for friendship because she is insecure  about her weight.,2017-03-10T05:27:51.000Z,1
2017-03-08T19:00:05.000Z,oIB4jNYeRY4,ROUGH NIGHT - Official Restricted Trailer (HD),Female cast of: Very Bad Things.,2017-03-10T05:26:54.000Z,1
2017-03-08T19:00:05.000Z,oIB4jNYeRY4,ROUGH NIGHT - Official Restricted Trailer (HD),I already saw Very Bad Things. I'll pass,2017-03-10T05:26:01.000Z,1
2017-03-08T19:00:05.000Z,oIB4jNYeRY4,ROUGH NIGHT - Official Restricted Trailer (HD),Can you imagine the stripper being Chris Evans at 1:13 (pretty sure that's what she's thinking),2017-03-10T05:25:05.000Z,1
2017-03-08T19:00:05.000Z,oIB4jNYeRY4,ROUGH NIGHT - Official Restricted Trailer (HD),I got a few good laughs from this! What's all the fuss?,2017-03-10T05:22:52.000Z,0
2017-03-08T19:00:05.000Z,oIB4jNYeRY4,ROUGH NIGHT - Official Restricted Trailer (HD),"Not knocking it because of the female cast, but this type of movie has been played out over and over.",2017-03-10T05:21:04.000Z,1
2017-03-08T19:00:05.000Z,oIB4jNYeRY4,ROUGH NIGHT - Official Restricted Trailer (HD),So it's a girl version of hangover,2017-03-10T05:18:36.000Z,1
2017-03-08T19:00:05.000Z,oIB4jNYeRY4,ROUGH NIGHT - Official Restricted Trailer (HD),"makes the women feminist look even worse for the so called ""feminist"" movement. I am triggered. lol",2017-03-10T05:14:47.000Z,1
