publish_time,Video ID,Title,Comment,updatedAt,likeCount
2017-03-08T19:00:05.000Z,oIB4jNYeRY4,ROUGH NIGHT - Official Restricted Trailer (HD),No no no no no N.....O.... NO! Just NO!,2017-03-16T06:46:32.000Z,0
2017-03-08T19:00:05.000Z,oIB4jNYeRY4,ROUGH NIGHT - Official Restricted Trailer (HD),"9:26 Rough Night Movie Available in hd Quality
Stream Now https://plus.google.com/+McQuinGanesStaringDika/posts/49tJwGPies5",2017-03-16T04:27:23.000Z,0
2017-03-08T19:00:05.000Z,oIB4jNYeRY4,ROUGH NIGHT - Official Restricted Trailer (HD),"The worst thing about this movie is that fat girl. Not beacuse she's fat. But she is obnoxious, screaming, swearing and annoying in general.",2017-03-16T03:46:45.000Z,1
2017-03-08T19:00:05.000Z,oIB4jNYeRY4,ROUGH NIGHT - Official Restricted Trailer (HD),Zoe kravtiz 😍😍😍,2017-03-16T03:03:46.000Z,0
2017-03-08T19:00:05.000Z,oIB4jNYeRY4,ROUGH NIGHT - Official Restricted Trailer (HD),This movie is the exact copy of a Tamil movie ' Panchathanthiram' acted by Kamal Hassan ....Instead of five girls here they have five men...that's it...everyscene resembles exactly same as Panchathanthiram...,2017-03-16T02:54:55.000Z,0
2017-03-08T19:00:05.000Z,oIB4jNYeRY4,ROUGH NIGHT - Official Restricted Trailer (HD),"Weekend at Bernie's, with women. LAME.",2017-03-16T01:13:25.000Z,1
2017-03-08T19:00:05.000Z,oIB4jNYeRY4,ROUGH NIGHT - Official Restricted Trailer (HD),this movie like a panchathandhiram tamil movie....,2017-03-16T01:08:30.000Z,0
2017-03-08T19:00:05.000Z,oIB4jNYeRY4,ROUGH NIGHT - Official Restricted Trailer (HD),Yay!! I Heart Degeneracy!,2017-03-15T23:32:19.000Z,0
2017-03-08T19:00:05.000Z,oIB4jNYeRY4,ROUGH NIGHT - Official Restricted Trailer (HD),This is just Bridesmaids (2011). They even go to Vegas and get high.,2017-03-15T23:08:34.000Z,1
2017-03-08T19:00:05.000Z,oIB4jNYeRY4,ROUGH NIGHT - Official Restricted Trailer (HD),this looks bad and not in a good way...ugh. was hoping for something wacky n fun.,2017-03-15T22:55:15.000Z,1
2017-03-08T19:00:05.000Z,oIB4jNYeRY4,ROUGH NIGHT - Official Restricted Trailer (HD),"I feel like everyone's acting in this movie is overly done....

You guys spent all your money on an A-lister and just casted background actors in a movie?",2017-03-15T22:06:33.000Z,2
2017-03-08T19:00:05.000Z,oIB4jNYeRY4,ROUGH NIGHT - Official Restricted Trailer (HD),I feel like I already watched the whole movie after watching this trailer,2017-03-15T20:50:09.000Z,2
2017-03-08T19:00:05.000Z,oIB4jNYeRY4,ROUGH NIGHT - Official Restricted Trailer (HD),Who approves of this garbage? If I was the directors mother I wouldn't even say it's good.,2017-03-15T20:43:04.000Z,1
2017-03-08T19:00:05.000Z,oIB4jNYeRY4,ROUGH NIGHT - Official Restricted Trailer (HD),This looks fucking funny,2017-03-15T19:46:48.000Z,1
2017-03-08T19:00:05.000Z,oIB4jNYeRY4,ROUGH NIGHT - Official Restricted Trailer (HD),"HAHA they don't even try to name these horrible cookie-cutter comedies anymore... i.e.: ""Bad Moms"", ""Rough Night"", ""Fist Fight""... if Weekend at Bernie's was a new concept today, they would just name is ""Dead Guy""",2017-03-15T19:43:31.000Z,1
2017-03-08T19:00:05.000Z,oIB4jNYeRY4,ROUGH NIGHT - Official Restricted Trailer (HD),Another retarded copycat comedy for woemn with low selfesteem.,2017-03-15T19:15:50.000Z,1
2017-03-08T19:00:05.000Z,oIB4jNYeRY4,ROUGH NIGHT - Official Restricted Trailer (HD),sounds like tamil movie Panchathantiram,2017-03-15T18:07:18.000Z,0
2017-03-08T19:00:05.000Z,oIB4jNYeRY4,ROUGH NIGHT - Official Restricted Trailer (HD),"I'm gonna say it, this legit looks like a white version of Girls Night.",2017-03-15T17:48:12.000Z,1
2017-03-08T19:00:05.000Z,oIB4jNYeRY4,ROUGH NIGHT - Official Restricted Trailer (HD),"I'm going to go with ""Very Bad Things"" meets ""Weekend at Bernies"".",2017-03-15T17:25:36.000Z,5
2017-03-08T19:00:05.000Z,oIB4jNYeRY4,ROUGH NIGHT - Official Restricted Trailer (HD),"Oh, so it's a Rule 63 version of Very Bad Things. Okay. I gotcha.",2017-03-15T15:43:08.000Z,0
2017-03-08T19:00:05.000Z,oIB4jNYeRY4,ROUGH NIGHT - Official Restricted Trailer (HD),female version of The Hangover?,2017-03-15T15:11:36.000Z,1
2017-03-08T19:00:05.000Z,oIB4jNYeRY4,ROUGH NIGHT - Official Restricted Trailer (HD),hangover female version,2017-03-15T14:42:45.000Z,1
2017-03-08T19:00:05.000Z,oIB4jNYeRY4,ROUGH NIGHT - Official Restricted Trailer (HD),Was that Colton Haynes?,2017-03-15T14:13:07.000Z,0
2017-03-08T19:00:05.000Z,oIB4jNYeRY4,ROUGH NIGHT - Official Restricted Trailer (HD),i hate you kate mckinoned,2017-03-15T13:34:23.000Z,0
2017-03-08T19:00:05.000Z,oIB4jNYeRY4,ROUGH NIGHT - Official Restricted Trailer (HD),Bo Burnham at 2:09!!!,2017-03-15T12:43:03.000Z,0
2017-03-08T19:00:05.000Z,oIB4jNYeRY4,ROUGH NIGHT - Official Restricted Trailer (HD),why scarlet..,2017-03-15T12:12:09.000Z,0
2017-03-08T19:00:05.000Z,oIB4jNYeRY4,ROUGH NIGHT - Official Restricted Trailer (HD),"2:25 
horror",2017-03-15T11:47:27.000Z,0
2017-03-08T19:00:05.000Z,oIB4jNYeRY4,ROUGH NIGHT - Official Restricted Trailer (HD),So when is this horny fat girl trope gonna die out?,2017-03-15T10:46:36.000Z,1
2017-03-08T19:00:05.000Z,oIB4jNYeRY4,ROUGH NIGHT - Official Restricted Trailer (HD),C'mon Sony... c'mon. At least make something new and original.,2017-03-15T08:38:05.000Z,0
2017-03-08T19:00:05.000Z,oIB4jNYeRY4,ROUGH NIGHT - Official Restricted Trailer (HD),looks hella funny,2017-03-15T08:34:37.000Z,1
2017-03-08T19:00:05.000Z,oIB4jNYeRY4,ROUGH NIGHT - Official Restricted Trailer (HD),Who takes credit for being a 'studio'?,2017-03-15T05:56:10.000Z,0
2017-03-08T19:00:05.000Z,oIB4jNYeRY4,ROUGH NIGHT - Official Restricted Trailer (HD),Ghostbusters 4 ?,2017-03-15T05:50:38.000Z,0
2017-03-08T19:00:05.000Z,oIB4jNYeRY4,ROUGH NIGHT - Official Restricted Trailer (HD),"it's like they saw the movie Bridesmaids and thought ""you know what this was missing? murdering a sex worker and using the body as a prop throughout film",2017-03-15T04:23:38.000Z,0
2017-03-08T19:00:05.000Z,oIB4jNYeRY4,ROUGH NIGHT - Official Restricted Trailer (HD),no thanks,2017-03-15T04:01:50.000Z,0
2017-03-08T19:00:05.000Z,oIB4jNYeRY4,ROUGH NIGHT - Official Restricted Trailer (HD),This looks so so awful...but tbh it has Kate Mckinnon and Ilana Glazer in it so I'll power through,2017-03-15T03:04:38.000Z,6
2017-03-08T19:00:05.000Z,oIB4jNYeRY4,ROUGH NIGHT - Official Restricted Trailer (HD),Someone getting ate out on 2:07,2017-03-15T02:35:06.000Z,0
2017-03-08T19:00:05.000Z,oIB4jNYeRY4,ROUGH NIGHT - Official Restricted Trailer (HD),"So, whats the underlying theme of this film that will educate the viewer?",2017-03-15T02:25:06.000Z,0
2017-03-08T19:00:05.000Z,oIB4jNYeRY4,ROUGH NIGHT - Official Restricted Trailer (HD),Why do Liberals love coke?,2017-03-15T02:05:14.000Z,0
2017-03-08T19:00:05.000Z,oIB4jNYeRY4,ROUGH NIGHT - Official Restricted Trailer (HD),һ,2017-03-15T02:04:08.000Z,0
2017-03-08T19:00:05.000Z,oIB4jNYeRY4,ROUGH NIGHT - Official Restricted Trailer (HD),A motive to start diet ! 😋,2017-03-15T02:01:54.000Z,0
2017-03-08T19:00:05.000Z,oIB4jNYeRY4,ROUGH NIGHT - Official Restricted Trailer (HD),"Really Scarlett, this is what you put your time in? Woow",2017-03-15T01:24:35.000Z,0
2017-03-08T19:00:05.000Z,oIB4jNYeRY4,ROUGH NIGHT - Official Restricted Trailer (HD),2017 ghostbusters,2017-03-15T00:38:27.000Z,0
2017-03-08T19:00:05.000Z,oIB4jNYeRY4,ROUGH NIGHT - Official Restricted Trailer (HD),Hangover and Sex and the City had an ugly baby. This.,2017-03-15T00:25:52.000Z,2
2017-03-08T19:00:05.000Z,oIB4jNYeRY4,ROUGH NIGHT - Official Restricted Trailer (HD),zoe ❤,2017-03-14T23:40:49.000Z,0
2017-03-08T19:00:05.000Z,oIB4jNYeRY4,ROUGH NIGHT - Official Restricted Trailer (HD),Saw the entire movie just now.,2017-03-14T23:20:23.000Z,0
2017-03-08T19:00:05.000Z,oIB4jNYeRY4,ROUGH NIGHT - Official Restricted Trailer (HD),How about this guys and girls. It's a paycheck. A BIG paycheck. How much you think Scarjo is getting paid for this little turd? Couple million? I'd be in a shitty movie too.,2017-03-14T23:14:48.000Z,0
2017-03-08T19:00:05.000Z,oIB4jNYeRY4,ROUGH NIGHT - Official Restricted Trailer (HD),"Is this supposed to be funny? 
How much more is Hollywood going to beat this dead horse of a movie subject??",2017-03-14T22:49:40.000Z,0
2017-03-08T19:00:05.000Z,oIB4jNYeRY4,ROUGH NIGHT - Official Restricted Trailer (HD),"chick version of ""Very Bad Things"" lets hope this doesn't fall under the spectrum of chick version of ""Ghost Busters"", cuz i really liked ""Very Bad Things""",2017-03-14T22:42:41.000Z,0
2017-03-08T19:00:05.000Z,oIB4jNYeRY4,ROUGH NIGHT - Official Restricted Trailer (HD),What on earth is Kate McKinnon's accent meant to be in this? Is it southern or Australian or is it just me?,2017-03-14T22:30:32.000Z,0
2017-03-08T19:00:05.000Z,oIB4jNYeRY4,ROUGH NIGHT - Official Restricted Trailer (HD),"Just stick to videogames, Sony.",2017-03-14T21:43:45.000Z,0
2017-03-08T19:00:05.000Z,oIB4jNYeRY4,ROUGH NIGHT - Official Restricted Trailer (HD),After seeing Kate McKinnon and ScarJo's chemistry on SNL i'm 100x more excited for this movie!!!,2017-03-14T21:35:17.000Z,6
2017-03-08T19:00:05.000Z,oIB4jNYeRY4,ROUGH NIGHT - Official Restricted Trailer (HD),Isn't this that movie with Zach Galafinakis and Ed Helms? On the plus side Zoe Kravitz is hot.,2017-03-14T21:31:37.000Z,0
2017-03-08T19:00:05.000Z,oIB4jNYeRY4,ROUGH NIGHT - Official Restricted Trailer (HD),Sony trying to go bankrupt or something with all the gender swap films...dont even tell me they are making Oceans 8 lol,2017-03-14T21:21:39.000Z,1
2017-03-08T19:00:05.000Z,oIB4jNYeRY4,ROUGH NIGHT - Official Restricted Trailer (HD),"so, a Very Bad Things remake?",2017-03-14T21:18:58.000Z,0
2017-03-08T19:00:05.000Z,oIB4jNYeRY4,ROUGH NIGHT - Official Restricted Trailer (HD),Reminds me of that movie Very bad things with Christian Slater,2017-03-14T20:40:34.000Z,0
2017-03-08T19:00:05.000Z,oIB4jNYeRY4,ROUGH NIGHT - Official Restricted Trailer (HD),"Colton Hayden! ( Yeah, this is the only thing that i have to Say)",2017-03-14T20:34:11.000Z,0
2017-03-08T19:00:05.000Z,oIB4jNYeRY4,ROUGH NIGHT - Official Restricted Trailer (HD),"WHITE version of ""Girls Trip"" ???",2017-03-14T19:50:17.000Z,0
2017-03-08T19:00:05.000Z,oIB4jNYeRY4,ROUGH NIGHT - Official Restricted Trailer (HD),this looks like fuckig g arbage,2017-03-14T19:49:37.000Z,1
2017-03-08T19:00:05.000Z,oIB4jNYeRY4,ROUGH NIGHT - Official Restricted Trailer (HD),"so why did I have to sign in to see this trailer? a couple of fucks? or the fake dicks on the blonde chicks head? not ""mature"" worthy IMO.",2017-03-14T19:25:48.000Z,0
2017-03-08T19:00:05.000Z,oIB4jNYeRY4,ROUGH NIGHT - Official Restricted Trailer (HD),"This movie looks like the movie ""Very bad things"" only now it's a comedy with chicks.",2017-03-14T18:32:26.000Z,0
2017-03-08T19:00:05.000Z,oIB4jNYeRY4,ROUGH NIGHT - Official Restricted Trailer (HD),Jesus fucking Christ this makes me wanna die.,2017-03-14T18:24:17.000Z,0
2017-03-08T19:00:05.000Z,oIB4jNYeRY4,ROUGH NIGHT - Official Restricted Trailer (HD),"Unfortunately, this is not a parody.",2017-03-14T17:57:56.000Z,0
2017-03-08T19:00:05.000Z,oIB4jNYeRY4,ROUGH NIGHT - Official Restricted Trailer (HD),whaaaaat is this? oh my god lol,2017-03-14T17:27:00.000Z,0
2017-03-08T19:00:05.000Z,oIB4jNYeRY4,ROUGH NIGHT - Official Restricted Trailer (HD),"Fine, fine stop bitching, Ill take one for the team, and take the fat coked out chick.",2017-03-14T16:26:58.000Z,0
2017-03-08T19:00:05.000Z,oIB4jNYeRY4,ROUGH NIGHT - Official Restricted Trailer (HD),So is this a remake of the movie very bad thing?  But with an all female cast.,2017-03-14T15:31:48.000Z,0
2017-03-08T19:00:05.000Z,oIB4jNYeRY4,ROUGH NIGHT - Official Restricted Trailer (HD),"Oh God, Who in Sony is approving those scripts to get out? Don't they have quality control? this unoriginal film...at least from the trailer, should have been stopped from the floor, but someone approved of it and now it is a movie.  This is just sad at this point.",2017-03-14T15:27:52.000Z,0
2017-03-08T19:00:05.000Z,oIB4jNYeRY4,ROUGH NIGHT - Official Restricted Trailer (HD),ScarJo's cut on the box office must be really good to do a throwaway flick like this,2017-03-14T15:20:22.000Z,0
2017-03-08T19:00:05.000Z,oIB4jNYeRY4,ROUGH NIGHT - Official Restricted Trailer (HD),DUMB,2017-03-14T15:02:58.000Z,0
2017-03-08T19:00:05.000Z,oIB4jNYeRY4,ROUGH NIGHT - Official Restricted Trailer (HD),this big actress is annoying af... i prefer fat amy ! >:( hangover prt 4,2017-03-14T14:51:02.000Z,0
2017-03-08T19:00:05.000Z,oIB4jNYeRY4,ROUGH NIGHT - Official Restricted Trailer (HD),"I'll see it for Scarlett. That's it. 

Come on ladies, the Hangover was bad enough to begin with.",2017-03-14T14:34:39.000Z,0
2017-03-08T19:00:05.000Z,oIB4jNYeRY4,ROUGH NIGHT - Official Restricted Trailer (HD),If you want to watch the original film that this movie is ripped off from it's called Very Bad Things (1998).  Get your sh*! together Sony.,2017-03-14T13:05:52.000Z,0
2017-03-08T19:00:05.000Z,oIB4jNYeRY4,ROUGH NIGHT - Official Restricted Trailer (HD),the hangover girls version,2017-03-14T10:59:58.000Z,0
2017-03-08T19:00:05.000Z,oIB4jNYeRY4,ROUGH NIGHT - Official Restricted Trailer (HD),"MAKE MOVIES GREAT AGAIN





Not this decadent, degenerate tripe.",2017-03-14T10:26:56.000Z,3
2017-03-08T19:00:05.000Z,oIB4jNYeRY4,ROUGH NIGHT - Official Restricted Trailer (HD),looks like garbage!!,2017-03-14T09:50:48.000Z,0
2017-03-08T19:00:05.000Z,oIB4jNYeRY4,ROUGH NIGHT - Official Restricted Trailer (HD),They ripped off a Michael Bay shot,2017-03-14T08:50:38.000Z,0
2017-03-08T19:00:05.000Z,oIB4jNYeRY4,ROUGH NIGHT - Official Restricted Trailer (HD),so this movie revolves around a fat chick jumping in a male stripper and killing him,2017-03-14T08:35:10.000Z,0
2017-03-08T19:00:05.000Z,oIB4jNYeRY4,ROUGH NIGHT - Official Restricted Trailer (HD),good look,2017-03-14T07:19:23.000Z,0
2017-03-08T19:00:05.000Z,oIB4jNYeRY4,ROUGH NIGHT - Official Restricted Trailer (HD),what is the music in the beginning before the actual trailer plays,2017-03-14T06:53:24.000Z,0
2017-03-08T19:00:05.000Z,oIB4jNYeRY4,ROUGH NIGHT - Official Restricted Trailer (HD),Another white movie with only a sprinkling of ethnicity;),2017-03-14T06:41:31.000Z,0
2017-03-08T19:00:05.000Z,oIB4jNYeRY4,ROUGH NIGHT - Official Restricted Trailer (HD),This is lowkey a parody of 'The Loft',2017-03-14T05:22:06.000Z,0
2017-03-08T19:00:05.000Z,oIB4jNYeRY4,ROUGH NIGHT - Official Restricted Trailer (HD),"REMINDS ME OF THE ""CUNTBUSTERS""...FOCKING RETARDED...",2017-03-14T05:02:20.000Z,0
2017-03-08T19:00:05.000Z,oIB4jNYeRY4,ROUGH NIGHT - Official Restricted Trailer (HD),The number of misogynists in the comments is overwhelming. I'm looking forward to this movie. ✌🏼 Also looking forward to any misogynistic comments that follow this. 😘,2017-03-14T05:01:54.000Z,1
2017-03-08T19:00:05.000Z,oIB4jNYeRY4,ROUGH NIGHT - Official Restricted Trailer (HD),People saying this is The Hangover with a female cast makes me feel old. This is clearly Very Bad Things with a female cast.,2017-03-14T04:46:17.000Z,0
2017-03-08T19:00:05.000Z,oIB4jNYeRY4,ROUGH NIGHT - Official Restricted Trailer (HD),I love the new black widow movie trailer,2017-03-14T04:22:14.000Z,0
2017-03-08T19:00:05.000Z,oIB4jNYeRY4,ROUGH NIGHT - Official Restricted Trailer (HD),"""Very Bad Things""its much better.",2017-03-14T04:07:30.000Z,0
2017-03-08T19:00:05.000Z,oIB4jNYeRY4,ROUGH NIGHT - Official Restricted Trailer (HD),I don't care what anyone says I'll see it for my girl Mckinnon,2017-03-14T04:07:16.000Z,27
2017-03-08T19:00:05.000Z,oIB4jNYeRY4,ROUGH NIGHT - Official Restricted Trailer (HD),THAT TOOK A TURN I DIDN'T EXPECT,2017-03-14T04:03:04.000Z,1
2017-03-08T19:00:05.000Z,oIB4jNYeRY4,ROUGH NIGHT - Official Restricted Trailer (HD),So many triggered Anti-SJW's LOL.,2017-03-14T02:39:33.000Z,0
2017-03-08T19:00:05.000Z,oIB4jNYeRY4,ROUGH NIGHT - Official Restricted Trailer (HD),"This is ""Very Bad Things"" with chicks.",2017-03-14T02:27:47.000Z,4
2017-03-08T19:00:05.000Z,oIB4jNYeRY4,ROUGH NIGHT - Official Restricted Trailer (HD),"I will pass on this movie simply because it looks like a terrible movie in this trailer. I don't care if it mimics a past movie or that it has an all girl anything. The sex of the director, cast, writers etc. DO NOT decide the quality of a movie. An actor, director, screenwriter, special effects artist, etc. etc. is a great by ability not by sex.  The movie in this trailer LOOKS like a bad movie. It is not closed mindedness when a person chooses not to waste money for what looks like a bad product.",2017-03-14T02:06:21.000Z,0
2017-03-08T19:00:05.000Z,oIB4jNYeRY4,ROUGH NIGHT - Official Restricted Trailer (HD),If there's no scar joe tits I'm not up for it...,2017-03-14T01:47:21.000Z,0
2017-03-08T19:00:05.000Z,oIB4jNYeRY4,ROUGH NIGHT - Official Restricted Trailer (HD),I can tell u that the ending is he isn't really dead probably has a sleeping disorder saved u 10.00 bucks,2017-03-14T01:28:13.000Z,0
2017-03-08T19:00:05.000Z,oIB4jNYeRY4,ROUGH NIGHT - Official Restricted Trailer (HD),Dang I saw my girl scarjo was in this so I was gonna give the trailer a chance. Then I saw the dislike bar.,2017-03-14T01:13:44.000Z,0
2017-03-08T19:00:05.000Z,oIB4jNYeRY4,ROUGH NIGHT - Official Restricted Trailer (HD),is this a remake or just a complete copy?,2017-03-14T00:44:27.000Z,0
2017-03-08T19:00:05.000Z,oIB4jNYeRY4,ROUGH NIGHT - Official Restricted Trailer (HD),...does anyone know the name of the guy who played the stripper?,2017-03-14T00:43:29.000Z,0
2017-03-08T19:00:05.000Z,oIB4jNYeRY4,ROUGH NIGHT - Official Restricted Trailer (HD),Fairly certain she won't be swimming in anything but her own blubber and despair.,2017-03-14T00:00:44.000Z,1
2017-03-08T19:00:05.000Z,oIB4jNYeRY4,ROUGH NIGHT - Official Restricted Trailer (HD),God Sony strikes out again this is just a watered down versions of Hangover and Bridesmaids mixed together,2017-03-13T23:44:32.000Z,0
2017-03-08T19:00:05.000Z,oIB4jNYeRY4,ROUGH NIGHT - Official Restricted Trailer (HD),"""Very Bad Things"" except with bitches.",2017-03-13T23:16:55.000Z,0
2017-03-08T19:00:05.000Z,oIB4jNYeRY4,ROUGH NIGHT - Official Restricted Trailer (HD),2:06 that actor plays as Roy Harper/Arsenal in the CWs Arrow,2017-03-13T23:08:04.000Z,0
2017-03-08T19:00:05.000Z,oIB4jNYeRY4,ROUGH NIGHT - Official Restricted Trailer (HD),So Very Bad Things crossed with Bridesmaids.....good actresses in what looks like a shitty movie,2017-03-13T23:06:17.000Z,0
2017-03-08T19:00:05.000Z,oIB4jNYeRY4,ROUGH NIGHT - Official Restricted Trailer (HD),Looks unoriginal.,2017-03-13T23:05:33.000Z,0
2017-03-08T19:00:05.000Z,oIB4jNYeRY4,ROUGH NIGHT - Official Restricted Trailer (HD),Chicks acting like guys - pure leftist/chick porn. Glad I saw the trailer so I can completely avoid this. Sorry Scarlett - you could be naked for the whole film and I wouldn't bother.,2017-03-13T23:02:40.000Z,1
2017-03-08T19:00:05.000Z,oIB4jNYeRY4,ROUGH NIGHT - Official Restricted Trailer (HD),"All that, and they DON'T make a puppet of the corpse? I'd prefer Weekend at Bernie's 2017.",2017-03-13T22:51:54.000Z,0
2017-03-08T19:00:05.000Z,oIB4jNYeRY4,ROUGH NIGHT - Official Restricted Trailer (HD),I wanted to like it - looks fucking awful.,2017-03-13T22:43:09.000Z,0
2017-03-08T19:00:05.000Z,oIB4jNYeRY4,ROUGH NIGHT - Official Restricted Trailer (HD),"Actually, to me, this looks more like ""The Hangover"" than ""Bridesmaids"". Bridesmaids was painfully un-funny.",2017-03-13T22:35:32.000Z,0
2017-03-08T19:00:05.000Z,oIB4jNYeRY4,ROUGH NIGHT - Official Restricted Trailer (HD),"I laughed to the trailer. What's wrong with you people? So toxic. Sorry I don't know wtf you guys are comparing this movie to from the 90's or whatever but for me, this movie looks funny. Yes I have seen the hang over and they are kinda similar but i don't mind seeing girls act just as dumb.",2017-03-13T22:22:28.000Z,0
2017-03-08T19:00:05.000Z,oIB4jNYeRY4,ROUGH NIGHT - Official Restricted Trailer (HD),This movie is 10 years to late. i am over movies like this.,2017-03-13T21:27:19.000Z,0
2017-03-08T19:00:05.000Z,oIB4jNYeRY4,ROUGH NIGHT - Official Restricted Trailer (HD),does anybody else feel that this is just the female version of the hangover?,2017-03-13T21:24:20.000Z,0
2017-03-08T19:00:05.000Z,oIB4jNYeRY4,ROUGH NIGHT - Official Restricted Trailer (HD),"essentially, the hangover for females!",2017-03-13T21:23:57.000Z,0
2017-03-08T19:00:05.000Z,oIB4jNYeRY4,ROUGH NIGHT - Official Restricted Trailer (HD),It looks like it's going to be a  jewmazing film,2017-03-13T21:14:49.000Z,0
2017-03-08T19:00:05.000Z,oIB4jNYeRY4,ROUGH NIGHT - Official Restricted Trailer (HD),"First of all there are very few people who comment who actually have knowledge and understanding about what feminism is. THIS MOVIE IS NOT FEMINIST. In fact, many feminist are also challenging one aspect of the movie which is the fact that they accidently kill a stripper (who is male) and they are claiming that the movie is anti-sexworker and perpetuating stereotypical beliefs that sex workers' death is normalized to such a point that has become comedic. 
This has nothing about ""women being whores"" or what have you. It's a stupid comedy full of stupid unrealistic, over the top, shock value humour just like any other shitty Hollywood comedy.",2017-03-13T21:07:51.000Z,1
2017-03-08T19:00:05.000Z,oIB4jNYeRY4,ROUGH NIGHT - Official Restricted Trailer (HD),This was already a movie back in the 1990's. It was called Very Bad Things.,2017-03-13T20:57:25.000Z,21
2017-03-08T19:00:05.000Z,oIB4jNYeRY4,ROUGH NIGHT - Official Restricted Trailer (HD),It's no Fear And Loathing In LasVegas orthe lesser Hot-tub Time-machine. Looks like a coke advert for millennial goofballs,2017-03-13T20:39:15.000Z,0
2017-03-08T19:00:05.000Z,oIB4jNYeRY4,ROUGH NIGHT - Official Restricted Trailer (HD),I kinda wanna watch this just for the girl from Workaholics. lol,2017-03-13T20:37:13.000Z,0
2017-03-08T19:00:05.000Z,oIB4jNYeRY4,ROUGH NIGHT - Official Restricted Trailer (HD),sooooo it's Scarlett Johansson + 4 randoms in girly Hangover. right........,2017-03-13T20:14:13.000Z,0
2017-03-08T19:00:05.000Z,oIB4jNYeRY4,ROUGH NIGHT - Official Restricted Trailer (HD),"So ""Fun"" means drinking, drugs and sex?

Thats all these movies ever do...",2017-03-13T19:42:52.000Z,13
2017-03-08T19:00:05.000Z,oIB4jNYeRY4,ROUGH NIGHT - Official Restricted Trailer (HD),"This idea is 20 years old.  I was just about 30 when ""Very Bad Things"" came out (not a bad movie).  The trailer is cut awfully.  I like Scarlett Johansson, but based on the trailer this movie looks terrible.",2017-03-13T19:15:00.000Z,0
2017-03-08T19:00:05.000Z,oIB4jNYeRY4,ROUGH NIGHT - Official Restricted Trailer (HD),Awful... Old ideas reimagined with women... Bachelor Party anyone?... The Hangover?? GET SOME NEW IDEAS!!!!!!!!,2017-03-13T19:12:30.000Z,0
2017-03-08T19:00:05.000Z,oIB4jNYeRY4,ROUGH NIGHT - Official Restricted Trailer (HD),"I'm really tired of these ""People do impossibly stupid things"" movies.  Also the 'fat' chick kills a hot guy. Thanks Sony.",2017-03-13T19:00:38.000Z,0
2017-03-08T19:00:05.000Z,oIB4jNYeRY4,ROUGH NIGHT - Official Restricted Trailer (HD),Garbage. Just garbage.,2017-03-13T18:44:34.000Z,0
2017-03-08T19:00:05.000Z,oIB4jNYeRY4,ROUGH NIGHT - Official Restricted Trailer (HD),I liked this waaaaaay more when it was Very Bad Things. Sorry Favreau / Stern / Slater / Piven,2017-03-13T18:26:06.000Z,0
2017-03-08T19:00:05.000Z,oIB4jNYeRY4,ROUGH NIGHT - Official Restricted Trailer (HD),'Very Bad Things' with a female cast.,2017-03-13T17:32:50.000Z,0
2017-03-08T19:00:05.000Z,oIB4jNYeRY4,ROUGH NIGHT - Official Restricted Trailer (HD),sCarlet is so beautiful,2017-03-13T17:25:23.000Z,0
2017-03-08T19:00:05.000Z,oIB4jNYeRY4,ROUGH NIGHT - Official Restricted Trailer (HD),In this comment section: A bunch of dudes saying how much they hate this film about women marketed for women about women letting loose and being stupid. So it's okay if we get things like Hangover but girls can't have the same treatment. kden,2017-03-13T17:23:54.000Z,0
2017-03-08T19:00:05.000Z,oIB4jNYeRY4,ROUGH NIGHT - Official Restricted Trailer (HD),Soooo all the aussie actresses in hollywood and you have kate mckinnon doing that shitty accent?????,2017-03-13T17:15:32.000Z,0
2017-03-08T19:00:05.000Z,oIB4jNYeRY4,ROUGH NIGHT - Official Restricted Trailer (HD),Woo a bunch of depressed women in their 30's go out for a weekend and have a life changing lesson. What a surprise.,2017-03-13T17:03:01.000Z,0
2017-03-08T19:00:05.000Z,oIB4jNYeRY4,ROUGH NIGHT - Official Restricted Trailer (HD),"this movie has.....literally....already been done.  its called very bad things and its, unlike im sure this, pretty good.",2017-03-13T16:57:54.000Z,0
2017-03-08T19:00:05.000Z,oIB4jNYeRY4,ROUGH NIGHT - Official Restricted Trailer (HD),Haha 1:32 starts to vomit slightly. Lmao that's me,2017-03-13T16:42:47.000Z,0
2017-03-08T19:00:05.000Z,oIB4jNYeRY4,ROUGH NIGHT - Official Restricted Trailer (HD),looks pretty boring,2017-03-13T16:42:01.000Z,0
2017-03-08T19:00:05.000Z,oIB4jNYeRY4,ROUGH NIGHT - Official Restricted Trailer (HD),they should call it black widows trip from new york,2017-03-13T16:21:42.000Z,0
2017-03-08T19:00:05.000Z,oIB4jNYeRY4,ROUGH NIGHT - Official Restricted Trailer (HD),The amount of dislike this trailer is getting femenatizi's are gonna claim sexism but i honestly disliked it because the movie wants to be the hangover with women. you want to push the feminist agenda come up with something original at least,2017-03-13T16:22:39.000Z,41
