publish_time,Video ID,Title,Comment,updatedAt,likeCount
2017-06-28T13:00:13.000Z,AXCTMGYUg9A,The Greatest Showman | Official Trailer [HD] | 20th Century FOX,Should have been nominated for an Oscar for Best Picture,2019-11-09T16:57:13.000Z,0
2017-06-28T13:00:13.000Z,AXCTMGYUg9A,The Greatest Showman | Official Trailer [HD] | 20th Century FOX,"""A show business? I've never heard of it...""
*""Cuz I just invented it""* 😏 
Man I love this movie 💗💓💓",2019-11-08T02:07:03.000Z,1
2017-06-28T13:00:13.000Z,AXCTMGYUg9A,The Greatest Showman | Official Trailer [HD] | 20th Century FOX,Great songs. Shitty storyline. I was bored to death lol.,2019-11-02T12:36:31.000Z,1
2017-06-28T13:00:13.000Z,AXCTMGYUg9A,The Greatest Showman | Official Trailer [HD] | 20th Century FOX,Love this movie❤,2019-10-29T23:39:49.000Z,0
2017-06-28T13:00:13.000Z,AXCTMGYUg9A,The Greatest Showman | Official Trailer [HD] | 20th Century FOX,"Well I’m putting myself at risk here for hate, but I didn’t like this movie.

The characters and morals were inspiring, and the songs were pretty good. But I just couldn’t catch on with the plot line like I hoped I would, in my opinion there wasn’t really much of a plot line to follow on.

But for those who like this film, I respect your opinions and hope you will respect mine. 😊",2019-10-20T15:50:00.000Z,2
2017-06-28T13:00:13.000Z,AXCTMGYUg9A,The Greatest Showman | Official Trailer [HD] | 20th Century FOX,"So after saving the world, Marvel Superheroes traveled back to Industrial Revolution to become a normal citizens in their life
Wolverine: *Running a circus show*
Iron-Man: *Became a vet and can now talk to animals*",2019-10-20T03:34:34.000Z,0
2017-06-28T13:00:13.000Z,AXCTMGYUg9A,The Greatest Showman | Official Trailer [HD] | 20th Century FOX,Too bad I can't find the movie,2019-10-16T10:07:30.000Z,0
2017-06-28T13:00:13.000Z,AXCTMGYUg9A,The Greatest Showman | Official Trailer [HD] | 20th Century FOX,Is there any movie recommendation's with this scenery,2019-10-14T19:58:09.000Z,2
2017-06-28T13:00:13.000Z,AXCTMGYUg9A,The Greatest Showman | Official Trailer [HD] | 20th Century FOX,This is going to become a cult classic ..,2019-10-11T16:32:15.000Z,0
2017-06-28T13:00:13.000Z,AXCTMGYUg9A,The Greatest Showman | Official Trailer [HD] | 20th Century FOX,Hmm... I have to watch this.,2019-10-08T12:46:18.000Z,0
2017-06-28T13:00:13.000Z,AXCTMGYUg9A,The Greatest Showman | Official Trailer [HD] | 20th Century FOX,"Its a Outstanding, Magical and Magnificent movie. No words can fully describe the rapture and ecstasy everyone feels after watching the movie. Simply Heavenly! Your childhood dreams coming true right infront you. Leaves Me breathless",2019-10-07T02:07:14.000Z,0
2017-06-28T13:00:13.000Z,AXCTMGYUg9A,The Greatest Showman | Official Trailer [HD] | 20th Century FOX,So I am a huge fan of Zendaya and saw she was making her movie debut in 2017 and the song captivated me to watch this movie. But what’s funny is that I didn’t know it was actually gonna be in the movie,2019-10-05T19:56:20.000Z,0
2017-06-28T13:00:13.000Z,AXCTMGYUg9A,The Greatest Showman | Official Trailer [HD] | 20th Century FOX,I get people like this movie but isn’t it kind of insulting to paint this cruel and shady historical figure in a honorable light? The people who were a part of the PT show are probably rolling in there grave...,2019-09-29T19:50:49.000Z,1
2017-06-28T13:00:13.000Z,AXCTMGYUg9A,The Greatest Showman | Official Trailer [HD] | 20th Century FOX,"It looks nice but the only reason I am not watching it is cause I can't watch Zendaya, I don't like seeing her at all. And the movie seems too happy. No drama or tears to shed. I better watch Shindler's list.",2019-09-29T08:16:41.000Z,0
2017-06-28T13:00:13.000Z,AXCTMGYUg9A,The Greatest Showman | Official Trailer [HD] | 20th Century FOX,UNDERRATED.AS.HELL,2019-09-23T08:38:30.000Z,0
2017-06-28T13:00:13.000Z,AXCTMGYUg9A,The Greatest Showman | Official Trailer [HD] | 20th Century FOX,"One of the most misguided and vacuous films of all time, catering to the lowest of desperate sensibilities.  It's inaccurate not just to its source material but to reality in general, and this is a recipe for keeping audiences in a naive state of impotence.  If you enjoyed this and you are older than 14, you have failed.  I just hope Michelle Williams was paid really well, because nobody else involved is a real artist anyway.",2019-09-19T22:30:36.000Z,1
2017-06-28T13:00:13.000Z,AXCTMGYUg9A,The Greatest Showman | Official Trailer [HD] | 20th Century FOX,Am I just One of those people that comment like 23 times?,2019-09-16T21:55:39.000Z,0
2017-06-28T13:00:13.000Z,AXCTMGYUg9A,The Greatest Showman | Official Trailer [HD] | 20th Century FOX,Why does no one like Zac Efron!?,2019-09-16T21:55:00.000Z,0
2017-06-28T13:00:13.000Z,AXCTMGYUg9A,The Greatest Showman | Official Trailer [HD] | 20th Century FOX,"This movie I love since I was like seven and I love this movie so so much and it means a lot to me.
It really gives a good point to everyone and it has a good moral of the story
Everyone’s different that can turn into something big everyone here special
Subscribe to my channel for support.
No one will be like anyone else, they have their own beauty
This is amazing movie.
Barnum’s dream was very big
And believe it or not some people don’t know he was a real person,
Please show support to everyone you know that is differently Made.",2019-09-16T21:51:23.000Z,0
2017-06-28T13:00:13.000Z,AXCTMGYUg9A,The Greatest Showman | Official Trailer [HD] | 20th Century FOX,How the heck did I not know about this musical untill just now? I have to see this.,2019-09-16T20:34:44.000Z,0
2017-06-28T13:00:13.000Z,AXCTMGYUg9A,The Greatest Showman | Official Trailer [HD] | 20th Century FOX,"HUGH JACKMAN has a background on theater and music during his younger years and MY GOODNESS it paid off with this film!!! ❤️❤️❤️ this was not the only film where he sang though 😍 

AMAZING CAST AND CREW! I’m proud to be alive to enjoy this musical film with my family! ❤️",2019-09-12T14:49:04.000Z,0
2017-06-28T13:00:13.000Z,AXCTMGYUg9A,The Greatest Showman | Official Trailer [HD] | 20th Century FOX,He’s from my city Bridgeport ct we have apartments name after him and he donated his land to is with now our beach also named sea side beach,2019-09-11T14:39:34.000Z,0
2017-06-28T13:00:13.000Z,AXCTMGYUg9A,The Greatest Showman | Official Trailer [HD] | 20th Century FOX,I know a gem when I see one,2019-09-03T18:52:55.000Z,0
2017-06-28T13:00:13.000Z,AXCTMGYUg9A,The Greatest Showman | Official Trailer [HD] | 20th Century FOX,"Well, almost two years later I finally watched the movie and I love it. It was amazing.",2019-09-01T04:33:31.000Z,11
2017-06-28T13:00:13.000Z,AXCTMGYUg9A,The Greatest Showman | Official Trailer [HD] | 20th Century FOX,"i ignored this on 2017... thought it was another boring musical film...now watched it on 2019 ..it was amazing than i was expected . great music, choreography and story,just wow! 10/10",2019-08-31T05:04:54.000Z,0
2017-06-28T13:00:13.000Z,AXCTMGYUg9A,The Greatest Showman | Official Trailer [HD] | 20th Century FOX,A feel-good Hollywood bullshit. A pack of lies luridly told. I have been reading on freak shows and circuses and this article sums up much of what I realize: https://www.newyorker.com/magazine/2019/08/05/what-p-t-barnum-understood-about-america?utm_medium=social&utm_source=facebook&utm_brand=tny&utm_social-type=owned&mbid=social_facebook&fbclid=IwAR35mM11i13DdSGPXJh4aRNtXjqUgYRfcsDOVX3vvKd-Q9YDE0SERRxRDh4,2019-08-30T07:26:08.000Z,0
2017-06-28T13:00:13.000Z,AXCTMGYUg9A,The Greatest Showman | Official Trailer [HD] | 20th Century FOX,"Oh the irony. Barnum made a living exploiting people who are different, now his most common memory will be attached in some capacity to a song about empowering them.

I don’t know if that’s a good or a bad thing, but it’s certainly interesting.",2019-08-29T01:46:25.000Z,1
2017-06-28T13:00:13.000Z,AXCTMGYUg9A,The Greatest Showman | Official Trailer [HD] | 20th Century FOX,Oh man everyone who likes this movie go search up The Dollop 291 PT Barnum. This movie is so ridiculous when you hear the truth.,2019-08-24T02:51:36.000Z,0
2017-06-28T13:00:13.000Z,AXCTMGYUg9A,The Greatest Showman | Official Trailer [HD] | 20th Century FOX,"1
0
7",2019-08-22T05:19:44.000Z,0
2017-06-28T13:00:13.000Z,AXCTMGYUg9A,The Greatest Showman | Official Trailer [HD] | 20th Century FOX,To this day best movie I watched,2019-08-20T18:25:17.000Z,0
2017-06-28T13:00:13.000Z,AXCTMGYUg9A,The Greatest Showman | Official Trailer [HD] | 20th Century FOX,"You have a flare for show business 

There's no such thing as show business 

I just invented it

P.T Barnum.


Over 146 years later look at where we are today.",2019-08-15T02:45:01.000Z,0
2017-06-28T13:00:13.000Z,AXCTMGYUg9A,The Greatest Showman | Official Trailer [HD] | 20th Century FOX,"Wow,that's a really amazing trailer .I love it",2019-08-11T16:04:14.000Z,0
2017-06-28T13:00:13.000Z,AXCTMGYUg9A,The Greatest Showman | Official Trailer [HD] | 20th Century FOX,One of the best movie that i see in my life,2019-08-07T17:53:08.000Z,0
2017-06-28T13:00:13.000Z,AXCTMGYUg9A,The Greatest Showman | Official Trailer [HD] | 20th Century FOX,People are still singing Let It Go instead of This Is Me,2019-08-05T08:41:55.000Z,1
2017-06-28T13:00:13.000Z,AXCTMGYUg9A,The Greatest Showman | Official Trailer [HD] | 20th Century FOX,It’s good,2019-08-05T08:40:01.000Z,0
2017-06-28T13:00:13.000Z,AXCTMGYUg9A,The Greatest Showman | Official Trailer [HD] | 20th Century FOX,Hi everyone don't be put off by the freaks it is great movie that really touches the heart,2019-08-04T20:06:21.000Z,0
2017-06-28T13:00:13.000Z,AXCTMGYUg9A,The Greatest Showman | Official Trailer [HD] | 20th Century FOX,California fakeapp intelligenceyou jackson ordinary insanity inside manaj Kennedy,2019-08-02T19:49:42.000Z,0
2017-06-28T13:00:13.000Z,AXCTMGYUg9A,The Greatest Showman | Official Trailer [HD] | 20th Century FOX,"As University Musical teacher, my dream came true and i loved this movie",2019-08-02T07:52:54.000Z,0
2017-06-28T13:00:13.000Z,AXCTMGYUg9A,The Greatest Showman | Official Trailer [HD] | 20th Century FOX,"2017: Nope
2018: Ehh, Na
2019: YEAH PUT THIS IN EVERYONE’S RECOMMENDED CUE THE CREDITS.

Posted by
SuperBloxTube",2019-07-31T07:56:53.000Z,4
2017-06-28T13:00:13.000Z,AXCTMGYUg9A,The Greatest Showman | Official Trailer [HD] | 20th Century FOX,Sırf Bang Chan önerdi diye izleyebilirim cidden,2019-07-29T12:54:47.000Z,1
2017-06-28T13:00:13.000Z,AXCTMGYUg9A,The Greatest Showman | Official Trailer [HD] | 20th Century FOX,one of my all time favorite musical!!!!!,2019-07-25T21:29:12.000Z,0
2017-06-28T13:00:13.000Z,AXCTMGYUg9A,The Greatest Showman | Official Trailer [HD] | 20th Century FOX,Am i the only one thought Zac and Zendaya is the main star until i watched this trailer. Blame Rewrite The Stars,2019-07-21T13:00:45.000Z,1
2017-06-28T13:00:13.000Z,AXCTMGYUg9A,The Greatest Showman | Official Trailer [HD] | 20th Century FOX,What an amazing way to push the trans movement lol,2019-07-19T23:23:54.000Z,0
2017-06-28T13:00:13.000Z,AXCTMGYUg9A,The Greatest Showman | Official Trailer [HD] | 20th Century FOX,"my mom said she wouldn’t like it because it was a musical film, but she loved it. I love this movie so much. watched it over 20 times and know all the songs.",2019-07-18T01:56:32.000Z,0
2017-06-28T13:00:13.000Z,AXCTMGYUg9A,The Greatest Showman | Official Trailer [HD] | 20th Century FOX,Awsome film.,2019-07-16T16:16:56.000Z,0
2017-06-28T13:00:13.000Z,AXCTMGYUg9A,The Greatest Showman | Official Trailer [HD] | 20th Century FOX,Now we can't wait for The Greatest Showman 2!,2019-07-15T20:55:30.000Z,0
2017-06-28T13:00:13.000Z,AXCTMGYUg9A,The Greatest Showman | Official Trailer [HD] | 20th Century FOX,I love it,2019-07-12T16:20:46.000Z,0
2017-06-28T13:00:13.000Z,AXCTMGYUg9A,The Greatest Showman | Official Trailer [HD] | 20th Century FOX,"I'm sorry but for me this was the best trailer and musical movie I have ever seen in my entire life so far.
I'm sorry Descendants your music was great and Rip sweet cameron but TGS is the best.",2019-07-10T18:21:36.000Z,0
2017-06-28T13:00:13.000Z,AXCTMGYUg9A,The Greatest Showman | Official Trailer [HD] | 20th Century FOX,"July 2019 anyone?
Screw critics
Screw rotten tomatoes
THIS MOVIE AND THE TRAILER ITSELF IS GOLD",2019-07-02T15:36:19.000Z,0
2017-06-28T13:00:13.000Z,AXCTMGYUg9A,The Greatest Showman | Official Trailer [HD] | 20th Century FOX,I have never seen such a great beginning of any movie ..!hats off,2019-07-01T11:34:11.000Z,1
2017-06-28T13:00:13.000Z,AXCTMGYUg9A,The Greatest Showman | Official Trailer [HD] | 20th Century FOX,this song gives me chills everytime.,2019-06-25T18:48:01.000Z,0
2017-06-28T13:00:13.000Z,AXCTMGYUg9A,The Greatest Showman | Official Trailer [HD] | 20th Century FOX,"Hugh: ""Bankrupt?..""

Me: *yes Hooman. Bankrupt*

Zac: ""Show business?""

Hugh: ""mhm""

Zac: ""Never heard""

Me: *bish wat da f-*

Hugh: ""And I Made it up""

Me: **claps loudly 👏👏👏👏👏👏** *wowww.....*

*now that's a TRAILER*",2019-06-18T07:56:21.000Z,0
2017-06-28T13:00:13.000Z,AXCTMGYUg9A,The Greatest Showman | Official Trailer [HD] | 20th Century FOX,That's one of a hell TRAILER,2019-06-17T11:30:15.000Z,0
2017-06-28T13:00:13.000Z,AXCTMGYUg9A,The Greatest Showman | Official Trailer [HD] | 20th Century FOX,Me: **eating lunch when i saw the movie** **shocked** **spits out what im chewing** 😂,2019-06-17T04:46:39.000Z,4
2017-06-28T13:00:13.000Z,AXCTMGYUg9A,The Greatest Showman | Official Trailer [HD] | 20th Century FOX,I'm so f7cking glad I'm acting in a play bout this,2019-06-13T18:18:28.000Z,0
2017-06-28T13:00:13.000Z,AXCTMGYUg9A,The Greatest Showman | Official Trailer [HD] | 20th Century FOX,"""Wolverine singing The Movie""",2019-06-09T16:25:28.000Z,0
2017-06-28T13:00:13.000Z,AXCTMGYUg9A,The Greatest Showman | Official Trailer [HD] | 20th Century FOX,1.05 it’s showtime,2019-06-09T04:10:48.000Z,0
2017-06-28T13:00:13.000Z,AXCTMGYUg9A,The Greatest Showman | Official Trailer [HD] | 20th Century FOX,"Hey critics 
Do our smiles seems fake?",2019-06-07T08:38:48.000Z,0
2017-06-28T13:00:13.000Z,AXCTMGYUg9A,The Greatest Showman | Official Trailer [HD] | 20th Century FOX,😍😍😍 Zac Efron 😍😍😍,2019-06-02T23:49:42.000Z,1
2017-06-28T13:00:13.000Z,AXCTMGYUg9A,The Greatest Showman | Official Trailer [HD] | 20th Century FOX,"The critics are so very wrong about this movie, this was an amazing film, a classic.",2019-06-02T21:08:47.000Z,0
2017-06-28T13:00:13.000Z,AXCTMGYUg9A,The Greatest Showman | Official Trailer [HD] | 20th Century FOX,"Eu só queria assistir esse filme no Brasil sem pagar, isso é pedir demais????😢😢😢😢😢😢😢😢💔💔💔💔💔",2019-06-02T00:38:19.000Z,1
2017-06-28T13:00:13.000Z,AXCTMGYUg9A,The Greatest Showman | Official Trailer [HD] | 20th Century FOX,"We only need Greatest SHowman, no more HAMILTON nor DEAR EVAN HANSEN!! These 2 musicals are terrible, TGS is better!!",2019-05-31T03:50:47.000Z,3
2017-06-28T13:00:13.000Z,AXCTMGYUg9A,The Greatest Showman | Official Trailer [HD] | 20th Century FOX,this trailer is too muchhhhhhoooooooooooo,2019-05-29T13:30:31.000Z,0
2017-06-28T13:00:13.000Z,AXCTMGYUg9A,The Greatest Showman | Official Trailer [HD] | 20th Century FOX,The Prestige anyone?,2019-05-29T05:16:28.000Z,1
2017-06-28T13:00:13.000Z,AXCTMGYUg9A,The Greatest Showman | Official Trailer [HD] | 20th Century FOX,Love ya hugh,2019-05-24T10:10:52.000Z,0
2017-06-28T13:00:13.000Z,AXCTMGYUg9A,The Greatest Showman | Official Trailer [HD] | 20th Century FOX,A MASTERPIECE,2019-05-17T23:59:44.000Z,0
2017-06-28T13:00:13.000Z,AXCTMGYUg9A,The Greatest Showman | Official Trailer [HD] | 20th Century FOX,"It doesn't matter if u ar different 





We're all equal",2019-05-12T17:05:03.000Z,2
2017-06-28T13:00:13.000Z,AXCTMGYUg9A,The Greatest Showman | Official Trailer [HD] | 20th Century FOX,this is literally the best movie in the world,2019-05-08T15:10:18.000Z,1
2017-06-28T13:00:13.000Z,AXCTMGYUg9A,The Greatest Showman | Official Trailer [HD] | 20th Century FOX,"This is a Masterpiece, better than Dear Evan Hansen and Hamilton, those two suck too bad, The Greatest Showman is 1000x better than these two Musicals, DeH and Hammy are awful!!",2019-04-29T07:44:12.000Z,1
2017-06-28T13:00:13.000Z,AXCTMGYUg9A,The Greatest Showman | Official Trailer [HD] | 20th Century FOX,Best movie of the decade!,2019-04-26T19:13:24.000Z,0
2017-06-28T13:00:13.000Z,AXCTMGYUg9A,The Greatest Showman | Official Trailer [HD] | 20th Century FOX,THE SONG PLAYING IN THIS TRAILER IS MY FAVORITE SONG?!,2019-04-23T22:02:31.000Z,0
2017-06-28T13:00:13.000Z,AXCTMGYUg9A,The Greatest Showman | Official Trailer [HD] | 20th Century FOX,TGSM make most of Musical Movies by Disney look like a Joke,2019-04-23T11:38:33.000Z,0
2017-06-28T13:00:13.000Z,AXCTMGYUg9A,The Greatest Showman | Official Trailer [HD] | 20th Century FOX,Best movie to watch.,2019-04-23T10:26:11.000Z,0
2017-06-28T13:00:13.000Z,AXCTMGYUg9A,The Greatest Showman | Official Trailer [HD] | 20th Century FOX,Who is here after bts fansign that jungkook have watched this movie for 3 times already..😍,2019-04-22T06:20:04.000Z,0
2017-06-28T13:00:13.000Z,AXCTMGYUg9A,The Greatest Showman | Official Trailer [HD] | 20th Century FOX,I’m related to the ringaling brothers the people who started the circus,2019-04-20T06:27:07.000Z,0
2017-06-28T13:00:13.000Z,AXCTMGYUg9A,The Greatest Showman | Official Trailer [HD] | 20th Century FOX,Best movie I’ve seen in a hot minute besides Ready Player One which is also very good. Why are all of the GREAT movies so underrated!! I just bought the record for this for my record console and 4 year old just can’t keep from dancing to it.,2019-04-19T17:13:50.000Z,0
2017-06-28T13:00:13.000Z,AXCTMGYUg9A,The Greatest Showman | Official Trailer [HD] | 20th Century FOX,Congrats from india 🇮🇳,2019-04-14T21:49:11.000Z,3
2017-06-28T13:00:13.000Z,AXCTMGYUg9A,The Greatest Showman | Official Trailer [HD] | 20th Century FOX,The best art in the world is make people happy. ✌️,2019-04-11T06:02:38.000Z,0
2017-06-28T13:00:13.000Z,AXCTMGYUg9A,The Greatest Showman | Official Trailer [HD] | 20th Century FOX,I remember one of the trailers having more of a cut of Barnum and his wife dancing but can’t seem to find the trailer 😩,2019-04-10T18:03:09.000Z,0
2017-06-28T13:00:13.000Z,AXCTMGYUg9A,The Greatest Showman | Official Trailer [HD] | 20th Century FOX,SPOILER ALERT(not really) P.T. Barnum was actually a huge jerk. He actually only did that for the money. But.... It's a family movie...so,2019-04-09T03:00:00.000Z,0
2017-06-28T13:00:13.000Z,AXCTMGYUg9A,The Greatest Showman | Official Trailer [HD] | 20th Century FOX,was this based on  a book n a true story???,2019-04-07T22:06:13.000Z,0
2017-06-28T13:00:13.000Z,AXCTMGYUg9A,The Greatest Showman | Official Trailer [HD] | 20th Century FOX,Now Watching...,2019-04-07T12:47:58.000Z,1
2017-06-28T13:00:13.000Z,AXCTMGYUg9A,The Greatest Showman | Official Trailer [HD] | 20th Century FOX,"Michelle williams!
Very talented!",2019-04-06T15:14:05.000Z,0
2017-06-28T13:00:13.000Z,AXCTMGYUg9A,The Greatest Showman | Official Trailer [HD] | 20th Century FOX,I've watched it 2 actually,2019-04-06T13:10:41.000Z,0
2017-06-28T13:00:13.000Z,AXCTMGYUg9A,The Greatest Showman | Official Trailer [HD] | 20th Century FOX,The greatest showman RULES,2019-04-06T13:06:44.000Z,0
2017-06-28T13:00:13.000Z,AXCTMGYUg9A,The Greatest Showman | Official Trailer [HD] | 20th Century FOX,Who's here because they see Hugh Jackman and Zac Efron and also think that they would make a great combination,2019-04-05T22:43:50.000Z,0
2017-06-28T13:00:13.000Z,AXCTMGYUg9A,The Greatest Showman | Official Trailer [HD] | 20th Century FOX,This musical was so powerful. I laughed and cried😃 one word magnificent....,2019-04-05T22:24:12.000Z,2
2017-06-28T13:00:13.000Z,AXCTMGYUg9A,The Greatest Showman | Official Trailer [HD] | 20th Century FOX,"Philip:""I can't just run off and join the circus.""
P.T:""Why not you clearly have a flare for show business.""
Philip:""Show business? I've never heard of it.""
P.T:""Because I just invented it.""
I love The Greatest Showman :)",2019-04-02T23:18:22.000Z,2
2017-06-28T13:00:13.000Z,AXCTMGYUg9A,The Greatest Showman | Official Trailer [HD] | 20th Century FOX,this is such an amazing movie!!!,2019-04-01T16:37:53.000Z,0
2017-06-28T13:00:13.000Z,AXCTMGYUg9A,The Greatest Showman | Official Trailer [HD] | 20th Century FOX,2017? I think its 2018,2019-04-01T12:59:16.000Z,0
2017-06-28T13:00:13.000Z,AXCTMGYUg9A,The Greatest Showman | Official Trailer [HD] | 20th Century FOX,"""Ready?....Showtime!""",2019-03-31T17:32:47.000Z,1
2017-06-28T13:00:13.000Z,AXCTMGYUg9A,The Greatest Showman | Official Trailer [HD] | 20th Century FOX,The songs in the show is so so good,2019-03-29T16:13:19.000Z,0
2017-06-28T13:00:13.000Z,AXCTMGYUg9A,The Greatest Showman | Official Trailer [HD] | 20th Century FOX,I don't understand why he didn't transform into the wolverine like he does on most every movie I've seen him in? Was he hiding it for some reason? I don't see why. Because it would be the best time to do it since the focus is on oddities and freaks.,2019-03-28T00:06:03.000Z,0
2017-06-28T13:00:13.000Z,AXCTMGYUg9A,The Greatest Showman | Official Trailer [HD] | 20th Century FOX,Who sings that intrusive screechy song during the whole trailer ? Terrible choice. Totally distracted me from the actual trailer.,2019-03-24T05:30:32.000Z,1
2017-06-28T13:00:13.000Z,AXCTMGYUg9A,The Greatest Showman | Official Trailer [HD] | 20th Century FOX,"From The Prestige to The Greatest Showman, Hugh Jackman fits the best in films of centuries gone by.",2019-03-23T18:12:48.000Z,0
2017-06-28T13:00:13.000Z,AXCTMGYUg9A,The Greatest Showman | Official Trailer [HD] | 20th Century FOX,Love this movie,2019-03-20T22:12:47.000Z,1
2017-06-28T13:00:13.000Z,AXCTMGYUg9A,The Greatest Showman | Official Trailer [HD] | 20th Century FOX,It’s weird seeing Hugh Jackman without a messy beard.,2019-03-20T12:25:24.000Z,0
2017-06-28T13:00:13.000Z,AXCTMGYUg9A,The Greatest Showman | Official Trailer [HD] | 20th Century FOX,I watched this movie 10 times and now i'm watching the trailer over and over again,2019-03-13T20:54:51.000Z,0
2017-06-28T13:00:13.000Z,AXCTMGYUg9A,The Greatest Showman | Official Trailer [HD] | 20th Century FOX,Goosebumps,2019-03-13T16:10:50.000Z,0
2017-06-28T13:00:13.000Z,AXCTMGYUg9A,The Greatest Showman | Official Trailer [HD] | 20th Century FOX,Could you make a The Greatest Showman 2,2019-03-13T11:06:55.000Z,1
2017-06-28T13:00:13.000Z,AXCTMGYUg9A,The Greatest Showman | Official Trailer [HD] | 20th Century FOX,Boo,2019-03-09T04:56:24.000Z,0
2017-06-28T13:00:13.000Z,AXCTMGYUg9A,The Greatest Showman | Official Trailer [HD] | 20th Century FOX,This is such a beautiful movie! Recommend watching it 100%,2019-03-07T20:32:35.000Z,0
2017-06-28T13:00:13.000Z,AXCTMGYUg9A,The Greatest Showman | Official Trailer [HD] | 20th Century FOX,A celebration of humanity,2019-03-07T07:29:13.000Z,0
2017-06-28T13:00:13.000Z,AXCTMGYUg9A,The Greatest Showman | Official Trailer [HD] | 20th Century FOX,This Movie Was Made my Heart Smile And I was Crying At someparts even the part zac efron got in the Fire,2019-03-05T23:45:32.000Z,1
2017-06-28T13:00:13.000Z,AXCTMGYUg9A,The Greatest Showman | Official Trailer [HD] | 20th Century FOX,THEY'RE ALREADY IN THE TALKS OF A SEQUEL!!!,2019-03-05T03:03:15.000Z,8
2017-06-28T13:00:13.000Z,AXCTMGYUg9A,The Greatest Showman | Official Trailer [HD] | 20th Century FOX,"I wanna see this movie that the trailer showed it to be, not the one we actually got.😂😭",2019-03-04T16:13:05.000Z,0
2017-06-28T13:00:13.000Z,AXCTMGYUg9A,The Greatest Showman | Official Trailer [HD] | 20th Century FOX,The greatest film,2019-03-03T09:33:52.000Z,0
2017-06-28T13:00:13.000Z,AXCTMGYUg9A,The Greatest Showman | Official Trailer [HD] | 20th Century FOX,"Someone recommended this movie to me, and after watching the trailer, how can I not watch it.",2019-03-01T14:25:14.000Z,1
2017-06-28T13:00:13.000Z,AXCTMGYUg9A,The Greatest Showman | Official Trailer [HD] | 20th Century FOX,"The only problem with this movie is Zendaya...I mean hello, aren't there ANY talentfull actresses in Hollywood?",2019-03-01T06:19:05.000Z,0
2017-06-28T13:00:13.000Z,AXCTMGYUg9A,The Greatest Showman | Official Trailer [HD] | 20th Century FOX,I was gonna watch it then I saw zack effron,2019-03-01T04:51:39.000Z,0
2017-06-28T13:00:13.000Z,AXCTMGYUg9A,The Greatest Showman | Official Trailer [HD] | 20th Century FOX,"The movie released at  2017
Me at 2019: I just knew that it's Hugh Jackman",2019-02-28T15:26:40.000Z,1
2017-06-28T13:00:13.000Z,AXCTMGYUg9A,The Greatest Showman | Official Trailer [HD] | 20th Century FOX,Nobody ever made a difference by being like everyone else,2019-02-28T06:39:11.000Z,0
2017-06-28T13:00:13.000Z,AXCTMGYUg9A,The Greatest Showman | Official Trailer [HD] | 20th Century FOX,"BEST

MOVIE

EVER

FIGHT ME",2019-02-23T19:04:59.000Z,0
2017-06-28T13:00:13.000Z,AXCTMGYUg9A,The Greatest Showman | Official Trailer [HD] | 20th Century FOX,Best movie,2019-02-21T09:10:09.000Z,0
2017-06-28T13:00:13.000Z,AXCTMGYUg9A,The Greatest Showman | Official Trailer [HD] | 20th Century FOX,I don’t think so we are going on with the wedding 💒 is that a good time of you to do that you will have a lot of fun to do you have a good friend and you get your right about it haha 🤣 is a great day to get together for you and you get your right we are going down to our wedding and stuff and we will see,2019-02-19T22:09:55.000Z,0
2017-06-28T13:00:13.000Z,AXCTMGYUg9A,The Greatest Showman | Official Trailer [HD] | 20th Century FOX,wow zendaya looks something like i flushed in the toilet 2 minutes ago,2019-02-17T16:43:25.000Z,0
