publish_time,Video ID,Title,Comment,updatedAt,likeCount
2017-06-28T13:00:13.000Z,AXCTMGYUg9A,The Greatest Showman | Official Trailer [HD] | 20th Century FOX,Good film,2018-01-17T13:05:10.000Z,2
2017-06-28T13:00:13.000Z,AXCTMGYUg9A,The Greatest Showman | Official Trailer [HD] | 20th Century FOX,CUZ I JUST INVENTED IT,2018-01-17T01:41:37.000Z,0
2017-06-28T13:00:13.000Z,AXCTMGYUg9A,The Greatest Showman | Official Trailer [HD] | 20th Century FOX,People are saying that because of the trailer the movie is going to be amazing. The last Jedi had a great trailer but the movie was not that good. This movie trailer was good but the movie wasn't even that good. I was disappointed with both movies. Thought they would be good,2018-01-16T21:05:06.000Z,0
2017-06-28T13:00:13.000Z,AXCTMGYUg9A,The Greatest Showman | Official Trailer [HD] | 20th Century FOX,Gentle test funny behavioral promising statistics field disability interrupt,2018-01-16T20:29:49.000Z,0
2017-06-28T13:00:13.000Z,AXCTMGYUg9A,The Greatest Showman | Official Trailer [HD] | 20th Century FOX,"I wanna cry and happy at the same time , love this movie a lot",2018-01-16T14:50:53.000Z,6
2017-06-28T13:00:13.000Z,AXCTMGYUg9A,The Greatest Showman | Official Trailer [HD] | 20th Century FOX,"I have just watched it today. It is such an amazing movie, inspiring story and great music.",2018-01-16T14:43:23.000Z,0
2017-06-28T13:00:13.000Z,AXCTMGYUg9A,The Greatest Showman | Official Trailer [HD] | 20th Century FOX,Jelijah gang,2018-01-16T14:36:31.000Z,0
2017-06-28T13:00:13.000Z,AXCTMGYUg9A,The Greatest Showman | Official Trailer [HD] | 20th Century FOX,Amazing!,2018-01-16T11:28:11.000Z,0
2017-06-28T13:00:13.000Z,AXCTMGYUg9A,The Greatest Showman | Official Trailer [HD] | 20th Century FOX,"I cried during this movie, it was fantastic just awesome and the soundtrack is the best in a movie since transformers and guardians of the galaxy you have to see this movie",2018-01-16T05:00:13.000Z,1
2017-06-28T13:00:13.000Z,AXCTMGYUg9A,The Greatest Showman | Official Trailer [HD] | 20th Century FOX,girly movie,2018-01-16T04:21:54.000Z,0
2017-06-28T13:00:13.000Z,AXCTMGYUg9A,The Greatest Showman | Official Trailer [HD] | 20th Century FOX,Can anyone tell me what is pt barnum last words at the end of this movie?,2018-01-16T03:20:12.000Z,0
2017-06-28T13:00:13.000Z,AXCTMGYUg9A,The Greatest Showman | Official Trailer [HD] | 20th Century FOX,Future classic.,2018-01-15T21:45:59.000Z,87
2017-06-28T13:00:13.000Z,AXCTMGYUg9A,The Greatest Showman | Official Trailer [HD] | 20th Century FOX,I googled P.T Barnum after I watch the movie...turns out he wasn't a good guy after all.,2018-01-15T19:43:46.000Z,0
2017-06-28T13:00:13.000Z,AXCTMGYUg9A,The Greatest Showman | Official Trailer [HD] | 20th Century FOX,the best i've ever seen,2018-01-15T17:12:11.000Z,0
2017-06-28T13:00:13.000Z,AXCTMGYUg9A,The Greatest Showman | Official Trailer [HD] | 20th Century FOX,I've been watvhed this movie for twice lol,2018-01-15T14:15:41.000Z,0
2017-06-28T13:00:13.000Z,AXCTMGYUg9A,The Greatest Showman | Official Trailer [HD] | 20th Century FOX,Goosebumps anyone?😂😂,2018-01-15T14:12:36.000Z,0
2017-06-28T13:00:13.000Z,AXCTMGYUg9A,The Greatest Showman | Official Trailer [HD] | 20th Century FOX,"*Now, that's a TRAILER*",2018-01-15T08:13:52.000Z,942
2017-06-28T13:00:13.000Z,AXCTMGYUg9A,The Greatest Showman | Official Trailer [HD] | 20th Century FOX,I remember seeing Barnum and Bailey’s Greatest show on Earth as a kid. Sadly it has laid to rest. This movie brought back memories though that will never be forgotten.,2018-01-15T05:55:49.000Z,1
2017-06-28T13:00:13.000Z,AXCTMGYUg9A,The Greatest Showman | Official Trailer [HD] | 20th Century FOX,Totally convincing my mom to take me to go watch this movie!! Let’s just hope she says yes,2018-01-15T04:43:54.000Z,0
2017-06-28T13:00:13.000Z,AXCTMGYUg9A,The Greatest Showman | Official Trailer [HD] | 20th Century FOX,After watching this movie it deserves so much more credit than La La Land I'm sorry but this was such an amazing movie!,2018-01-15T00:51:49.000Z,487
2017-06-28T13:00:13.000Z,AXCTMGYUg9A,The Greatest Showman | Official Trailer [HD] | 20th Century FOX,the greatest showman is the theme for the circus im in's show,2018-01-15T00:28:25.000Z,0
2017-06-28T13:00:13.000Z,AXCTMGYUg9A,The Greatest Showman | Official Trailer [HD] | 20th Century FOX,BEST MOVIE EVER❤👑,2018-01-14T21:07:40.000Z,5
2017-06-28T13:00:13.000Z,AXCTMGYUg9A,The Greatest Showman | Official Trailer [HD] | 20th Century FOX,Best movie iv'e ever seen,2018-01-14T19:54:41.000Z,1
2017-06-28T13:00:13.000Z,AXCTMGYUg9A,The Greatest Showman | Official Trailer [HD] | 20th Century FOX,The woman with a beard is a fat version of Conchita Wurst,2018-01-14T15:21:43.000Z,0
2017-06-28T13:00:13.000Z,AXCTMGYUg9A,The Greatest Showman | Official Trailer [HD] | 20th Century FOX,better than la la land!!!,2018-01-14T12:45:40.000Z,65
2017-06-28T13:00:13.000Z,AXCTMGYUg9A,The Greatest Showman | Official Trailer [HD] | 20th Century FOX,Can you tell me how is the movie?..please,2018-01-14T11:57:11.000Z,1
2017-06-28T13:00:13.000Z,AXCTMGYUg9A,The Greatest Showman | Official Trailer [HD] | 20th Century FOX,Pale agenda please brain bias ice heart gentleman neck.,2018-01-14T11:36:36.000Z,0
2017-06-28T13:00:13.000Z,AXCTMGYUg9A,The Greatest Showman | Official Trailer [HD] | 20th Century FOX,Even the trailer made me cry. What will the movie do to me?,2018-01-14T09:09:06.000Z,0
2017-06-28T13:00:13.000Z,AXCTMGYUg9A,The Greatest Showman | Official Trailer [HD] | 20th Century FOX,This was a phenomenal movie,2018-01-14T06:39:14.000Z,1
2017-06-28T13:00:13.000Z,AXCTMGYUg9A,The Greatest Showman | Official Trailer [HD] | 20th Century FOX,was crying through the whole movie. It was so beauiful,2018-01-14T05:04:55.000Z,0
2017-06-28T13:00:13.000Z,AXCTMGYUg9A,The Greatest Showman | Official Trailer [HD] | 20th Century FOX,Awesome movie,2018-01-14T04:11:46.000Z,0
2017-06-28T13:00:13.000Z,AXCTMGYUg9A,The Greatest Showman | Official Trailer [HD] | 20th Century FOX,"ok, i cried.",2018-01-14T03:53:58.000Z,0
2017-06-28T13:00:13.000Z,AXCTMGYUg9A,The Greatest Showman | Official Trailer [HD] | 20th Century FOX,aiii parece ser muito topp ameiii,2018-01-13T23:45:02.000Z,0
2017-06-28T13:00:13.000Z,AXCTMGYUg9A,The Greatest Showman | Official Trailer [HD] | 20th Century FOX,Goosebumbs.,2018-01-13T20:58:43.000Z,2
2017-06-28T13:00:13.000Z,AXCTMGYUg9A,The Greatest Showman | Official Trailer [HD] | 20th Century FOX,The greatest musical movie ever invented,2018-01-13T18:23:59.000Z,4
2017-06-28T13:00:13.000Z,AXCTMGYUg9A,The Greatest Showman | Official Trailer [HD] | 20th Century FOX,"Perfect movie👍🏿👍🏿👍🏿👍🏿👍🏿👍🏿 satu kemasan yg bagus sekali, banyak pelajaran nya dan amazing
Wow,,, Excellent",2018-01-13T16:14:48.000Z,0
2017-06-28T13:00:13.000Z,AXCTMGYUg9A,The Greatest Showman | Official Trailer [HD] | 20th Century FOX,"I cried a lot, just what I needed!",2018-01-13T14:58:54.000Z,0
2017-06-28T13:00:13.000Z,AXCTMGYUg9A,The Greatest Showman | Official Trailer [HD] | 20th Century FOX,hugh jackman. from wild to be sweetest character,2018-01-13T14:57:58.000Z,0
2017-06-28T13:00:13.000Z,AXCTMGYUg9A,The Greatest Showman | Official Trailer [HD] | 20th Century FOX,Come to StevenchunDraw see my previous The Greatest Showman DRAWING !!!! 😍😍😍,2018-01-13T14:21:35.000Z,0
2017-06-28T13:00:13.000Z,AXCTMGYUg9A,The Greatest Showman | Official Trailer [HD] | 20th Century FOX,Seen it twice! Amazing movie!,2018-01-13T13:29:02.000Z,0
2017-06-28T13:00:13.000Z,AXCTMGYUg9A,The Greatest Showman | Official Trailer [HD] | 20th Century FOX,the best movie ive ever seen I CRIED,2018-01-13T10:58:29.000Z,0
2017-06-28T13:00:13.000Z,AXCTMGYUg9A,The Greatest Showman | Official Trailer [HD] | 20th Century FOX,woman movie/.,2018-01-13T09:51:07.000Z,0
2017-06-28T13:00:13.000Z,AXCTMGYUg9A,The Greatest Showman | Official Trailer [HD] | 20th Century FOX,so far the best movie this year,2018-01-13T08:55:39.000Z,0
2017-06-28T13:00:13.000Z,AXCTMGYUg9A,The Greatest Showman | Official Trailer [HD] | 20th Century FOX,Here because some klance au lmfao,2018-01-13T07:56:39.000Z,0
2017-06-28T13:00:13.000Z,AXCTMGYUg9A,The Greatest Showman | Official Trailer [HD] | 20th Century FOX,"I just saw this movie, and it was all truly amazing, right from the very second it started! I loved the songs, the scenes with Barnum and Charity writing letters was adorable, Zendaya's moves and acting were phenomenal (so were Zac Efron's), and I loved the fact that they shined light on and celebrated people that were different from what society depicts as ""normal"" (such as the bearded lady and the guy that was freakishly tall)! If you ever get the opportunity to see this movie, GO SEE IT!!",2018-01-13T07:55:24.000Z,0
2017-06-28T13:00:13.000Z,AXCTMGYUg9A,The Greatest Showman | Official Trailer [HD] | 20th Century FOX,"what a movie to be on christmas season..the vibes is great
very well done FOX..",2018-01-13T07:44:24.000Z,0
2017-06-28T13:00:13.000Z,AXCTMGYUg9A,The Greatest Showman | Official Trailer [HD] | 20th Century FOX,That last piece of dialogue about show business is SO GENIUS OH MY GOD CHILLS,2018-01-13T03:37:55.000Z,0
2017-06-28T13:00:13.000Z,AXCTMGYUg9A,The Greatest Showman | Official Trailer [HD] | 20th Century FOX,"A great movie, excellent 👏👏👏👏",2018-01-13T02:36:15.000Z,0
2017-06-28T13:00:13.000Z,AXCTMGYUg9A,The Greatest Showman | Official Trailer [HD] | 20th Century FOX,Not one negative comment is unbelievable.,2018-01-13T00:36:27.000Z,0
2017-06-28T13:00:13.000Z,AXCTMGYUg9A,The Greatest Showman | Official Trailer [HD] | 20th Century FOX,Fall in love!!,2018-01-12T19:53:14.000Z,0
2017-06-28T13:00:13.000Z,AXCTMGYUg9A,The Greatest Showman | Official Trailer [HD] | 20th Century FOX,One of the most beautiful movies ever... i cried at least 5 times,2018-01-12T15:58:44.000Z,4
2017-06-28T13:00:13.000Z,AXCTMGYUg9A,The Greatest Showman | Official Trailer [HD] | 20th Century FOX,This is amazing.. Recommended,2018-01-12T14:44:45.000Z,0
2017-06-28T13:00:13.000Z,AXCTMGYUg9A,The Greatest Showman | Official Trailer [HD] | 20th Century FOX,I love it so much,2018-01-12T14:22:59.000Z,0
2017-06-28T13:00:13.000Z,AXCTMGYUg9A,The Greatest Showman | Official Trailer [HD] | 20th Century FOX,"I watched it, and it was amazing guys!! You should watch it!!",2018-01-12T14:15:50.000Z,0
2017-06-28T13:00:13.000Z,AXCTMGYUg9A,The Greatest Showman | Official Trailer [HD] | 20th Century FOX,"The most wonderful movie for me so far! great songs, great story",2018-01-12T13:12:00.000Z,0
2017-06-28T13:00:13.000Z,AXCTMGYUg9A,The Greatest Showman | Official Trailer [HD] | 20th Century FOX,My girlfriend is making me go see this movie.,2018-01-12T11:33:27.000Z,0
2017-06-28T13:00:13.000Z,AXCTMGYUg9A,The Greatest Showman | Official Trailer [HD] | 20th Century FOX,,2018-01-12T09:46:47.000Z,0
2017-06-28T13:00:13.000Z,AXCTMGYUg9A,The Greatest Showman | Official Trailer [HD] | 20th Century FOX,Slowly pitch thumb aside aircraft acceptance hill cousin post pretty match.,2018-01-12T09:04:18.000Z,0
2017-06-28T13:00:13.000Z,AXCTMGYUg9A,The Greatest Showman | Official Trailer [HD] | 20th Century FOX,"*""A celebration of humanity""*",2018-02-02T12:09:33.000Z,931
2017-06-28T13:00:13.000Z,AXCTMGYUg9A,The Greatest Showman | Official Trailer [HD] | 20th Century FOX,"Hey everyone!
Loved this movie so I drew a portrait of Hugh Jackman, check out my speed drawing video of the process here and let me know what you think!
https://youtu.be/rhDmzKkRDx8",2018-01-12T05:44:13.000Z,0
2017-06-28T13:00:13.000Z,AXCTMGYUg9A,The Greatest Showman | Official Trailer [HD] | 20th Century FOX,truley awesome and what a song.. man.. whoa... and with all due respect.. no one can beat hugh jackman in acting...,2018-01-12T04:40:16.000Z,0
2017-06-28T13:00:13.000Z,AXCTMGYUg9A,The Greatest Showman | Official Trailer [HD] | 20th Century FOX,"Hey, would you please put captions on this video?",2018-01-12T04:25:32.000Z,0
2017-06-28T13:00:13.000Z,AXCTMGYUg9A,The Greatest Showman | Official Trailer [HD] | 20th Century FOX,"I love so much this movie, wonderful, top and top",2018-01-12T04:06:43.000Z,0
2017-06-28T13:00:13.000Z,AXCTMGYUg9A,The Greatest Showman | Official Trailer [HD] | 20th Century FOX,Gonna watch this today probably,2018-01-12T03:03:53.000Z,2
2017-06-28T13:00:13.000Z,AXCTMGYUg9A,The Greatest Showman | Official Trailer [HD] | 20th Century FOX,this is like one of the greatest trailer i've ever seen.,2018-01-12T02:06:28.000Z,492
2017-06-28T13:00:13.000Z,AXCTMGYUg9A,The Greatest Showman | Official Trailer [HD] | 20th Century FOX,"Stunning film, you need to see this",2018-01-11T21:00:55.000Z,9
2017-06-28T13:00:13.000Z,AXCTMGYUg9A,The Greatest Showman | Official Trailer [HD] | 20th Century FOX,"I watched the movie and all I can say is that the camerawork was great and the songs were amazing, but that was it. 
I feel that the plot wasn't well planned. Why is he the greatest showman? All the things he went through were part and parcel of what doing a business is like - it's perfectly normal. He recruited people who were different to perform in his show, but gave them up as he was blinded by fame and opportunities and didn't want them to embarrass him. He almost lost his family but soon got his wife back, quickly at that. Got back to his show only to let Zac be the showman instead of him. The things he went through as a 'business' man or a showman eventually led him to being more of a family man. 
Why is he the greatest showman? I think it's just me - Everyone loved the movie but I was disappointed when I watched it. The songs were unbelievably great, the camerawork and the editing was exceptional but other than that, I couldn't find any other things that are good in this movie.",2018-01-11T19:32:20.000Z,2
2017-06-28T13:00:13.000Z,AXCTMGYUg9A,The Greatest Showman | Official Trailer [HD] | 20th Century FOX,i swear this is the best movie i watch in my whole life . thx for 20th century fox.,2018-01-11T17:57:34.000Z,2
2017-06-28T13:00:13.000Z,AXCTMGYUg9A,The Greatest Showman | Official Trailer [HD] | 20th Century FOX,This movie was really beautiful 😭😍 World need a lot of movie like this ❤️,2018-01-11T16:50:37.000Z,0
2017-06-28T13:00:13.000Z,AXCTMGYUg9A,The Greatest Showman | Official Trailer [HD] | 20th Century FOX,"P.T. Barnum, at your service.",2018-01-11T15:18:30.000Z,1
2017-06-28T13:00:13.000Z,AXCTMGYUg9A,The Greatest Showman | Official Trailer [HD] | 20th Century FOX,An absolutely fantastic film. 100% feel good. I DEFY anyone not to love it. I've now seen it 9 times and each time it gets better and better.,2018-01-11T12:06:08.000Z,0
2017-06-28T13:00:13.000Z,AXCTMGYUg9A,The Greatest Showman | Official Trailer [HD] | 20th Century FOX,AMAZING OMG ❤,2018-01-11T10:28:28.000Z,0
2017-06-28T13:00:13.000Z,AXCTMGYUg9A,The Greatest Showman | Official Trailer [HD] | 20th Century FOX,Saw this today. Every movie I've watched in the past 2 years had  disappointed me. This did not. I actually really liked it. Worth watching.,2018-01-11T09:28:53.000Z,0
2017-06-28T13:00:13.000Z,AXCTMGYUg9A,The Greatest Showman | Official Trailer [HD] | 20th Century FOX,I wish I was part of this movie so bad!,2018-01-11T08:44:58.000Z,0
2017-06-28T13:00:13.000Z,AXCTMGYUg9A,The Greatest Showman | Official Trailer [HD] | 20th Century FOX,the songs are just A M A Z I N G,2018-01-11T08:23:36.000Z,0
2017-06-28T13:00:13.000Z,AXCTMGYUg9A,The Greatest Showman | Official Trailer [HD] | 20th Century FOX,Anyone else getting American Horror Story Freakshow vibes?,2018-01-11T04:37:53.000Z,1
2017-06-28T13:00:13.000Z,AXCTMGYUg9A,The Greatest Showman | Official Trailer [HD] | 20th Century FOX,This song is heart touching it makes me so happy everytime i hear i just saw the movie it is the best movie in the world!,2018-01-10T22:51:59.000Z,10
2017-06-28T13:00:13.000Z,AXCTMGYUg9A,The Greatest Showman | Official Trailer [HD] | 20th Century FOX,This song makes me wanna be a singer and a actor i have always wanted to do trapeze so this make me want to be a actor and singer even more please reply to this and thank you,2018-01-10T22:51:03.000Z,6
2017-06-28T13:00:13.000Z,AXCTMGYUg9A,The Greatest Showman | Official Trailer [HD] | 20th Century FOX,This is the best movie I have ever seen I loovveee the sound track,2018-01-10T22:41:29.000Z,1
2017-06-28T13:00:13.000Z,AXCTMGYUg9A,The Greatest Showman | Official Trailer [HD] | 20th Century FOX,Ima laugh if Vanessa Hudgens comes out of nowhere,2018-01-10T22:36:22.000Z,1
2017-06-28T13:00:13.000Z,AXCTMGYUg9A,The Greatest Showman | Official Trailer [HD] | 20th Century FOX,Great show indeed ! Compared to the other slop that's out there I'm happy to see a wonderful story with great characters and original music.,2018-01-10T22:00:13.000Z,5
2017-06-28T13:00:13.000Z,AXCTMGYUg9A,The Greatest Showman | Official Trailer [HD] | 20th Century FOX,Legit saw it twice this week. It's absolutely amazing. Great job,2018-01-10T20:08:49.000Z,0
2017-06-28T13:00:13.000Z,AXCTMGYUg9A,The Greatest Showman | Official Trailer [HD] | 20th Century FOX,Just saw it last night. Absolutely amazing. 1 million times better than La La Land.,2018-01-10T19:34:15.000Z,0
2017-06-28T13:00:13.000Z,AXCTMGYUg9A,The Greatest Showman | Official Trailer [HD] | 20th Century FOX,This movie was outstanding. Best film I've seen in a decade. Wow. Just... wow.,2018-01-10T18:48:36.000Z,0
2017-06-28T13:00:13.000Z,AXCTMGYUg9A,The Greatest Showman | Official Trailer [HD] | 20th Century FOX,"0:44 I don't know, man, I'm getting vague Jacob Frye vibes here.",2018-01-10T18:41:38.000Z,0
2017-06-28T13:00:13.000Z,AXCTMGYUg9A,The Greatest Showman | Official Trailer [HD] | 20th Century FOX,No wonder he lost the oscar.,2018-01-10T18:15:50.000Z,0
2017-06-28T13:00:13.000Z,AXCTMGYUg9A,The Greatest Showman | Official Trailer [HD] | 20th Century FOX,"This looks amazing, I need to see it like right now. Love Zendaya, Zac and Hugh. Also can we take a moment to appreciate this music and the people who made this trailer, wow.",2018-01-10T05:17:43.000Z,4
2017-06-28T13:00:13.000Z,AXCTMGYUg9A,The Greatest Showman | Official Trailer [HD] | 20th Century FOX,I know this movie from RM of BTS,2018-01-10T04:44:15.000Z,0
2017-06-28T13:00:13.000Z,AXCTMGYUg9A,The Greatest Showman | Official Trailer [HD] | 20th Century FOX,BEST MOVIE,2018-01-10T04:04:11.000Z,0
2017-06-28T13:00:13.000Z,AXCTMGYUg9A,The Greatest Showman | Official Trailer [HD] | 20th Century FOX,"I love this movie, I cried it.",2018-01-10T02:35:12.000Z,0
2017-06-28T13:00:13.000Z,AXCTMGYUg9A,The Greatest Showman | Official Trailer [HD] | 20th Century FOX,"I want to get it, can anyone tell me, where i can Download this movie, cuz i dont hve enough money to buy it",2018-01-10T02:26:55.000Z,0
2017-06-28T13:00:13.000Z,AXCTMGYUg9A,The Greatest Showman | Official Trailer [HD] | 20th Century FOX,wolverine recruited troy bolton and michelle,2018-01-10T02:14:59.000Z,0
2017-06-28T13:00:13.000Z,AXCTMGYUg9A,The Greatest Showman | Official Trailer [HD] | 20th Century FOX,"Great movie. Love the inspiration, the message, the essence and the music.",2018-01-09T23:32:12.000Z,0
2017-06-28T13:00:13.000Z,AXCTMGYUg9A,The Greatest Showman | Official Trailer [HD] | 20th Century FOX,"I love this movie!! 
They left out the slaves, worker conditions, and animal abuse though. (;",2018-01-09T17:50:34.000Z,0
2017-06-28T13:00:13.000Z,AXCTMGYUg9A,The Greatest Showman | Official Trailer [HD] | 20th Century FOX,"OMG !! It looks amazing ! I NEED to see this movie ! This trailer gives me ""Big Fish"" vibes !",2018-01-09T17:22:25.000Z,0
2017-06-28T13:00:13.000Z,AXCTMGYUg9A,The Greatest Showman | Official Trailer [HD] | 20th Century FOX,IVE WATCHED THE FILM 2 WEEKS AGO. Since then I’ve been addicted to the soundtrack of this movie and the characters. All I want to say is that I NEED A PART 2 BUT IT SHOULD FOCUS MORE ON ZENDAYA AND ZAC...? Maybeeee? This movie is really great though.,2018-01-09T15:42:55.000Z,0
2017-06-28T13:00:13.000Z,AXCTMGYUg9A,The Greatest Showman | Official Trailer [HD] | 20th Century FOX,i wonder is he robert angier... or his clone?,2018-01-09T14:21:41.000Z,0
2017-06-28T13:00:13.000Z,AXCTMGYUg9A,The Greatest Showman | Official Trailer [HD] | 20th Century FOX,Land bay plot road pitch portray sit serving.,2018-01-09T11:48:31.000Z,0
2017-06-28T13:00:13.000Z,AXCTMGYUg9A,The Greatest Showman | Official Trailer [HD] | 20th Century FOX,IM IN LOVE WITH THIS MOVIE,2018-01-09T10:08:53.000Z,0
2017-06-28T13:00:13.000Z,AXCTMGYUg9A,The Greatest Showman | Official Trailer [HD] | 20th Century FOX,"ugh, Millennial Cliches the Movie",2018-01-09T08:09:43.000Z,0
2017-06-28T13:00:13.000Z,AXCTMGYUg9A,The Greatest Showman | Official Trailer [HD] | 20th Century FOX,"saw the movie over the holidays, family, kid friendly, great performances but EVERY scene turns into a singing musical which is overbearing after a while. Impatient story line moves way too quickly in the first 15 mins leaving too much out.... Good movie overall.",2018-01-09T01:07:15.000Z,0
2017-06-28T13:00:13.000Z,AXCTMGYUg9A,The Greatest Showman | Official Trailer [HD] | 20th Century FOX,The two words that I would use to describe this movie is 'enrapturing'  and absolutely 'magical'. There was a better word I was going to use for magical but I couldn't remember it. You just sit there and you can't look away. It pulls you right in and makes you want to dance and sing the entire time.,2018-01-09T00:28:37.000Z,0
2017-06-28T13:00:13.000Z,AXCTMGYUg9A,The Greatest Showman | Official Trailer [HD] | 20th Century FOX,"Too bad Barnum isn't wasn't as ""perfect"" in real life as he was here. Can you say ""contrived""?? I'll be glad when Hollywood actually starts making honest, hard-hitting films about how these people's lives REALLY were, not Hollywood wants us to view them through the rose-colored glasses.",2018-01-08T16:39:18.000Z,0
2017-06-28T13:00:13.000Z,AXCTMGYUg9A,The Greatest Showman | Official Trailer [HD] | 20th Century FOX,What a greatest movieeee,2018-01-08T16:09:50.000Z,0
2017-06-28T13:00:13.000Z,AXCTMGYUg9A,The Greatest Showman | Official Trailer [HD] | 20th Century FOX,"Happy propaganda, this made laugh, skipping it because propaganda is boring but good try hollywood.",2018-01-08T15:35:48.000Z,0
2017-06-28T13:00:13.000Z,AXCTMGYUg9A,The Greatest Showman | Official Trailer [HD] | 20th Century FOX,"I’ll watching this movie tomorrow, can’t wait ahhh",2018-01-08T14:58:31.000Z,0
2017-06-28T13:00:13.000Z,AXCTMGYUg9A,The Greatest Showman | Official Trailer [HD] | 20th Century FOX,What's the same of sound track playing in trailer?,2018-01-08T13:53:35.000Z,0
2017-06-28T13:00:13.000Z,AXCTMGYUg9A,The Greatest Showman | Official Trailer [HD] | 20th Century FOX,"The best film i ever seen. 
Beautiful music and lyrics.
The story is beyond emotionel. 
Recommend it to everyone who loves a movie where you just get blown away and wanna feel a magic touch. 

BEST MOVIE EVER OF 2017/2018!!!!",2018-01-08T11:23:31.000Z,0
2017-06-28T13:00:13.000Z,AXCTMGYUg9A,The Greatest Showman | Official Trailer [HD] | 20th Century FOX,"If this dude invented show business and was the greatest showman, human civilization is clearly going backwards.",2018-01-08T11:05:17.000Z,0
2017-06-28T13:00:13.000Z,AXCTMGYUg9A,The Greatest Showman | Official Trailer [HD] | 20th Century FOX,System point exact waste duty identical bring early few breast purchase worker.,2018-01-08T10:53:39.000Z,0
2017-06-28T13:00:13.000Z,AXCTMGYUg9A,The Greatest Showman | Official Trailer [HD] | 20th Century FOX,"i had a goosebumps when Jenny Lind performed 'Never Enough' i really wanna gave standing ovation, all the songs in this movie are dope",2018-01-08T05:46:27.000Z,0
2017-06-28T13:00:13.000Z,AXCTMGYUg9A,The Greatest Showman | Official Trailer [HD] | 20th Century FOX,I want to see this so bad,2018-01-08T03:44:34.000Z,0
2017-06-28T13:00:13.000Z,AXCTMGYUg9A,The Greatest Showman | Official Trailer [HD] | 20th Century FOX,"quotes that are in the trailer, but not in the movie, so it bugged me for some reason:
0:27-0:28 ""Not even close""
0:37-0:40 ""Girls, I think I've had an idea.""
1:58-2:00 (This might have been in the movie, correct me if im wrong, but I dont remember it) ""No one ever made a difference by being like everyone else.""
2:12-2:14 ""I've never heard of it."" ""'Cuz I just invented it.""

But this was an amazing movie",2018-01-08T00:17:58.000Z,0
2017-06-28T13:00:13.000Z,AXCTMGYUg9A,The Greatest Showman | Official Trailer [HD] | 20th Century FOX,Best movie 👏👏👏,2018-01-07T22:38:55.000Z,0
2017-06-28T13:00:13.000Z,AXCTMGYUg9A,The Greatest Showman | Official Trailer [HD] | 20th Century FOX,"It's a proper musical.For a cold January night when the world is bleak, this film was made to put a smile on your face. The critics may hate it but who cares. The cinema was full , on a Sunday evening. Hugh Jackman was great .",2018-01-07T21:42:26.000Z,0
2017-06-28T13:00:13.000Z,AXCTMGYUg9A,The Greatest Showman | Official Trailer [HD] | 20th Century FOX,"This movie is one of the best I have ever watched ,It is hard to make me cry but I cried the whole time in the cinema",2018-01-07T21:39:42.000Z,0
2017-06-28T13:00:13.000Z,AXCTMGYUg9A,The Greatest Showman | Official Trailer [HD] | 20th Century FOX,THE BEST MOVIE EVER,2018-01-07T19:54:40.000Z,0
2017-06-28T13:00:13.000Z,AXCTMGYUg9A,The Greatest Showman | Official Trailer [HD] | 20th Century FOX,I love Zendaya ♥,2018-01-07T18:56:47.000Z,0
2017-06-28T13:00:13.000Z,AXCTMGYUg9A,The Greatest Showman | Official Trailer [HD] | 20th Century FOX,Почему печатаете оскорбления в адрес Аллы Пугачевой?,2018-01-07T17:33:30.000Z,0
2017-06-28T13:00:13.000Z,AXCTMGYUg9A,The Greatest Showman | Official Trailer [HD] | 20th Century FOX,The movie is the best,2018-01-07T15:21:17.000Z,0
