publish_time,Video ID,Title,Comment,updatedAt,likeCount
2017-06-28T13:00:13.000Z,AXCTMGYUg9A,The Greatest Showman | Official Trailer [HD] | 20th Century FOX,I thought Disney movies were sickeningly 'sweet' but this movie is a whole different level of sugar overdose... looks like 2 hours of pure torture.,2017-06-29T14:57:30.000Z,23
2017-06-28T13:00:13.000Z,AXCTMGYUg9A,The Greatest Showman | Official Trailer [HD] | 20th Century FOX,I like the song,2017-06-29T14:56:39.000Z,0
2017-06-28T13:00:13.000Z,AXCTMGYUg9A,The Greatest Showman | Official Trailer [HD] | 20th Century FOX,Hate the music/song in the background! Killing the vibe,2017-06-29T14:55:04.000Z,0
2017-06-28T13:00:13.000Z,AXCTMGYUg9A,The Greatest Showman | Official Trailer [HD] | 20th Century FOX,"I thought the title was ""The Greatest Snowman""
I am disappoint",2017-06-29T14:54:23.000Z,0
2017-06-28T13:00:13.000Z,AXCTMGYUg9A,The Greatest Showman | Official Trailer [HD] | 20th Century FOX,"Another trailer falls victim to the trend of using terrible, inappropriate music.",2017-06-29T14:54:22.000Z,0
2017-06-28T13:00:13.000Z,AXCTMGYUg9A,The Greatest Showman | Official Trailer [HD] | 20th Century FOX,wolverine in a different universe,2017-06-29T14:52:39.000Z,0
2017-06-28T13:00:13.000Z,AXCTMGYUg9A,The Greatest Showman | Official Trailer [HD] | 20th Century FOX,Very good,2017-06-29T14:52:39.000Z,0
2017-06-28T13:00:13.000Z,AXCTMGYUg9A,The Greatest Showman | Official Trailer [HD] | 20th Century FOX,"And as a circus freak, he'll show off his Wolverine claws.",2017-06-29T14:48:12.000Z,0
2017-06-28T13:00:13.000Z,AXCTMGYUg9A,The Greatest Showman | Official Trailer [HD] | 20th Century FOX,jean valjean travels to the future and become a circus manager while cosette somehow ages quickly and becomes his wife,2017-06-29T14:44:44.000Z,1
2017-06-28T13:00:13.000Z,AXCTMGYUg9A,The Greatest Showman | Official Trailer [HD] | 20th Century FOX,Happy Zac is doing something decent after he took a downfall with baywatch. I can't wait for this movie,2017-06-29T14:40:33.000Z,0
2017-06-28T13:00:13.000Z,AXCTMGYUg9A,The Greatest Showman | Official Trailer [HD] | 20th Century FOX,did fox buy Hugh Jackman?,2017-06-29T14:38:33.000Z,0
2017-06-28T13:00:13.000Z,AXCTMGYUg9A,The Greatest Showman | Official Trailer [HD] | 20th Century FOX,"Oscar nomination right here. Along with Dunkirk, God this movie looks like its going to be something",2017-06-29T14:38:11.000Z,0
2017-06-28T13:00:13.000Z,AXCTMGYUg9A,The Greatest Showman | Official Trailer [HD] | 20th Century FOX,on the start of trailer I thought this is prequel to prestige.😁,2017-06-29T14:37:48.000Z,0
2017-06-28T13:00:13.000Z,AXCTMGYUg9A,The Greatest Showman | Official Trailer [HD] | 20th Century FOX,Hugh jackman is definitely the greatest showman,2017-06-29T14:36:41.000Z,11
2017-06-28T13:00:13.000Z,AXCTMGYUg9A,The Greatest Showman | Official Trailer [HD] | 20th Century FOX,"would be ok...  a bit cheesy, but ok... if it weren't for that screeching hyena ""singing"". good Lord. all in all, worst trailer of 2017",2017-06-29T14:33:37.000Z,0
2017-06-28T13:00:13.000Z,AXCTMGYUg9A,The Greatest Showman | Official Trailer [HD] | 20th Century FOX,Thought this was a prequel to The Prestige at first lol,2017-06-29T14:28:34.000Z,0
2017-06-28T13:00:13.000Z,AXCTMGYUg9A,The Greatest Showman | Official Trailer [HD] | 20th Century FOX,Reminds me of The Prestige :),2017-06-29T14:26:25.000Z,0
2017-06-28T13:00:13.000Z,AXCTMGYUg9A,The Greatest Showman | Official Trailer [HD] | 20th Century FOX,WHO WROTE SUCH A SPLENDID MUSIC !!!!!??????😭,2017-06-29T14:22:26.000Z,0
2017-06-28T13:00:13.000Z,AXCTMGYUg9A,The Greatest Showman | Official Trailer [HD] | 20th Century FOX,loak,2017-06-29T14:16:48.000Z,0
2017-06-28T13:00:13.000Z,AXCTMGYUg9A,The Greatest Showman | Official Trailer [HD] | 20th Century FOX,I love it,2017-06-29T14:15:29.000Z,0
2017-06-28T13:00:13.000Z,AXCTMGYUg9A,The Greatest Showman | Official Trailer [HD] | 20th Century FOX,Terrible song choice,2017-06-29T14:13:31.000Z,0
2017-06-28T13:00:13.000Z,AXCTMGYUg9A,The Greatest Showman | Official Trailer [HD] | 20th Century FOX,Sometimes the idiots who make trailers really don't know how to use a song in a trailer. Was this the best song they could come up with.,2017-06-29T14:09:20.000Z,0
2017-06-28T13:00:13.000Z,AXCTMGYUg9A,The Greatest Showman | Official Trailer [HD] | 20th Century FOX,I saw the thumbnail and totally thought that this was a sequel to the prestige.,2017-06-29T14:00:14.000Z,0
2017-06-28T13:00:13.000Z,AXCTMGYUg9A,The Greatest Showman | Official Trailer [HD] | 20th Century FOX,Am I the only one who actually likes the music.,2017-06-29T13:56:54.000Z,563
2017-06-28T13:00:13.000Z,AXCTMGYUg9A,The Greatest Showman | Official Trailer [HD] | 20th Century FOX,Logan is that you?,2017-06-29T13:55:22.000Z,0
2017-06-28T13:00:13.000Z,AXCTMGYUg9A,The Greatest Showman | Official Trailer [HD] | 20th Century FOX,Zac looks as if he thinks he's in another comedy.,2017-06-29T13:53:50.000Z,0
2017-06-28T13:00:13.000Z,AXCTMGYUg9A,The Greatest Showman | Official Trailer [HD] | 20th Century FOX,undertone much?  Hollywood capitalizing on the next level of the drain this country is going down.,2017-06-29T13:52:39.000Z,0
2017-06-28T13:00:13.000Z,AXCTMGYUg9A,The Greatest Showman | Official Trailer [HD] | 20th Century FOX,The Freakshow,2017-06-29T13:50:42.000Z,0
2017-06-28T13:00:13.000Z,AXCTMGYUg9A,The Greatest Showman | Official Trailer [HD] | 20th Century FOX,"American horror story 
          FreakShOw",2017-06-29T13:46:11.000Z,0
2017-06-28T13:00:13.000Z,AXCTMGYUg9A,The Greatest Showman | Official Trailer [HD] | 20th Century FOX,what's the song for this,2017-06-29T13:43:41.000Z,0
2017-06-28T13:00:13.000Z,AXCTMGYUg9A,The Greatest Showman | Official Trailer [HD] | 20th Century FOX,"This looks super good, I can't wait to see it",2017-06-29T13:43:41.000Z,1
2017-06-28T13:00:13.000Z,AXCTMGYUg9A,The Greatest Showman | Official Trailer [HD] | 20th Century FOX,https://soundcloud.com/thchellkat/sets/songs-4-u-ep,2017-06-29T13:42:20.000Z,0
2017-06-28T13:00:13.000Z,AXCTMGYUg9A,The Greatest Showman | Official Trailer [HD] | 20th Century FOX,I did not recognize Hugh without his wolverine and LOGAN look He looks so young!,2017-06-29T13:38:40.000Z,0
2017-06-28T13:00:13.000Z,AXCTMGYUg9A,The Greatest Showman | Official Trailer [HD] | 20th Century FOX,Michelle Williams? this movie will fail because of her. she's like poison.,2017-06-29T13:37:13.000Z,0
2017-06-28T13:00:13.000Z,AXCTMGYUg9A,The Greatest Showman | Official Trailer [HD] | 20th Century FOX,What a cast 😍😍,2017-06-29T13:34:51.000Z,0
2017-06-28T13:00:13.000Z,AXCTMGYUg9A,The Greatest Showman | Official Trailer [HD] | 20th Century FOX,This is quite a turn. Logan to this. Wow,2017-06-29T13:30:51.000Z,4
2017-06-28T13:00:13.000Z,AXCTMGYUg9A,The Greatest Showman | Official Trailer [HD] | 20th Century FOX,Am I the only one in love with the song? 😍,2017-06-29T13:29:28.000Z,760
2017-06-28T13:00:13.000Z,AXCTMGYUg9A,The Greatest Showman | Official Trailer [HD] | 20th Century FOX,OMG YES ZAC EFRON!!!!❤️😁,2017-06-29T13:28:59.000Z,0
2017-06-28T13:00:13.000Z,AXCTMGYUg9A,The Greatest Showman | Official Trailer [HD] | 20th Century FOX,This looks terrible,2017-06-29T13:25:08.000Z,0
2017-06-28T13:00:13.000Z,AXCTMGYUg9A,The Greatest Showman | Official Trailer [HD] | 20th Century FOX,Wolverine is alive o:,2017-06-29T13:23:56.000Z,0
2017-06-28T13:00:13.000Z,AXCTMGYUg9A,The Greatest Showman | Official Trailer [HD] | 20th Century FOX,The Great Snowman,2017-06-29T13:23:17.000Z,0
2017-06-28T13:00:13.000Z,AXCTMGYUg9A,The Greatest Showman | Official Trailer [HD] | 20th Century FOX,Thought it was prestige sequil,2017-06-29T13:19:13.000Z,0
2017-06-28T13:00:13.000Z,AXCTMGYUg9A,The Greatest Showman | Official Trailer [HD] | 20th Century FOX,This is actually prestige part 2,2017-06-29T13:11:11.000Z,0
2017-06-28T13:00:13.000Z,AXCTMGYUg9A,The Greatest Showman | Official Trailer [HD] | 20th Century FOX,This movie will probably earn Hugh Jackman his second best actor nomination after Les Miz.,2017-06-29T13:01:10.000Z,7
2017-06-28T13:00:13.000Z,AXCTMGYUg9A,The Greatest Showman | Official Trailer [HD] | 20th Century FOX,"God yes Zac is finally in a real movie, God yes I need some real emotion from those perfect eyes",2017-06-29T12:53:24.000Z,0
2017-06-28T13:00:13.000Z,AXCTMGYUg9A,The Greatest Showman | Official Trailer [HD] | 20th Century FOX,Anyone else hoping this was related to the Prestige?,2017-06-29T12:53:21.000Z,0
2017-06-28T13:00:13.000Z,AXCTMGYUg9A,The Greatest Showman | Official Trailer [HD] | 20th Century FOX,this Prestige sequel looks interesting,2017-06-29T12:53:11.000Z,0
2017-06-28T13:00:13.000Z,AXCTMGYUg9A,The Greatest Showman | Official Trailer [HD] | 20th Century FOX,"Ugg this looks bad. Anyone know anything about the actual Barnum? No?? Well he didnt organize a group of ""different people to showcase their differences"", the first ""performer"" he ever had was a blind, disabled old slave that he paraded around telling everyone that she was goerge washington's nurse and was 160! If you wanna do historical fiction you may wanna try for some of the history.",2017-06-29T12:53:08.000Z,0
2017-06-28T13:00:13.000Z,AXCTMGYUg9A,The Greatest Showman | Official Trailer [HD] | 20th Century FOX,THIS IS MY FAVORITE MOVIE AND I HAVEN'T EVEN SEEN IT YET,2017-06-29T12:49:58.000Z,0
2017-06-28T13:00:13.000Z,AXCTMGYUg9A,The Greatest Showman | Official Trailer [HD] | 20th Century FOX,At this time I don't know which movie I want to win a lot of OSCARS: Logan or The Greatest Showman. The second seems to be really good,2017-11-18T06:18:02.000Z,0
2017-06-28T13:00:13.000Z,AXCTMGYUg9A,The Greatest Showman | Official Trailer [HD] | 20th Century FOX,So this isn't the prestige??,2017-06-29T12:44:12.000Z,0
2017-06-28T13:00:13.000Z,AXCTMGYUg9A,The Greatest Showman | Official Trailer [HD] | 20th Century FOX,"Anybody know the name of this song? Unlike some ppl, I actually like it and think that it matches the show!",2017-06-29T12:42:38.000Z,0
2017-06-28T13:00:13.000Z,AXCTMGYUg9A,The Greatest Showman | Official Trailer [HD] | 20th Century FOX,They took away Logan's beard and gave it to a woman,2017-06-29T12:39:38.000Z,0
2017-06-28T13:00:13.000Z,AXCTMGYUg9A,The Greatest Showman | Official Trailer [HD] | 20th Century FOX,everything was fine until zendaya showed up,2017-06-29T12:36:35.000Z,0
2017-06-28T13:00:13.000Z,AXCTMGYUg9A,The Greatest Showman | Official Trailer [HD] | 20th Century FOX,X-men is doing show business everyone.,2017-06-29T12:35:51.000Z,0
2017-06-28T13:00:13.000Z,AXCTMGYUg9A,The Greatest Showman | Official Trailer [HD] | 20th Century FOX,This movie is probably going to be the best one this year.,2017-06-29T12:33:39.000Z,50
2017-06-28T13:00:13.000Z,AXCTMGYUg9A,The Greatest Showman | Official Trailer [HD] | 20th Century FOX,It's kind of ironic this movie is coming out after the last Barnum show ended.,2017-06-29T12:32:40.000Z,0
2017-06-28T13:00:13.000Z,AXCTMGYUg9A,The Greatest Showman | Official Trailer [HD] | 20th Century FOX,That wolverine run. We knew we were gonna see that soon. :') ,2017-06-29T12:27:00.000Z,0
2017-06-28T13:00:13.000Z,AXCTMGYUg9A,The Greatest Showman | Official Trailer [HD] | 20th Century FOX,Finally a trailer!!!!!!!,2017-06-29T12:23:48.000Z,0
2017-06-28T13:00:13.000Z,AXCTMGYUg9A,The Greatest Showman | Official Trailer [HD] | 20th Century FOX,The Prestige without Nolan,2017-06-29T12:21:38.000Z,0
2017-06-28T13:00:13.000Z,AXCTMGYUg9A,The Greatest Showman | Official Trailer [HD] | 20th Century FOX,"USA, USA, USA",2017-06-29T12:13:43.000Z,0
2017-06-28T13:00:13.000Z,AXCTMGYUg9A,The Greatest Showman | Official Trailer [HD] | 20th Century FOX,"Yeah, the real reason i came here was because i knew that this movie's directer is the one, going to direct the naruto live action movie",2017-06-29T12:12:32.000Z,15
2017-06-28T13:00:13.000Z,AXCTMGYUg9A,The Greatest Showman | Official Trailer [HD] | 20th Century FOX,No one is commenting about how this circus is closing after a 146 years,2017-06-29T12:07:49.000Z,0
2017-06-28T13:00:13.000Z,AXCTMGYUg9A,The Greatest Showman | Official Trailer [HD] | 20th Century FOX,Hugh always brings movie magic to life.,2017-06-29T12:02:26.000Z,0
2017-06-28T13:00:13.000Z,AXCTMGYUg9A,The Greatest Showman | Official Trailer [HD] | 20th Century FOX,THIS LOOKS COOOL,2017-06-29T12:00:04.000Z,0
2017-06-28T13:00:13.000Z,AXCTMGYUg9A,The Greatest Showman | Official Trailer [HD] | 20th Century FOX,"Just a new movie right 








WRONG ZAC EFFRON IS IN IT







FRICKEN HIGH SCHOOL MUSICAL 4",2017-06-29T11:59:49.000Z,0
2017-06-28T13:00:13.000Z,AXCTMGYUg9A,The Greatest Showman | Official Trailer [HD] | 20th Century FOX,bad trailer.,2017-06-29T11:50:30.000Z,0
2017-06-28T13:00:13.000Z,AXCTMGYUg9A,The Greatest Showman | Official Trailer [HD] | 20th Century FOX,name of the song?,2017-06-29T11:48:52.000Z,0
2017-06-28T13:00:13.000Z,AXCTMGYUg9A,The Greatest Showman | Official Trailer [HD] | 20th Century FOX,YES YES YES,2017-06-29T11:43:29.000Z,0
2017-06-28T13:00:13.000Z,AXCTMGYUg9A,The Greatest Showman | Official Trailer [HD] | 20th Century FOX,Zendaya is an almost every movie,2017-06-29T11:36:58.000Z,0
2017-06-28T13:00:13.000Z,AXCTMGYUg9A,The Greatest Showman | Official Trailer [HD] | 20th Century FOX,What's the name of the song ??,2017-06-29T11:36:29.000Z,0
2017-06-28T13:00:13.000Z,AXCTMGYUg9A,The Greatest Showman | Official Trailer [HD] | 20th Century FOX,"Something nice,fresh and different after a GODLY wonder woman saga....I feel its goona be EPIC...awesome cast n of course....the logan jackman wolverine 😁😁I",2017-06-29T11:30:41.000Z,0
2017-06-28T13:00:13.000Z,AXCTMGYUg9A,The Greatest Showman | Official Trailer [HD] | 20th Century FOX,As soon as I see zac efron I independently wanted to see the movie 😂❤️,2017-06-29T11:28:46.000Z,0
2017-06-28T13:00:13.000Z,AXCTMGYUg9A,The Greatest Showman | Official Trailer [HD] | 20th Century FOX,Is this a prequel to the prestige?,2017-06-29T11:27:02.000Z,0
2017-06-28T13:00:13.000Z,AXCTMGYUg9A,The Greatest Showman | Official Trailer [HD] | 20th Century FOX,movie is looking good.,2017-06-29T11:23:51.000Z,0
2017-06-28T13:00:13.000Z,AXCTMGYUg9A,The Greatest Showman | Official Trailer [HD] | 20th Century FOX,"""No one ever made a difference by being like everyone else."" 

Hugh Jackman 👐👐👐👋👋👋👋",2017-06-29T11:23:17.000Z,1793
2017-06-28T13:00:13.000Z,AXCTMGYUg9A,The Greatest Showman | Official Trailer [HD] | 20th Century FOX,Who's Zendaya?,2017-06-29T11:20:54.000Z,0
2017-06-28T13:00:13.000Z,AXCTMGYUg9A,The Greatest Showman | Official Trailer [HD] | 20th Century FOX,C. Y.                             B,2017-06-29T11:19:06.000Z,0
2017-06-28T13:00:13.000Z,AXCTMGYUg9A,The Greatest Showman | Official Trailer [HD] | 20th Century FOX,dont be what they made you. .,2017-06-29T11:16:52.000Z,0
2017-06-28T13:00:13.000Z,AXCTMGYUg9A,The Greatest Showman | Official Trailer [HD] | 20th Century FOX,the new x men film looks a bit wired,2017-06-29T11:16:46.000Z,0
2017-06-28T13:00:13.000Z,AXCTMGYUg9A,The Greatest Showman | Official Trailer [HD] | 20th Century FOX,Zendaya and Zac Efron 😍 Omg I already ship them.,2017-06-29T11:16:42.000Z,0
2017-06-28T13:00:13.000Z,AXCTMGYUg9A,The Greatest Showman | Official Trailer [HD] | 20th Century FOX,Can trailers win oscars ? This looks amazing,2017-06-29T11:16:30.000Z,434
2017-06-28T13:00:13.000Z,AXCTMGYUg9A,The Greatest Showman | Official Trailer [HD] | 20th Century FOX,this gave me goosebumps. I can't wait to see it.,2017-06-29T11:10:03.000Z,0
2017-06-28T13:00:13.000Z,AXCTMGYUg9A,The Greatest Showman | Official Trailer [HD] | 20th Century FOX,ZENDAYA IS GOING PLACES I'M SO PROUD,2017-06-29T11:09:43.000Z,0
2017-06-28T13:00:13.000Z,AXCTMGYUg9A,The Greatest Showman | Official Trailer [HD] | 20th Century FOX,ZENDAYA AND ZAC EFRON IM,2017-06-29T11:08:28.000Z,0
2017-06-28T13:00:13.000Z,AXCTMGYUg9A,The Greatest Showman | Official Trailer [HD] | 20th Century FOX,What an amazing trailer!,2017-06-29T11:04:57.000Z,0
2017-06-28T13:00:13.000Z,AXCTMGYUg9A,The Greatest Showman | Official Trailer [HD] | 20th Century FOX,"He looks younger, than Logan!",2017-06-29T10:57:26.000Z,3
2017-06-28T13:00:13.000Z,AXCTMGYUg9A,The Greatest Showman | Official Trailer [HD] | 20th Century FOX,Only gonna watch it because Hugh Jackman,2017-06-29T10:55:37.000Z,0
2017-06-28T13:00:13.000Z,AXCTMGYUg9A,The Greatest Showman | Official Trailer [HD] | 20th Century FOX,"I love Michelle Williams, That's all i want to say.",2017-06-29T10:49:13.000Z,0
2017-06-28T13:00:13.000Z,AXCTMGYUg9A,The Greatest Showman | Official Trailer [HD] | 20th Century FOX,I think Zac Effron has the ability to become the most successful Disney graduate since Kurt Russell. He seems to have amazing range as an actor.,2017-06-29T10:47:29.000Z,0
2017-06-28T13:00:13.000Z,AXCTMGYUg9A,The Greatest Showman | Official Trailer [HD] | 20th Century FOX,This movie is absolutely amazing I got shills watching the trailer 😱😱😱😱,2017-06-29T10:41:34.000Z,0
2017-06-28T13:00:13.000Z,AXCTMGYUg9A,The Greatest Showman | Official Trailer [HD] | 20th Century FOX,wolverine has fallen:(,2017-06-29T10:41:32.000Z,0
2017-06-28T13:00:13.000Z,AXCTMGYUg9A,The Greatest Showman | Official Trailer [HD] | 20th Century FOX,"I've never seen woman with beards on her face - that is really ""special"".",2017-06-29T10:41:03.000Z,0
2017-06-28T13:00:13.000Z,AXCTMGYUg9A,The Greatest Showman | Official Trailer [HD] | 20th Century FOX,Zac with a person of colour😩 my heart is gonna burst,2017-06-29T10:40:59.000Z,0
2017-06-28T13:00:13.000Z,AXCTMGYUg9A,The Greatest Showman | Official Trailer [HD] | 20th Century FOX,That is pretty cool!,2017-06-29T10:37:55.000Z,0
2017-06-28T13:00:13.000Z,AXCTMGYUg9A,The Greatest Showman | Official Trailer [HD] | 20th Century FOX,The thumbnail made me think of The Prestige.,2017-06-29T10:34:22.000Z,0
2017-06-28T13:00:13.000Z,AXCTMGYUg9A,The Greatest Showman | Official Trailer [HD] | 20th Century FOX,Am i the only one who loves this song and gave them chills? i think having a somewhat modern soundtrack in an 1800's setting is really clever.,2017-06-29T10:28:09.000Z,0
2017-06-28T13:00:13.000Z,AXCTMGYUg9A,The Greatest Showman | Official Trailer [HD] | 20th Century FOX,song,2017-06-29T10:27:11.000Z,0
2017-06-28T13:00:13.000Z,AXCTMGYUg9A,The Greatest Showman | Official Trailer [HD] | 20th Century FOX,"Getting a prestige vibe from this hugh, love it",2017-06-29T10:25:42.000Z,0
2017-06-28T13:00:13.000Z,AXCTMGYUg9A,The Greatest Showman | Official Trailer [HD] | 20th Century FOX,im so happy for Zendaya! Cant wait till she fully breaks into the movie business :),2017-06-29T10:23:47.000Z,0
2017-06-28T13:00:13.000Z,AXCTMGYUg9A,The Greatest Showman | Official Trailer [HD] | 20th Century FOX,remembering prestige movie,2017-06-29T10:21:49.000Z,0
2017-06-28T13:00:13.000Z,AXCTMGYUg9A,The Greatest Showman | Official Trailer [HD] | 20th Century FOX,"Is HJ getting younger, somehow???",2017-06-29T10:20:53.000Z,0
2017-06-28T13:00:13.000Z,AXCTMGYUg9A,The Greatest Showman | Official Trailer [HD] | 20th Century FOX,"From the meanings, good writing, cinematography, actors/actresses, I can already tell this movie is going to be great.",2017-06-29T10:20:17.000Z,0
2017-06-28T13:00:13.000Z,AXCTMGYUg9A,The Greatest Showman | Official Trailer [HD] | 20th Century FOX,Hugh Jackman is such a skilled and versatile actor! Can't wait for this!,2017-06-29T10:11:52.000Z,562
2017-06-28T13:00:13.000Z,AXCTMGYUg9A,The Greatest Showman | Official Trailer [HD] | 20th Century FOX,Looks like it will be an amazing movie great to see jackman in this role,2017-06-29T10:09:48.000Z,1
2017-06-28T13:00:13.000Z,AXCTMGYUg9A,The Greatest Showman | Official Trailer [HD] | 20th Century FOX,The Greatest X-Man,2017-06-29T10:07:34.000Z,689
2017-06-28T13:00:13.000Z,AXCTMGYUg9A,The Greatest Showman | Official Trailer [HD] | 20th Century FOX,It feels like LOGAN it's alive...,2017-06-29T10:07:14.000Z,1
2017-06-28T13:00:13.000Z,AXCTMGYUg9A,The Greatest Showman | Official Trailer [HD] | 20th Century FOX,prequel of The Prestige?,2017-06-29T10:07:03.000Z,1
2017-06-28T13:00:13.000Z,AXCTMGYUg9A,The Greatest Showman | Official Trailer [HD] | 20th Century FOX,this *almost* had no spoilers in it,2017-06-29T10:02:02.000Z,2
2017-06-28T13:00:13.000Z,AXCTMGYUg9A,The Greatest Showman | Official Trailer [HD] | 20th Century FOX,what the name of the music please,2017-06-29T09:52:10.000Z,0
2017-06-28T13:00:13.000Z,AXCTMGYUg9A,The Greatest Showman | Official Trailer [HD] | 20th Century FOX,"i also love this movie,and love this jewelry ,https://www.aliexpress.com/store/2065038?spm=5261.seller_index.0.0.TYRBE0",2017-06-29T09:51:43.000Z,0
2017-06-28T13:00:13.000Z,AXCTMGYUg9A,The Greatest Showman | Official Trailer [HD] | 20th Century FOX,DID SPECIAL EDS COME UP WITH THIS MOVIE IDEA,2017-06-29T09:46:18.000Z,0
2017-06-28T13:00:13.000Z,AXCTMGYUg9A,The Greatest Showman | Official Trailer [HD] | 20th Century FOX,THIS IS ALL MY LIFE NEEDS,2017-06-29T09:46:17.000Z,0
2017-06-28T13:00:13.000Z,AXCTMGYUg9A,The Greatest Showman | Official Trailer [HD] | 20th Century FOX,This looks like visual poo.,2017-06-29T09:45:35.000Z,8
2017-06-28T13:00:13.000Z,AXCTMGYUg9A,The Greatest Showman | Official Trailer [HD] | 20th Century FOX,who else realised that this looks like kc undercover's circus episode?,2017-06-29T09:34:31.000Z,0
2017-06-28T13:00:13.000Z,AXCTMGYUg9A,The Greatest Showman | Official Trailer [HD] | 20th Century FOX,Track name ?,2017-06-29T09:24:31.000Z,0
2017-06-28T13:00:13.000Z,AXCTMGYUg9A,The Greatest Showman | Official Trailer [HD] | 20th Century FOX,Hugh Jackman as the protective leader of a group of peculiar people slightly mis-understood by society......we've never seen this before in cinemas!!!,2017-06-29T09:24:17.000Z,81
2017-06-28T13:00:13.000Z,AXCTMGYUg9A,The Greatest Showman | Official Trailer [HD] | 20th Century FOX,The prestige 2 : without magic,2017-06-29T09:19:57.000Z,150
2017-06-28T13:00:13.000Z,AXCTMGYUg9A,The Greatest Showman | Official Trailer [HD] | 20th Century FOX,FOR Z!!!,2017-06-29T09:17:45.000Z,1
2017-06-28T13:00:13.000Z,AXCTMGYUg9A,The Greatest Showman | Official Trailer [HD] | 20th Century FOX,MY MAN IS BACKKKKKKKKKKKKKKKKKKKKKKKKKKKKKKKKK,2017-06-29T09:13:46.000Z,0
2017-06-28T13:00:13.000Z,AXCTMGYUg9A,The Greatest Showman | Official Trailer [HD] | 20th Century FOX,I bet the twist at the end is that Christian Bale is going to shoot Hugh Jackman.,2017-06-29T09:12:35.000Z,0
2017-06-28T13:00:13.000Z,AXCTMGYUg9A,The Greatest Showman | Official Trailer [HD] | 20th Century FOX,I can't wait for this movie.. Zac efron back at musical is iconic,2017-06-29T09:11:30.000Z,0
2017-06-28T13:00:13.000Z,AXCTMGYUg9A,The Greatest Showman | Official Trailer [HD] | 20th Century FOX,Screaming,2017-06-29T09:07:40.000Z,0
2017-06-28T13:00:13.000Z,AXCTMGYUg9A,The Greatest Showman | Official Trailer [HD] | 20th Century FOX,"""Show-business? I've never heard of it.""

""Cause I just invented it.""",2017-06-29T09:07:15.000Z,0
2017-06-28T13:00:13.000Z,AXCTMGYUg9A,The Greatest Showman | Official Trailer [HD] | 20th Century FOX,AMERICAN HORROR STORY FREAK SHOW MUSICAL VERSION,2017-06-29T09:06:33.000Z,0
2017-06-28T13:00:13.000Z,AXCTMGYUg9A,The Greatest Showman | Official Trailer [HD] | 20th Century FOX,"""I will now attempt to cut this lady in half,"" 
*extends claws*",2017-06-29T09:03:51.000Z,0
2017-06-28T13:00:13.000Z,AXCTMGYUg9A,The Greatest Showman | Official Trailer [HD] | 20th Century FOX,"I like the song even though it's cheesy and the musical arrangements doesn't really fit into this period piece, but Moulin Rogue was able to pull off a modern twist so heck I'll give this movie a shot. And this looks fun and original.",2017-06-29T09:02:41.000Z,0
2017-06-28T13:00:13.000Z,AXCTMGYUg9A,The Greatest Showman | Official Trailer [HD] | 20th Century FOX,So this is a musical right,2017-06-29T09:01:45.000Z,0
2017-06-28T13:00:13.000Z,AXCTMGYUg9A,The Greatest Showman | Official Trailer [HD] | 20th Century FOX,which track is this?,2017-06-29T09:01:27.000Z,0
2017-06-28T13:00:13.000Z,AXCTMGYUg9A,The Greatest Showman | Official Trailer [HD] | 20th Century FOX,This movie looks like trash.,2017-06-29T09:00:00.000Z,0
2017-06-28T13:00:13.000Z,AXCTMGYUg9A,The Greatest Showman | Official Trailer [HD] | 20th Century FOX,i want to get one of those ringmaster outfits,2017-06-29T08:52:16.000Z,0
2017-06-28T13:00:13.000Z,AXCTMGYUg9A,The Greatest Showman | Official Trailer [HD] | 20th Century FOX,support for hugh jackman,2017-06-29T08:50:26.000Z,0
2017-06-28T13:00:13.000Z,AXCTMGYUg9A,The Greatest Showman | Official Trailer [HD] | 20th Century FOX,The Prestige 2?,2017-06-29T08:49:26.000Z,0
2017-06-28T13:00:13.000Z,AXCTMGYUg9A,The Greatest Showman | Official Trailer [HD] | 20th Century FOX,Ermmm yeah gona give this one a miss ,2017-06-29T08:50:29.000Z,0
2017-06-28T13:00:13.000Z,AXCTMGYUg9A,The Greatest Showman | Official Trailer [HD] | 20th Century FOX,I hope this movie does good since it comes out around the same time as the last jedi 🙏😕,2017-06-29T08:47:10.000Z,0
2017-06-28T13:00:13.000Z,AXCTMGYUg9A,The Greatest Showman | Official Trailer [HD] | 20th Century FOX,is it the sequel of the prestige?,2017-06-29T08:46:54.000Z,0
2017-06-28T13:00:13.000Z,AXCTMGYUg9A,The Greatest Showman | Official Trailer [HD] | 20th Century FOX,when wolverine needed some quick cash,2017-06-29T08:39:37.000Z,0
2017-06-28T13:00:13.000Z,AXCTMGYUg9A,The Greatest Showman | Official Trailer [HD] | 20th Century FOX,radical,2017-06-29T08:39:15.000Z,0
2017-06-28T13:00:13.000Z,AXCTMGYUg9A,The Greatest Showman | Official Trailer [HD] | 20th Century FOX,Yo this the gayest Xmen yet!,2017-06-29T08:38:39.000Z,0
2017-06-28T13:00:13.000Z,AXCTMGYUg9A,The Greatest Showman | Official Trailer [HD] | 20th Century FOX,Not liking the black music.,2017-06-29T08:37:25.000Z,0
