publish_time,Video ID,Title,Comment,updatedAt,likeCount
2014-12-23T01:20:45.000Z,FUS_Q7FsfqU,The Longest Ride | Official Trailer [HD] | 20th Century FOX,This looks terrible and just ruined a great song,2015-03-12T05:27:26.000Z,0
2014-12-23T01:20:45.000Z,FUS_Q7FsfqU,The Longest Ride | Official Trailer [HD] | 20th Century FOX,50 shades of grey cowboy addition!,2015-03-12T05:20:12.000Z,0
2014-12-23T01:20:45.000Z,FUS_Q7FsfqU,The Longest Ride | Official Trailer [HD] | 20th Century FOX,I thought this was the movie for the book Long Hard Ride by Lorelei James but gotta admit they look just abt the same except the old man part,2015-03-12T04:24:55.000Z,0
2014-12-23T01:20:45.000Z,FUS_Q7FsfqU,The Longest Ride | Official Trailer [HD] | 20th Century FOX,"Scott Eastwood looks like his dad, but he also kind of looks like he could be a Hemsworth brother, Chris, Liam and Scott all have that look",2015-03-12T02:19:11.000Z,0
2014-12-23T01:20:45.000Z,FUS_Q7FsfqU,The Longest Ride | Official Trailer [HD] | 20th Century FOX,What's the first song?,2015-03-12T00:14:44.000Z,0
2014-12-23T01:20:45.000Z,FUS_Q7FsfqU,The Longest Ride | Official Trailer [HD] | 20th Century FOX,Oh no. A movie about rodeos in 2015. People must be kidding me. How about making one about bullfightings as well?,2015-03-12T00:10:14.000Z,1
2014-12-23T01:20:45.000Z,FUS_Q7FsfqU,The Longest Ride | Official Trailer [HD] | 20th Century FOX,does anyone know the music in this trailer?,2015-03-11T23:36:28.000Z,0
2014-12-23T01:20:45.000Z,FUS_Q7FsfqU,The Longest Ride | Official Trailer [HD] | 20th Century FOX,what's the song in the background called?,2015-03-11T23:21:48.000Z,0
2014-12-23T01:20:45.000Z,FUS_Q7FsfqU,The Longest Ride | Official Trailer [HD] | 20th Century FOX,OMG can't wait to see this,2015-03-11T18:02:03.000Z,0
2014-12-23T01:20:45.000Z,FUS_Q7FsfqU,The Longest Ride | Official Trailer [HD] | 20th Century FOX,"I will probably read a lot more books in my lifetime, but I will always remember this one. In a way it can be happy and sad because it was really a love story of 2 couples. You just have to read it. Wonderful love story! 👍😉""His voice, even now, follows me everywhere on this longest of rides, this thing called life.” 😊",2015-03-11T17:51:18.000Z,0
2014-12-23T01:20:45.000Z,FUS_Q7FsfqU,The Longest Ride | Official Trailer [HD] | 20th Century FOX,Could anyone tell me what's the song in the beginning of the trailer? ,2015-03-11T16:31:29.000Z,0
2014-12-23T01:20:45.000Z,FUS_Q7FsfqU,The Longest Ride | Official Trailer [HD] | 20th Century FOX,50 shades of YEEHAH!,2015-03-11T10:00:15.000Z,2
2014-12-23T01:20:45.000Z,FUS_Q7FsfqU,The Longest Ride | Official Trailer [HD] | 20th Century FOX,"Wow this looks great. I can't wait for this movie too come out....
Plus i'm ALL about Rodeo.",2015-03-11T09:36:19.000Z,3
2014-12-23T01:20:45.000Z,FUS_Q7FsfqU,The Longest Ride | Official Trailer [HD] | 20th Century FOX,Looking forward to this.,2015-03-11T08:13:46.000Z,0
2014-12-23T01:20:45.000Z,FUS_Q7FsfqU,The Longest Ride | Official Trailer [HD] | 20th Century FOX,She looks so much like Sabrina carpenter ,2015-03-11T08:05:08.000Z,0
2014-12-23T01:20:45.000Z,FUS_Q7FsfqU,The Longest Ride | Official Trailer [HD] | 20th Century FOX,WAITING GAME FROM THE DIVERGENT SOUNDTRACK !!!!!!!!!!!!,2015-03-11T07:54:32.000Z,0
2014-12-23T01:20:45.000Z,FUS_Q7FsfqU,The Longest Ride | Official Trailer [HD] | 20th Century FOX,This really isn't what happened in the book. Just little parts are barely the same but majority of it isn't real. Smh,2015-03-11T06:34:32.000Z,0
2014-12-23T01:20:45.000Z,FUS_Q7FsfqU,The Longest Ride | Official Trailer [HD] | 20th Century FOX,Is that girl Dylan O'Brien's girlfriend ???,2015-03-11T03:16:59.000Z,406
2014-12-23T01:20:45.000Z,FUS_Q7FsfqU,The Longest Ride | Official Trailer [HD] | 20th Century FOX,ohhh god no sabía que harían la peli!!! wiii!! pero algunas partes no se ven como el libro :( ojala mantenga la esencia :3 ,2015-03-11T02:14:18.000Z,0
2014-12-23T01:20:45.000Z,FUS_Q7FsfqU,The Longest Ride | Official Trailer [HD] | 20th Century FOX,What song is this?,2015-03-11T00:21:43.000Z,0
2014-12-23T01:20:45.000Z,FUS_Q7FsfqU,The Longest Ride | Official Trailer [HD] | 20th Century FOX,"Oh great, its Fifty Shades of Grey country version. ",2015-03-10T23:43:33.000Z,1
2014-12-23T01:20:45.000Z,FUS_Q7FsfqU,The Longest Ride | Official Trailer [HD] | 20th Century FOX,I've been dying to see this,2015-03-10T19:36:48.000Z,0
2014-12-23T01:20:45.000Z,FUS_Q7FsfqU,The Longest Ride | Official Trailer [HD] | 20th Century FOX,whats name hozier song ? ,2015-03-10T12:54:48.000Z,0
2014-12-23T01:20:45.000Z,FUS_Q7FsfqU,The Longest Ride | Official Trailer [HD] | 20th Century FOX,What is the name of this song!??,2015-03-10T03:39:08.000Z,0
2014-12-23T01:20:45.000Z,FUS_Q7FsfqU,The Longest Ride | Official Trailer [HD] | 20th Century FOX,He's kinda beautiful.,2015-03-10T02:15:26.000Z,1
2014-12-23T01:20:45.000Z,FUS_Q7FsfqU,The Longest Ride | Official Trailer [HD] | 20th Century FOX,Dude seems way to old for her!,2015-03-09T19:53:12.000Z,0
2014-12-23T01:20:45.000Z,FUS_Q7FsfqU,The Longest Ride | Official Trailer [HD] | 20th Century FOX,OMG that one bull its Rango i love Bull riding i do it myself cant wait to see it ,2015-03-09T16:06:05.000Z,0
2014-12-23T01:20:45.000Z,FUS_Q7FsfqU,The Longest Ride | Official Trailer [HD] | 20th Century FOX,So every single Nicholas Sparks thing is basically the same? ,2015-03-09T10:03:33.000Z,1
2014-12-23T01:20:45.000Z,FUS_Q7FsfqU,The Longest Ride | Official Trailer [HD] | 20th Century FOX,Why they keep changing the real story of the books?,2015-03-09T00:59:45.000Z,0
2014-12-23T01:20:45.000Z,FUS_Q7FsfqU,The Longest Ride | Official Trailer [HD] | 20th Century FOX,HOZIERS WORK SONG IS IN THE TRAILER. I CAN FANGIRL YAY,2015-03-08T23:39:49.000Z,0
2014-12-23T01:20:45.000Z,FUS_Q7FsfqU,The Longest Ride | Official Trailer [HD] | 20th Century FOX,She can ride me The Longest,2015-03-08T16:49:29.000Z,0
2014-12-23T01:20:45.000Z,FUS_Q7FsfqU,The Longest Ride | Official Trailer [HD] | 20th Century FOX,"Wow! I just now discovered this movie from Nicholas Sparks and I like it! I found out that in Croatia starts showing at April 23, but then I go on a little trip to Italy, but after I get back I'll be sure to check it out! I can't wait hehe, all the films of Nicholas are fantastic, my favorite is Notebook and The Fault in Our Stars, and I hope to soon see and Dear John :)
Sorry for the mistakes. :) :) ",2015-03-08T16:05:18.000Z,0
2014-12-23T01:20:45.000Z,FUS_Q7FsfqU,The Longest Ride | Official Trailer [HD] | 20th Century FOX,"Okay......... I see now.!!     The ""New Thing "" in movie trailers is to echo the scenes with ..."" Fifty shades ..type Erotic music ""... especially for the ..intimate scenes.!!  Lol.   Not sure it Fits a movie like this though.??",2015-03-08T06:45:40.000Z,0
2014-12-23T01:20:45.000Z,FUS_Q7FsfqU,The Longest Ride | Official Trailer [HD] | 20th Century FOX,"This is not what happened in the book! Hahaha oh well, i'm tired of saying this to every Nicholas's films they do, everytime i'm always so disappointed when the trailer comes out cause they always messed it up BIG TIME. The longest ride is one of Nicholas sweetest book, and its so full of emotion and beautiful stories and yet this doesn't feel right. Its show lots of kissing and make out and whatever cheezy cliche things. Oh well.... 

END RANT",2015-03-07T15:59:38.000Z,1
2014-12-23T01:20:45.000Z,FUS_Q7FsfqU,The Longest Ride | Official Trailer [HD] | 20th Century FOX,when does it come out?,2015-03-07T00:50:45.000Z,0
2014-12-23T01:20:45.000Z,FUS_Q7FsfqU,The Longest Ride | Official Trailer [HD] | 20th Century FOX,for anyone who want to know the song is named waiting games..,2015-03-06T18:37:42.000Z,0
2014-12-23T01:20:45.000Z,FUS_Q7FsfqU,The Longest Ride | Official Trailer [HD] | 20th Century FOX,Is this a good book??,2015-03-06T11:07:03.000Z,1
2014-12-23T01:20:45.000Z,FUS_Q7FsfqU,The Longest Ride | Official Trailer [HD] | 20th Century FOX,Wohoo! Hozier (I don't like the plot of the movie but I love the song at the end of the trailer.),2015-03-06T08:47:10.000Z,0
2014-12-23T01:20:45.000Z,FUS_Q7FsfqU,The Longest Ride | Official Trailer [HD] | 20th Century FOX,Oh snap,2015-03-06T06:32:20.000Z,0
2014-12-23T01:20:45.000Z,FUS_Q7FsfqU,The Longest Ride | Official Trailer [HD] | 20th Century FOX,Nothin beats 8 Seconds!,2015-03-05T23:58:44.000Z,0
2014-12-23T01:20:45.000Z,FUS_Q7FsfqU,The Longest Ride | Official Trailer [HD] | 20th Century FOX,The trailer and the book are like totally different ,2015-03-05T23:01:01.000Z,0
2014-12-23T01:20:45.000Z,FUS_Q7FsfqU,The Longest Ride | Official Trailer [HD] | 20th Century FOX,What's the song when she started reading the letters,2015-03-05T05:26:37.000Z,0
2014-12-23T01:20:45.000Z,FUS_Q7FsfqU,The Longest Ride | Official Trailer [HD] | 20th Century FOX,Gives me chills ,2015-03-02T17:04:20.000Z,0
2014-12-23T01:20:45.000Z,FUS_Q7FsfqU,The Longest Ride | Official Trailer [HD] | 20th Century FOX,But I love The Waiting Game by Banks 😍 this song is perfect,2015-03-02T05:35:47.000Z,0
2014-12-23T01:20:45.000Z,FUS_Q7FsfqU,The Longest Ride | Official Trailer [HD] | 20th Century FOX,"Looks corny as hell but of course their demographic is going to love this like The Notebook, Dear John, etc.",2015-03-02T05:35:14.000Z,0
2014-12-23T01:20:45.000Z,FUS_Q7FsfqU,The Longest Ride | Official Trailer [HD] | 20th Century FOX,What is the song in the beginning?,2015-03-02T03:27:45.000Z,0
2014-12-23T01:20:45.000Z,FUS_Q7FsfqU,The Longest Ride | Official Trailer [HD] | 20th Century FOX,"I'm in the middle of reading this book, and it's pretty good so far.  ",2015-03-01T13:59:03.000Z,1
2014-12-23T01:20:45.000Z,FUS_Q7FsfqU,The Longest Ride | Official Trailer [HD] | 20th Century FOX,I would really watch this movie!,2015-03-01T13:02:25.000Z,0
2014-12-23T01:20:45.000Z,FUS_Q7FsfqU,The Longest Ride | Official Trailer [HD] | 20th Century FOX,No. No no no. Literally none of that happens in the book. I just finished reading it not an hour ago. Why does Sparks continue to rip apart his books and slap them together into a movie? I don't even want to see it now because it is not even close to being the same story.,2015-03-01T06:21:06.000Z,0
2014-12-23T01:20:45.000Z,FUS_Q7FsfqU,The Longest Ride | Official Trailer [HD] | 20th Century FOX,why does every romance movie have to be complicated.....,2015-03-01T04:22:03.000Z,0
2014-12-23T01:20:45.000Z,FUS_Q7FsfqU,The Longest Ride | Official Trailer [HD] | 20th Century FOX,I love Britt Robertson ever since she was in the tv show The Secret Circle!,2015-02-28T21:17:43.000Z,0
2014-12-23T01:20:45.000Z,FUS_Q7FsfqU,The Longest Ride | Official Trailer [HD] | 20th Century FOX,This film resembles a TV movie about a bull rider but it doesn't look to bad.,2015-02-28T17:49:52.000Z,0
2014-12-23T01:20:45.000Z,FUS_Q7FsfqU,The Longest Ride | Official Trailer [HD] | 20th Century FOX,The trailer gives a bit too much away,2015-02-28T11:15:56.000Z,0
2014-12-23T01:20:45.000Z,FUS_Q7FsfqU,The Longest Ride | Official Trailer [HD] | 20th Century FOX,I love Nicholas Sparks ,2015-02-27T22:46:24.000Z,0
2014-12-23T01:20:45.000Z,FUS_Q7FsfqU,The Longest Ride | Official Trailer [HD] | 20th Century FOX,"Hozier is so much better than this trailer(and the whole movie, I bet)!! I hope he will lend his magnificent voice to a good movie one day.",2015-02-27T12:32:05.000Z,0
2014-12-23T01:20:45.000Z,FUS_Q7FsfqU,The Longest Ride | Official Trailer [HD] | 20th Century FOX,"When, my, time comes around,
Lay me gently in the cold dark earth,
No grave can hold my body down I'll crawl home to her...



Hozier - Work song",2015-02-27T10:40:11.000Z,4
2014-12-23T01:20:45.000Z,FUS_Q7FsfqU,The Longest Ride | Official Trailer [HD] | 20th Century FOX,Oh the sexual innuendoes lol,2015-02-27T06:24:56.000Z,0
2014-12-23T01:20:45.000Z,FUS_Q7FsfqU,The Longest Ride | Official Trailer [HD] | 20th Century FOX,"Everybody has a day when you are supposed to get off the Bull and end the ride. Or the Bull kills you.
I am ready to get off the Bull and hold my woman forever. Thank you Jesus for saving me and my family.",2015-02-26T19:36:58.000Z,21
2014-12-23T01:20:45.000Z,FUS_Q7FsfqU,The Longest Ride | Official Trailer [HD] | 20th Century FOX,Ew he is a bullrider congrats on exploiting and torturing animals for a career that is your life hope a bull mauls him.,2015-02-26T19:23:49.000Z,0
2014-12-23T01:20:45.000Z,FUS_Q7FsfqU,The Longest Ride | Official Trailer [HD] | 20th Century FOX,I CANT WAIT TO SEE IT 😭😭😭,2015-02-26T04:28:07.000Z,0
2014-12-23T01:20:45.000Z,FUS_Q7FsfqU,The Longest Ride | Official Trailer [HD] | 20th Century FOX,This looks so freaking good ,2015-02-25T23:38:50.000Z,0
2014-12-23T01:20:45.000Z,FUS_Q7FsfqU,The Longest Ride | Official Trailer [HD] | 20th Century FOX,This is an amazing book!,2015-02-25T18:25:00.000Z,0
2014-12-23T01:20:45.000Z,FUS_Q7FsfqU,The Longest Ride | Official Trailer [HD] | 20th Century FOX,I can already tell this won't be like the book. :(,2015-02-25T03:14:18.000Z,0
2014-12-23T01:20:45.000Z,FUS_Q7FsfqU,The Longest Ride | Official Trailer [HD] | 20th Century FOX,"Anybody know the name of the song, whenever she starts reading the letters to Ira, (old man)",2015-02-24T16:41:32.000Z,0
2014-12-23T01:20:45.000Z,FUS_Q7FsfqU,The Longest Ride | Official Trailer [HD] | 20th Century FOX,This is nothing like 50 shades of gray there is no raping,2015-02-24T02:13:28.000Z,0
2014-12-23T01:20:45.000Z,FUS_Q7FsfqU,The Longest Ride | Official Trailer [HD] | 20th Century FOX,Alan Alda is in this !!! Greatest actor of all time gotta see this movie now ,2015-02-23T06:12:53.000Z,0
2014-12-23T01:20:45.000Z,FUS_Q7FsfqU,The Longest Ride | Official Trailer [HD] | 20th Century FOX,Hozier brought me here.,2015-02-22T09:12:45.000Z,0
2014-12-23T01:20:45.000Z,FUS_Q7FsfqU,The Longest Ride | Official Trailer [HD] | 20th Century FOX,Looks ok..still think the notebook is the best so far  ,2015-02-22T08:22:29.000Z,12
2014-12-23T01:20:45.000Z,FUS_Q7FsfqU,The Longest Ride | Official Trailer [HD] | 20th Century FOX,Saw Scott Eastwood at the Beverly Hilton last night. He is even hotter in person.,2015-02-21T20:17:31.000Z,0
2014-12-23T01:20:45.000Z,FUS_Q7FsfqU,The Longest Ride | Official Trailer [HD] | 20th Century FOX,Wasn't there a time when trailers left some things unanswered so you really wanted to see what happens? This kind of tells the whole story.,2015-02-21T09:36:23.000Z,0
2014-12-23T01:20:45.000Z,FUS_Q7FsfqU,The Longest Ride | Official Trailer [HD] | 20th Century FOX,@BlueBerri Lynn is it a date?,2015-02-21T04:42:18.000Z,2
2014-12-23T01:20:45.000Z,FUS_Q7FsfqU,The Longest Ride | Official Trailer [HD] | 20th Century FOX,"It's funny, because I've been watching Britt in the screen since Life Unexpected and she has always played a kid or high school girl, but now she has started to play as an adult. Time does fly!",2015-02-21T03:12:12.000Z,0
2014-12-23T01:20:45.000Z,FUS_Q7FsfqU,The Longest Ride | Official Trailer [HD] | 20th Century FOX,I've watched this around 40 times ,2015-02-20T15:02:54.000Z,1
2014-12-23T01:20:45.000Z,FUS_Q7FsfqU,The Longest Ride | Official Trailer [HD] | 20th Century FOX,Britt Robertson ❤️❤️❤️,2015-02-20T00:12:44.000Z,0
2014-12-23T01:20:45.000Z,FUS_Q7FsfqU,The Longest Ride | Official Trailer [HD] | 20th Century FOX,Seems promising :D,2015-02-19T21:23:01.000Z,0
2014-12-23T01:20:45.000Z,FUS_Q7FsfqU,The Longest Ride | Official Trailer [HD] | 20th Century FOX,Goosebumps Feels omg...,2015-02-19T20:00:01.000Z,0
2014-12-23T01:20:45.000Z,FUS_Q7FsfqU,The Longest Ride | Official Trailer [HD] | 20th Century FOX,"It looks a lot different from the book, but that doesn't mean it does look like a good movie ",2015-02-19T06:43:12.000Z,0
2014-12-23T01:20:45.000Z,FUS_Q7FsfqU,The Longest Ride | Official Trailer [HD] | 20th Century FOX,What's the name of the song in the beginning?,2015-02-19T05:18:12.000Z,0
2014-12-23T01:20:45.000Z,FUS_Q7FsfqU,The Longest Ride | Official Trailer [HD] | 20th Century FOX,omg this makes me wanna cry,2015-02-19T01:42:10.000Z,0
2014-12-23T01:20:45.000Z,FUS_Q7FsfqU,The Longest Ride | Official Trailer [HD] | 20th Century FOX,What's the song at the beginning?,2015-02-18T16:19:33.000Z,0
2014-12-23T01:20:45.000Z,FUS_Q7FsfqU,The Longest Ride | Official Trailer [HD] | 20th Century FOX,What are the songs in this preview?,2015-02-18T03:44:52.000Z,0
2014-12-23T01:20:45.000Z,FUS_Q7FsfqU,The Longest Ride | Official Trailer [HD] | 20th Century FOX,You guys are what's wrong with the world. Talk about bullies. If you don't like then don't watch it but no one wants to hear your complaining. ,2015-02-16T18:50:20.000Z,0
2014-12-23T01:20:45.000Z,FUS_Q7FsfqU,The Longest Ride | Official Trailer [HD] | 20th Century FOX,"For the first few minutes I'm like, ""typical boy meets gir, boy feels something different for girl"" then my eyes grew wide and goes, ""is this like tamer more romantic much brilliantly made version of 50 shades?"" Then Hozier starts singing in the background and I lost it. Thank you 20th century for including his song in the trailer, made me want to watch the movie for the sole reason that Hozier's song was used in the trailer. But yes, it did feel like 50 shades tamer more romantic and much brilliantly made version for me, based on the this. ",2015-02-16T14:26:57.000Z,0
2014-12-23T01:20:45.000Z,FUS_Q7FsfqU,The Longest Ride | Official Trailer [HD] | 20th Century FOX,What's the songs,2015-02-16T13:32:35.000Z,0
2014-12-23T01:20:45.000Z,FUS_Q7FsfqU,The Longest Ride | Official Trailer [HD] | 20th Century FOX,"I only want to see this movie because it started off with banks' ""waiting game"" song!!! I love her so much. ",2015-02-16T04:31:24.000Z,0
2014-12-23T01:20:45.000Z,FUS_Q7FsfqU,The Longest Ride | Official Trailer [HD] | 20th Century FOX,I cannot wait to see this movie. I love how they bring a old century with the new.,2015-02-15T17:13:40.000Z,0
2014-12-23T01:20:45.000Z,FUS_Q7FsfqU,The Longest Ride | Official Trailer [HD] | 20th Century FOX,"Are they seriously comparing soldiers fighting at war to bullfighting..? ya have me lost there. On a side note, clint's son has become a fiine man. I see a lil michael fassbender in there",2015-02-15T09:13:18.000Z,0
2014-12-23T01:20:45.000Z,FUS_Q7FsfqU,The Longest Ride | Official Trailer [HD] | 20th Century FOX,Whoa the actress who plays Ruth was Talisa in GoT!,2015-02-15T00:26:19.000Z,0
2014-12-23T01:20:45.000Z,FUS_Q7FsfqU,The Longest Ride | Official Trailer [HD] | 20th Century FOX,"Everyone's complaining about how cliche and boring this is. Well sorry, why dont you tell me when your new movie is coming out hmm ? ",2015-02-14T20:07:53.000Z,5
2014-12-23T01:20:45.000Z,FUS_Q7FsfqU,The Longest Ride | Official Trailer [HD] | 20th Century FOX,Hozier makes me sad in all the right places.,2015-02-14T19:22:15.000Z,0
2014-12-23T01:20:45.000Z,FUS_Q7FsfqU,The Longest Ride | Official Trailer [HD] | 20th Century FOX,What's the song called in the beginning ,2015-02-14T16:42:09.000Z,0
2014-12-23T01:20:45.000Z,FUS_Q7FsfqU,The Longest Ride | Official Trailer [HD] | 20th Century FOX,I'm just saying but that girls gonna be in a disney movie soon,2015-02-14T16:13:41.000Z,0
2014-12-23T01:20:45.000Z,FUS_Q7FsfqU,The Longest Ride | Official Trailer [HD] | 20th Century FOX,showcases much more sexiness/chemistry  than 50 shades trailers for sure,2015-02-14T16:08:49.000Z,0
2014-12-23T01:20:45.000Z,FUS_Q7FsfqU,The Longest Ride | Official Trailer [HD] | 20th Century FOX,Lol...This is what Clint Eastwood spawned? Hahahahaha...,2015-02-14T15:19:21.000Z,0
2014-12-23T01:20:45.000Z,FUS_Q7FsfqU,The Longest Ride | Official Trailer [HD] | 20th Century FOX,That song though!! Made me look at this trailer! ,2015-02-14T11:45:24.000Z,1
2014-12-23T01:20:45.000Z,FUS_Q7FsfqU,The Longest Ride | Official Trailer [HD] | 20th Century FOX,Looks like a shitty movie but Scott is really hooot!!,2015-02-14T10:53:00.000Z,0
2014-12-23T01:20:45.000Z,FUS_Q7FsfqU,The Longest Ride | Official Trailer [HD] | 20th Century FOX,"Scott looks like his dad, WOW, the generation of Clint Eastwood.  ",2015-02-14T07:52:16.000Z,2
2014-12-23T01:20:45.000Z,FUS_Q7FsfqU,The Longest Ride | Official Trailer [HD] | 20th Century FOX,"I'm confused...

So, she's going to ride him (for like) the entire movie?

Quite boring if you ask me, they need to switch positions a couple times..",2015-02-14T05:57:11.000Z,0
2014-12-23T01:20:45.000Z,FUS_Q7FsfqU,The Longest Ride | Official Trailer [HD] | 20th Century FOX,"Just found about this movie today... like the trailer a lot but the best thing is that they use Hozier's Work Song, which is my favorite ",2015-02-14T01:23:40.000Z,0
2014-12-23T01:20:45.000Z,FUS_Q7FsfqU,The Longest Ride | Official Trailer [HD] | 20th Century FOX,LAUREN BROUGHT ME HERE ,2015-02-14T00:15:08.000Z,1
2014-12-23T01:20:45.000Z,FUS_Q7FsfqU,The Longest Ride | Official Trailer [HD] | 20th Century FOX,0:32 Random butt zoom-in for no reason at all.,2015-02-13T22:46:26.000Z,0
2014-12-23T01:20:45.000Z,FUS_Q7FsfqU,The Longest Ride | Official Trailer [HD] | 20th Century FOX,When this was out 1 month ago but feels like 10. 😳😩,2015-02-13T22:14:28.000Z,0
2014-12-23T01:20:45.000Z,FUS_Q7FsfqU,The Longest Ride | Official Trailer [HD] | 20th Century FOX,THIS SONG OMFG ,2015-02-13T21:28:49.000Z,0
2014-12-23T01:20:45.000Z,FUS_Q7FsfqU,The Longest Ride | Official Trailer [HD] | 20th Century FOX,Like if u came here because of Adeline ,2015-02-13T20:49:25.000Z,0
2014-12-23T01:20:45.000Z,FUS_Q7FsfqU,The Longest Ride | Official Trailer [HD] | 20th Century FOX,WHO ELSE WAS SENT HERE BY ADELAINE MORINS SNAPCHAT??,2015-02-13T20:20:01.000Z,0
2014-12-23T01:20:45.000Z,FUS_Q7FsfqU,The Longest Ride | Official Trailer [HD] | 20th Century FOX,"Clint Eastwood did not support Barrack Obama, so I'm not watching this. ",2015-02-13T18:24:56.000Z,4
2014-12-23T01:20:45.000Z,FUS_Q7FsfqU,The Longest Ride | Official Trailer [HD] | 20th Century FOX,This book is so good. ❤️❤️,2015-02-13T15:25:26.000Z,0
2014-12-23T01:20:45.000Z,FUS_Q7FsfqU,The Longest Ride | Official Trailer [HD] | 20th Century FOX,"I  am not a Nicholas Sprarks fan, his movies are too cheezy, but Scott eastwood is all you need to watch this.",2015-02-13T06:48:46.000Z,1
2014-12-23T01:20:45.000Z,FUS_Q7FsfqU,The Longest Ride | Official Trailer [HD] | 20th Century FOX,I cannot wait to see this! I just wish that the characters looked like how they were described in the book. :/ This is gonna be just as good as the notebook. The longest ride is defiantly my favorite book from Nicholas Sparks!!,2015-02-13T05:13:20.000Z,0
2014-12-23T01:20:45.000Z,FUS_Q7FsfqU,The Longest Ride | Official Trailer [HD] | 20th Century FOX,Lauren Giraldo brought me here 😂,2015-02-13T03:35:22.000Z,0
2014-12-23T01:20:45.000Z,FUS_Q7FsfqU,The Longest Ride | Official Trailer [HD] | 20th Century FOX,Anyone else remember her from the Disney movie Avalon High?,2015-02-13T02:54:31.000Z,42
2014-12-23T01:20:45.000Z,FUS_Q7FsfqU,The Longest Ride | Official Trailer [HD] | 20th Century FOX,"I cried. 
I never cry.
What's going on?",2015-02-13T02:28:40.000Z,0
2014-12-23T01:20:45.000Z,FUS_Q7FsfqU,The Longest Ride | Official Trailer [HD] | 20th Century FOX,she's from the first time,2015-02-13T01:57:22.000Z,0
2014-12-23T01:20:45.000Z,FUS_Q7FsfqU,The Longest Ride | Official Trailer [HD] | 20th Century FOX,I really hope it turns out like the end of the book I am going to be so sooo disappointed! ! And crushed!!,2015-02-13T01:02:51.000Z,0
2014-12-23T01:20:45.000Z,FUS_Q7FsfqU,The Longest Ride | Official Trailer [HD] | 20th Century FOX,the second song is work song hozier,2015-02-13T01:00:01.000Z,0
2014-12-23T01:20:45.000Z,FUS_Q7FsfqU,The Longest Ride | Official Trailer [HD] | 20th Century FOX,Another 50 Shade of Grey movie?!,2015-02-13T00:51:12.000Z,0
2014-12-23T01:20:45.000Z,FUS_Q7FsfqU,The Longest Ride | Official Trailer [HD] | 20th Century FOX,Lauren sent me here. #scgang,2015-02-13T00:39:01.000Z,1
2014-12-23T01:20:45.000Z,FUS_Q7FsfqU,The Longest Ride | Official Trailer [HD] | 20th Century FOX,I saw the ariat brand on the sideline while he was riding...BEST BRAND FOR PADDOCK BOOTS AND HALF CHAPS!,2015-02-12T21:37:19.000Z,15
2014-12-23T01:20:45.000Z,FUS_Q7FsfqU,The Longest Ride | Official Trailer [HD] | 20th Century FOX,so sad o-o -tear-,2015-02-12T21:08:25.000Z,0
2014-12-23T01:20:45.000Z,FUS_Q7FsfqU,The Longest Ride | Official Trailer [HD] | 20th Century FOX,Britt looks so grown up :D ,2015-02-12T19:25:30.000Z,0
2014-12-23T01:20:45.000Z,FUS_Q7FsfqU,The Longest Ride | Official Trailer [HD] | 20th Century FOX,OVAJ FILM JE EKSTRA JEDVA CEKAM DA GA ODGLEDAM,2015-02-12T18:11:38.000Z,0
2014-12-23T01:20:45.000Z,FUS_Q7FsfqU,The Longest Ride | Official Trailer [HD] | 20th Century FOX,What's the name of the two songs on here,2015-02-12T18:02:40.000Z,0
2014-12-23T01:20:45.000Z,FUS_Q7FsfqU,The Longest Ride | Official Trailer [HD] | 20th Century FOX,I really just clicked on the trailer because it sounded like a porno...*the longest ride*..hehe..hehe,2015-02-12T13:40:23.000Z,0
2014-12-23T01:20:45.000Z,FUS_Q7FsfqU,The Longest Ride | Official Trailer [HD] | 20th Century FOX,Yes bull riding and going to war same things..,2015-02-12T09:23:20.000Z,0
2014-12-23T01:20:45.000Z,FUS_Q7FsfqU,The Longest Ride | Official Trailer [HD] | 20th Century FOX,omg I cant wait for this movie,2015-02-12T00:37:42.000Z,0
2014-12-23T01:20:45.000Z,FUS_Q7FsfqU,The Longest Ride | Official Trailer [HD] | 20th Century FOX,"This is nothing like the book... The book was perfect! Such a sweet story, I definitely recommend reading it before you see the movie! ",2015-02-11T07:43:44.000Z,0
