publish_time,Video ID,Title,Comment,updatedAt,likeCount
2017-06-28T13:00:13.000Z,AXCTMGYUg9A,The Greatest Showman | Official Trailer [HD] | 20th Century FOX,"Hugh Jackman is my absolute favorite actor!!! I actually started crying with joy when I first saw the trailer. It looks like the most amazing movie ever. The lines, set, plot, actors (and zendaya my queen!!) all look 10/10. Me and my mom are watching it the very first viewing and buying it once it's released.  We both think it will win several oscars",2017-10-22T12:56:05.000Z,0
2017-06-28T13:00:13.000Z,AXCTMGYUg9A,The Greatest Showman | Official Trailer [HD] | 20th Century FOX,"""No one ever made a difference by  being leke everyone else"" 
so true . god i love hugh jackman",2017-10-21T09:28:11.000Z,0
2017-06-28T13:00:13.000Z,AXCTMGYUg9A,The Greatest Showman | Official Trailer [HD] | 20th Century FOX,Hugh jackman makes me nut,2017-10-21T02:30:52.000Z,0
2017-06-28T13:00:13.000Z,AXCTMGYUg9A,The Greatest Showman | Official Trailer [HD] | 20th Century FOX,How many OSCAR nominations will have?,2017-10-20T05:45:40.000Z,0
2017-06-28T13:00:13.000Z,AXCTMGYUg9A,The Greatest Showman | Official Trailer [HD] | 20th Century FOX,They better not do the thing lime they did in Spidey where Zendaya was all up in the previews but barely in the movie. If they gunna use ma girl to draw buzz....she better be all up and through that movie!😭😭. I NEED more Zen,2017-10-19T16:52:49.000Z,48
2017-06-28T13:00:13.000Z,AXCTMGYUg9A,The Greatest Showman | Official Trailer [HD] | 20th Century FOX,So wolverine is running a circus now? Sweet,2017-10-19T14:36:37.000Z,12
2017-06-28T13:00:13.000Z,AXCTMGYUg9A,The Greatest Showman | Official Trailer [HD] | 20th Century FOX,I want to watch this movie so baaaaad😃😂😂😂😂😂😃😃😂😃😃😃😂,2017-10-19T12:28:40.000Z,0
2017-06-28T13:00:13.000Z,AXCTMGYUg9A,The Greatest Showman | Official Trailer [HD] | 20th Century FOX,Don't like the woman with beard,2017-10-19T07:17:38.000Z,0
2017-06-28T13:00:13.000Z,AXCTMGYUg9A,The Greatest Showman | Official Trailer [HD] | 20th Century FOX,I just want to see zendaya fine self 🤣,2017-10-19T04:30:58.000Z,4
2017-06-28T13:00:13.000Z,AXCTMGYUg9A,The Greatest Showman | Official Trailer [HD] | 20th Century FOX,Looks like a beautiful film,2017-10-19T02:52:29.000Z,0
2017-06-28T13:00:13.000Z,AXCTMGYUg9A,The Greatest Showman | Official Trailer [HD] | 20th Century FOX,Music completely killed the epicness of the footage,2017-10-19T00:15:51.000Z,0
2017-06-28T13:00:13.000Z,AXCTMGYUg9A,The Greatest Showman | Official Trailer [HD] | 20th Century FOX,I CANT WAIT TO WATCH THISSSS ‼‼😭,2017-10-18T22:32:45.000Z,0
2017-06-28T13:00:13.000Z,AXCTMGYUg9A,The Greatest Showman | Official Trailer [HD] | 20th Century FOX,I’m only interested in seeing zendaya and zac Efrons chemistry 😖😖😖😍😍😍,2017-10-18T22:00:28.000Z,1
2017-06-28T13:00:13.000Z,AXCTMGYUg9A,The Greatest Showman | Official Trailer [HD] | 20th Century FOX,"the thoughts of ""The Presige"" hit me really hard",2017-10-18T20:26:49.000Z,0
2017-06-28T13:00:13.000Z,AXCTMGYUg9A,The Greatest Showman | Official Trailer [HD] | 20th Century FOX,"Zac Efron & Zendaya, Oh, I am so seeing this movie! It looks incredible!!!!!",2017-10-17T22:05:11.000Z,25
2017-06-28T13:00:13.000Z,AXCTMGYUg9A,The Greatest Showman | Official Trailer [HD] | 20th Century FOX,I hope they show the Cardiff Giant.,2017-10-17T03:18:18.000Z,0
2017-06-28T13:00:13.000Z,AXCTMGYUg9A,The Greatest Showman | Official Trailer [HD] | 20th Century FOX,3 months later and still watching this trailer,2017-10-16T06:46:02.000Z,0
2017-06-28T13:00:13.000Z,AXCTMGYUg9A,The Greatest Showman | Official Trailer [HD] | 20th Century FOX,Got goosebumps every time I listened to the song. Can't wait to see it in the theater.,2017-10-15T13:36:57.000Z,0
2017-06-28T13:00:13.000Z,AXCTMGYUg9A,The Greatest Showman | Official Trailer [HD] | 20th Century FOX,"I'm a simple man. I see Hugh Jackman, I LIKE!",2017-10-15T08:36:47.000Z,0
2017-06-28T13:00:13.000Z,AXCTMGYUg9A,The Greatest Showman | Official Trailer [HD] | 20th Century FOX,The guy who says better luck with your next job is Hugh Jackman as well.,2017-10-14T19:19:05.000Z,0
2017-06-28T13:00:13.000Z,AXCTMGYUg9A,The Greatest Showman | Official Trailer [HD] | 20th Century FOX,When you’re bi and two of your celebrity crushes are a couple in a movie,2017-10-14T16:27:18.000Z,362
2017-06-28T13:00:13.000Z,AXCTMGYUg9A,The Greatest Showman | Official Trailer [HD] | 20th Century FOX,Looks good but the music doesn't fit and it's annoying as f.,2017-10-14T03:46:46.000Z,0
2017-06-28T13:00:13.000Z,AXCTMGYUg9A,The Greatest Showman | Official Trailer [HD] | 20th Century FOX,"So excited, the bearded lady is the one who signs the song and I can't wait for it to come out 😭😂",2017-10-12T06:46:18.000Z,0
2017-06-28T13:00:13.000Z,AXCTMGYUg9A,The Greatest Showman | Official Trailer [HD] | 20th Century FOX,"if the trailer for a movie is so good you want to binge it over and over, imagine how good the movie will be.",2017-10-12T01:29:48.000Z,0
2017-06-28T13:00:13.000Z,AXCTMGYUg9A,The Greatest Showman | Official Trailer [HD] | 20th Century FOX,"Contrary to popular belief, not all of the Wolverine's adventures before joining the X-Men were violent bloodbaths.",2017-10-10T23:46:24.000Z,0
2017-06-28T13:00:13.000Z,AXCTMGYUg9A,The Greatest Showman | Official Trailer [HD] | 20th Century FOX,I'm not a big circus fan but this is a movie I would love to see!!!,2017-10-10T19:10:15.000Z,0
2017-06-28T13:00:13.000Z,AXCTMGYUg9A,The Greatest Showman | Official Trailer [HD] | 20th Century FOX,vomit,2017-10-09T10:12:58.000Z,0
2017-06-28T13:00:13.000Z,AXCTMGYUg9A,The Greatest Showman | Official Trailer [HD] | 20th Century FOX,Just by the trailer It already touched my heart i cant wait for christmas!,2017-10-09T07:10:33.000Z,0
2017-06-28T13:00:13.000Z,AXCTMGYUg9A,The Greatest Showman | Official Trailer [HD] | 20th Century FOX,This is literally the best trailer I have ever seen,2017-10-09T01:03:54.000Z,0
2017-06-28T13:00:13.000Z,AXCTMGYUg9A,The Greatest Showman | Official Trailer [HD] | 20th Century FOX,i hope the song will not better than the movie,2017-10-08T11:47:04.000Z,0
2017-06-28T13:00:13.000Z,AXCTMGYUg9A,The Greatest Showman | Official Trailer [HD] | 20th Century FOX,I can’t wait for the movie,2017-10-07T23:35:50.000Z,2
2017-06-28T13:00:13.000Z,AXCTMGYUg9A,The Greatest Showman | Official Trailer [HD] | 20th Century FOX,"Barnham was a shyster - I'm sick. of Hollywood and it's lies. ""Everyone is a star"" yeah righteo Hugh - mate I doubt Jackman knew much about this moral cancer of his time, but it is kinda fitting given the Left wing lies that Hollywood has used to bombard the U.S. and hence the world with, desensitizing the culture to the point where little boys are being encouraged by the state to wear dresses to school and other mentally retarded things like allowing whole millions of potential jihadis to wander off to whatever part of the world will pay the most to pander to them. I have nothing against P T Barnham, individual sodomites or individual Muslims : but I am not going to celebrate these people's bad life choices: Barnham purchased and used slaves like you use an iPhone, and he was cruel to animals as a cherry on top. Don't worry, I'm sure all the opening sequence about losing his job and just fulfilling his ambition to his wife and (one?) daughter will find you forgiving whatever of this man's crimes against the vulnerable people in society they no doubt gloss over in order to say ""based on a true story"". As for me and my family, I will not be watching.",2017-10-07T17:17:43.000Z,2
2017-06-28T13:00:13.000Z,AXCTMGYUg9A,The Greatest Showman | Official Trailer [HD] | 20th Century FOX,Who's singing this?  It sounds like Alex Newell from glee,2017-10-07T17:00:19.000Z,0
2017-06-28T13:00:13.000Z,AXCTMGYUg9A,The Greatest Showman | Official Trailer [HD] | 20th Century FOX,Keala Settle is queen,2017-10-07T09:57:19.000Z,19
2017-06-28T13:00:13.000Z,AXCTMGYUg9A,The Greatest Showman | Official Trailer [HD] | 20th Century FOX,The song I need the title! And Im so watching this movie!,2017-10-07T06:20:54.000Z,0
2017-06-28T13:00:13.000Z,AXCTMGYUg9A,The Greatest Showman | Official Trailer [HD] | 20th Century FOX,Is this the Second part of The Prestige??? I am lost,2017-10-06T20:01:26.000Z,0
2017-06-28T13:00:13.000Z,AXCTMGYUg9A,The Greatest Showman | Official Trailer [HD] | 20th Century FOX,This is oscar with a garauntee,2017-10-05T17:18:10.000Z,1
2017-06-28T13:00:13.000Z,AXCTMGYUg9A,The Greatest Showman | Official Trailer [HD] | 20th Century FOX,"Feels very uplifting, i guess because of the background music.",2017-10-05T10:34:15.000Z,0
2017-06-28T13:00:13.000Z,AXCTMGYUg9A,The Greatest Showman | Official Trailer [HD] | 20th Century FOX,"First time I saw this, it was a YouTube advertisment. I almost skipped it, then it seemed interesting. I'm so glad I hadn't skipped it. After the trailer, I don't think I was paying attention to the original video anymore",2017-10-05T00:57:10.000Z,0
2017-06-28T13:00:13.000Z,AXCTMGYUg9A,The Greatest Showman | Official Trailer [HD] | 20th Century FOX,"Wow! I wonder if they're going to include Joice Heth? Or the abuse people suffered in freak shows. Or any of the animal abuse? Or mention how this guy helped to start modern day human zoos. (Btw was a slave forced on display ,similar to Sarah Baartman, who Barnum acted as lead surgeon in a public autopsy after she died. He claimed the body was a fake and that she was still alive but later admitted that this was yet another hoax :D ) such a swell american hero to dedicate a ""docu""-musical to :)",2017-10-04T18:14:46.000Z,0
2017-06-28T13:00:13.000Z,AXCTMGYUg9A,The Greatest Showman | Official Trailer [HD] | 20th Century FOX,1:20 cough cough batgirl & nightwing,2017-10-04T08:55:36.000Z,1
2017-06-28T13:00:13.000Z,AXCTMGYUg9A,The Greatest Showman | Official Trailer [HD] | 20th Century FOX,I already know its going to get an Oscar nod!,2017-10-04T02:50:30.000Z,0
2017-06-28T13:00:13.000Z,AXCTMGYUg9A,The Greatest Showman | Official Trailer [HD] | 20th Century FOX,Hugh Jakman 🖒👏👏👏👏👏👏,2017-10-03T22:00:21.000Z,0
2017-06-28T13:00:13.000Z,AXCTMGYUg9A,The Greatest Showman | Official Trailer [HD] | 20th Century FOX,baby Z,2017-10-03T15:15:47.000Z,0
2017-06-28T13:00:13.000Z,AXCTMGYUg9A,The Greatest Showman | Official Trailer [HD] | 20th Century FOX,So Troy Bolton and Logan are running a circus together 😂😂,2017-10-03T12:27:30.000Z,1
2017-06-28T13:00:13.000Z,AXCTMGYUg9A,The Greatest Showman | Official Trailer [HD] | 20th Century FOX,"Just gonna point out that he is not hiring the dwarf because he believes ""unique people make a difference"" but because people will want to see the freaks in his show. Same reason people want to see the bearded lady.",2017-10-03T07:47:24.000Z,0
2017-06-28T13:00:13.000Z,AXCTMGYUg9A,The Greatest Showman | Official Trailer [HD] | 20th Century FOX,am I the only one cried when watching the trailer?,2017-10-03T05:23:10.000Z,0
2017-06-28T13:00:13.000Z,AXCTMGYUg9A,The Greatest Showman | Official Trailer [HD] | 20th Century FOX,If this is coming Christmas then who needs a present,2017-10-02T22:21:26.000Z,1
2017-06-28T13:00:13.000Z,AXCTMGYUg9A,The Greatest Showman | Official Trailer [HD] | 20th Century FOX,one of the best songs i have ever heard..... amazing..... tears and goosebumps,2017-10-02T09:51:12.000Z,0
2017-06-28T13:00:13.000Z,AXCTMGYUg9A,The Greatest Showman | Official Trailer [HD] | 20th Century FOX,going on tuesday to  see the screening of this movie,2017-10-02T04:35:11.000Z,0
2017-06-28T13:00:13.000Z,AXCTMGYUg9A,The Greatest Showman | Official Trailer [HD] | 20th Century FOX,Starting at 0:48 is when I start to like the trailer (of course the song as well :)),2017-10-01T23:37:16.000Z,0
2017-06-28T13:00:13.000Z,AXCTMGYUg9A,The Greatest Showman | Official Trailer [HD] | 20th Century FOX,This legit reminds me of butterfly circus when a dude takes a bunch of misfits and creates a happy moving circus  that travels around the world,2017-10-01T04:33:25.000Z,0
2017-06-28T13:00:13.000Z,AXCTMGYUg9A,The Greatest Showman | Official Trailer [HD] | 20th Century FOX,wowsers,2017-10-01T01:50:20.000Z,0
2017-06-28T13:00:13.000Z,AXCTMGYUg9A,The Greatest Showman | Official Trailer [HD] | 20th Century FOX,"Looks like I'll be at the theater on Christmas, this trailer has me quaking.. giving me polar express vibes 😭",2017-09-30T22:13:23.000Z,0
2017-06-28T13:00:13.000Z,AXCTMGYUg9A,The Greatest Showman | Official Trailer [HD] | 20th Century FOX,I've been replying x10000000000000 times. Can't wait!!!!!!!!!!,2017-09-30T17:55:39.000Z,0
2017-06-28T13:00:13.000Z,AXCTMGYUg9A,The Greatest Showman | Official Trailer [HD] | 20th Century FOX,This has to be one of the most gorgeous trailers I've ever seen!,2017-09-30T02:36:33.000Z,195
2017-06-28T13:00:13.000Z,AXCTMGYUg9A,The Greatest Showman | Official Trailer [HD] | 20th Century FOX,I work in a movie theater and see this trailer multiple times almost everyday and I never get tired of it.,2017-09-29T14:14:12.000Z,0
2017-06-28T13:00:13.000Z,AXCTMGYUg9A,The Greatest Showman | Official Trailer [HD] | 20th Century FOX,Watched this soooo many times,2017-09-29T11:38:20.000Z,0
2017-06-28T13:00:13.000Z,AXCTMGYUg9A,The Greatest Showman | Official Trailer [HD] | 20th Century FOX,I'll never miss Zac efron in a musical. I can't wait to see this!!,2017-09-28T20:45:19.000Z,0
2017-06-28T13:00:13.000Z,AXCTMGYUg9A,The Greatest Showman | Official Trailer [HD] | 20th Century FOX,Keala Settle!! Waitress anyone,2017-09-28T13:52:13.000Z,0
2017-06-28T13:00:13.000Z,AXCTMGYUg9A,The Greatest Showman | Official Trailer [HD] | 20th Century FOX,AHHHHHHHHHHHHHHHHHHHHHHHHHHHHHHHHHHHHHHHHHHHHHHHHHHHHHHHHH,2017-09-28T11:34:52.000Z,0
2017-06-28T13:00:13.000Z,AXCTMGYUg9A,The Greatest Showman | Official Trailer [HD] | 20th Century FOX,"Now THESE are the type of films I love to see Zac Efron be in👏🙌
Can't wait his scene with Zendaya as well😍😍",2017-09-28T06:29:52.000Z,0
2017-06-28T13:00:13.000Z,AXCTMGYUg9A,The Greatest Showman | Official Trailer [HD] | 20th Century FOX,Such a feel good movie.,2017-09-27T15:16:47.000Z,0
2017-06-28T13:00:13.000Z,AXCTMGYUg9A,The Greatest Showman | Official Trailer [HD] | 20th Century FOX,provision keep regular noon effort homeless mandate glory interrupt.,2017-09-27T14:15:14.000Z,0
2017-06-28T13:00:13.000Z,AXCTMGYUg9A,The Greatest Showman | Official Trailer [HD] | 20th Century FOX,Looks like academy award nominations are brewing around,2017-09-27T11:55:12.000Z,3
2017-06-28T13:00:13.000Z,AXCTMGYUg9A,The Greatest Showman | Official Trailer [HD] | 20th Century FOX,I luv dis,2017-09-26T22:39:34.000Z,0
2017-06-28T13:00:13.000Z,AXCTMGYUg9A,The Greatest Showman | Official Trailer [HD] | 20th Century FOX,I NEED TO KNOW THE NAME OF THIS SONG,2017-09-26T22:34:31.000Z,11
2017-06-28T13:00:13.000Z,AXCTMGYUg9A,The Greatest Showman | Official Trailer [HD] | 20th Century FOX,Only gonna watch this for Zendaya 😃,2017-09-26T10:25:59.000Z,1
2017-06-28T13:00:13.000Z,AXCTMGYUg9A,The Greatest Showman | Official Trailer [HD] | 20th Century FOX,Plot twist: Pennywise is the clown and eats the entire cast.,2017-09-26T05:18:26.000Z,0
2017-06-28T13:00:13.000Z,AXCTMGYUg9A,The Greatest Showman | Official Trailer [HD] | 20th Century FOX,"Let me just answer all the haters in the comments. 
1. Its a musical of course its gonna look happy and sugar coated its meant to be that way. Look at la la land people.

2. Dont judge a musical based off of 1 song you heard. Too soon.

3. This is just for the respect of the actors like jackman being typecasted as wolverine. Dont vall actors by their previois roles. They have names and they arent judt that character you choose to call them. 

4. Lastly dont go so in depth about plot so early. Its 1 trailer thats out atm dont assume. 

Haters are so judgy so just wanted to say this.",2017-09-25T23:36:41.000Z,1
2017-06-28T13:00:13.000Z,AXCTMGYUg9A,The Greatest Showman | Official Trailer [HD] | 20th Century FOX,I'm not supposed to be crying...,2017-09-25T23:26:36.000Z,0
2017-06-28T13:00:13.000Z,AXCTMGYUg9A,The Greatest Showman | Official Trailer [HD] | 20th Century FOX,"Inspirationtional, makes me feel like anything is possible, looking foward for this movie to be released!",2017-11-01T21:11:48.000Z,0
2017-06-28T13:00:13.000Z,AXCTMGYUg9A,The Greatest Showman | Official Trailer [HD] | 20th Century FOX,"I saw this trailer for the first time with kingsman 2, and I've never clapped or cried harder!",2017-09-24T22:51:39.000Z,0
2017-06-28T13:00:13.000Z,AXCTMGYUg9A,The Greatest Showman | Official Trailer [HD] | 20th Century FOX,spectacular,2017-09-23T14:42:33.000Z,0
2017-06-28T13:00:13.000Z,AXCTMGYUg9A,The Greatest Showman | Official Trailer [HD] | 20th Century FOX,Hugh Jackman + Musical movie= The greatest musical movie,2017-09-23T08:49:52.000Z,0
2017-06-28T13:00:13.000Z,AXCTMGYUg9A,The Greatest Showman | Official Trailer [HD] | 20th Century FOX,ZEEENDAAAYAAAAAAA,2017-09-23T08:03:33.000Z,2
2017-06-28T13:00:13.000Z,AXCTMGYUg9A,The Greatest Showman | Official Trailer [HD] | 20th Century FOX,Wow this look so gooooood,2017-09-23T02:31:02.000Z,0
2017-06-28T13:00:13.000Z,AXCTMGYUg9A,The Greatest Showman | Official Trailer [HD] | 20th Century FOX,I I am going to love this movie for a couple of reasons one each shows the birth of Show Business and how PT Barnum got his start and also PT Barnum was the mayor of my hometown Bridgeport Connecticut back in the late eighteen hundreds we have Apartments here named after him he died here in Bridgeport and his legacy is right here.,2017-09-23T01:38:10.000Z,0
2017-06-28T13:00:13.000Z,AXCTMGYUg9A,The Greatest Showman | Official Trailer [HD] | 20th Century FOX,"OMG I CANT WAIT FOR THIS MOVIE, I LOVE HUGH JACKMAN AND I LOVE THE CIRCUS, THIS IS GONNA BE AMAZING!!!!!",2017-09-23T01:13:50.000Z,0
2017-06-28T13:00:13.000Z,AXCTMGYUg9A,The Greatest Showman | Official Trailer [HD] | 20th Century FOX,Welcome to lib-ville.,2017-09-23T00:20:42.000Z,0
2017-06-28T13:00:13.000Z,AXCTMGYUg9A,The Greatest Showman | Official Trailer [HD] | 20th Century FOX,"Might be just be, but Hugh Jackman seems to be extremely likeable.",2017-09-22T13:16:26.000Z,0
2017-06-28T13:00:13.000Z,AXCTMGYUg9A,The Greatest Showman | Official Trailer [HD] | 20th Century FOX,This trailer gives me goosebumps! 😍❤,2017-09-21T15:06:08.000Z,0
2017-06-28T13:00:13.000Z,AXCTMGYUg9A,The Greatest Showman | Official Trailer [HD] | 20th Century FOX,Pals significantly Anyone  identify larger  this vaviant ?#,2017-09-21T14:30:02.000Z,0
2017-06-28T13:00:13.000Z,AXCTMGYUg9A,The Greatest Showman | Official Trailer [HD] | 20th Century FOX,"THIS MOVIE IS MADE TO WIN ""BEST PICTURE""...",2017-09-21T02:42:44.000Z,86
2017-06-28T13:00:13.000Z,AXCTMGYUg9A,The Greatest Showman | Official Trailer [HD] | 20th Century FOX,Can it be Christmas already?!?! 😍😍😍😍😍,2017-09-19T19:35:14.000Z,19
2017-06-28T13:00:13.000Z,AXCTMGYUg9A,The Greatest Showman | Official Trailer [HD] | 20th Century FOX,"Completely glorifies a sleazy man -- but boy, that soundtrack! Something to look forward to this Christmas. A story about giving a voice to the outcasts -- something that you don't during the holy season anymore, thanks to consumer greed and conservatism.",2017-09-19T10:25:35.000Z,0
2017-06-28T13:00:13.000Z,AXCTMGYUg9A,The Greatest Showman | Official Trailer [HD] | 20th Century FOX,"Eat a Snickers Wolverine.  Why?  Every time your hungry, you start acting like a circus leader.",2017-09-18T14:44:39.000Z,1
2017-06-28T13:00:13.000Z,AXCTMGYUg9A,The Greatest Showman | Official Trailer [HD] | 20th Century FOX,Greatest showman is working title.. real title is Prestige: Origins 😄😄😄,2017-09-17T14:43:37.000Z,0
2017-06-28T13:00:13.000Z,AXCTMGYUg9A,The Greatest Showman | Official Trailer [HD] | 20th Century FOX,"""Show business?  Never heard of it"" (me: watches High School Musical 1, 2, and 3",2017-09-16T22:24:00.000Z,0
2017-06-28T13:00:13.000Z,AXCTMGYUg9A,The Greatest Showman | Official Trailer [HD] | 20th Century FOX,This film looks fantastic!,2017-09-16T14:26:26.000Z,0
2017-06-28T13:00:13.000Z,AXCTMGYUg9A,The Greatest Showman | Official Trailer [HD] | 20th Century FOX,Ok the bearded woman is so fierce I can tell she will be a great character.  And ZENDAYA looks stunning,2017-09-16T07:13:07.000Z,0
2017-06-28T13:00:13.000Z,AXCTMGYUg9A,The Greatest Showman | Official Trailer [HD] | 20th Century FOX,Can we all take a minute to talk about the beautiful Michelle Williams!!! She is elegant!,2017-09-16T06:07:02.000Z,0
2017-06-28T13:00:13.000Z,AXCTMGYUg9A,The Greatest Showman | Official Trailer [HD] | 20th Century FOX,Capitilism the musical,2017-09-16T02:19:35.000Z,0
2017-06-28T13:00:13.000Z,AXCTMGYUg9A,The Greatest Showman | Official Trailer [HD] | 20th Century FOX,"Check out 'The Dollop' podcast about PT Barnum!

https://itunes.apple.com/us/podcast/the-dollop-with-dave-anthony-and-gareth-reynolds/id643055307?mt=2&i=1000391881157",2017-09-15T11:43:08.000Z,0
2017-06-28T13:00:13.000Z,AXCTMGYUg9A,The Greatest Showman | Official Trailer [HD] | 20th Century FOX,Alright -- here's another clear example Hollywood making a definitive time in history (an extremely monumental one in the theatrical world at that) and making it a squeaky clean family-friendly affair. P. T. Barnum was not a good dude. Does no one recall him taking advantage of disabled and deformed human beings to make a profit? The American Museum? Jumbo the Elephant? It's sad that individuals with no prior knowledge of P. T. Barnum will leave this film with an extremely positive view of him. The man was an entrepreneur before anything else. and took advantage of individuals to make a profit for himself.,2017-09-14T23:51:11.000Z,0
2017-06-28T13:00:13.000Z,AXCTMGYUg9A,The Greatest Showman | Official Trailer [HD] | 20th Century FOX,Hugh knew he wouldbe in this!😀,2017-09-12T16:45:29.000Z,0
2017-06-28T13:00:13.000Z,AXCTMGYUg9A,The Greatest Showman | Official Trailer [HD] | 20th Century FOX,the song is lit,2017-09-12T13:46:23.000Z,0
2017-06-28T13:00:13.000Z,AXCTMGYUg9A,The Greatest Showman | Official Trailer [HD] | 20th Century FOX,eagerly waiting for the movie,2017-09-11T18:31:27.000Z,2
2017-06-28T13:00:13.000Z,AXCTMGYUg9A,The Greatest Showman | Official Trailer [HD] | 20th Century FOX,"Ughhh how long do we have to wait for them to release this song, This is me by Keala Settle ughhh this song is literally e everything. Powerful and beautiful!!!",2017-09-09T03:29:59.000Z,11
2017-06-28T13:00:13.000Z,AXCTMGYUg9A,The Greatest Showman | Official Trailer [HD] | 20th Century FOX,"This looks incredible, but in most excited about Keala Settle becoming a star. What a talent.",2017-09-09T03:10:18.000Z,0
2017-06-28T13:00:13.000Z,AXCTMGYUg9A,The Greatest Showman | Official Trailer [HD] | 20th Century FOX,"the song is ""this is me"" by Keala Settle",2017-09-08T03:07:43.000Z,0
2017-06-28T13:00:13.000Z,AXCTMGYUg9A,The Greatest Showman | Official Trailer [HD] | 20th Century FOX,1:14,2017-09-07T02:28:44.000Z,0
2017-06-28T13:00:13.000Z,AXCTMGYUg9A,The Greatest Showman | Official Trailer [HD] | 20th Century FOX,if there were awards for trailers this would win them all this looks fab,2017-09-06T19:01:18.000Z,324
2017-06-28T13:00:13.000Z,AXCTMGYUg9A,The Greatest Showman | Official Trailer [HD] | 20th Century FOX,I need to see this movie😁,2017-09-05T14:46:11.000Z,0
2017-06-28T13:00:13.000Z,AXCTMGYUg9A,The Greatest Showman | Official Trailer [HD] | 20th Century FOX,Dispite by the look of this Trailer it looks like it'll be Really Really Good for Christmas and a Double Oscar Nomination for Hugh Jackman for The Greatest Showman & Logan,2017-09-05T02:23:20.000Z,0
2017-06-28T13:00:13.000Z,AXCTMGYUg9A,The Greatest Showman | Official Trailer [HD] | 20th Century FOX,I LOVE THE THEME OF THIS MOVIE!!!! ITS SOOO PERFEEECTTT!,2017-09-04T23:24:45.000Z,0
2017-06-28T13:00:13.000Z,AXCTMGYUg9A,The Greatest Showman | Official Trailer [HD] | 20th Century FOX,song?,2017-09-04T21:17:46.000Z,0
2017-06-28T13:00:13.000Z,AXCTMGYUg9A,The Greatest Showman | Official Trailer [HD] | 20th Century FOX,I smell oscars here,2017-09-04T11:55:16.000Z,0
2017-06-28T13:00:13.000Z,AXCTMGYUg9A,The Greatest Showman | Official Trailer [HD] | 20th Century FOX,"I love Hugh Jackman but this is ridiculous. PT Barnum was a swindler through and through. An entertaining one, but this feel-good revisionist piece is so out of left field it's insane.",2017-09-03T17:24:14.000Z,0
2017-06-28T13:00:13.000Z,AXCTMGYUg9A,The Greatest Showman | Official Trailer [HD] | 20th Century FOX,Zaccccc😍,2017-09-03T15:30:33.000Z,0
2017-06-28T13:00:13.000Z,AXCTMGYUg9A,The Greatest Showman | Official Trailer [HD] | 20th Century FOX,I WANT ORIGINAL SONG PLS :( :),2017-09-02T17:37:46.000Z,0
2017-06-28T13:00:13.000Z,AXCTMGYUg9A,The Greatest Showman | Official Trailer [HD] | 20th Century FOX,"Maybe P.T. Barnum's slave, Joice Heth, will make an appearance in this movie? He had her on exhibition in 1835 and 1836, which might be before the time portrayed.",2017-09-02T01:28:06.000Z,3
2017-06-28T13:00:13.000Z,AXCTMGYUg9A,The Greatest Showman | Official Trailer [HD] | 20th Century FOX,no. Zendaya can't have Tom AND Zach,2017-09-01T03:19:29.000Z,0
2017-06-28T13:00:13.000Z,AXCTMGYUg9A,The Greatest Showman | Official Trailer [HD] | 20th Century FOX,"As talented as this singer from the track playing is, it does not fit the feel of the movie.",2017-08-31T21:36:31.000Z,0
2017-06-28T13:00:13.000Z,AXCTMGYUg9A,The Greatest Showman | Official Trailer [HD] | 20th Century FOX,Can someone tell me the name of the song in this trailer?,2017-08-31T08:51:57.000Z,0
