publish_time,Video ID,Title,Comment,updatedAt,likeCount,polarity,subjectivity
2014-07-15T14:50:19.000Z,z3biFxZIJOQ,Disney&#39;s Big Hero 6 - Official US Trailer 1,Aw! He's so cute! I can't wait to see the animation looks awesome,2014-07-17 14:48:16,0,0.8125,1.0
2014-07-15T14:50:19.000Z,z3biFxZIJOQ,Disney&#39;s Big Hero 6 - Official US Trailer 1,1:30 </3 life alert,2014-07-17 14:36:50,0,0.0,0.0
2014-07-15T14:50:19.000Z,z3biFxZIJOQ,Disney&#39;s Big Hero 6 - Official US Trailer 1,Ka-boo-key mask.,2014-07-17 14:35:19,0,0.0,0.0
2014-07-15T14:50:19.000Z,z3biFxZIJOQ,Disney&#39;s Big Hero 6 - Official US Trailer 1,"This looks better than Frozen! And, did anyone spot Hans the idiot on the ""Wanted"" sign at 1:17?Â  This is gonna be awesome!",2014-07-17 14:34:14,7,0.27499999999999997,0.7666666666666666
2014-07-15T14:50:19.000Z,z3biFxZIJOQ,Disney&#39;s Big Hero 6 - Official US Trailer 1,I like Frozen for what it is...a kids movie...naturally for my kids.,2014-07-17 14:13:41,0,0.0,0.0
2014-07-15T14:50:19.000Z,z3biFxZIJOQ,Disney&#39;s Big Hero 6 - Official US Trailer 1,Hipsters don't like Frozen....,2014-07-17 14:12:47,0,0.0,0.0
2014-07-15T14:50:19.000Z,z3biFxZIJOQ,Disney&#39;s Big Hero 6 - Official US Trailer 1,Can't wait I liked Tangled and Frozen but disney's comedies are by far the best of the newest ones. And why isn't Bolt in this section of disney movies?,2014-07-17 13:58:38,1,0.5666666666666667,0.7000000000000001
2014-07-15T14:50:19.000Z,z3biFxZIJOQ,Disney&#39;s Big Hero 6 - Official US Trailer 1,Is it just me or dose the guy 0:27 look a little like Amon from Legend of Korra.,2014-07-17 13:56:02,0,-0.1875,0.5
2014-07-15T14:50:19.000Z,z3biFxZIJOQ,Disney&#39;s Big Hero 6 - Official US Trailer 1,"1:17 Hans from frozen, at the leaflet behind the policeman",2014-07-17 13:52:47,3,-0.4,0.7
2014-07-15T14:50:19.000Z,z3biFxZIJOQ,Disney&#39;s Big Hero 6 - Official US Trailer 1,we jump out of a windowÂ ,2014-07-17 13:06:07,0,0.0,0.0
2014-07-15T14:50:19.000Z,z3biFxZIJOQ,Disney&#39;s Big Hero 6 - Official US Trailer 1,it remind me of heroman,2014-07-17 12:24:22,0,0.0,0.0
2014-07-15T14:50:19.000Z,z3biFxZIJOQ,Disney&#39;s Big Hero 6 - Official US Trailer 1,Hairy baby! ^_^,2014-07-17 12:23:10,1,0.0,0.0
2014-07-15T14:50:19.000Z,z3biFxZIJOQ,Disney&#39;s Big Hero 6 - Official US Trailer 1,"Finally ready to throw some money at disney again. Couldn't get me with the parks, couldn't get me with Frozen, but this. I'm ready to chuck my wallet at them while i run for a seat in the center of the theater",2014-07-17 11:43:25,0,0.10000000000000002,0.3666666666666667
2014-07-15T14:50:19.000Z,z3biFxZIJOQ,Disney&#39;s Big Hero 6 - Official US Trailer 1,do anybody know what name is the song at 1:25 in this trailer,2014-07-17 11:33:01,0,0.0,0.0
2014-07-15T14:50:19.000Z,z3biFxZIJOQ,Disney&#39;s Big Hero 6 - Official US Trailer 1,R.I.P Tape :),2014-07-17 11:21:29,0,0.5,1.0
2014-07-15T14:50:19.000Z,z3biFxZIJOQ,Disney&#39;s Big Hero 6 - Official US Trailer 1,So cool !!!,2014-07-17 11:03:33,0,0.68359375,0.65
2014-07-15T14:50:19.000Z,z3biFxZIJOQ,Disney&#39;s Big Hero 6 - Official US Trailer 1,"For anyone who wants to know, the song is ""My songs know what you did in the dark"" by Fall out boy :D",2014-07-17 11:00:06,13,0.35000000000000003,0.5
2014-07-15T14:50:19.000Z,z3biFxZIJOQ,Disney&#39;s Big Hero 6 - Official US Trailer 1,Can't wait!!!,2014-07-17 10:43:06,0,0.0,0.0
2014-07-15T14:50:19.000Z,z3biFxZIJOQ,Disney&#39;s Big Hero 6 - Official US Trailer 1,Looks great.,2014-07-17 10:31:20,0,0.8,0.75
2014-07-15T14:50:19.000Z,z3biFxZIJOQ,Disney&#39;s Big Hero 6 - Official US Trailer 1,GOD DAMN IT AMON!!! NOT AGAIN!!!,2014-07-17 10:28:18,1,0.0,0.0
2014-07-15T14:50:19.000Z,z3biFxZIJOQ,Disney&#39;s Big Hero 6 - Official US Trailer 1,AWESOME I CAN'T WAIT :^).,2014-07-17 10:27:22,0,0.875,1.0
2014-07-15T14:50:19.000Z,z3biFxZIJOQ,Disney&#39;s Big Hero 6 - Official US Trailer 1,I WANT ONE!,2014-07-17 10:26:31,0,0.0,0.0
2014-07-15T14:50:19.000Z,z3biFxZIJOQ,Disney&#39;s Big Hero 6 - Official US Trailer 1,Looks so cool! can't wait!!!,2014-07-17 10:22:12,2,0.8544921875,0.65
2014-07-15T14:50:19.000Z,z3biFxZIJOQ,Disney&#39;s Big Hero 6 - Official US Trailer 1,Dude! I've got to see this! :D,2014-07-17 10:17:22,1,1.0,1.0
2014-07-15T14:50:19.000Z,z3biFxZIJOQ,Disney&#39;s Big Hero 6 - Official US Trailer 1,"I am eager to see this movie,Â ",2014-07-17 09:07:39,0,0.0,0.0
2014-07-15T14:50:19.000Z,z3biFxZIJOQ,Disney&#39;s Big Hero 6 - Official US Trailer 1,"Wait, is that Voltes V on 2:11?",2014-07-17 09:06:53,0,0.0,0.0
2014-07-15T14:50:19.000Z,z3biFxZIJOQ,Disney&#39;s Big Hero 6 - Official US Trailer 1,drop everything and save world :D can't wait...,2014-07-17 08:25:10,0,1.0,1.0
2014-07-15T14:50:19.000Z,z3biFxZIJOQ,Disney&#39;s Big Hero 6 - Official US Trailer 1,I wanna see this movie so freaking bad!!,2014-07-17 07:58:34,0,-1.0,0.6666666666666666
2014-07-15T14:50:19.000Z,z3biFxZIJOQ,Disney&#39;s Big Hero 6 - Official US Trailer 1,"this looks amazing C:
cant wait for this movie!!",2014-07-17 07:53:42,0,0.9375000000000001,0.9
2014-07-15T14:50:19.000Z,z3biFxZIJOQ,Disney&#39;s Big Hero 6 - Official US Trailer 1,"""Hairy baby, hairy baby.""",2014-07-17 07:52:55,0,0.0,0.0
2014-07-15T14:50:19.000Z,z3biFxZIJOQ,Disney&#39;s Big Hero 6 - Official US Trailer 1,"I'm excited for this movie. With the success of Tangled, Wreak-It Ralph and Frozen, this movie looks promising to build on that.",2014-07-17 07:19:28,1,0.2916666666666667,0.4166666666666667
2014-07-15T14:50:19.000Z,z3biFxZIJOQ,Disney&#39;s Big Hero 6 - Official US Trailer 1,I can't believe Disney stole the setting of Jazzpunk to make this movie!!Â ,2014-07-17 06:58:37,0,0.0,0.0
2014-07-15T14:50:19.000Z,z3biFxZIJOQ,Disney&#39;s Big Hero 6 - Official US Trailer 1,"lets hope they dont make the same mistakes on the writing here as they did with frozen. frozen, for all its pretty animation and thoughtful characterization, had some serious flaws in its execution. ",2014-07-17 06:58:10,0,0.07916666666666668,0.5729166666666666
2014-07-15T14:50:19.000Z,z3biFxZIJOQ,Disney&#39;s Big Hero 6 - Official US Trailer 1,Ok. Take ma money again,2014-07-17 06:54:13,1,0.0,0.0
2014-07-15T14:50:19.000Z,z3biFxZIJOQ,Disney&#39;s Big Hero 6 - Official US Trailer 1,My inner child and outer anime freak is just doing backflips from this!,2014-07-17 06:29:19,2,0.0,0.16666666666666666
2014-07-15T14:50:19.000Z,z3biFxZIJOQ,Disney&#39;s Big Hero 6 - Official US Trailer 1,Fall out boy yay,2014-07-17 06:14:53,0,0.0,0.0
2014-07-15T14:50:19.000Z,z3biFxZIJOQ,Disney&#39;s Big Hero 6 - Official US Trailer 1,I could totally tell T.J. Miller is voicing one of the characters ðŸ‘Œ,2014-07-17 06:09:40,61,0.0,0.75
2014-07-15T14:50:19.000Z,z3biFxZIJOQ,Disney&#39;s Big Hero 6 - Official US Trailer 1,LOL!! So funny! Cant wait!,2014-07-17 06:09:25,0,0.6953125,0.85
2014-07-15T14:50:19.000Z,z3biFxZIJOQ,Disney&#39;s Big Hero 6 - Official US Trailer 1,This movie is going to be amazing but I think Disney should have learned much more about Japan,2014-07-17 05:50:16,0,0.55,0.7
2014-07-15T14:50:19.000Z,z3biFxZIJOQ,Disney&#39;s Big Hero 6 - Official US Trailer 1,"In ""Meet the Baymax"" Teaser
i was little disapointed because baymax can talk
(i think baymax not funny anymore)

but when i watch this trailer
I WRONG .. baymax still funny (more funny i think)
""hairy baby .. hairyyy babbyy"" xD",2014-07-17 05:40:20,0,0.03125,0.8166666666666668
2014-07-15T14:50:19.000Z,z3biFxZIJOQ,Disney&#39;s Big Hero 6 - Official US Trailer 1,"I bet the ending of this movie is going to be lame, the looks story interesting but the end will be lame",2014-07-17 04:43:38,0,-0.16666666666666666,0.6666666666666666
2014-07-15T14:50:19.000Z,z3biFxZIJOQ,Disney&#39;s Big Hero 6 - Official US Trailer 1,Hairy baby.... Now thats a name I want to keep for a pet.,2014-07-17 04:29:57,3,0.0,0.0
2014-07-15T14:50:19.000Z,z3biFxZIJOQ,Disney&#39;s Big Hero 6 - Official US Trailer 1,"So this Disney studio, sucked all the talent out of Pixar? They seem to be the only ones with CGI game on point.Â ",2014-07-17 04:28:46,1,-0.2,0.7
2014-07-15T14:50:19.000Z,z3biFxZIJOQ,Disney&#39;s Big Hero 6 - Official US Trailer 1,People do know this is from the big hero 6 comic right?,2014-07-17 04:13:56,0,0.17857142857142858,0.37857142857142856
2014-07-15T14:50:19.000Z,z3biFxZIJOQ,Disney&#39;s Big Hero 6 - Official US Trailer 1,Is that josh hutcherson?,2014-07-17 04:01:17,0,0.0,0.0
2014-07-15T14:50:19.000Z,z3biFxZIJOQ,Disney&#39;s Big Hero 6 - Official US Trailer 1,"Why is there so much hate against Frozen?, can we just stop and enjoy this trailer instead, please?",2014-07-17 03:56:54,1,-0.2,0.7
2014-07-15T14:50:19.000Z,z3biFxZIJOQ,Disney&#39;s Big Hero 6 - Official US Trailer 1,"the animation is the same as Frozen, this movie promises to be awesome",2014-07-17 03:52:37,0,0.5,0.5625
2014-07-15T14:50:19.000Z,z3biFxZIJOQ,Disney&#39;s Big Hero 6 - Official US Trailer 1,"Yes keep going disney, the more good movies you make, the better Kingdom Hearts 3 will be!",2014-07-17 03:37:50,11,0.6083333333333333,0.5333333333333333
2014-07-15T14:50:19.000Z,z3biFxZIJOQ,Disney&#39;s Big Hero 6 - Official US Trailer 1,Baymax is now officially my favorite superhero. XD,2014-07-17 03:33:19,0,0.5,1.0
2014-07-15T14:50:19.000Z,z3biFxZIJOQ,Disney&#39;s Big Hero 6 - Official US Trailer 1,"I'M SO EXCITED FOR THIS!!!!
Y'all can hate all you want, I think this movie is going to be awesome and I'm super excited",2014-07-17 03:33:05,0,0.36477213541666664,0.8133333333333332
2014-07-15T14:50:19.000Z,z3biFxZIJOQ,Disney&#39;s Big Hero 6 - Official US Trailer 1,nice trailer. what a day. New Guardains pics. Avengers 2 pics. Thor becomes a woman?!?! and then Big Hero 6.,2014-07-17 03:27:29,1,0.27102272727272725,0.5181818181818182
2014-07-15T14:50:19.000Z,z3biFxZIJOQ,Disney&#39;s Big Hero 6 - Official US Trailer 1,it reminds me of knack a little bit .__.,2014-07-17 03:20:26,0,-0.1875,0.5
2014-07-15T14:50:19.000Z,z3biFxZIJOQ,Disney&#39;s Big Hero 6 - Official US Trailer 1,Meh.,2014-07-17 03:12:06,0,0.0,0.0
2014-07-15T14:50:19.000Z,z3biFxZIJOQ,Disney&#39;s Big Hero 6 - Official US Trailer 1,I can't wait for this. It will totally make up for missing Maleficent and possibly Guardians of the Galaxy.,2014-07-17 03:02:40,0,-0.06666666666666667,0.6
2014-07-15T14:50:19.000Z,z3biFxZIJOQ,Disney&#39;s Big Hero 6 - Official US Trailer 1,I want one...,2014-07-17 03:00:20,0,0.0,0.0
2014-07-15T14:50:19.000Z,z3biFxZIJOQ,Disney&#39;s Big Hero 6 - Official US Trailer 1,1:15 HANS IS ON THE BILLBOARD.Â ,2014-07-17 02:43:16,0,0.0,0.0
2014-07-15T14:50:19.000Z,z3biFxZIJOQ,Disney&#39;s Big Hero 6 - Official US Trailer 1,I CAN'T WAIT TO GO SEE IT!!! <333,2014-07-17 02:40:12,0,0.0,0.0
2014-07-15T14:50:19.000Z,z3biFxZIJOQ,Disney&#39;s Big Hero 6 - Official US Trailer 1,Why does Baymax have to look so cool.,2014-07-17 02:34:46,0,0.35,0.65
2014-07-15T14:50:19.000Z,z3biFxZIJOQ,Disney&#39;s Big Hero 6 - Official US Trailer 1,"Why does this have to look so awesome.
I want it now",2014-07-17 02:31:30,0,1.0,1.0
2014-07-15T14:50:19.000Z,z3biFxZIJOQ,Disney&#39;s Big Hero 6 - Official US Trailer 1,Mr. Kabuki's mask is not scary as Valka.,2014-07-17 02:21:35,0,0.25,1.0
2014-07-15T14:50:19.000Z,z3biFxZIJOQ,Disney&#39;s Big Hero 6 - Official US Trailer 1,And I thought the movie was going to be silent.,2014-07-17 02:10:03,0,0.0,0.1
2014-07-15T14:50:19.000Z,z3biFxZIJOQ,Disney&#39;s Big Hero 6 - Official US Trailer 1,Think I'll pass on this one. Looks more like a Dreamworks pic than a Disney one. Let me know when they're working on their next fairy tale movie.,2014-07-17 02:03:17,0,0.25,0.25
2014-07-15T14:50:19.000Z,z3biFxZIJOQ,Disney&#39;s Big Hero 6 - Official US Trailer 1,I thought he gonna say..... let's me take a selfieÂ ,2014-07-17 02:02:31,0,0.0,0.0
2014-07-15T14:50:19.000Z,z3biFxZIJOQ,Disney&#39;s Big Hero 6 - Official US Trailer 1,This ain't Disney this is Pixar baby!,2014-07-17 01:51:59,0,0.0,0.0
2014-07-15T14:50:19.000Z,z3biFxZIJOQ,Disney&#39;s Big Hero 6 - Official US Trailer 1,That looks awesome!!!!!!!!,2014-07-17 01:44:03,0,1.0,1.0
2014-07-15T14:50:19.000Z,z3biFxZIJOQ,Disney&#39;s Big Hero 6 - Official US Trailer 1,Fall Out Boy!,2014-07-17 01:24:42,0,0.0,0.0
2014-07-15T14:50:19.000Z,z3biFxZIJOQ,Disney&#39;s Big Hero 6 - Official US Trailer 1,Dis looks hilarious. ,2014-07-17 01:17:33,0,0.5,1.0
2014-07-15T14:50:19.000Z,z3biFxZIJOQ,Disney&#39;s Big Hero 6 - Official US Trailer 1,yes,2014-07-17 01:15:50,0,0.0,0.0
2014-07-15T14:50:19.000Z,z3biFxZIJOQ,Disney&#39;s Big Hero 6 - Official US Trailer 1,"For those of you that didn'tÂ catch it the first time, when the officer turns around, there's a ""Wanted""Â clipping of Hans hanging on the bulletin board",2014-07-17 01:10:36,0,0.25,0.3333333333333333
2014-07-15T14:50:19.000Z,z3biFxZIJOQ,Disney&#39;s Big Hero 6 - Official US Trailer 1,"""We just out a window."" Oh my god I can not wait for this. It looks amazing.",2014-07-17 01:03:13,0,0.6000000000000001,0.9
2014-07-15T14:50:19.000Z,z3biFxZIJOQ,Disney&#39;s Big Hero 6 - Official US Trailer 1,This looks like something Christopher Nolan would direct!,2014-07-17 00:59:31,0,0.125,0.4
2014-07-15T14:50:19.000Z,z3biFxZIJOQ,Disney&#39;s Big Hero 6 - Official US Trailer 1,"1:13
IS THAT PRINCE HANS OF THE SOUTHERN FUCKING ISLES ON THE WANTED BOARD",2014-07-17 00:55:23,2,-0.3,0.4
2014-07-15T14:50:19.000Z,z3biFxZIJOQ,Disney&#39;s Big Hero 6 - Official US Trailer 1,"Does anybody else think that Disney is trying to get the How to Train Your Dragon vibe with this? I mean, the main character looks and has the same characteristics of Hiccup. Plus, they're starting to go the more adventurous, ""save the world,"" action type of plot. It's kind of annoying, yet also cool how Disney is finally starting to take a leaf from HTTYD's book.",2014-07-17 00:52:12,0,0.10037878787878786,0.48143939393939394
2014-07-15T14:50:19.000Z,z3biFxZIJOQ,Disney&#39;s Big Hero 6 - Official US Trailer 1,Totally going to see it!!!,2014-07-17 00:30:29,0,0.0,0.75
2014-07-15T14:50:19.000Z,z3biFxZIJOQ,Disney&#39;s Big Hero 6 - Official US Trailer 1,Anyone else see Hans?Â ,2014-07-17 00:20:26,0,0.0,0.0
2014-07-15T14:50:19.000Z,z3biFxZIJOQ,Disney&#39;s Big Hero 6 - Official US Trailer 1,"1:15 If you look closely at the bulletin board, you can see that Prince #Hans from #FROZEN is a #prison escapee.",2014-07-17 00:18:49,0,0.0,0.0
2014-07-15T14:50:19.000Z,z3biFxZIJOQ,Disney&#39;s Big Hero 6 - Official US Trailer 1,"Big Hero 6 is a superhero team. Wheres the team, all I see is one kid and his robot?",2014-07-17 00:14:43,0,0.0,0.1
2014-07-15T14:50:19.000Z,z3biFxZIJOQ,Disney&#39;s Big Hero 6 - Official US Trailer 1,"Please be better than that concert movie Frozen.
Frozen was so overrated to where I just wish it was never made! >.<",2014-07-17 00:14:37,866,0.625,0.5
2014-07-15T14:50:19.000Z,z3biFxZIJOQ,Disney&#39;s Big Hero 6 - Official US Trailer 1,fat balloon cry,2014-07-17 00:11:31,0,0.0,0.0
2014-07-15T14:50:19.000Z,z3biFxZIJOQ,Disney&#39;s Big Hero 6 - Official US Trailer 1,"There a MANGA VERSION of Big Hero 6 in Japan, coming out in August!
I'm so excited, the first Disney/Marvel MANGA ever MADE!!!Â ",2014-07-17 00:10:44,4,0.2877604166666667,0.39444444444444443
2014-07-15T14:50:19.000Z,z3biFxZIJOQ,Disney&#39;s Big Hero 6 - Official US Trailer 1,"OMG!! MINUTE 1:24!!!! THAT PICTURE FRAME AT THE RIGHT OF THE POLICE MAN IS THE POLICE WOMAN FROM ""BOLT""!!!! well... chris williams (director of Bolt) also directed this one... but, OMFG!!!",2014-07-17 00:05:08,0,1.0,0.5357142857142857
2014-07-15T14:50:19.000Z,z3biFxZIJOQ,Disney&#39;s Big Hero 6 - Official US Trailer 1,From the creators of Frozen and Wreck-it Ralph??.... okay you got me :p,2014-07-17 00:02:03,2,0.625,0.75
2014-07-15T14:50:19.000Z,z3biFxZIJOQ,Disney&#39;s Big Hero 6 - Official US Trailer 1,"*watches*
Yeah I still wanna hug Baymax.......Â ",2014-07-16 23:55:49,1,0.0,0.0
2014-07-15T14:50:19.000Z,z3biFxZIJOQ,Disney&#39;s Big Hero 6 - Official US Trailer 1,K is T.J. miller voicing a character in this movie i think imheard him,2014-07-16 23:43:03,0,0.0,0.0
2014-07-15T14:50:19.000Z,z3biFxZIJOQ,Disney&#39;s Big Hero 6 - Official US Trailer 1,see 1:15 HANS WANTED.. on the paper pinned on the wall,2014-07-16 23:38:05,0,0.0,0.0
2014-07-15T14:50:19.000Z,z3biFxZIJOQ,Disney&#39;s Big Hero 6 - Official US Trailer 1,"so how long before disney actually start designing new female characters and stop using Rapunzel's face? despite that, this film looks like it could be great.",2014-07-16 23:33:17,1,0.17727272727272728,0.37424242424242427
2014-07-15T14:50:19.000Z,z3biFxZIJOQ,Disney&#39;s Big Hero 6 - Official US Trailer 1,"Disney's Second Renaissance began with the re-imagining of the Princess and the Frog, followed by the ever quaint Tangled, Winnie the Pooh, blockbuster hit Wreck it Ralph, and the 5th highest grossing film in history; Frozen. Â Now comes Big Hero 6, a highly anticipated movie. Â Disney, keep on manufacturing the goods and the impending doom will surely subside!Â ",2014-07-16 23:29:05,8,0.19625,0.3822222222222222
2014-07-15T14:50:19.000Z,z3biFxZIJOQ,Disney&#39;s Big Hero 6 - Official US Trailer 1,"At 1:44, was that Nikki Wong from ""6teen""?",2014-07-16 23:28:38,0,0.0,0.0
2014-07-15T14:50:19.000Z,z3biFxZIJOQ,Disney&#39;s Big Hero 6 - Official US Trailer 1,Idk why but Japanese version trailer shows the depth of this movie really is.,2014-07-16 23:23:31,0,0.1,0.1
2014-07-15T14:50:19.000Z,z3biFxZIJOQ,Disney&#39;s Big Hero 6 - Official US Trailer 1,"I'm glad they don't show the Marvel logo. This movie was done by Disney, who bought Marvel and has every right to include or not include Marvel, even if the work is based on it. After all, it is the 54th animated feature in the Walt Disney Animated Classics series, so no need to include Marvel.Â ",2014-07-16 23:01:41,2,0.39285714285714285,0.7678571428571428
2014-07-15T14:50:19.000Z,z3biFxZIJOQ,Disney&#39;s Big Hero 6 - Official US Trailer 1,If you look closely in the wanted pictures as 1:17 it's Hans from Frozen,2014-07-16 22:57:36,0,0.0,0.0
2014-07-15T14:50:19.000Z,z3biFxZIJOQ,Disney&#39;s Big Hero 6 - Official US Trailer 1,Did anyone else scream when Fall Out Boy started playing?,2014-07-16 22:26:55,0,0.0,0.0
2014-07-15T14:50:19.000Z,z3biFxZIJOQ,Disney&#39;s Big Hero 6 - Official US Trailer 1,I thought Big Hero 6 were Marvel's? why can't I spot any of marvel's logo in this trailer? is there really none or am I just simply missed it? hmmm,2014-07-16 22:21:22,0,0.06666666666666667,0.21904761904761907
2014-07-15T14:50:19.000Z,z3biFxZIJOQ,Disney&#39;s Big Hero 6 - Official US Trailer 1,CAN'T WAIT..,2014-07-16 22:21:21,0,0.0,0.0
2014-07-15T14:50:19.000Z,z3biFxZIJOQ,Disney&#39;s Big Hero 6 - Official US Trailer 1,Looks good :),2014-07-16 22:19:45,0,0.6,0.8
2014-07-15T14:50:19.000Z,z3biFxZIJOQ,Disney&#39;s Big Hero 6 - Official US Trailer 1,HAS ANYONE NOTICED THAT HANS HAS A WANTED POSTER ON THE BILLBOARD BEHIND THE COP???????? HOLY SHIT! XDDDDDDDDDDÂ Â  1:17,2014-07-16 22:19:23,0,-0.325,0.75
2014-07-15T14:50:19.000Z,z3biFxZIJOQ,Disney&#39;s Big Hero 6 - Official US Trailer 1,"AAAAAWWWWWWWWWWWW!!! Baymax looks so cute!Â 

This is on my list of films to see during the winter film season.",2014-07-16 22:18:47,0,0.625,1.0
2014-07-15T14:50:19.000Z,z3biFxZIJOQ,Disney&#39;s Big Hero 6 - Official US Trailer 1,Hairy baby! Hairy baby.,2014-07-16 22:16:16,1,0.0,0.0
2014-07-15T14:50:19.000Z,z3biFxZIJOQ,Disney&#39;s Big Hero 6 - Official US Trailer 1,"It looks good, but is it only going to be Hiro and Baymax in it?Â  Because if none of the other heroes are going to make an appearance, ""Big Hero 6"" is sort of misleading...",2014-07-16 22:14:41,0,0.14375,0.51875
2014-07-15T14:50:19.000Z,z3biFxZIJOQ,Disney&#39;s Big Hero 6 - Official US Trailer 1,I think big hero 6 going to be cool movie but not cool as frozen,2014-07-16 22:12:08,0,0.05833333333333333,0.4666666666666666
2014-07-15T14:50:19.000Z,z3biFxZIJOQ,Disney&#39;s Big Hero 6 - Official US Trailer 1,"From creators of.......
Wreck-It-Ralph: Yay
Frozen: Boo",2014-07-16 22:10:34,1,0.0,0.0
2014-07-15T14:50:19.000Z,z3biFxZIJOQ,Disney&#39;s Big Hero 6 - Official US Trailer 1,"I am really excited for this, love the villain's design.",2014-07-16 22:01:41,0,0.4375,0.675
2014-07-15T14:50:19.000Z,z3biFxZIJOQ,Disney&#39;s Big Hero 6 - Official US Trailer 1,"OH, this............. is going to be fun to watch.",2014-07-16 21:55:20,0,0.3,0.2
2014-07-15T14:50:19.000Z,z3biFxZIJOQ,Disney&#39;s Big Hero 6 - Official US Trailer 1,This movies gonna be a hit,2014-07-16 21:44:30,0,0.0,0.0
2014-07-15T14:50:19.000Z,z3biFxZIJOQ,Disney&#39;s Big Hero 6 - Official US Trailer 1,Big Hero 6 is Japanese superhero team from Marvel comics. they are even using the same character names as those in the comics for this movie,2014-07-16 21:43:44,0,0.0,0.075
2014-07-15T14:50:19.000Z,z3biFxZIJOQ,Disney&#39;s Big Hero 6 - Official US Trailer 1,I can't wait to watch it is so awesome,2014-07-16 21:37:24,0,1.0,1.0
2014-07-15T14:50:19.000Z,z3biFxZIJOQ,Disney&#39;s Big Hero 6 - Official US Trailer 1,The trailer is funnyðŸ˜†ðŸ˜‚,2014-07-16 21:35:48,0,0.0,0.0
2014-07-15T14:50:19.000Z,z3biFxZIJOQ,Disney&#39;s Big Hero 6 - Official US Trailer 1,"""Hairy baby! Hairy baaaaaaby""",2014-07-16 21:34:35,1,0.0,0.0
2014-07-15T14:50:19.000Z,z3biFxZIJOQ,Disney&#39;s Big Hero 6 - Official US Trailer 1,Cool anime influenced comic book film and fall out boy. My life is complete :D,2014-07-16 21:32:48,0,0.425,0.6375
2014-07-15T14:50:19.000Z,z3biFxZIJOQ,Disney&#39;s Big Hero 6 - Official US Trailer 1,"For those of u who haven't seen it go check out the Japanese trailer, which is much better then this",2014-07-16 21:27:20,1,0.25,0.25
2014-07-15T14:50:19.000Z,z3biFxZIJOQ,Disney&#39;s Big Hero 6 - Official US Trailer 1,The robot kinda reminds me of the depresed robot of The Hitchhiker's Guide to the Galaxy.,2014-07-16 21:22:06,0,0.0,0.0
2014-07-15T14:50:19.000Z,z3biFxZIJOQ,Disney&#39;s Big Hero 6 - Official US Trailer 1,"En el tablÃ³n de detrÃ¡s estÃ¡ Hans, de frozen, en buscados!!! que bueno!Â ",2014-07-16 21:17:22,0,0.0,0.0
2014-07-15T14:50:19.000Z,z3biFxZIJOQ,Disney&#39;s Big Hero 6 - Official US Trailer 1,what is name is Music?,2014-07-16 21:16:03,0,0.0,0.0
2014-07-15T14:50:19.000Z,z3biFxZIJOQ,Disney&#39;s Big Hero 6 - Official US Trailer 1,Must be in Kingdom Hearts III!,2014-07-16 21:15:28,0,0.0,0.0
2014-07-15T14:50:19.000Z,z3biFxZIJOQ,Disney&#39;s Big Hero 6 - Official US Trailer 1,hanz from frozen is on a wanted poster behind the cop,2014-07-16 21:14:19,0,-0.4,0.7
2014-07-15T14:50:19.000Z,z3biFxZIJOQ,Disney&#39;s Big Hero 6 - Official US Trailer 1,Does anybody else notice that Hans has escaped from prison!@1:15Â ,2014-07-16 21:08:47,0,0.0,0.0
2014-07-15T14:50:19.000Z,z3biFxZIJOQ,Disney&#39;s Big Hero 6 - Official US Trailer 1,did they just make that ballon guy into iron man?,2014-07-16 21:08:37,0,0.0,0.0
2014-07-15T14:50:19.000Z,z3biFxZIJOQ,Disney&#39;s Big Hero 6 - Official US Trailer 1,"Total mixing of studios here, but when I see this movie, i won't be able to get past seeing/hearing Tuffnut from How to Train Your Dragon in the kid talking at 1:46 because of the same voice actor. Can't wait for this!! :D",2014-07-16 21:02:57,0,0.25,0.55
2014-07-15T14:50:19.000Z,z3biFxZIJOQ,Disney&#39;s Big Hero 6 - Official US Trailer 1,"I am not fast.
~Baymax",2014-07-16 21:01:26,0,-0.1,0.6
2014-07-15T14:50:19.000Z,z3biFxZIJOQ,Disney&#39;s Big Hero 6 - Official US Trailer 1,"This movie definitely won't be as successful as Frozen, it will probably be less successful than Wreck-it-Ralph. I can tell just by the premise and setting. Sorry to all the Frozen haters.",2014-07-16 20:54:59,0,0.20833333333333337,0.7416666666666667
2014-07-15T14:50:19.000Z,z3biFxZIJOQ,Disney&#39;s Big Hero 6 - Official US Trailer 1,"I swear if I hear another person sing that corny song ""Let It Go"" one more time, I will completely freak out.",2014-07-16 20:52:11,0,0.3,0.45
2014-07-15T14:50:19.000Z,z3biFxZIJOQ,Disney&#39;s Big Hero 6 - Official US Trailer 1,LOL A 'drunk' robot. This I gotta see!,2014-07-16 20:47:41,0,0.08750000000000002,0.85
2014-07-15T14:50:19.000Z,z3biFxZIJOQ,Disney&#39;s Big Hero 6 - Official US Trailer 1,OMG I WANT ONE!!!,2014-07-16 20:44:43,0,0.0,0.0
2014-07-15T14:50:19.000Z,z3biFxZIJOQ,Disney&#39;s Big Hero 6 - Official US Trailer 1,"Fall out boys
Excellent choice for this
AND IM GONNA LOVE THIS!!!
Did i hear Toughnut",2014-07-16 20:32:27,0,0.98828125,0.8
2014-07-15T14:50:19.000Z,z3biFxZIJOQ,Disney&#39;s Big Hero 6 - Official US Trailer 1,Oh My Gosh! It's Awesome,2014-07-16 20:27:51,0,1.0,1.0
2014-07-15T14:50:19.000Z,z3biFxZIJOQ,Disney&#39;s Big Hero 6 - Official US Trailer 1,"Am I the only one bothered by the fact the police officer said 'Kabuki Mask'? Kabuki isn't performed using masks; rather, they use exaggerated makeup. The performances utilizing masks is called Noh, but even then they're usually all white and featureless.",2014-07-16 20:20:01,0,-0.1875,0.5625
2014-07-15T14:50:19.000Z,z3biFxZIJOQ,Disney&#39;s Big Hero 6 - Official US Trailer 1,I want Hiro to be mine,2014-07-16 20:17:02,0,0.0,0.0
2014-07-15T14:50:19.000Z,z3biFxZIJOQ,Disney&#39;s Big Hero 6 - Official US Trailer 1,"@GoodVsEvil1314 Yeah, I thought so too. I think the government agent guy who helped them go undercover?",2014-07-16 20:14:47,0,0.0,0.0
2014-07-15T14:50:19.000Z,z3biFxZIJOQ,Disney&#39;s Big Hero 6 - Official US Trailer 1,FALL OUT BOY!! And Tbh Im excited for this action-packed film that FINALLY disney made! Im just excited like how I was excited for Frozen,2014-07-16 19:54:07,0,0.28125,0.8125
2014-07-15T14:50:19.000Z,z3biFxZIJOQ,Disney&#39;s Big Hero 6 - Official US Trailer 1,"Sooo....

This takes place in San Fransokyo CA, USJ. A world where japan wins world war 2.",2014-07-16 19:52:25,2,0.3,0.2
2014-07-15T14:50:19.000Z,z3biFxZIJOQ,Disney&#39;s Big Hero 6 - Official US Trailer 1,This looks awesome!!,2014-07-16 19:42:12,0,1.0,1.0
