publish_time,Video ID,Title,Comment,updatedAt,likeCount
2017-12-13T14:12:41.000Z,IC_lnyn2R2Q,THE 15:17 TO PARIS - Official Trailer [HD],someone is making money off this...and thats wrong,2018-01-07T22:57:34.000Z,0
2017-12-13T14:12:41.000Z,IC_lnyn2R2Q,THE 15:17 TO PARIS - Official Trailer [HD],"No ass, no titties, no bueno",2018-01-06T21:57:49.000Z,0
2017-12-13T14:12:41.000Z,IC_lnyn2R2Q,THE 15:17 TO PARIS - Official Trailer [HD],Liberals will be boycotting this. Fucking terrorist lovers.,2018-01-06T21:43:40.000Z,1
2017-12-13T14:12:41.000Z,IC_lnyn2R2Q,THE 15:17 TO PARIS - Official Trailer [HD],Lol,2018-01-06T03:52:47.000Z,0
2017-12-13T14:12:41.000Z,IC_lnyn2R2Q,THE 15:17 TO PARIS - Official Trailer [HD],the commuter without liam neeson !,2018-01-05T13:45:38.000Z,0
2017-12-13T14:12:41.000Z,IC_lnyn2R2Q,THE 15:17 TO PARIS - Official Trailer [HD],No more hocus pocus,2018-01-05T08:22:24.000Z,0
2017-12-13T14:12:41.000Z,IC_lnyn2R2Q,THE 15:17 TO PARIS - Official Trailer [HD],"Nice more propaganda films, so americans can feel good about themselves and give each other pats on the back.",2018-01-04T20:16:48.000Z,15
2017-12-13T14:12:41.000Z,IC_lnyn2R2Q,THE 15:17 TO PARIS - Official Trailer [HD],"Sure makes one wonder how they would react in a similar situation doesn't it? Would you hide (no shame in that) or would you ""go for broke""? I often times ask myself what I would do. These men reacted. Was it training? Divine intervention? Adrenaline? Who knows. I would hope that I would have the courage to act but unless put in that situation I will never know. What's in your wallet??",2018-01-04T18:05:35.000Z,1
2017-12-13T14:12:41.000Z,IC_lnyn2R2Q,THE 15:17 TO PARIS - Official Trailer [HD],"‘Murica...what would candy ass socialist Europe do with out us...oh right...live under tyranny or be dead, and they try so hard to live under tyranny or be dead.",2018-01-04T15:01:01.000Z,1
2017-12-13T14:12:41.000Z,IC_lnyn2R2Q,THE 15:17 TO PARIS - Official Trailer [HD],"Clint Eastwood is the man. Can't wait see this! Dude has always been good with telling a good story, hopefully this movie gives him even more recognition.",2018-01-04T08:05:04.000Z,2
2017-12-13T14:12:41.000Z,IC_lnyn2R2Q,THE 15:17 TO PARIS - Official Trailer [HD],My friend knows this guy,2018-01-03T07:26:35.000Z,0
2017-12-13T14:12:41.000Z,IC_lnyn2R2Q,THE 15:17 TO PARIS - Official Trailer [HD],"Holy shit. I'm an american and i lived in belgium for five years. I've ridden on that train countless times, it even went right by my HOUSE.... wow. These guys are amazing",2018-01-03T05:05:50.000Z,182
2017-12-13T14:12:41.000Z,IC_lnyn2R2Q,THE 15:17 TO PARIS - Official Trailer [HD],FRAUD,2018-01-02T03:40:52.000Z,3
2017-12-13T14:12:41.000Z,IC_lnyn2R2Q,THE 15:17 TO PARIS - Official Trailer [HD],Who is that guy giving the motivational speech??,2018-01-02T00:23:16.000Z,0
2017-12-13T14:12:41.000Z,IC_lnyn2R2Q,THE 15:17 TO PARIS - Official Trailer [HD],When's the movie about heroes saving innocent people from american bombs coming out?,2018-01-01T07:53:01.000Z,26
2017-12-13T14:12:41.000Z,IC_lnyn2R2Q,THE 15:17 TO PARIS - Official Trailer [HD],I thought I recognized em in the thumbnail... That's pretty bold!,2017-12-31T21:34:21.000Z,1
2017-12-13T14:12:41.000Z,IC_lnyn2R2Q,THE 15:17 TO PARIS - Official Trailer [HD],"I have to give a five star two thumbs up on this movie that’s coming up is because Clinton Eastwood is an amazing filmmaker, I making a very new and improved decision about the real three heroes to be in this movie some say it’s a documentary but the people we’re wrong this is the motion picture, I think I smell an Oscar on this one. And Mark my words I’m going to be the movie theater and see this movie, One legendary filmmaker filming The real heroes I think to me is an iconic idea🎥🎬🇺🇸🇺🇸🇺🇸🚇",2017-12-31T09:20:21.000Z,1
2017-12-13T14:12:41.000Z,IC_lnyn2R2Q,THE 15:17 TO PARIS - Official Trailer [HD],PAM and eastwood,2017-12-31T05:58:29.000Z,0
2017-12-13T14:12:41.000Z,IC_lnyn2R2Q,THE 15:17 TO PARIS - Official Trailer [HD],anyone know where the trailer motivational speech is from? or was it made just for the movie thanx <3,2017-12-31T04:38:54.000Z,0
2017-12-13T14:12:41.000Z,IC_lnyn2R2Q,THE 15:17 TO PARIS - Official Trailer [HD],Ha his a bayern fan,2017-12-28T16:52:03.000Z,0
2017-12-13T14:12:41.000Z,IC_lnyn2R2Q,THE 15:17 TO PARIS - Official Trailer [HD],BILL CLINTON IS A RAPIST,2017-12-28T15:00:34.000Z,3
2017-12-13T14:12:41.000Z,IC_lnyn2R2Q,THE 15:17 TO PARIS - Official Trailer [HD],"As much as I love Clint Eastwood and the actual story of this very true event, this movie looks like it will go either way. The dialogue seems super awful. ""You ever think life is pushing us for a greater purpose."" Yikes. The non actor thing only works if the non actors are good. Which is remained to be seen. They will do well with the action portion but the emotional moments will be the the real test. I loved American Sniper so we'll see.",2017-12-28T06:21:34.000Z,1
2017-12-13T14:12:41.000Z,IC_lnyn2R2Q,THE 15:17 TO PARIS - Official Trailer [HD],PAMALAMADINGDONG,2017-12-28T01:58:05.000Z,1
2017-12-13T14:12:41.000Z,IC_lnyn2R2Q,THE 15:17 TO PARIS - Official Trailer [HD],"As a UC Berkeley student, I think the person who hijacked the train had some legitimate grievances. His country was probably war torn and poor as a product of american/western Europe imperialism and destructive foreign policy that was implemented to destabilize Arabic countries in order to install puppets that would sell the U.S. and the west oil at a cheap rate. I'm not saying the terrorist was right for doing what he did, but those American soldiers are part of an evil U.S. military that drops bombs on innocent civilians every single day. They're certainly not innocent themselves.",2017-12-27T23:22:04.000Z,1
2017-12-13T14:12:41.000Z,IC_lnyn2R2Q,THE 15:17 TO PARIS - Official Trailer [HD],0:43,2017-12-27T19:18:27.000Z,0
2017-12-13T14:12:41.000Z,IC_lnyn2R2Q,THE 15:17 TO PARIS - Official Trailer [HD],Imagine what it must've been like to act out how the actual thing you did went down. Crazy!,2017-12-27T13:35:07.000Z,13
2017-12-13T14:12:41.000Z,IC_lnyn2R2Q,THE 15:17 TO PARIS - Official Trailer [HD],Clint Eastwood has become the planet's most boring and predictable film maker.,2017-12-27T07:07:08.000Z,0
2017-12-13T14:12:41.000Z,IC_lnyn2R2Q,THE 15:17 TO PARIS - Official Trailer [HD],Am so going to watch thisssss,2017-12-27T00:19:34.000Z,3
2017-12-13T14:12:41.000Z,IC_lnyn2R2Q,THE 15:17 TO PARIS - Official Trailer [HD],Oh my god that's ninja tracks used in this trailer.,2017-12-26T22:52:40.000Z,0
2017-12-13T14:12:41.000Z,IC_lnyn2R2Q,THE 15:17 TO PARIS - Official Trailer [HD],Not all heroes wear capes..some wear gi's...,2017-12-26T22:49:22.000Z,59
2017-12-13T14:12:41.000Z,IC_lnyn2R2Q,THE 15:17 TO PARIS - Official Trailer [HD],"I am genuinely interested in seeing this movie, but for me Clint Eastwood has had an average streak. While Letters from Iwo Jima, Unforgiven, Mystic River, and Million Dollar Baby are amazing films, American Sniper and Sully were just kinda ok films and I really did not like Jersey Boys, J. Edgar,  and Hereafter. Hopefully, this is a home run for me.",2017-12-26T17:22:59.000Z,0
2017-12-13T14:12:41.000Z,IC_lnyn2R2Q,THE 15:17 TO PARIS - Official Trailer [HD],joint suit fit development holiday wood always however together.,2017-12-26T11:06:58.000Z,1
2017-12-13T14:12:41.000Z,IC_lnyn2R2Q,THE 15:17 TO PARIS - Official Trailer [HD],Who’s speech is that?,2017-12-25T23:13:30.000Z,0
2017-12-13T14:12:41.000Z,IC_lnyn2R2Q,THE 15:17 TO PARIS - Official Trailer [HD],Upbringing of some bad ass alpha Christian Americans. TRUE Story,2017-12-25T23:10:19.000Z,0
2017-12-13T14:12:41.000Z,IC_lnyn2R2Q,THE 15:17 TO PARIS - Official Trailer [HD],Anthony is my brother lol. dont believe me....my IG is ju.green and he's on there somewhere and that Lakers shirt he has on our mom bought me for like $30 lmao. Pretty insane he survived but i'm proud af !!,2017-12-25T22:27:32.000Z,0
2017-12-13T14:12:41.000Z,IC_lnyn2R2Q,THE 15:17 TO PARIS - Official Trailer [HD],Fuck yea,2017-12-25T17:51:42.000Z,0
2017-12-13T14:12:41.000Z,IC_lnyn2R2Q,THE 15:17 TO PARIS - Official Trailer [HD],US AIR FORCE ALSO ROCKS ! GOD BLESS ALL OUR ARMED FORCES !,2017-12-24T20:05:00.000Z,0
2017-12-13T14:12:41.000Z,IC_lnyn2R2Q,THE 15:17 TO PARIS - Official Trailer [HD],"An other propaganda movie made by the famous Trump supporter, EL FAMOSO CLINT EASTWOOD",2017-12-24T12:41:29.000Z,0
2017-12-13T14:12:41.000Z,IC_lnyn2R2Q,THE 15:17 TO PARIS - Official Trailer [HD],"Can't believe the dudes are playing as themselves. The guys that saved the train are playing as themselves, that's fucking awesome",2017-12-24T07:55:19.000Z,0
2017-12-13T14:12:41.000Z,IC_lnyn2R2Q,THE 15:17 TO PARIS - Official Trailer [HD],2 hour movie for a 5 minute event...seriously this movie should not have been made,2017-12-24T04:37:07.000Z,13
2017-12-13T14:12:41.000Z,IC_lnyn2R2Q,THE 15:17 TO PARIS - Official Trailer [HD],trash,2017-12-24T02:04:56.000Z,0
2017-12-13T14:12:41.000Z,IC_lnyn2R2Q,THE 15:17 TO PARIS - Official Trailer [HD],"Too bad we didn't saw the first French passenger, who fought the terrorist hand-to-hand instead of surrendering, despite him being a civilian without any combat training.

He's the real MVP.

But he's not American ... so no movie for him.

Those three soldiers are still heroes, but now they are just making a sick propaganda movie.",2017-12-24T01:20:49.000Z,6
2017-12-13T14:12:41.000Z,IC_lnyn2R2Q,THE 15:17 TO PARIS - Official Trailer [HD],Say it with me kids: PROPAGANDA,2017-12-23T23:02:48.000Z,1
2017-12-13T14:12:41.000Z,IC_lnyn2R2Q,THE 15:17 TO PARIS - Official Trailer [HD],"That man making the speech is Les Brown, a motivational speaker. If you have not heard him speak or seen his videos, check them out. That man have a voice and a will to succeed.",2017-12-23T22:04:09.000Z,0
2017-12-13T14:12:41.000Z,IC_lnyn2R2Q,THE 15:17 TO PARIS - Official Trailer [HD],I love Clint Eastwood but this movie will be certainly propaganda,2017-12-23T21:37:03.000Z,7
2017-12-13T14:12:41.000Z,IC_lnyn2R2Q,THE 15:17 TO PARIS - Official Trailer [HD],this looks bad. Who thought it was a good idea to have non actors act?,2017-12-23T21:30:02.000Z,0
2017-12-13T14:12:41.000Z,IC_lnyn2R2Q,THE 15:17 TO PARIS - Official Trailer [HD],"I know what you're thinking.
Can you make it to the first screening of this film when it hits theaters.
To tell you the truth, in all the excitement I'm not sure.
But seeing this is a film about Islamic terrorism people will be thronging to see you gotta ask yourself one question: 'Do I feel lucky'
Well, do you, punk?",2017-12-23T21:10:23.000Z,0
2017-12-13T14:12:41.000Z,IC_lnyn2R2Q,THE 15:17 TO PARIS - Official Trailer [HD],ayy my boy reppin bayern,2017-12-23T20:48:06.000Z,0
2017-12-13T14:12:41.000Z,IC_lnyn2R2Q,THE 15:17 TO PARIS - Official Trailer [HD],LOL. Of course this video is flooded with conservative comments and attacks on liberals. Keep worshiping your president who is a puppet to Vladimir Putin and a traitor. WHAT A REAL AMERICAN PATRIOT HE IS!,2017-12-23T20:38:16.000Z,17
2017-12-13T14:12:41.000Z,IC_lnyn2R2Q,THE 15:17 TO PARIS - Official Trailer [HD],Military propaganda as fuuuuuck,2017-12-23T20:28:19.000Z,26
2017-12-13T14:12:41.000Z,IC_lnyn2R2Q,THE 15:17 TO PARIS - Official Trailer [HD],BOOOOOOOOOORRRRRRIIIIIIINNNNNNGGGGGGGGGGGGGGGGGGGGGGGGGGG,2017-12-23T20:18:04.000Z,1
2017-12-13T14:12:41.000Z,IC_lnyn2R2Q,THE 15:17 TO PARIS - Official Trailer [HD],So a 2-minute long incident condensed into a two-hour movie?,2017-12-23T17:40:05.000Z,149
2017-12-13T14:12:41.000Z,IC_lnyn2R2Q,THE 15:17 TO PARIS - Official Trailer [HD],"(I'm talking about the DC movies) For the next movie they could work with heyday (Harry potter and gravity) I think it could help a lot to the quality. ⚡️😘👍🏻😘⚡️, 👍🏻=😭😭😄😄😚😚,  NO=😰🔫(if they did not understand is that I'm going to commit suicide if it's a no).",2017-12-23T01:50:12.000Z,0
2017-12-13T14:12:41.000Z,IC_lnyn2R2Q,THE 15:17 TO PARIS - Official Trailer [HD],Finally! A movie about the jihad crisis in Europe.,2017-12-22T21:11:44.000Z,115
2017-12-13T14:12:41.000Z,IC_lnyn2R2Q,THE 15:17 TO PARIS - Official Trailer [HD],"Lucky for the terrorist to be taken down by American military guys. If he'd been taken down by Russian Spetnaz, he'd of been savagely beaten to death and there wouldn't be a film about it.",2017-12-22T19:55:11.000Z,1
2017-12-13T14:12:41.000Z,IC_lnyn2R2Q,THE 15:17 TO PARIS - Official Trailer [HD],interesting with the cast real heroes in the movie,2017-12-22T13:21:50.000Z,0
2017-12-13T14:12:41.000Z,IC_lnyn2R2Q,THE 15:17 TO PARIS - Official Trailer [HD],easy money for hollywood. they know exactly which rabid folks will throw their dollars at this.,2017-12-22T11:39:57.000Z,2
2017-12-13T14:12:41.000Z,IC_lnyn2R2Q,THE 15:17 TO PARIS - Official Trailer [HD],I'm seeing this movie because 0:42 was filmed at Robins Air Force Base,2017-12-21T23:23:44.000Z,0
2017-12-13T14:12:41.000Z,IC_lnyn2R2Q,THE 15:17 TO PARIS - Official Trailer [HD],That's my baby cousin!! Good job Spencer. I'm bummed I couldn't make Thanksgiving.,2017-12-21T23:01:14.000Z,1
2017-12-13T14:12:41.000Z,IC_lnyn2R2Q,THE 15:17 TO PARIS - Official Trailer [HD],"Manufactured false flags wth trained military/ CIA agents again who just happened to be there to save th day, followed by their repeated false flag act in propaganda movies. u can make this stuff up. I bet u all this crap wil have no use fr after th 2 states Isreal/Palestine separated by fortified huge walls. Satan is working overtime to NO AVAIL!",2017-12-21T16:47:27.000Z,1
2017-12-13T14:12:41.000Z,IC_lnyn2R2Q,THE 15:17 TO PARIS - Official Trailer [HD],God bless America. Vomit.,2017-12-21T15:43:03.000Z,5
2017-12-13T14:12:41.000Z,IC_lnyn2R2Q,THE 15:17 TO PARIS - Official Trailer [HD],Very brave but also extremely lucky the gun jammed or a lot of ppl would have been hurt. I also question the decision to use the real life people who took down the  terrorist as lead actor's idk just seems cheesy to do that but hey it's Hollywood,2017-12-21T14:30:36.000Z,0
2017-12-13T14:12:41.000Z,IC_lnyn2R2Q,THE 15:17 TO PARIS - Official Trailer [HD],History makes the greatest story.. You couldn't write a better story.. Veterans are true hero's.,2017-12-21T13:36:33.000Z,0
2017-12-13T14:12:41.000Z,IC_lnyn2R2Q,THE 15:17 TO PARIS - Official Trailer [HD],"This is hard stuff, man.",2017-12-21T11:42:12.000Z,0
2017-12-13T14:12:41.000Z,IC_lnyn2R2Q,THE 15:17 TO PARIS - Official Trailer [HD],"Ok, in the beginning it looks exiting. A siege movie in a train by Clint Eastwood... Great! ...But that salivating sermon! Dear God!",2017-12-21T10:53:48.000Z,0
2017-12-13T14:12:41.000Z,IC_lnyn2R2Q,THE 15:17 TO PARIS - Official Trailer [HD],Just can't stop watching it,2017-12-21T10:12:25.000Z,0
2017-12-13T14:12:41.000Z,IC_lnyn2R2Q,THE 15:17 TO PARIS - Official Trailer [HD],Sacramento Proud!,2017-12-21T07:07:25.000Z,1
2017-12-13T14:12:41.000Z,IC_lnyn2R2Q,THE 15:17 TO PARIS - Official Trailer [HD],I was about to watch another video and this was the ad on it i had the option to skip it but i didnt it looks great!,2017-12-21T03:41:37.000Z,0
2017-12-13T14:12:41.000Z,IC_lnyn2R2Q,THE 15:17 TO PARIS - Official Trailer [HD],"As soon as I saw that they were not only making this movie, and then later on the actual guys will be starring in it....I am definitely going to see this movie!!!!",2017-12-21T01:39:57.000Z,0
2017-12-13T14:12:41.000Z,IC_lnyn2R2Q,THE 15:17 TO PARIS - Official Trailer [HD],Wonderful recently peer chamber sophisticated beautiful extension favor judgment garlic pale.,2017-12-21T00:25:40.000Z,0
2017-12-13T14:12:41.000Z,IC_lnyn2R2Q,THE 15:17 TO PARIS - Official Trailer [HD],The legend of the 'Murican gunny hero exists only in the phantasies of Hollywood directors. Everyone who's been out there knows what I mean. So Fuck You Clint Eastwood!,2017-12-20T22:29:57.000Z,1
2017-12-13T14:12:41.000Z,IC_lnyn2R2Q,THE 15:17 TO PARIS - Official Trailer [HD],This is idiotic he is shown clearing a village and being armed with a weapon he was a Medical Ambulance Servicer and since I am in the Air Force I know they do not do that. My career field however would be the ones doing that not him not to mention he got kicked out because he started a bar fight in Sacramento.,2017-12-20T20:42:32.000Z,0
2017-12-13T14:12:41.000Z,IC_lnyn2R2Q,THE 15:17 TO PARIS - Official Trailer [HD],Great exercise for ptsd I bet,2017-12-20T16:35:15.000Z,0
2017-12-13T14:12:41.000Z,IC_lnyn2R2Q,THE 15:17 TO PARIS - Official Trailer [HD],"star spangled nonsense......its a propaganda film, standard american drivel, how do you make a film out of this?? its a small incident, similar things happen everyday around the world and yet somehow clint manages to make a two hour film out of it?? these acts of so called ""heroism"" happen everyday, most people dont see the need to shout about it from the rooftops and make a 100 million dollar film.... grow up america.",2017-12-20T13:44:52.000Z,6
2017-12-13T14:12:41.000Z,IC_lnyn2R2Q,THE 15:17 TO PARIS - Official Trailer [HD],Pammy!,2017-12-20T12:51:21.000Z,0
2017-12-13T14:12:41.000Z,IC_lnyn2R2Q,THE 15:17 TO PARIS - Official Trailer [HD],Anyone know where this motivational speech came from....,2017-12-20T12:16:43.000Z,0
2017-12-13T14:12:41.000Z,IC_lnyn2R2Q,THE 15:17 TO PARIS - Official Trailer [HD],A must watch,2017-12-20T06:11:04.000Z,0
2017-12-13T14:12:41.000Z,IC_lnyn2R2Q,THE 15:17 TO PARIS - Official Trailer [HD],Les Brown anybody,2017-12-19T21:48:09.000Z,1
2017-12-13T14:12:41.000Z,IC_lnyn2R2Q,THE 15:17 TO PARIS - Official Trailer [HD],Anyone know the speaker and the track?,2017-12-19T21:42:40.000Z,0
2017-12-13T14:12:41.000Z,IC_lnyn2R2Q,THE 15:17 TO PARIS - Official Trailer [HD],Bayern fan. Thats the only thing i dislike,2017-12-19T20:36:23.000Z,0
2017-12-13T14:12:41.000Z,IC_lnyn2R2Q,THE 15:17 TO PARIS - Official Trailer [HD],not my cup of tea,2017-12-19T19:38:35.000Z,0
2017-12-13T14:12:41.000Z,IC_lnyn2R2Q,THE 15:17 TO PARIS - Official Trailer [HD],The music amazing,2017-12-19T19:02:05.000Z,1
2017-12-13T14:12:41.000Z,IC_lnyn2R2Q,THE 15:17 TO PARIS - Official Trailer [HD],Am I the only one who noticed someone wearing a Bayern Munich football top?,2017-12-19T17:13:26.000Z,0
2017-12-13T14:12:41.000Z,IC_lnyn2R2Q,THE 15:17 TO PARIS - Official Trailer [HD],Will definitely see it!,2017-12-19T16:55:19.000Z,0
2017-12-13T14:12:41.000Z,IC_lnyn2R2Q,THE 15:17 TO PARIS - Official Trailer [HD],another boring james bond story,2017-12-19T16:37:47.000Z,0
2017-12-13T14:12:41.000Z,IC_lnyn2R2Q,THE 15:17 TO PARIS - Official Trailer [HD],best trailer for upcoming movie after very long,2017-12-19T16:36:24.000Z,0
2017-12-13T14:12:41.000Z,IC_lnyn2R2Q,THE 15:17 TO PARIS - Official Trailer [HD],This fucking Airman is about to make some real bank... lucky fuck,2017-12-19T11:53:33.000Z,0
2017-12-13T14:12:41.000Z,IC_lnyn2R2Q,THE 15:17 TO PARIS - Official Trailer [HD],This is fucking KICK ASS!,2017-12-19T10:07:27.000Z,0
2017-12-13T14:12:41.000Z,IC_lnyn2R2Q,THE 15:17 TO PARIS - Official Trailer [HD],"OK, I wanna see this.",2017-12-19T07:44:09.000Z,0
2017-12-13T14:12:41.000Z,IC_lnyn2R2Q,THE 15:17 TO PARIS - Official Trailer [HD],"subs again ya,,??",2017-12-19T06:28:43.000Z,0
2017-12-13T14:12:41.000Z,IC_lnyn2R2Q,THE 15:17 TO PARIS - Official Trailer [HD],Is it me or does Spencer Stone look similar to Kyle Gott?,2017-12-19T06:09:12.000Z,0
2017-12-13T14:12:41.000Z,IC_lnyn2R2Q,THE 15:17 TO PARIS - Official Trailer [HD],This movie looks like it’ll be a bag of smashed assholes,2017-12-19T04:50:55.000Z,0
2017-12-13T14:12:41.000Z,IC_lnyn2R2Q,THE 15:17 TO PARIS - Official Trailer [HD],Is that Pam,2017-12-19T03:48:58.000Z,0
2017-12-13T14:12:41.000Z,IC_lnyn2R2Q,THE 15:17 TO PARIS - Official Trailer [HD],"So cool to see that these three guys are getting the recognition they deserve. When this attack happened I was working at a Jamba Juice in Sacramento, the one that Spencer Stone worked at a few years before. He was still on good terms with my managers and came into the store on my day off which I was super bummed about. 
They all went out for drinks in downtown Sac and Spencer was stabbed by a man for defending one of my managers. Obviously he's all good. 
Just a cool little thing to know that I was only one person away from knowing this hero and his friends! Can't wait to see this film.",2017-12-18T22:02:32.000Z,0
2017-12-13T14:12:41.000Z,IC_lnyn2R2Q,THE 15:17 TO PARIS - Official Trailer [HD],So this kid gets promoted and now a movie. WOW... only in the Air Force.... LMFAO,2017-12-18T21:26:14.000Z,1
2017-12-13T14:12:41.000Z,IC_lnyn2R2Q,THE 15:17 TO PARIS - Official Trailer [HD],I wonder if they'll show the British soldier who helped too.  (I doubt it),2017-12-18T18:17:48.000Z,0
2017-12-13T14:12:41.000Z,IC_lnyn2R2Q,THE 15:17 TO PARIS - Official Trailer [HD],"Another Eastwood's film about how US and it's people are world's saviors. Boring and dumb. ""Sniper"" was about a serial killer not a hero!!!! You don't kill dozens of people and call yourself a hero! You people chose Trump as president and that says a lot about your intelligence.",2017-12-18T15:46:39.000Z,1
2017-12-13T14:12:41.000Z,IC_lnyn2R2Q,THE 15:17 TO PARIS - Official Trailer [HD],"https://youtu.be/9XnWQ83kPoc
CAR CRASH CRAZY DRİVERS OMG GOOD VİDEO",2017-12-18T14:23:43.000Z,0
2017-12-13T14:12:41.000Z,IC_lnyn2R2Q,THE 15:17 TO PARIS - Official Trailer [HD],Eh no thanks.,2017-12-18T08:51:30.000Z,19
2017-12-13T14:12:41.000Z,IC_lnyn2R2Q,THE 15:17 TO PARIS - Official Trailer [HD],"Congratulations, you played yourself.",2017-12-18T05:25:32.000Z,0
2017-12-13T14:12:41.000Z,IC_lnyn2R2Q,THE 15:17 TO PARIS - Official Trailer [HD],"From the director with the perfect record 
who has never made a movie that is not excellent in his whole career...",2017-12-18T03:31:17.000Z,1
2017-12-13T14:12:41.000Z,IC_lnyn2R2Q,THE 15:17 TO PARIS - Official Trailer [HD],"Damn, being portrayed by the heroes that lived it. Thats something new that I've never seen in a movie before.",2017-12-18T03:27:34.000Z,0
2017-12-13T14:12:41.000Z,IC_lnyn2R2Q,THE 15:17 TO PARIS - Official Trailer [HD],Can't wait for this movie. Spencer's mom lives down the street from me and he went to school with my brother. Have our own little hometown hero in our own neighborhood.,2017-12-18T01:40:33.000Z,0
2017-12-13T14:12:41.000Z,IC_lnyn2R2Q,THE 15:17 TO PARIS - Official Trailer [HD],"""This is actually quite unique. Getting the actual Heroes of this true story to play themselves in the film."" Yep, Mr. Eastwood is innovating in a time where hollywood is filled degenerate frauds. He understands the shifting tide that people don't connect with these wealthy degenerate actors talking down to them anymore. It also rewards the real heroes, not hollywood frauds.",2017-12-18T00:34:01.000Z,0
2017-12-13T14:12:41.000Z,IC_lnyn2R2Q,THE 15:17 TO PARIS - Official Trailer [HD],"Clint Eastwood, the living legend of cinema, still on top of his game, 87 by now, is directing relevant, spectacular, daring and true movies. This time he is back again with one in a kind movie, an experience which no one else dares to touch, heroes played by non-actor real heroes. speechless. Hyped for this one.",2017-12-17T23:47:21.000Z,1
2017-12-13T14:12:41.000Z,IC_lnyn2R2Q,THE 15:17 TO PARIS - Official Trailer [HD],Sac Town finest!!,2017-12-17T22:34:21.000Z,0
2017-12-13T14:12:41.000Z,IC_lnyn2R2Q,THE 15:17 TO PARIS - Official Trailer [HD],"The beginning soundtrack sounds like something out of the Last of Us, Gustavo Santaolalla vibes anyone?",2017-12-17T21:08:28.000Z,0
2017-12-13T14:12:41.000Z,IC_lnyn2R2Q,THE 15:17 TO PARIS - Official Trailer [HD],this movie looks motivating af,2017-12-17T20:55:07.000Z,0
2017-12-13T14:12:41.000Z,IC_lnyn2R2Q,THE 15:17 TO PARIS - Official Trailer [HD],that speech tough,2017-12-17T18:55:45.000Z,0
2017-12-13T14:12:41.000Z,IC_lnyn2R2Q,THE 15:17 TO PARIS - Official Trailer [HD],what BS Eastwood is selling,2017-12-17T18:40:30.000Z,0
2017-12-13T14:12:41.000Z,IC_lnyn2R2Q,THE 15:17 TO PARIS - Official Trailer [HD],I got the chills when I watched this,2017-12-17T18:07:17.000Z,0
2017-12-13T14:12:41.000Z,IC_lnyn2R2Q,THE 15:17 TO PARIS - Official Trailer [HD],Other people in the train from other nationalities also helped. But of course it is only the American who go off and do a movie about it. And then the movie becomes an exaltation of America in general... Every good-hearted act becomes a product that sells. I bet the next day that it happened they already had the journalist knocking on the door to write a book about it.,2017-12-17T17:56:51.000Z,15
2017-12-13T14:12:41.000Z,IC_lnyn2R2Q,THE 15:17 TO PARIS - Official Trailer [HD],Playing this on repeat for the monologue in the background. Anyone knows where can I find the full version ?,2017-12-17T17:33:10.000Z,0
2017-12-13T14:12:41.000Z,IC_lnyn2R2Q,THE 15:17 TO PARIS - Official Trailer [HD],Clint does it again.,2017-12-17T17:19:25.000Z,0
2017-12-13T14:12:41.000Z,IC_lnyn2R2Q,THE 15:17 TO PARIS - Official Trailer [HD],More American Might Porno from Eastwood. No thanks. Seen it all before.,2017-12-17T15:45:17.000Z,2
2017-12-13T14:12:41.000Z,IC_lnyn2R2Q,THE 15:17 TO PARIS - Official Trailer [HD],But who is playing the british guy who helped sit on the attacker once it was safe?,2017-12-17T15:36:47.000Z,0
2017-12-13T14:12:41.000Z,IC_lnyn2R2Q,THE 15:17 TO PARIS - Official Trailer [HD],"You had me at Clint Eastwood. 

Now, *shut up and take my money!*",2017-12-17T15:32:58.000Z,991
2017-12-13T14:12:41.000Z,IC_lnyn2R2Q,THE 15:17 TO PARIS - Official Trailer [HD],"Mr Eastwood take note, If you have zombies instead of terrorists I think it would make for a better film. Never too late to add them in!",2017-12-17T14:49:54.000Z,0
