publish_time,Video ID,Title,Comment,updatedAt,likeCount
2017-12-13T14:12:41.000Z,IC_lnyn2R2Q,THE 15:17 TO PARIS - Official Trailer [HD],"2 GI's making tourism in the shithole of France.

Probabilities?

Average guy in USA doesn t even quotes 2 countries from south america , and you think 2 GIs will visit a spot  that even frenchs doesn t give a shit?!!!!???

Probabilities : 1%.






-------------------------------------------------------------------------------------------
2 Gis found a ""suspect"" arabic people.

Probability?

A ""suspect"" arabic , isn t it????
What kind of clues you have???
How you can separate shaddy  arabic people from a ""good one""???
This hypothesis just makes no sens.

Probabilities : 10% ( admitting one of the GIs read all Sherlock Holmes books).



---------------------------------------------------------------------------------------------------
2GIs and one terrorist , lost in the same place in France , in a little town completely unknown , at the same time...

Probability?

In France , you can find arabics peoples absolutely everywhere.

But you find GIs only in Toulon facilities , when the Nimitz aircraft carrier take a rest.

So , the probabilities are very low..............

I give you 15% , cause i am not callous.

------------------------------------------------------------------------------------------------------
Gis and terrorist in the SAME wagon.

Probability?

Well , often , you have 10 wagons in the train , so i could say 10%.


----------------------------------------------------------------------------------------------------------
Terrorist raises his weapon , push the trigger and...........................the gun is blocked??????????!!!!!!!!!!

Probability?

I guess one percent . (and i m nice) 




--------------------------------------------------------------------------------------------------------------------

Probability that the single blocked weapon of the  box  was choosen by the naughty guy  of this fairy tale?

Jesus .....0.5% and i m VERY  tolerant.





----------------------------------------------------------------------------------------------------------------------------------

OK , now the probabilities of ALL this situations happen in  the same time , at the  same place ?


.................Hmmmmmmmmmm...........OK.

Wake up guys.",2018-02-02T17:27:30.000Z,0
2017-12-13T14:12:41.000Z,IC_lnyn2R2Q,THE 15:17 TO PARIS - Official Trailer [HD],Trailer starts at 15:17.,2018-02-02T16:13:57.000Z,0
2017-12-13T14:12:41.000Z,IC_lnyn2R2Q,THE 15:17 TO PARIS - Official Trailer [HD],What dose he do with his hands at the end,2018-02-02T15:28:08.000Z,0
2017-12-13T14:12:41.000Z,IC_lnyn2R2Q,THE 15:17 TO PARIS - Official Trailer [HD],"Clint, may you livee another 88 years.",2018-02-02T15:14:19.000Z,1
2017-12-13T14:12:41.000Z,IC_lnyn2R2Q,THE 15:17 TO PARIS - Official Trailer [HD],"What about the two french people, who were not trained soldiers, that attacked the terrorist just before, and were shot in the process ? Why isn't the fact that the two american soldiers decided, from their own words, to attack as the rifle jammed represented ? 
It wouldn't be another petty hollywood spin on events, to make it all about brave 'muricans saving frightened french cowards, would it ?
Well done for rotting a story of brave men stopping a terrorist killing innocents, just for shitty propaganda. Very well done.",2018-02-02T11:30:42.000Z,0
2017-12-13T14:12:41.000Z,IC_lnyn2R2Q,THE 15:17 TO PARIS - Official Trailer [HD],"i saw an ad for this and im positive i witnessed Jaleel White (Steve Urkel) portraying a classrom teacher, dressed in a gray suit.",2018-02-02T09:16:44.000Z,0
2017-12-13T14:12:41.000Z,IC_lnyn2R2Q,THE 15:17 TO PARIS - Official Trailer [HD],So stoked,2018-02-02T03:08:53.000Z,1
2017-12-13T14:12:41.000Z,IC_lnyn2R2Q,THE 15:17 TO PARIS - Official Trailer [HD],I'm going to see it just because Urkel's in it,2018-02-02T02:11:27.000Z,0
2017-12-13T14:12:41.000Z,IC_lnyn2R2Q,THE 15:17 TO PARIS - Official Trailer [HD],"Keep in mind that the French conductors 'locked' themselves into a closet, while this went down...  The French..  worthless.",2018-02-02T01:21:28.000Z,2
2017-12-13T14:12:41.000Z,IC_lnyn2R2Q,THE 15:17 TO PARIS - Official Trailer [HD],"One of the new teasers shows a teacher yelling at, like, 5 year olds if they'd know what to do in a terrorist attack. That's stupid to me. They're kids. Stop yelling at them",2018-02-01T21:19:45.000Z,0
2017-12-13T14:12:41.000Z,IC_lnyn2R2Q,THE 15:17 TO PARIS - Official Trailer [HD],Americans are going to get off to this patriotic shit. Pathetic.,2018-02-01T20:40:01.000Z,0
2017-12-13T14:12:41.000Z,IC_lnyn2R2Q,THE 15:17 TO PARIS - Official Trailer [HD],American propaganda machine hard at work.,2018-02-01T18:08:43.000Z,17
2017-12-13T14:12:41.000Z,IC_lnyn2R2Q,THE 15:17 TO PARIS - Official Trailer [HD],Only Clint Eastwood would have the courage to use the actual people who were there and did this heroic feat.,2018-02-01T17:57:17.000Z,2
2017-12-13T14:12:41.000Z,IC_lnyn2R2Q,THE 15:17 TO PARIS - Official Trailer [HD],Islam _cannot_ coexist with Western Culture or Values.,2018-02-01T13:53:39.000Z,1
2017-12-13T14:12:41.000Z,IC_lnyn2R2Q,THE 15:17 TO PARIS - Official Trailer [HD],"Mark Moogalian and Chris Norman talk about their roles in the film:

https://www.thenational.ae/arts-culture/film/the-15-17-to-paris-the-real-life-heroes-who-helped-foil-terror-attack-star-in-new-film-1.700793",2018-02-01T09:07:01.000Z,0
2017-12-13T14:12:41.000Z,IC_lnyn2R2Q,THE 15:17 TO PARIS - Official Trailer [HD],"And we thought the acting in Gran Torino was horrendous...good God. At least those kids WERE actors. This looks insufferable. 

Trump fans should love it.",2018-02-01T03:22:29.000Z,3
2017-12-13T14:12:41.000Z,IC_lnyn2R2Q,THE 15:17 TO PARIS - Official Trailer [HD],there is a fucking movie about every fucking attack now. where is the movie when my bitch ass ex gf attacked me on twitter?,2018-02-01T03:08:17.000Z,0
2017-12-13T14:12:41.000Z,IC_lnyn2R2Q,THE 15:17 TO PARIS - Official Trailer [HD],"Hey Clint, thanks for making movies that inspire us to be better human beings.",2018-02-01T01:49:29.000Z,2
2017-12-13T14:12:41.000Z,IC_lnyn2R2Q,THE 15:17 TO PARIS - Official Trailer [HD],"It's so awesome that real people are used. Real heroes!!!   I'm so tired of the 10 actors that are constantly used in Hollywood and did I say tired of the nepotism?  So many of them have no value to society at all,  yet some want them to run for president? You are doing the good work, Mr. Eastwood.   Thank you!!",2018-02-01T00:06:26.000Z,1
2017-12-13T14:12:41.000Z,IC_lnyn2R2Q,THE 15:17 TO PARIS - Official Trailer [HD],"The voiceover is Les Brown, considered by most to be one of the world's best motivational speakers in the world today. i encourage everyone to listen to his speeches and read his background. This guy is truly inspirational and comes very much from humble beginnings.",2018-01-31T20:02:47.000Z,70
2017-12-13T14:12:41.000Z,IC_lnyn2R2Q,THE 15:17 TO PARIS - Official Trailer [HD],"a train in paris? where people are french and the ""only"" heroes are americans who casualty are soldiers,  you never get tired to pretend that youre the heroes in everything smh. Critics are going to destroy this movie mark my words.",2018-01-31T19:09:12.000Z,1
2017-12-13T14:12:41.000Z,IC_lnyn2R2Q,THE 15:17 TO PARIS - Official Trailer [HD],I just got to know today that the actors are the actual people who were in that incident. Now it is in my must watch list !,2018-01-31T16:52:10.000Z,37
2017-12-13T14:12:41.000Z,IC_lnyn2R2Q,THE 15:17 TO PARIS - Official Trailer [HD],Awesome 😎 I cant wait to watch this whole movie 👍,2018-01-31T14:17:27.000Z,2
2017-12-13T14:12:41.000Z,IC_lnyn2R2Q,THE 15:17 TO PARIS - Official Trailer [HD],"This should finally get the bad taste of ""The Last Jedi"" out of my mouth.",2018-01-31T14:10:54.000Z,2
2017-12-13T14:12:41.000Z,IC_lnyn2R2Q,THE 15:17 TO PARIS - Official Trailer [HD],I am crying. I wish these guys a happy and wonderful life. I would like to meet them.,2018-01-31T12:38:39.000Z,8
2017-12-13T14:12:41.000Z,IC_lnyn2R2Q,THE 15:17 TO PARIS - Official Trailer [HD],Anyone else find themselves holding their breaths about 3/4 in?,2018-01-31T06:59:01.000Z,0
2017-12-13T14:12:41.000Z,IC_lnyn2R2Q,THE 15:17 TO PARIS - Official Trailer [HD],1:35 is that a BB gun?!?,2018-01-31T04:38:55.000Z,0
2017-12-13T14:12:41.000Z,IC_lnyn2R2Q,THE 15:17 TO PARIS - Official Trailer [HD],This movie is soo racist.,2018-01-31T00:31:42.000Z,1
2017-12-13T14:12:41.000Z,IC_lnyn2R2Q,THE 15:17 TO PARIS - Official Trailer [HD],"Remember, Clint Eastwood was against Obama and most likely a Trump supporter.",2018-01-30T23:16:23.000Z,3
2017-12-13T14:12:41.000Z,IC_lnyn2R2Q,THE 15:17 TO PARIS - Official Trailer [HD],Today my teacher told us about this can’t wait to watch it,2018-01-30T22:00:35.000Z,0
2017-12-13T14:12:41.000Z,IC_lnyn2R2Q,THE 15:17 TO PARIS - Official Trailer [HD],Can't wait to see this one and to place my support behind Clint Eastwood for daring to air such a patriotic film!,2018-01-30T21:52:49.000Z,2
2017-12-13T14:12:41.000Z,IC_lnyn2R2Q,THE 15:17 TO PARIS - Official Trailer [HD],"Real story : Heroes from USA/France/UK stopped a terrorist the most amazing way, saving countless lives. The story according to this trailer : HELL YEAH AMERICA !! WE BREED OUR CHILDREN TO SAVE THE WORLD AND THAT'S WHAT THEY F*CKIN DO.",2018-01-30T19:45:41.000Z,2
2017-12-13T14:12:41.000Z,IC_lnyn2R2Q,THE 15:17 TO PARIS - Official Trailer [HD],just more propaganda,2018-01-30T19:28:24.000Z,8
2017-12-13T14:12:41.000Z,IC_lnyn2R2Q,THE 15:17 TO PARIS - Official Trailer [HD],"I love Clint Eastwood... 



Em I mean the ""old"" Clint Eastwood.",2018-01-30T15:34:17.000Z,1
2017-12-13T14:12:41.000Z,IC_lnyn2R2Q,THE 15:17 TO PARIS - Official Trailer [HD],Heroes  !! Merci !,2018-01-30T12:22:36.000Z,0
2017-12-13T14:12:41.000Z,IC_lnyn2R2Q,THE 15:17 TO PARIS - Official Trailer [HD],propaganda....,2018-01-30T12:01:58.000Z,2
2017-12-13T14:12:41.000Z,IC_lnyn2R2Q,THE 15:17 TO PARIS - Official Trailer [HD],"A lot of love in that movie.  What an amazing concept.  This world needs heroes. Clint Eastwood is a Legend and this is just what America needs right now, some real heroes.  Thank you Warner Bros. and Thank you Clint.  All respect.",2018-01-30T08:54:36.000Z,0
2017-12-13T14:12:41.000Z,IC_lnyn2R2Q,THE 15:17 TO PARIS - Official Trailer [HD],A movie about a 10 minute fight where 2 American lads disarmed a terrorist.  Jaysus... the propaganda mill must be running out of ideas or something.  USA USA USA etc etc etc.,2018-01-30T07:46:50.000Z,0
2017-12-13T14:12:41.000Z,IC_lnyn2R2Q,THE 15:17 TO PARIS - Official Trailer [HD],"Hmm its funny none of these guys had a gun and they were still able to stop a terrorist attack/shooting, yet those not in favor of gun laws state that being armed is a neccesity in stoping attacks.",2018-01-30T06:47:35.000Z,0
2017-12-13T14:12:41.000Z,IC_lnyn2R2Q,THE 15:17 TO PARIS - Official Trailer [HD],"I think its SOOO amazing that Clint cast the real life heroes in this! And that he actually took on a real life hero story to film! Cannot wait to support this film when it comes out! You’ve got my attendance in that theatre chair, sir.",2018-01-30T04:54:11.000Z,2
2017-12-13T14:12:41.000Z,IC_lnyn2R2Q,THE 15:17 TO PARIS - Official Trailer [HD],LOL THE WIKIPEDIA PAGE SAYS ROBBERY WAS HIS ONLY INTENT. BOI YOU DONT ROB SOMEONE WITH AN AK,2018-01-30T03:19:40.000Z,5
2017-12-13T14:12:41.000Z,IC_lnyn2R2Q,THE 15:17 TO PARIS - Official Trailer [HD],neonazi vs sexy terrorist... who will win?? lolololol,2018-01-30T03:04:52.000Z,0
2017-12-13T14:12:41.000Z,IC_lnyn2R2Q,THE 15:17 TO PARIS - Official Trailer [HD],Release date? Can't wait to see this.,2018-01-30T01:59:54.000Z,0
2017-12-13T14:12:41.000Z,IC_lnyn2R2Q,THE 15:17 TO PARIS - Official Trailer [HD],I can sense the butthurt of triggered leftard bastards over this lmfao,2018-01-29T22:14:46.000Z,7
2017-12-13T14:12:41.000Z,IC_lnyn2R2Q,THE 15:17 TO PARIS - Official Trailer [HD],"""Once you begin to discover who you are then you really realize how you have been given authority over your life. But you can only do that through the struggle of life, and most people are born to struggle. Most people go through life avoiding pain. When you’re working on a dream, at some point in time a transition takes place. You learn how to leap higher and you start challenging yourself to dig deeper. Something in you that you never activated lies dormant in there. Don’t try and take any shortcuts, do what you know is right. You’ve been chosen for this great work."" - unknown.",2018-01-29T22:10:26.000Z,0
2017-12-13T14:12:41.000Z,IC_lnyn2R2Q,THE 15:17 TO PARIS - Official Trailer [HD],Seeing this for Pam,2018-01-29T21:28:12.000Z,0
2017-12-13T14:12:41.000Z,IC_lnyn2R2Q,THE 15:17 TO PARIS - Official Trailer [HD],They actually used the real heroes for the movie. Love it! I can't wait to see it.,2018-01-29T20:19:57.000Z,8
2017-12-13T14:12:41.000Z,IC_lnyn2R2Q,THE 15:17 TO PARIS - Official Trailer [HD],Looking forward to seeing this,2018-01-29T18:52:29.000Z,1
2017-12-13T14:12:41.000Z,IC_lnyn2R2Q,THE 15:17 TO PARIS - Official Trailer [HD],"'Alex, shut the heck up'",2018-01-29T18:13:17.000Z,0
2017-12-13T14:12:41.000Z,IC_lnyn2R2Q,THE 15:17 TO PARIS - Official Trailer [HD],Spencer Stone (guy @ 0:18 seconds) looks just like Alexander Ludwig from Lone Survivor,2018-01-29T17:24:48.000Z,0
2017-12-13T14:12:41.000Z,IC_lnyn2R2Q,THE 15:17 TO PARIS - Official Trailer [HD],That's a great trailer.,2018-01-29T16:51:37.000Z,0
2017-12-13T14:12:41.000Z,IC_lnyn2R2Q,THE 15:17 TO PARIS - Official Trailer [HD],"American propaganda, again...",2018-01-29T12:58:34.000Z,2
2017-12-13T14:12:41.000Z,IC_lnyn2R2Q,THE 15:17 TO PARIS - Official Trailer [HD],"Im tired of these bullshit clint eastwood films that get baws pussys wet. Oh america, real actors, hero exageration stories. Why dont you show the other side where drones kill children and countries get torn apart. Clint would rather glorify soliders than tell the whole gd truth",2018-01-29T02:10:21.000Z,0
2017-12-13T14:12:41.000Z,IC_lnyn2R2Q,THE 15:17 TO PARIS - Official Trailer [HD],This trailer really makes you want to watch the movie.,2018-01-29T01:10:55.000Z,1
2017-12-13T14:12:41.000Z,IC_lnyn2R2Q,THE 15:17 TO PARIS - Official Trailer [HD],Crazy story god bless them,2018-01-29T00:40:14.000Z,1
2017-12-13T14:12:41.000Z,IC_lnyn2R2Q,THE 15:17 TO PARIS - Official Trailer [HD],Eastwood's death will be a national tragedy,2018-01-28T22:30:55.000Z,0
2017-12-13T14:12:41.000Z,IC_lnyn2R2Q,THE 15:17 TO PARIS - Official Trailer [HD],Clint is a true patriot ... he stands tall in the swamp,2018-01-28T22:22:00.000Z,193
2017-12-13T14:12:41.000Z,IC_lnyn2R2Q,THE 15:17 TO PARIS - Official Trailer [HD],"Awesome! Real life, not a liberal fantasy.",2018-01-28T22:20:24.000Z,1
2017-12-13T14:12:41.000Z,IC_lnyn2R2Q,THE 15:17 TO PARIS - Official Trailer [HD],"When I read the comments posted on this thread I am astonished  at the level of hatred, cold hearts and shear ignorance expressed.  NOW the question is who did I just insult, the haters, lovers or both?    Which are you and why?",2018-01-28T19:21:26.000Z,0
2017-12-13T14:12:41.000Z,IC_lnyn2R2Q,THE 15:17 TO PARIS - Official Trailer [HD],What event was this based on again?,2018-01-28T18:58:44.000Z,0
2017-12-13T14:12:41.000Z,IC_lnyn2R2Q,THE 15:17 TO PARIS - Official Trailer [HD],A L L A H --------------not this time!!,2018-01-28T18:52:46.000Z,1
2017-12-13T14:12:41.000Z,IC_lnyn2R2Q,THE 15:17 TO PARIS - Official Trailer [HD],hahahahahah are you serious??? This is gonna be so lame! Hollywood has no more creativity left.,2018-01-28T11:35:31.000Z,0
2017-12-13T14:12:41.000Z,IC_lnyn2R2Q,THE 15:17 TO PARIS - Official Trailer [HD],Army porn. recruitment tool. yawn.,2018-01-28T10:15:41.000Z,6
2017-12-13T14:12:41.000Z,IC_lnyn2R2Q,THE 15:17 TO PARIS - Official Trailer [HD],"Who’s the voice speaking? 
Sound familiar?",2018-01-28T07:53:58.000Z,0
2017-12-13T14:12:41.000Z,IC_lnyn2R2Q,THE 15:17 TO PARIS - Official Trailer [HD],"Alek, Spencer & Anthony: true American heroes.",2018-01-28T06:59:48.000Z,0
2017-12-13T14:12:41.000Z,IC_lnyn2R2Q,THE 15:17 TO PARIS - Official Trailer [HD],"I remember seeing this event on the news, these guys are real heroes",2018-01-28T05:00:00.000Z,0
2017-12-13T14:12:41.000Z,IC_lnyn2R2Q,THE 15:17 TO PARIS - Official Trailer [HD],Looks good,2018-01-28T04:15:12.000Z,0
2017-12-13T14:12:41.000Z,IC_lnyn2R2Q,THE 15:17 TO PARIS - Official Trailer [HD],They make movies about everything huh 😐,2018-01-28T00:51:42.000Z,1
2017-12-13T14:12:41.000Z,IC_lnyn2R2Q,THE 15:17 TO PARIS - Official Trailer [HD],Pam!,2018-01-27T23:52:02.000Z,0
2017-12-13T14:12:41.000Z,IC_lnyn2R2Q,THE 15:17 TO PARIS - Official Trailer [HD],"christ. This trailer got shoved in my face by youtube every 5-10 min it's so annoying. 

The only movie I've seen from clint eastwood is Gran Torino and that movie was hot garbage. This looks boring too. 

blah blah blah im so great im so important im so inspiring. Self-importance seems to be a theme in clint eastwood's movie. Gran Torino too he's like ""the savior"" of the weak and defenseless asain people. give me a break.. kinda what happens when you play so many heroic roles I guess. I respect him as an actor but not as a director

also, who gives a shit if the actors are the actual people? The point of movies (unless in document/actual footage types) is that it's all make believe to sell a message. It honestly doesn't matter at all and in fact, it makes it even weirder cus then it's like ""oh yeah im so great. I'll star in the movie that reminds people im so great"" imagine someone made a movie about how great trump is and they star trump himself. regardless of your political view, that would look so cocky. Like burns staring as burns in his own movie to glorify himself. 

Another thing is the performance might suffer. Take Gran Torino for example. The hmong people or whatever werent even actors and this one kid's acting was so shit it took me out of the movie. There's a dramatic scene where clint locks up this kid and the kid screams clint's name while banging the door. Go look it up. it's hilariously bad. That hmong blood sure helped the movie! Honestly, no one gives a shit if he's actually hmong or if a peson like walt actually existed. If ""they starred real people"" is what gets your movie remembered, then it's a bad movie.

I get it you people love clint eastwood. I like him too. just not the movie he directs

Also, what the fuck. i hate these movies where you already know this one major scene is coming up and the entire fucking movie is in an anticipation of that one scene. what's the point. 

I already know what the movie wants to say. i know what it's about. so by the end of the movie i wouldn't have learned anything new than how great this guy is. So boring. I watch documentaries for that and they're much more honest about what happened and cut the bullshit about melodramatic scenes in their life. 

Sorry I sound jaded but this damn trailer was shoved to my face for the past 2 weeks. it pissed me off",2018-01-27T17:47:05.000Z,0
2017-12-13T14:12:41.000Z,IC_lnyn2R2Q,THE 15:17 TO PARIS - Official Trailer [HD],"Superman and Batman aren’t heroes, but these guys, these guys are real heroes.",2018-01-27T17:24:05.000Z,2
2017-12-13T14:12:41.000Z,IC_lnyn2R2Q,THE 15:17 TO PARIS - Official Trailer [HD],Emotional and don't even know how the story ends! That's a trailer!!,2018-01-27T16:18:22.000Z,0
2017-12-13T14:12:41.000Z,IC_lnyn2R2Q,THE 15:17 TO PARIS - Official Trailer [HD],"Who is the speaker in the background speech?

Aloha!",2018-01-27T07:01:18.000Z,0
2017-12-13T14:12:41.000Z,IC_lnyn2R2Q,THE 15:17 TO PARIS - Official Trailer [HD],Fuk Hollywood fuck this movie and fuck the dirtyfilty jew s especially the men,2018-01-27T06:10:22.000Z,1
2017-12-13T14:12:41.000Z,IC_lnyn2R2Q,THE 15:17 TO PARIS - Official Trailer [HD],I'm gonna watch this movie cause I likes trains,2018-01-27T04:45:33.000Z,0
2017-12-13T14:12:41.000Z,IC_lnyn2R2Q,THE 15:17 TO PARIS - Official Trailer [HD],What's the speech delivered in the trailee,2018-01-27T04:08:29.000Z,0
2017-12-13T14:12:41.000Z,IC_lnyn2R2Q,THE 15:17 TO PARIS - Official Trailer [HD],BJJ!!,2018-01-27T02:54:18.000Z,0
2017-12-13T14:12:41.000Z,IC_lnyn2R2Q,THE 15:17 TO PARIS - Official Trailer [HD],Who is the inspirational speaker/preacher?,2018-01-27T02:48:24.000Z,0
2017-12-13T14:12:41.000Z,IC_lnyn2R2Q,THE 15:17 TO PARIS - Official Trailer [HD],how many of came just to see if it is really pam,2018-01-27T02:40:54.000Z,0
2017-12-13T14:12:41.000Z,IC_lnyn2R2Q,THE 15:17 TO PARIS - Official Trailer [HD],Finally a truly politically correct movie,2018-01-27T02:04:12.000Z,0
2017-12-13T14:12:41.000Z,IC_lnyn2R2Q,THE 15:17 TO PARIS - Official Trailer [HD],"Looks awful,  besides letters,  his latest filma have horrible writing and delivery,",2018-01-26T22:05:07.000Z,0
2017-12-13T14:12:41.000Z,IC_lnyn2R2Q,THE 15:17 TO PARIS - Official Trailer [HD],Clint Eastwood is a fellow Patriot and real Hollywood 🇺🇸🇺🇸🇺🇸,2018-01-26T21:57:40.000Z,0
2017-12-13T14:12:41.000Z,IC_lnyn2R2Q,THE 15:17 TO PARIS - Official Trailer [HD],Hoax,2018-01-26T19:59:47.000Z,4
2017-12-13T14:12:41.000Z,IC_lnyn2R2Q,THE 15:17 TO PARIS - Official Trailer [HD],Wow!!!! A movie that might get me back to a movie theater! Along with DeathWish with Bruce Willis,2018-01-26T18:41:32.000Z,0
2017-12-13T14:12:41.000Z,IC_lnyn2R2Q,THE 15:17 TO PARIS - Official Trailer [HD],"How do they plan to make this interesting?  Reading what ACTUALLY happened, one guy wrestled with the gunman and fell on the floor.  A middle aged Frenchman tried to wrestle the rifle away and the gunman shot him in the neck with a pistol.  The gunman's rifle jammed and that's when the three Americans jumped him.  One got cut up with a box cutter (almost got his thumb severed) but the others beat the gunman unconscious.

Not discrediting the heroic actions of the people involved, but essentially the guys rushed someone with a box cutter; the rifle jammed and the pistol was only used on the first guy, so in all it sounds like one shot was fired.  I know they didn't KNOW the rifle would jam but how do you convey drama on the screen?  It'd be like ""The gunman swings the gun towards the three young protagonists who's lives we've been following this whole movie...the gun jams and a beating ensues!!!""",2018-01-26T16:33:46.000Z,0
2017-12-13T14:12:41.000Z,IC_lnyn2R2Q,THE 15:17 TO PARIS - Official Trailer [HD],what another hit by Clint Eastwood...made my day!,2018-01-26T12:46:25.000Z,0
2017-12-13T14:12:41.000Z,IC_lnyn2R2Q,THE 15:17 TO PARIS - Official Trailer [HD],The fact that the actors are actually the guys to which it happened to them!!! Omg wouldn’t that trigger anxiety and stuff? Damn,2018-01-26T12:14:47.000Z,0
2017-12-13T14:12:41.000Z,IC_lnyn2R2Q,THE 15:17 TO PARIS - Official Trailer [HD],"What a terrible thing for Eastwood to do. Show young men serving their country and being brave.  Oh yes, and saving innocent lives to boot.  Hollyweirders don't live in the real world but one made of fairy tales and a hatred for America. When they get up to accept their awards I have to ask myself, do they really believe in the God that they are thanking? Or is their god Harvey Weinstein, as Meryl Streep called him. Stick to your ""craft"" and stop giving us advice on how to live and who to vote for. My vote goes to Clint Eastwood. Looking forward to seeing this movie and the 3 young heroes.",2018-01-26T07:11:21.000Z,1
2017-12-13T14:12:41.000Z,IC_lnyn2R2Q,THE 15:17 TO PARIS - Official Trailer [HD],shut up and take my money,2018-01-26T06:24:05.000Z,0
2017-12-13T14:12:41.000Z,IC_lnyn2R2Q,THE 15:17 TO PARIS - Official Trailer [HD],Damn all positive comments,2018-01-26T03:18:31.000Z,0
2017-12-13T14:12:41.000Z,IC_lnyn2R2Q,THE 15:17 TO PARIS - Official Trailer [HD],He is wearing the Bayern Munich Jersey....,2018-01-26T01:50:38.000Z,0
2017-12-13T14:12:41.000Z,IC_lnyn2R2Q,THE 15:17 TO PARIS - Official Trailer [HD],"Now I know what you're thinking, will he receive 5 Oscars or only 4!!! Do you feel liberal? Punk!",2018-01-26T00:31:17.000Z,0
2017-12-13T14:12:41.000Z,IC_lnyn2R2Q,THE 15:17 TO PARIS - Official Trailer [HD],Glad to see not all the youth has gone metro-sexual,2018-01-25T21:51:43.000Z,0
2017-12-13T14:12:41.000Z,IC_lnyn2R2Q,THE 15:17 TO PARIS - Official Trailer [HD],This looks like a steaming pile of shite,2018-01-25T17:49:03.000Z,2
2017-12-13T14:12:41.000Z,IC_lnyn2R2Q,THE 15:17 TO PARIS - Official Trailer [HD],"The thumbs down people have the disease liberalism!!!! Dont worry,we are very close to a cure!!    MAGA",2018-01-25T14:31:50.000Z,10
2017-12-13T14:12:41.000Z,IC_lnyn2R2Q,THE 15:17 TO PARIS - Official Trailer [HD],"Wonder who plays Chris Norman? Oh, wait, no one fucking plays Chris Norman, the 62 year old IT guy who helped pin the terrorist down and tied him up with his own tie. Because Chris Norman is English and we can't have that shit in Hollywood. Brits are strictly bad guys only. Fuck!",2018-01-25T13:04:28.000Z,1
2017-12-13T14:12:41.000Z,IC_lnyn2R2Q,THE 15:17 TO PARIS - Official Trailer [HD],"What a modivating speach, anyone know where to find it ?",2018-01-25T06:52:26.000Z,2
2017-12-13T14:12:41.000Z,IC_lnyn2R2Q,THE 15:17 TO PARIS - Official Trailer [HD],I want to go to war and save lives. Wtf? No! Translation: I want to go to war and take lives.  BS propaganda hollyweird vomit in my mouth.,2018-01-25T02:30:56.000Z,1
2017-12-13T14:12:41.000Z,IC_lnyn2R2Q,THE 15:17 TO PARIS - Official Trailer [HD],Great way by Mr Eastwood to honor American heroes...,2018-01-24T21:57:48.000Z,24
