publish_time,Video ID,Title,Comment,updatedAt,likeCount
2016-05-10T16:02:06.000Z,z4l3-_yub5A,Queen of Katwe - Official Trailer,"I remember watching this movie in the cinema. After the movie ended, people just stuck. No one moved. They stayed after all screen turning black with nothing on it. It's first time for me, watching a movie when it's ended, people dont want move and seems busy with their own thoughts.",2016-11-24T02:10:45.000Z,0
2016-05-10T16:02:06.000Z,z4l3-_yub5A,Queen of Katwe - Official Trailer,made by a 5year old,2016-11-21T10:22:27.000Z,0
2016-05-10T16:02:06.000Z,z4l3-_yub5A,Queen of Katwe - Official Trailer,I'm laughing my fucking ass off at the insecure racist white people who dislike any sort of none-white attention and praise for Africans or any other sort of race other than their own. I don't see how the lack of melanin colour to prevent u from getting damage from the sun makes u more powerful than the other races which has a lot of it.,2016-11-21T04:20:24.000Z,7
2016-05-10T16:02:06.000Z,z4l3-_yub5A,Queen of Katwe - Official Trailer,I saw the full movie it was very good🎬,2016-11-13T17:37:09.000Z,0
2016-05-10T16:02:06.000Z,z4l3-_yub5A,Queen of Katwe - Official Trailer,"Tears came to my eyes watching the trailer, I can't be in public while I watch the actual movie...Looking forward to it",2016-11-13T16:55:39.000Z,0
2016-05-10T16:02:06.000Z,z4l3-_yub5A,Queen of Katwe - Official Trailer,"""Sometimes the place where you were sued to is not where you belong."" I cried hearing this coz I can relate.
I'm so inspired by the movie. I made a move and made my parents believe I can be a journalist without getting locked in our house in a serious boredom. Tomorrow, I'm officially leaving the town to compete for the newspaper.  Thanks, Disney!",2016-11-13T09:56:08.000Z,3
2016-05-10T16:02:06.000Z,z4l3-_yub5A,Queen of Katwe - Official Trailer,"i watched this today cause today at school we went to a theater and watched this movie,it was very good (CHECKMATE)",2016-11-10T01:09:23.000Z,0
2016-05-10T16:02:06.000Z,z4l3-_yub5A,Queen of Katwe - Official Trailer,Yes Mama Yam!,2016-11-09T02:23:44.000Z,1
2016-05-10T16:02:06.000Z,z4l3-_yub5A,Queen of Katwe - Official Trailer,I would like to have this on Blu-Ray for Christmas,2016-11-08T20:36:52.000Z,0
2016-05-10T16:02:06.000Z,z4l3-_yub5A,Queen of Katwe - Official Trailer,Song ?,2016-11-04T18:42:03.000Z,0
2016-05-10T16:02:06.000Z,z4l3-_yub5A,Queen of Katwe - Official Trailer,Disney is doing a shitty job of marketing this movie. I only found out about it from a poster in the corner of the cinema.,2016-11-03T19:29:37.000Z,24
2016-05-10T16:02:06.000Z,z4l3-_yub5A,Queen of Katwe - Official Trailer,The feels in this!!,2016-11-02T18:56:52.000Z,0
2016-05-10T16:02:06.000Z,z4l3-_yub5A,Queen of Katwe - Official Trailer,After watching the trailer..i feel like i watched the whole movie...,2016-11-02T02:20:47.000Z,1
2016-05-10T16:02:06.000Z,z4l3-_yub5A,Queen of Katwe - Official Trailer,this movie is all about me...Christina..k..people say l can't reach me dreams..but I say I will get it mi way.coz LM queen bee baby.this is to all who say we can make it to the top.coz we will never drop.,2016-11-01T22:51:28.000Z,0
2016-05-10T16:02:06.000Z,z4l3-_yub5A,Queen of Katwe - Official Trailer,Evolution of Disney !!! I really cant wait to watch this movie.,2016-10-29T18:24:39.000Z,1
2016-05-10T16:02:06.000Z,z4l3-_yub5A,Queen of Katwe - Official Trailer,this is the best movie I have ever seen in my life. it deserves more than an Oscar,2016-10-29T11:13:04.000Z,1
2016-05-10T16:02:06.000Z,z4l3-_yub5A,Queen of Katwe - Official Trailer,This movie was amazing. The only thing I fear is that many will not go and see it because it hasn't really been broadcasted widely.,2016-10-29T04:05:32.000Z,1
2016-05-10T16:02:06.000Z,z4l3-_yub5A,Queen of Katwe - Official Trailer,I cant wait to watch this!!!,2016-10-28T02:28:16.000Z,1
2016-05-10T16:02:06.000Z,z4l3-_yub5A,Queen of Katwe - Official Trailer,i watched this and OH MY GODVSHJSJSNE BEST MOVIE EVER,2016-10-27T22:48:18.000Z,0
2016-05-10T16:02:06.000Z,z4l3-_yub5A,Queen of Katwe - Official Trailer,HWERE U GO #INDIA #MIRA NAIR,2016-10-27T17:54:47.000Z,0
2016-05-10T16:02:06.000Z,z4l3-_yub5A,Queen of Katwe - Official Trailer,I saw the movie today. It was absolutely beautiful. I highly recommend it.,2016-10-26T20:08:51.000Z,7
2016-05-10T16:02:06.000Z,z4l3-_yub5A,Queen of Katwe - Official Trailer,. . . . somebody tell me the name of the song,2016-10-25T19:01:33.000Z,0
2016-05-10T16:02:06.000Z,z4l3-_yub5A,Queen of Katwe - Official Trailer,I watched it already and it is so coooooool☺😭😭😭😭,2016-10-25T17:27:00.000Z,0
2016-05-10T16:02:06.000Z,z4l3-_yub5A,Queen of Katwe - Official Trailer,"Gosh... When they played the instrumental of Thick Skin by Leona Lewis , I began to cry! Love that song!",2016-10-24T23:21:11.000Z,0
2016-05-10T16:02:06.000Z,z4l3-_yub5A,Queen of Katwe - Official Trailer,OMG UGANDA 🇺🇬,2016-10-24T15:23:00.000Z,0
2016-05-10T16:02:06.000Z,z4l3-_yub5A,Queen of Katwe - Official Trailer,"I just laugh how people say this movie will be horrible and suddenly find it good, I mean, for some people.",2016-10-24T12:47:57.000Z,0
2016-05-10T16:02:06.000Z,z4l3-_yub5A,Queen of Katwe - Official Trailer,Is this coming out in UK? ;-; I would reaallly like to see this!! It looks amazing <3,2016-10-23T16:40:17.000Z,0
2016-05-10T16:02:06.000Z,z4l3-_yub5A,Queen of Katwe - Official Trailer,"cancer, aids, crippling depression",2016-10-23T12:18:49.000Z,1
2016-05-10T16:02:06.000Z,z4l3-_yub5A,Queen of Katwe - Official Trailer,What an amazing film. It looks so beautiful and it has such a beautiful story!,2016-10-21T23:09:16.000Z,0
2016-05-10T16:02:06.000Z,z4l3-_yub5A,Queen of Katwe - Official Trailer,"I just read the book, I didn't think the mother would be wearing something so expensive looking.",2016-10-21T17:43:34.000Z,0
2016-05-10T16:02:06.000Z,z4l3-_yub5A,Queen of Katwe - Official Trailer,it's out today 😄😃😊,2016-10-21T15:42:31.000Z,0
2016-05-10T16:02:06.000Z,z4l3-_yub5A,Queen of Katwe - Official Trailer,I watched this movie and 1)I almost cried😭😭 2)I love this movie 💛💛,2016-10-21T08:49:49.000Z,0
2016-05-10T16:02:06.000Z,z4l3-_yub5A,Queen of Katwe - Official Trailer,"even if disney's marketing skills are terrible, im deffo seeing this movie. it had me choking with emotion.",2016-10-21T08:12:29.000Z,0
2016-05-10T16:02:06.000Z,z4l3-_yub5A,Queen of Katwe - Official Trailer,"Lupita Nyong'o isn't really that gorgeous at all. Just because someone else told you she is, why is that now your opinion? Maybe you like the IDEA of her being gorgeous, but she just ain't and you know it. Stop frontin'.",2016-10-20T10:33:13.000Z,0
2016-05-10T16:02:06.000Z,z4l3-_yub5A,Queen of Katwe - Official Trailer,I'm not gonna cry IM NOT! I I 😣😣😢😢😢😢😢,2016-10-19T15:27:19.000Z,0
2016-05-10T16:02:06.000Z,z4l3-_yub5A,Queen of Katwe - Official Trailer,name of the song in this trailer?,2016-10-19T14:42:56.000Z,0
2016-05-10T16:02:06.000Z,z4l3-_yub5A,Queen of Katwe - Official Trailer,Тhis mооооvie is now аvаааilаblе tооо wаtсh hеre => https://twitter.com/69615231bb798c79f/status/787871663362744320                                                               Queеn of Каtwееее   ООffiсiаl Тrаilеr,2016-10-17T04:37:25.000Z,0
2016-05-10T16:02:06.000Z,z4l3-_yub5A,Queen of Katwe - Official Trailer,This movie gave so much life! A must see for all girls in every nation. Beautiful. #WeAreOne,2016-10-16T15:59:11.000Z,0
2016-05-10T16:02:06.000Z,z4l3-_yub5A,Queen of Katwe - Official Trailer,excellent movie,2016-10-16T05:13:36.000Z,0
2016-05-10T16:02:06.000Z,z4l3-_yub5A,Queen of Katwe - Official Trailer,"""Use your minds""",2016-10-16T03:18:07.000Z,0
2016-05-10T16:02:06.000Z,z4l3-_yub5A,Queen of Katwe - Official Trailer,It looks good but I don't wanna see it because the trailer basically showed me the whole movie,2016-10-15T21:57:03.000Z,0
2016-05-10T16:02:06.000Z,z4l3-_yub5A,Queen of Katwe - Official Trailer,I am disappointed with the theme songs lack of African or Ugandan feel to it.,2016-10-15T12:15:47.000Z,0
2016-05-10T16:02:06.000Z,z4l3-_yub5A,Queen of Katwe - Official Trailer,No white Saviors in sight,2016-10-15T00:46:48.000Z,7
2016-05-10T16:02:06.000Z,z4l3-_yub5A,Queen of Katwe - Official Trailer,I'm looking forward to seeing this.,2016-10-14T19:00:03.000Z,0
2016-05-10T16:02:06.000Z,z4l3-_yub5A,Queen of Katwe - Official Trailer,ZzZ not enough s ex lol,2016-10-14T04:52:08.000Z,0
2016-05-10T16:02:06.000Z,z4l3-_yub5A,Queen of Katwe - Official Trailer,as it is called music?,2016-10-14T02:32:28.000Z,0
2016-05-10T16:02:06.000Z,z4l3-_yub5A,Queen of Katwe - Official Trailer,It flooped,2016-10-14T00:55:17.000Z,0
2016-05-10T16:02:06.000Z,z4l3-_yub5A,Queen of Katwe - Official Trailer,It's still is pretty cool,2016-10-13T23:09:26.000Z,0
2016-05-10T16:02:06.000Z,z4l3-_yub5A,Queen of Katwe - Official Trailer,"A must watch movie, thank you Disney!",2016-10-13T22:58:34.000Z,0
2016-05-10T16:02:06.000Z,z4l3-_yub5A,Queen of Katwe - Official Trailer,it never came to my town,2016-10-12T16:30:07.000Z,0
2016-05-10T16:02:06.000Z,z4l3-_yub5A,Queen of Katwe - Official Trailer,SO EXCITED FOR THIS MOVIE,2016-10-12T16:15:28.000Z,0
2016-05-10T16:02:06.000Z,z4l3-_yub5A,Queen of Katwe - Official Trailer,✊,2016-10-12T15:01:40.000Z,0
2016-05-10T16:02:06.000Z,z4l3-_yub5A,Queen of Katwe - Official Trailer,Most of these comments are too sad.. this movie is amazing. Am glad that my country was represented well. #proudugandan,2016-10-12T07:14:05.000Z,0
2016-05-10T16:02:06.000Z,z4l3-_yub5A,Queen of Katwe - Official Trailer,I saw this movie yesterday and I so enjoyed watching this uplifting film!!!,2016-10-11T18:05:00.000Z,0
2016-05-10T16:02:06.000Z,z4l3-_yub5A,Queen of Katwe - Official Trailer,How come I didn't hear of that movie sooner!!!!,2016-10-10T23:40:36.000Z,0
2016-05-10T16:02:06.000Z,z4l3-_yub5A,Queen of Katwe - Official Trailer,"Her Chess rating aside, her ability to overcome her personal and social limitations should be enough to be impressed with  her. You know, the point most often lost in this stories is the odds against which the people in them rise above their situation. In her case it is pretty impressive to be a candidate from grand MASTER COMING FROM WHERE SHE DID. Does she has a long way to go?, SURE but at least she started going there one day maybe. I loved the casting and the great job of the leads (her mother, her and her coach). the movie is very moving too and well shot too.",2016-10-10T22:43:17.000Z,3
2016-05-10T16:02:06.000Z,z4l3-_yub5A,Queen of Katwe - Official Trailer,"Great job Disney! Make more films like this, I thoroughly enjoyed it!  ONE LOVE!",2016-10-10T18:38:58.000Z,0
2016-05-10T16:02:06.000Z,z4l3-_yub5A,Queen of Katwe - Official Trailer,This movie was so good!! I didn't want it to end.,2016-10-10T16:45:52.000Z,0
2016-05-10T16:02:06.000Z,z4l3-_yub5A,Queen of Katwe - Official Trailer,awesome movie,2016-10-10T16:32:48.000Z,0
2016-05-10T16:02:06.000Z,z4l3-_yub5A,Queen of Katwe - Official Trailer,awesome movie,2016-10-10T16:32:39.000Z,0
2016-05-10T16:02:06.000Z,z4l3-_yub5A,Queen of Katwe - Official Trailer,it's not just for the hardship of this girl. I am in Jamaica and I can relate. can't wait for this movie to reach cinemas here.,2016-10-10T14:38:04.000Z,0
2016-05-10T16:02:06.000Z,z4l3-_yub5A,Queen of Katwe - Official Trailer,"It's a pity that this trailer is marred by such a crappy, emotionally forced, cookie-cutter pop song.",2016-10-10T13:48:24.000Z,0
2016-05-10T16:02:06.000Z,z4l3-_yub5A,Queen of Katwe - Official Trailer,Excellent movie.,2016-10-09T21:20:00.000Z,0
2016-05-10T16:02:06.000Z,z4l3-_yub5A,Queen of Katwe - Official Trailer,Flop! The movie,2016-10-09T20:52:18.000Z,0
2016-05-10T16:02:06.000Z,z4l3-_yub5A,Queen of Katwe - Official Trailer,My girl Leona Lewis getting hers...The song's name is Thick Skin - Leona Lewis. for anybody who's interested. Love her.,2016-10-09T07:19:32.000Z,3
2016-05-10T16:02:06.000Z,z4l3-_yub5A,Queen of Katwe - Official Trailer,I'M NOT CRYING SHUT UP,2016-10-09T02:16:09.000Z,45
2016-05-10T16:02:06.000Z,z4l3-_yub5A,Queen of Katwe - Official Trailer,"I really like black people because they are honest and real , not like the white who are hypocritices",2016-10-08T13:44:43.000Z,4
2016-05-10T16:02:06.000Z,z4l3-_yub5A,Queen of Katwe - Official Trailer,Can't wait to see this movie !,2016-10-08T03:15:30.000Z,0
2016-05-10T16:02:06.000Z,z4l3-_yub5A,Queen of Katwe - Official Trailer,It doesn't matter that she wasnt the greatest chess player in the world-it matters that it helped her become something better than her current situation...thats what this beautiful movie is about.,2016-10-07T23:25:31.000Z,0
2016-05-10T16:02:06.000Z,z4l3-_yub5A,Queen of Katwe - Official Trailer,Whats's the song in the trailer? Can't get it out of my head!!,2016-10-07T18:23:12.000Z,0
2016-05-10T16:02:06.000Z,z4l3-_yub5A,Queen of Katwe - Official Trailer,i am really proud of mira nair.,2016-10-07T14:09:34.000Z,0
2016-05-10T16:02:06.000Z,z4l3-_yub5A,Queen of Katwe - Official Trailer,I like chess,2016-10-07T13:54:59.000Z,0
2016-05-10T16:02:06.000Z,z4l3-_yub5A,Queen of Katwe - Official Trailer,I can't wait to see this movie,2016-10-07T13:27:14.000Z,0
2016-05-10T16:02:06.000Z,z4l3-_yub5A,Queen of Katwe - Official Trailer,Typical.,2016-10-07T12:11:38.000Z,0
2016-05-10T16:02:06.000Z,z4l3-_yub5A,Queen of Katwe - Official Trailer,"This is by far the worst movie that exists. It's sole purpose is to give
 people cancer and to shit on intellectual whites. I am 100% sure this movie
 was made only to launder money to the Clintons, there is no way that a 
movie could possibly be this bad unintentionally. Was this director the 
kid that sat on the bench eating miracle whip while the other kids 
played kickball, and this is his sick twisted way of getting revenge on 
those kids by making their kids watch this piece of garbage? I 
accidentally let my dachshund view a short portion of this filth, and 
now it works for Air Bud entertainment. Lupita, how did you stoop
 so low? You were a slave and now you're a fat 
out of work actor that can't even raise money on kickstarter and has to 
go to its shitty knockoff indiegogo to get paid for this deplorable 
piece of waste. You should have died when you got caught drinking and 
driving so we would have a piece of you to look back fondly upon, now 
all your fans see is a fat actor that can't even star in a real movie. 
Shame on you Luzika and everyone else involved in this 
trainwreck, I hope you all never find work again, and your families 
recognize you as the sub human fecal matter that you are.",2016-10-07T10:04:07.000Z,1
2016-05-10T16:02:06.000Z,z4l3-_yub5A,Queen of Katwe - Official Trailer,I'm watching this on a school field trip,2016-10-06T22:05:34.000Z,0
2016-05-10T16:02:06.000Z,z4l3-_yub5A,Queen of Katwe - Official Trailer,what's name of song played in trailer,2016-10-06T16:36:01.000Z,0
2016-05-10T16:02:06.000Z,z4l3-_yub5A,Queen of Katwe - Official Trailer,Man I already started tearing up at the trailer. Looks so good.,2016-10-06T13:02:09.000Z,0
2016-05-10T16:02:06.000Z,z4l3-_yub5A,Queen of Katwe - Official Trailer,"I will be going to this movie, and  I know without a  doubt it will be movie of the  year.",2016-10-06T12:56:48.000Z,0
2016-05-10T16:02:06.000Z,z4l3-_yub5A,Queen of Katwe - Official Trailer,"What is with all the trolls? Oh right, it's a black movie set in Africa, some ""people"" and I use that word loosely, must find something wrong with it. Why are they called trolls, anyway, when maggots would be a a more apt description - ""a pale thing that feeds on shit""",2016-10-06T12:03:27.000Z,0
2016-05-10T16:02:06.000Z,z4l3-_yub5A,Queen of Katwe - Official Trailer,"Just saw this movie. Inspiration galore! Lupita and David slayed! There were so many touching moments conveyed with just a look, an action, a scene... It was funny; it was sad; it was cute; it was heartbreaking; it was joyful. Roller coaster of emotions. I might not be able to watch any other movie for a while. That's how deep this movie was.",2016-10-06T11:52:43.000Z,0
2016-05-10T16:02:06.000Z,z4l3-_yub5A,Queen of Katwe - Official Trailer,What is the song pls?,2016-10-06T06:46:44.000Z,0
2016-05-10T16:02:06.000Z,z4l3-_yub5A,Queen of Katwe - Official Trailer,"Fuck you haters. This movie isnt about you. Trust westerners to include ELO ratings and IQ tests and what fuckall measurements they enjoy taking after carpet bombing everyone else. Ita about uganda and about her life. Not about stupid ELO ratings. And when were Americans good at chess, last i heard russians dominated chess and then an Indian and then a norwegian. So fuck you haters.",2016-10-06T05:09:09.000Z,2
2016-05-10T16:02:06.000Z,z4l3-_yub5A,Queen of Katwe - Official Trailer,The trailer made me cry...I'm scared to watch the movie now.,2016-10-06T04:42:27.000Z,0
2016-05-10T16:02:06.000Z,z4l3-_yub5A,Queen of Katwe - Official Trailer,Just saw this movie yesterday and it's by far the best movie I've ever seen rate 11/10 for me I definitely recommend seeing it,2016-10-06T04:06:22.000Z,101
2016-05-10T16:02:06.000Z,z4l3-_yub5A,Queen of Katwe - Official Trailer,harembe is so proud in her grave,2016-10-06T00:46:37.000Z,0
2016-05-10T16:02:06.000Z,z4l3-_yub5A,Queen of Katwe - Official Trailer,we,2016-10-06T00:35:17.000Z,0
2016-05-10T16:02:06.000Z,z4l3-_yub5A,Queen of Katwe - Official Trailer,we wuz high iq and shiiit,2016-10-06T00:35:07.000Z,0
2016-05-10T16:02:06.000Z,z4l3-_yub5A,Queen of Katwe - Official Trailer,Could not wait to see this movie and it did not let me down! The message was inspiring.,2016-10-05T23:44:28.000Z,0
2016-05-10T16:02:06.000Z,z4l3-_yub5A,Queen of Katwe - Official Trailer,Fuck y'all haters,2016-10-05T03:23:45.000Z,0
2016-05-10T16:02:06.000Z,z4l3-_yub5A,Queen of Katwe - Official Trailer,This looks wonderful! I will take my family to see this for sure!!,2016-10-04T23:29:05.000Z,0
2016-05-10T16:02:06.000Z,z4l3-_yub5A,Queen of Katwe - Official Trailer,Looks like this will get quite an award for being funny as fuck.,2016-10-04T23:04:59.000Z,0
2016-05-10T16:02:06.000Z,z4l3-_yub5A,Queen of Katwe - Official Trailer,WOW... its such a powerful story. Bigups!!!,2016-10-04T13:27:23.000Z,0
2016-05-10T16:02:06.000Z,z4l3-_yub5A,Queen of Katwe - Official Trailer,Thick Skin 🎶 by Leona Lewis is Amazing ❤,2016-10-04T10:55:23.000Z,0
2016-05-10T16:02:06.000Z,z4l3-_yub5A,Queen of Katwe - Official Trailer,aw this made me cry,2016-10-04T04:07:45.000Z,1
2016-05-10T16:02:06.000Z,z4l3-_yub5A,Queen of Katwe - Official Trailer,Double toasted brought me here,2016-10-04T03:32:48.000Z,0
2016-05-10T16:02:06.000Z,z4l3-_yub5A,Queen of Katwe - Official Trailer,THIS SOUNDTRACK on my channel with LYRICS!! #leonalewis #thickskin,2016-10-03T20:24:46.000Z,0
2016-05-10T16:02:06.000Z,z4l3-_yub5A,Queen of Katwe - Official Trailer,whaoh,2016-10-03T12:31:44.000Z,0
2016-05-10T16:02:06.000Z,z4l3-_yub5A,Queen of Katwe - Official Trailer,mind bending waiitng to see the movie,2016-10-03T06:22:33.000Z,0
2016-05-10T16:02:06.000Z,z4l3-_yub5A,Queen of Katwe - Official Trailer,no they did an amazing job marketing,2016-10-03T03:04:49.000Z,1
2016-05-10T16:02:06.000Z,z4l3-_yub5A,Queen of Katwe - Official Trailer,i got goosebumps,2016-10-03T01:32:00.000Z,4
2016-05-10T16:02:06.000Z,z4l3-_yub5A,Queen of Katwe - Official Trailer,I watched movie just today at the theatres and it was so good and inspiring!  best movie ever,2016-10-03T00:03:48.000Z,2
2016-05-10T16:02:06.000Z,z4l3-_yub5A,Queen of Katwe - Official Trailer,1:40 GET RKZT,2016-10-02T22:12:48.000Z,0
2016-05-10T16:02:06.000Z,z4l3-_yub5A,Queen of Katwe - Official Trailer,No not again ......i smell another Oscar,2016-10-02T20:50:06.000Z,0
2016-05-10T16:02:06.000Z,z4l3-_yub5A,Queen of Katwe - Official Trailer,Amazing Film👏🏽Disney Well Done👏🏽,2016-10-02T11:01:06.000Z,0
2016-05-10T16:02:06.000Z,z4l3-_yub5A,Queen of Katwe - Official Trailer,"Women can't play chess. Black women REALLY can't play chess. The star of this film has Fide ranking of only 1600. In other words, she totally sucks and could be easily beaten by most of the hoboes in a local park. No wonder this sack of shit bombed at the box office.",2016-10-02T04:30:31.000Z,0
2016-05-10T16:02:06.000Z,z4l3-_yub5A,Queen of Katwe - Official Trailer,such an awesome movie! thank you Disney for giving the platform to one of the many beautiful African stories 👍👌,2016-10-02T02:15:27.000Z,0
2016-05-10T16:02:06.000Z,z4l3-_yub5A,Queen of Katwe - Official Trailer,lol katwe is not rural Uganda,2016-10-02T00:30:37.000Z,0
2016-05-10T16:02:06.000Z,z4l3-_yub5A,Queen of Katwe - Official Trailer,who wants to see a movie bout chess😂😂,2016-10-01T23:53:56.000Z,0
2016-05-10T16:02:06.000Z,z4l3-_yub5A,Queen of Katwe - Official Trailer,The movie is awesome.  I just got home from watching it.  Is it perfect?  Almost.  I look forward to numerous awards nominations.,2016-10-01T22:32:47.000Z,0
2016-05-10T16:02:06.000Z,z4l3-_yub5A,Queen of Katwe - Official Trailer,why i'm tearing ?,2016-10-01T20:36:41.000Z,0
2016-05-10T16:02:06.000Z,z4l3-_yub5A,Queen of Katwe - Official Trailer,"“*Sometimes the place we are use to*, is not the place you belong.  You belong where you believe you belong…
-
*WHERE IS THAT FOR YOU*?”",2016-10-01T18:28:50.000Z,0
2016-05-10T16:02:06.000Z,z4l3-_yub5A,Queen of Katwe - Official Trailer,Lol The add that I am seeing is the trailer for the movie. I am trying to watch the trailer for god sake. An ad for the video I am about to watch. Lol,2016-10-01T17:34:30.000Z,0
2016-05-10T16:02:06.000Z,z4l3-_yub5A,Queen of Katwe - Official Trailer,"I gotta admit, it's a good Movie! I congrats to Disney and ESPN Films for this collaboration",2016-10-01T15:18:19.000Z,0
2016-05-10T16:02:06.000Z,z4l3-_yub5A,Queen of Katwe - Official Trailer,I watched this movie today and i give it a 10/10 👌👌,2016-10-01T00:05:56.000Z,1
2016-05-10T16:02:06.000Z,z4l3-_yub5A,Queen of Katwe - Official Trailer,"Wee wuz kangs an quaanz!!!  LOL, my White azz!!!",2016-09-30T23:37:33.000Z,0
2016-05-10T16:02:06.000Z,z4l3-_yub5A,Queen of Katwe - Official Trailer,the movie is about more than chess.and I can respect that.  how can any one dislike somthing so postive and inspiring.,2016-09-30T17:40:21.000Z,3
2016-05-10T16:02:06.000Z,z4l3-_yub5A,Queen of Katwe - Official Trailer,Can someone please tell me the name of the song?,2016-09-30T13:07:49.000Z,2
2016-05-10T16:02:06.000Z,z4l3-_yub5A,Queen of Katwe - Official Trailer,more is still yet to come from uganda,2016-09-30T05:45:58.000Z,0
2016-05-10T16:02:06.000Z,z4l3-_yub5A,Queen of Katwe - Official Trailer,WE...,2016-09-29T22:51:54.000Z,1
2016-05-10T16:02:06.000Z,z4l3-_yub5A,Queen of Katwe - Official Trailer,"Bunch of ass hats who can't get over her rating of 1622. Maybe a) see the movie first, and b) realize that maybe it could be about a girl who escapes her circumstances by pursuing a dream when everyone was telling her she couldn't.",2016-09-29T22:33:05.000Z,107
2016-05-10T16:02:06.000Z,z4l3-_yub5A,Queen of Katwe - Official Trailer,"Lol , all people hating on this movie...got news for you....movies are not real!!! you might already know that there is not batman and no spider can make you a superhero.....but then it brings us the to the reality of your hate...and that is racism...you don't like it because somehow you think that its impossible for a african kid to become someone so you just hate on the concept of it.....while you happily watch any bullshit story which might or might not be 'inspired' by reality .",2016-09-29T22:16:44.000Z,44
2016-05-10T16:02:06.000Z,z4l3-_yub5A,Queen of Katwe - Official Trailer,I see that critics and audiences rate the movie very highly. The performances of Lupita and others are called outstanding. So it looks like those people posting Oscar wins  here were on target.,2016-09-29T20:40:51.000Z,1
2016-05-10T16:02:06.000Z,z4l3-_yub5A,Queen of Katwe - Official Trailer,My kids would rather watch something more about being a god damn kid.....,2016-09-29T15:23:00.000Z,0
2016-05-10T16:02:06.000Z,z4l3-_yub5A,Queen of Katwe - Official Trailer,love the song ever yes!!!,2016-09-29T11:43:30.000Z,0
2016-05-10T16:02:06.000Z,z4l3-_yub5A,Queen of Katwe - Official Trailer,"The ""We Wuz"" trolls are getting pathetically unoriginal. Scroll down and there's tons of comments that start like that. It's so lazy among other things.",2016-09-29T06:51:21.000Z,21
2016-05-10T16:02:06.000Z,z4l3-_yub5A,Queen of Katwe - Official Trailer,I am anxiously waiting to watch this movie.,2016-09-29T04:57:04.000Z,0
2016-05-10T16:02:06.000Z,z4l3-_yub5A,Queen of Katwe - Official Trailer,"Despite all of the negative and racist comments on this trailer, I believe that it looks very promising. I love adventure movies like these. I can't wait to watch it!",2016-09-28T23:19:20.000Z,1
2016-05-10T16:02:06.000Z,z4l3-_yub5A,Queen of Katwe - Official Trailer,"No disney in our home.For similar reasons there is no GSA, BSA.Corporations in bed with liberal political activists, ignoring children+their families.Until this is ended, no.",2016-09-28T15:14:17.000Z,1
2016-05-10T16:02:06.000Z,z4l3-_yub5A,Queen of Katwe - Official Trailer,"as an African child, l cant wait to watch this",2016-09-28T14:51:24.000Z,0
2016-05-10T16:02:06.000Z,z4l3-_yub5A,Queen of Katwe - Official Trailer,"What the fuck is this shit? If you want a great movie about chess prodigy, go watch 'Pawn Sacrifice'. Bobby Fischer is the epitome of chess genius.",2016-09-28T09:00:52.000Z,4
