publish_time,Video ID,Title,Comment,updatedAt,likeCount
2016-05-10T16:02:06.000Z,z4l3-_yub5A,Queen of Katwe - Official Trailer,Anyone know the name of the song? It goes beautifully with the trailer.,2016-08-07T16:39:37.000Z,6
2016-05-10T16:02:06.000Z,z4l3-_yub5A,Queen of Katwe - Official Trailer,im so gonna go see this movie!!! its so inspiring to be portrayed in a different continent,2016-08-07T00:25:47.000Z,0
2016-05-10T16:02:06.000Z,z4l3-_yub5A,Queen of Katwe - Official Trailer,"I love how colorful the culture is.

This looks like an amazing movie I can't wait!!!",2016-08-06T03:02:54.000Z,267
2016-05-10T16:02:06.000Z,z4l3-_yub5A,Queen of Katwe - Official Trailer,I want to see this so bad!!!!!!😆😆😆,2016-07-31T07:21:54.000Z,0
2016-05-10T16:02:06.000Z,z4l3-_yub5A,Queen of Katwe - Official Trailer,I think I just watched the trailer for next year's Best Picture winner.,2016-07-30T23:55:48.000Z,1
2016-05-10T16:02:06.000Z,z4l3-_yub5A,Queen of Katwe - Official Trailer,The song is called Thick Skin by Leona Lewis! It is taken from her empowering album I AM :),2016-07-30T00:52:33.000Z,1
2016-05-10T16:02:06.000Z,z4l3-_yub5A,Queen of Katwe - Official Trailer,Yes! Not a white savior in site!! So excited for this movie!,2016-07-28T13:27:46.000Z,0
2016-05-10T16:02:06.000Z,z4l3-_yub5A,Queen of Katwe - Official Trailer,I love you Africa with all my heart,2016-07-27T16:44:39.000Z,0
2016-05-10T16:02:06.000Z,z4l3-_yub5A,Queen of Katwe - Official Trailer,LETS GOOOO,2016-07-24T03:19:15.000Z,0
2016-05-10T16:02:06.000Z,z4l3-_yub5A,Queen of Katwe - Official Trailer,Why couldn't they get some black women with bigger afros..I'm sick of us looking hairless,2016-07-23T03:28:35.000Z,1
2016-05-10T16:02:06.000Z,z4l3-_yub5A,Queen of Katwe - Official Trailer,WE,2016-07-21T00:08:00.000Z,0
2016-05-10T16:02:06.000Z,z4l3-_yub5A,Queen of Katwe - Official Trailer,"I got the be apart of a special premiere of this movie, I had never heard of it before. I promise you all, this movie is so worth it, I would watch it again with my friends and family even though I've seen it already for free. Its worth every penny and Its very inspiring. I walked away from it learning that just because I was born and raised somewhere does not mean that I'm meant to spend the rest of my life there.",2016-07-20T20:34:10.000Z,21
2016-05-10T16:02:06.000Z,z4l3-_yub5A,Queen of Katwe - Official Trailer,i'm so ready for this,2016-07-20T08:37:13.000Z,0
2016-05-10T16:02:06.000Z,z4l3-_yub5A,Queen of Katwe - Official Trailer,So happy that they finally have a Uganda movie because I'm close from qatae 👍🏾👏🏾👏🏾👏🏾👏🏾,2016-07-19T01:44:12.000Z,0
2016-05-10T16:02:06.000Z,z4l3-_yub5A,Queen of Katwe - Official Trailer,oooh this looks really good,2016-07-14T18:09:11.000Z,0
2016-05-10T16:02:06.000Z,z4l3-_yub5A,Queen of Katwe - Official Trailer,This is going to be a life time movie.,2016-07-14T13:54:02.000Z,0
2016-05-10T16:02:06.000Z,z4l3-_yub5A,Queen of Katwe - Official Trailer,"My school donates to Uganda every year for different causes like food,clothes,shoes,schools,homes etc. Im so glad they have this amazing chance.This is the most amazing thing! I can't wait to see it. Thank You So Much!!",2016-07-14T07:31:17.000Z,1
2016-05-10T16:02:06.000Z,z4l3-_yub5A,Queen of Katwe - Official Trailer,yes disney needs to make more of these types of movies,2016-07-14T01:25:14.000Z,47
2016-05-10T16:02:06.000Z,z4l3-_yub5A,Queen of Katwe - Official Trailer,"I had a passage about Phiona's story in my state standardized test. It had me tearing up, because I was so inspired by her reliance, and her perseverance to prove to everyone that girls and boys can stand on equal terms. Makes me want to do something.",2016-07-13T23:06:04.000Z,0
2016-05-10T16:02:06.000Z,z4l3-_yub5A,Queen of Katwe - Official Trailer,I absolutely HAVE to see this!,2016-07-13T21:10:05.000Z,0
2016-05-10T16:02:06.000Z,z4l3-_yub5A,Queen of Katwe - Official Trailer,it better make me cry,2016-07-13T14:52:06.000Z,0
2016-05-10T16:02:06.000Z,z4l3-_yub5A,Queen of Katwe - Official Trailer,why did i get goosebumps?,2016-07-13T11:57:31.000Z,0
2016-05-10T16:02:06.000Z,z4l3-_yub5A,Queen of Katwe - Official Trailer,Is she a princess...if shes not I will be mad cause the first african princess is white,2016-07-13T11:52:22.000Z,0
2016-05-10T16:02:06.000Z,z4l3-_yub5A,Queen of Katwe - Official Trailer,This looks so beautiful!,2016-07-13T09:51:33.000Z,0
2016-05-10T16:02:06.000Z,z4l3-_yub5A,Queen of Katwe - Official Trailer,"I play chess and I'm African too, but I don't live or wasn't born in Africa only my parents were.",2016-07-13T02:29:43.000Z,1
2016-05-10T16:02:06.000Z,z4l3-_yub5A,Queen of Katwe - Official Trailer,I want to see this movie!,2016-07-12T22:43:49.000Z,0
2016-05-10T16:02:06.000Z,z4l3-_yub5A,Queen of Katwe - Official Trailer,what? couldn't find a ugandan song for the trailer?,2016-07-10T19:10:26.000Z,0
2016-05-10T16:02:06.000Z,z4l3-_yub5A,Queen of Katwe - Official Trailer,"Their accents are on point. 
Thanks Disney for not making another all white movie.",2016-07-09T19:57:39.000Z,0
2016-05-10T16:02:06.000Z,z4l3-_yub5A,Queen of Katwe - Official Trailer,"this movie looks promising, I hope it'll turn out to be oscar-worthy!",2016-07-07T22:05:16.000Z,0
2016-05-10T16:02:06.000Z,z4l3-_yub5A,Queen of Katwe - Official Trailer,Where are the ads for this movie? wheY THEY AT??,2016-07-07T21:48:58.000Z,0
2016-05-10T16:02:06.000Z,z4l3-_yub5A,Queen of Katwe - Official Trailer,I love chess can't wait to see this movie,2016-07-07T03:20:06.000Z,0
2016-05-10T16:02:06.000Z,z4l3-_yub5A,Queen of Katwe - Official Trailer,well....I'm crying,2016-07-06T03:24:14.000Z,0
2016-05-10T16:02:06.000Z,z4l3-_yub5A,Queen of Katwe - Official Trailer,This looks great!,2016-07-05T13:27:56.000Z,0
2016-05-10T16:02:06.000Z,z4l3-_yub5A,Queen of Katwe - Official Trailer,I hope Disney paid them well. We'll be looking into it...,2016-07-05T08:37:49.000Z,0
2016-05-10T16:02:06.000Z,z4l3-_yub5A,Queen of Katwe - Official Trailer,Did he shake her hand and wipe it on the tablecloth???????,2016-07-04T07:44:40.000Z,2
2016-05-10T16:02:06.000Z,z4l3-_yub5A,Queen of Katwe - Official Trailer,Wooooo this is going to be awesome,2016-07-03T19:53:09.000Z,0
2016-05-10T16:02:06.000Z,z4l3-_yub5A,Queen of Katwe - Official Trailer,looks awesome,2016-07-01T23:05:56.000Z,0
2016-05-10T16:02:06.000Z,z4l3-_yub5A,Queen of Katwe - Official Trailer,Omg why is this movie taking so long to come out I've been waiting foreverrrr!!,2016-07-01T21:05:04.000Z,0
2016-05-10T16:02:06.000Z,z4l3-_yub5A,Queen of Katwe - Official Trailer,I got goosebumps while watching the trailer!! Can't wait to watch the actual movie!!,2016-06-30T21:51:50.000Z,0
2016-05-10T16:02:06.000Z,z4l3-_yub5A,Queen of Katwe - Official Trailer,did i just watch the whole movie?!,2016-06-29T20:09:52.000Z,0
2016-05-10T16:02:06.000Z,z4l3-_yub5A,Queen of Katwe - Official Trailer,15 sec into the trailer and already hooting for her to have a epic future !!,2016-06-28T11:16:36.000Z,0
2016-05-10T16:02:06.000Z,z4l3-_yub5A,Queen of Katwe - Official Trailer,"these African women have beautiful facial features, anyway, now all the great things in black Africa, Disney wanna make a movie about a poor African girl playing fucking chess???? it makes noo sense! why not make a movie about the Benin, Yoruba, and Ibo kingdom?? why not make a movie of the great Sudanese empire?? why not make movie about the Orisha mythology in Nigeria??? it's so many kool things about our history as black Africans but they want to focus on poverty and pity. I spit and curse this damned movie.",2016-06-28T06:15:40.000Z,0
2016-05-10T16:02:06.000Z,z4l3-_yub5A,Queen of Katwe - Official Trailer,what's this song??,2016-06-28T02:27:13.000Z,0
2016-05-10T16:02:06.000Z,z4l3-_yub5A,Queen of Katwe - Official Trailer,yesss I'm taking my little cousins to see this awwww,2016-06-28T00:00:52.000Z,0
2016-05-10T16:02:06.000Z,z4l3-_yub5A,Queen of Katwe - Official Trailer,Where are my Zambians !!!!🇿🇲🇿🇲🇿🇲🇿🇲🇿🇲🇿🇲🇿🇲🇿🇲🇿🇲🇿🇲,2016-06-27T20:08:57.000Z,0
2016-05-10T16:02:06.000Z,z4l3-_yub5A,Queen of Katwe - Official Trailer,I can't wait,2016-06-27T19:52:24.000Z,0
2016-05-10T16:02:06.000Z,z4l3-_yub5A,Queen of Katwe - Official Trailer,no idea why but this brings such happy tears to my eyes.,2016-06-27T02:09:15.000Z,0
2016-05-10T16:02:06.000Z,z4l3-_yub5A,Queen of Katwe - Official Trailer,Sometimes the place you live is not the place you belong,2016-06-26T18:39:05.000Z,0
2016-05-10T16:02:06.000Z,z4l3-_yub5A,Queen of Katwe - Official Trailer,song?,2016-06-26T07:57:09.000Z,1
2016-05-10T16:02:06.000Z,z4l3-_yub5A,Queen of Katwe - Official Trailer,Can someone tell me the name of the song? Love it.,2016-06-25T16:28:23.000Z,0
2016-05-10T16:02:06.000Z,z4l3-_yub5A,Queen of Katwe - Official Trailer,it was 2 mins long and i'm arleady crying,2016-06-25T13:46:02.000Z,0
2016-05-10T16:02:06.000Z,z4l3-_yub5A,Queen of Katwe - Official Trailer,What is the song.,2016-06-23T12:40:29.000Z,0
2016-05-10T16:02:06.000Z,z4l3-_yub5A,Queen of Katwe - Official Trailer,👍👍👍👍👍👍👍👍🔥🔥🔥🔥🔥📚👑,2016-06-23T03:21:00.000Z,0
2016-05-10T16:02:06.000Z,z4l3-_yub5A,Queen of Katwe - Official Trailer,This trailer needs to go viral!,2016-06-23T01:47:16.000Z,0
2016-05-10T16:02:06.000Z,z4l3-_yub5A,Queen of Katwe - Official Trailer,Just finished reading the book...can't wait for the film! #oscarnom,2016-06-22T19:44:51.000Z,0
2016-05-10T16:02:06.000Z,z4l3-_yub5A,Queen of Katwe - Official Trailer,I can already see myself crying during this movie.,2016-06-21T20:27:20.000Z,0
2016-05-10T16:02:06.000Z,z4l3-_yub5A,Queen of Katwe - Official Trailer,"The book is rather incredible. If you've not read it, I highly recommend it. As a life long chess player, I'm proud to be apart of this game that invites anyone with riches or rags to be a master, if you have the heart to go for it. She worked so hard, went from the slums to parts of the world that she'd never heard of and saw things she didn't know existed. Yet, despite the intimidation from it all, she became a champion and an important symbol for women chess players. She's certainly a queen. :)",2016-06-21T14:10:38.000Z,1
2016-05-10T16:02:06.000Z,z4l3-_yub5A,Queen of Katwe - Official Trailer,David Oyelowo's accent is so believably Ugandan!!! Good job,2016-06-21T11:49:06.000Z,0
2016-05-10T16:02:06.000Z,z4l3-_yub5A,Queen of Katwe - Official Trailer,*Exhales at the end....love!!!,2016-06-19T16:18:59.000Z,4
2016-05-10T16:02:06.000Z,z4l3-_yub5A,Queen of Katwe - Official Trailer,"This trailer is so beautiful, can't wait to watch the film.",2016-06-19T10:19:34.000Z,0
2016-05-10T16:02:06.000Z,z4l3-_yub5A,Queen of Katwe - Official Trailer,thank you for saying the song name harry burnell,2016-06-18T20:55:53.000Z,0
2016-05-10T16:02:06.000Z,z4l3-_yub5A,Queen of Katwe - Official Trailer,"Did anyone saw this trailer during ""O.J. Made In America"" documentary?",2016-06-18T15:13:09.000Z,0
2016-05-10T16:02:06.000Z,z4l3-_yub5A,Queen of Katwe - Official Trailer,"Fairytales do not mean big castle, beautiful princess and her winning of prince charming. Fairytales mean a lot more than that. To be part of a fairytale , you don`t need to have any of the conventional Disney characteristics .You just have to believe in you and your dreams. Thanks Disney for breaking the mold you have created for years. Mira Nair kudos to you for this movie. Eagerly waiting for it .",2016-06-18T08:20:14.000Z,157
2016-05-10T16:02:06.000Z,z4l3-_yub5A,Queen of Katwe - Official Trailer,I'm African and this comes out on my birthday 😯,2016-06-17T20:22:19.000Z,0
2016-05-10T16:02:06.000Z,z4l3-_yub5A,Queen of Katwe - Official Trailer,Am proud to be a ugandan!,2016-06-17T19:28:09.000Z,0
2016-05-10T16:02:06.000Z,z4l3-_yub5A,Queen of Katwe - Official Trailer,"I have white north African that's from Libyan, but have 15 other nationalities.",2016-06-16T19:21:26.000Z,0
2016-05-10T16:02:06.000Z,z4l3-_yub5A,Queen of Katwe - Official Trailer,Ready to see this right now thank you Disney,2016-06-16T15:12:49.000Z,0
2016-05-10T16:02:06.000Z,z4l3-_yub5A,Queen of Katwe - Official Trailer,"Great I hope this movie gives hope to some little kid in some third world country that will never get to see this film, good going hollywood,how much did you make off that Tarzan movie?",2016-06-16T13:36:17.000Z,0
2016-05-10T16:02:06.000Z,z4l3-_yub5A,Queen of Katwe - Official Trailer,who is here for Leona Lewis? this song deserves to be No.1,2016-06-14T15:05:31.000Z,33
2016-05-10T16:02:06.000Z,z4l3-_yub5A,Queen of Katwe - Official Trailer,Cant waaaaaaiiiiiiiit😍😍😍😍,2016-06-13T02:38:44.000Z,0
2016-05-10T16:02:06.000Z,z4l3-_yub5A,Queen of Katwe - Official Trailer,the Gurl playing Fiona is beautiful,2016-06-13T00:24:24.000Z,0
2016-05-10T16:02:06.000Z,z4l3-_yub5A,Queen of Katwe - Official Trailer,this ginna awesome Can't wait til this comes out! in Sri Lanka  wooooooow,2016-06-10T18:48:40.000Z,0
2016-05-10T16:02:06.000Z,z4l3-_yub5A,Queen of Katwe - Official Trailer,Looks really good!,2016-06-09T22:59:30.000Z,0
2016-05-10T16:02:06.000Z,z4l3-_yub5A,Queen of Katwe - Official Trailer,I HAVE TO see this,2016-06-09T20:57:20.000Z,0
2016-05-10T16:02:06.000Z,z4l3-_yub5A,Queen of Katwe - Official Trailer,"Damn, I got teary eyed at a trailer.",2016-06-09T15:18:04.000Z,0
2016-05-10T16:02:06.000Z,z4l3-_yub5A,Queen of Katwe - Official Trailer,This is beautiful and the movie is going to be even more so :'),2016-06-08T17:00:34.000Z,0
2016-05-10T16:02:06.000Z,z4l3-_yub5A,Queen of Katwe - Official Trailer,This is gonna be a great one!!,2016-06-05T09:45:45.000Z,0
2016-05-10T16:02:06.000Z,z4l3-_yub5A,Queen of Katwe - Official Trailer,Can't wait for this one,2016-06-05T05:26:22.000Z,0
2016-05-10T16:02:06.000Z,z4l3-_yub5A,Queen of Katwe - Official Trailer,Inspiring and must watch <3,2016-06-04T05:02:54.000Z,0
2016-05-10T16:02:06.000Z,z4l3-_yub5A,Queen of Katwe - Official Trailer,Someone knows the song that play in 00:47s ?,2016-06-01T17:25:55.000Z,1
2016-05-10T16:02:06.000Z,z4l3-_yub5A,Queen of Katwe - Official Trailer,Shut UP!,2016-06-01T09:07:22.000Z,0
2016-05-10T16:02:06.000Z,z4l3-_yub5A,Queen of Katwe - Official Trailer,This looks amazing. Can't wait to see it!!!,2016-05-31T02:43:17.000Z,0
2016-05-10T16:02:06.000Z,z4l3-_yub5A,Queen of Katwe - Official Trailer,"This is a true story. This is a story that needs to be told, that needs to be heard.",2016-05-29T18:36:47.000Z,0
2016-05-10T16:02:06.000Z,z4l3-_yub5A,Queen of Katwe - Official Trailer,This is the right step for Disney! Proud and excited.,2016-05-29T18:32:36.000Z,0
2016-05-10T16:02:06.000Z,z4l3-_yub5A,Queen of Katwe - Official Trailer,Bout time,2016-05-28T21:40:02.000Z,0
2016-05-10T16:02:06.000Z,z4l3-_yub5A,Queen of Katwe - Official Trailer,"Phiona's story is such an amazing one, I hope this movie will live up to it!",2016-05-28T04:10:04.000Z,0
2016-05-10T16:02:06.000Z,z4l3-_yub5A,Queen of Katwe - Official Trailer,yay cant wait,2016-05-27T19:52:10.000Z,0
2016-05-10T16:02:06.000Z,z4l3-_yub5A,Queen of Katwe - Official Trailer,"Y'all should stop cutting those damn onions when I'm trying to watch your trailers, it makes my eyes wet, and now i need a tissue!",2016-05-26T21:49:22.000Z,33
2016-05-10T16:02:06.000Z,z4l3-_yub5A,Queen of Katwe - Official Trailer,ohhhhhh my God thank you thank you..........Disney,2016-05-26T16:24:58.000Z,0
2016-05-10T16:02:06.000Z,z4l3-_yub5A,Queen of Katwe - Official Trailer,when Uganda finally gets a good name in media 😭😭😭😭,2016-05-26T04:33:22.000Z,0
2016-05-10T16:02:06.000Z,z4l3-_yub5A,Queen of Katwe - Official Trailer,"This is motivating,Big Up you all Ugandans",2016-05-25T07:29:28.000Z,0
2016-05-10T16:02:06.000Z,z4l3-_yub5A,Queen of Katwe - Official Trailer,A colourful true story - exactly the description we wanted to use! This looks incredible and we can't wait to see it.,2016-05-24T15:35:06.000Z,0
2016-05-10T16:02:06.000Z,z4l3-_yub5A,Queen of Katwe - Official Trailer,she is so beautiful!,2016-05-24T04:09:04.000Z,0
2016-05-10T16:02:06.000Z,z4l3-_yub5A,Queen of Katwe - Official Trailer,oh my...I want to see it...this looks like a feel god movie....,2016-05-24T01:23:11.000Z,0
2016-05-10T16:02:06.000Z,z4l3-_yub5A,Queen of Katwe - Official Trailer,Calling it right now Lupita Nyong'o and David Oyelowo are wining an ocars,2016-05-24T01:17:33.000Z,77
2016-05-10T16:02:06.000Z,z4l3-_yub5A,Queen of Katwe - Official Trailer,This looks beautiful! All the hype!,2016-05-24T00:31:47.000Z,0
2016-05-10T16:02:06.000Z,z4l3-_yub5A,Queen of Katwe - Official Trailer,Leona Lewis <3,2016-05-24T00:24:09.000Z,4
2016-05-10T16:02:06.000Z,z4l3-_yub5A,Queen of Katwe - Official Trailer,"Okay, now this is how you reach a global market. You tell the story of a young woman whose life is like the majority of the world. And yet, Grace gave her an astounding opportunity. Faith, Hope, and Love. Excellence.",2016-05-23T21:45:58.000Z,23
2016-05-10T16:02:06.000Z,z4l3-_yub5A,Queen of Katwe - Official Trailer,Can't wait to see this 😊,2016-05-23T21:43:58.000Z,0
2016-05-10T16:02:06.000Z,z4l3-_yub5A,Queen of Katwe - Official Trailer,was that my Queen Leona Lewis singing,2016-05-23T18:53:27.000Z,40
2016-05-10T16:02:06.000Z,z4l3-_yub5A,Queen of Katwe - Official Trailer,"Brilliant, absolutely brilliant..  Kudos to William Wheeler, Mira Nair, actors and producers.  Thank you for bringing this story to us.  Pore raising..",2016-05-23T15:28:04.000Z,0
2016-05-10T16:02:06.000Z,z4l3-_yub5A,Queen of Katwe - Official Trailer,I had goosebumps. Can't wait to see this movie,2016-05-23T14:53:41.000Z,0
2016-05-10T16:02:06.000Z,z4l3-_yub5A,Queen of Katwe - Official Trailer,so so so Touching cant wait to see this,2016-05-23T04:18:00.000Z,0
2016-05-10T16:02:06.000Z,z4l3-_yub5A,Queen of Katwe - Official Trailer,"I don't go to the movies, but I will for this! I just need to get my eyes clear so I can see it. LOL I was crying like a baby watching this trailer. I love the wonderment and sparkle in the eyes of children when they find their niche and go for it. That is priceless. Especially when it's #BlackGirlsMagic. <3",2016-05-22T17:07:44.000Z,0
2016-05-10T16:02:06.000Z,z4l3-_yub5A,Queen of Katwe - Official Trailer,i literally started bawling,2016-05-22T13:02:13.000Z,0
2016-05-10T16:02:06.000Z,z4l3-_yub5A,Queen of Katwe - Official Trailer,"After watching exciting and thrilling roller caster ride along movies like Captain America Civil War...
I like to come down to earth with these sensitive and very human stories like 
In these trailers.",2016-05-22T01:46:24.000Z,0
2016-05-10T16:02:06.000Z,z4l3-_yub5A,Queen of Katwe - Official Trailer,*Esta película estará muy buena. Setiembre te espero con ansias.*,2016-05-21T17:05:22.000Z,0
2016-05-10T16:02:06.000Z,z4l3-_yub5A,Queen of Katwe - Official Trailer,proud to be indian...... indian lady director yooooooooooooo ... film by indian.........,2016-05-20T06:26:24.000Z,0
2016-05-10T16:02:06.000Z,z4l3-_yub5A,Queen of Katwe - Official Trailer,110 DISLIKES FOR WHAT,2016-05-20T00:46:56.000Z,2
2016-05-10T16:02:06.000Z,z4l3-_yub5A,Queen of Katwe - Official Trailer,I'm trying so hard to not sob too loudly so I don't miss a minute of the trailer. <3,2016-05-19T23:07:30.000Z,11
2016-05-10T16:02:06.000Z,z4l3-_yub5A,Queen of Katwe - Official Trailer,"Eagerly waiting for this movie, must be great...",2016-05-19T17:30:31.000Z,0
2016-05-10T16:02:06.000Z,z4l3-_yub5A,Queen of Katwe - Official Trailer,Proudly African!!!!!!!,2016-05-19T16:18:27.000Z,160
2016-05-10T16:02:06.000Z,z4l3-_yub5A,Queen of Katwe - Official Trailer,finally Uganda is shown to the world in a Disney movie for the first time. this is awesome.,2016-05-19T05:38:06.000Z,0
2016-05-10T16:02:06.000Z,z4l3-_yub5A,Queen of Katwe - Official Trailer,I'm proud to be Ugandan ✊🇺🇬🇺🇬,2016-05-19T01:03:58.000Z,0
2016-05-10T16:02:06.000Z,z4l3-_yub5A,Queen of Katwe - Official Trailer,Proudly Ugandan...#Africa #African,2016-05-18T11:30:49.000Z,0
2016-05-10T16:02:06.000Z,z4l3-_yub5A,Queen of Katwe - Official Trailer,holy shit i wanna watch this so baddddd,2016-05-18T03:51:11.000Z,0
2016-05-10T16:02:06.000Z,z4l3-_yub5A,Queen of Katwe - Official Trailer,Está película tiene mucho que enseñar y aportar.,2016-05-17T23:09:46.000Z,0
2016-05-10T16:02:06.000Z,z4l3-_yub5A,Queen of Katwe - Official Trailer,Woooow tht was awesome can't wait to watch it,2016-05-17T18:49:22.000Z,0
2016-05-10T16:02:06.000Z,z4l3-_yub5A,Queen of Katwe - Official Trailer,im already crying,2016-05-17T16:16:08.000Z,0
2016-05-10T16:02:06.000Z,z4l3-_yub5A,Queen of Katwe - Official Trailer,This looks really good. I can't wait to see it!,2016-05-17T16:08:14.000Z,0
2016-05-10T16:02:06.000Z,z4l3-_yub5A,Queen of Katwe - Official Trailer,Nice one,2016-05-17T14:31:43.000Z,1
2016-05-10T16:02:06.000Z,z4l3-_yub5A,Queen of Katwe - Official Trailer,What song is this? :),2016-05-17T10:55:25.000Z,0
2016-05-10T16:02:06.000Z,z4l3-_yub5A,Queen of Katwe - Official Trailer,Lupita and chess ♛ *dies*,2016-05-17T06:21:04.000Z,2
2016-05-10T16:02:06.000Z,z4l3-_yub5A,Queen of Katwe - Official Trailer,"I'm so excited for this! 
And as a heads up for folks, there are gonna be a lot of racist trolls and KKK wannabes plaguing the comments soon, but it won't take away from this fantastic film so don't let it get to you.  Just block and report the bigots instead of arguing with them.",2016-05-17T04:35:56.000Z,2
2016-05-10T16:02:06.000Z,z4l3-_yub5A,Queen of Katwe - Official Trailer,"I got teary eyed. She's so beautiful, her dark skin, she's beautiful, and bright minded. It's beautiful seeing someone from the ""ghetto"" becoming better. A black film in Disney, it makes me happy",2016-05-17T01:29:38.000Z,1
2016-05-10T16:02:06.000Z,z4l3-_yub5A,Queen of Katwe - Official Trailer,Beautiful people all around.,2016-05-16T21:05:09.000Z,0
2016-05-10T16:02:06.000Z,z4l3-_yub5A,Queen of Katwe - Official Trailer,😭😭😭 Best movie ever,2016-05-16T20:16:20.000Z,1
2016-05-10T16:02:06.000Z,z4l3-_yub5A,Queen of Katwe - Official Trailer,Just found out that my eyes can sweat,2016-05-16T18:46:43.000Z,0
2016-05-10T16:02:06.000Z,z4l3-_yub5A,Queen of Katwe - Official Trailer,WOW WOW WOW WOOOOOWWW...!!!!!! Am in love with this trailer. i hope september gets here soon cause of this...,2016-05-16T17:16:17.000Z,0
2016-05-10T16:02:06.000Z,z4l3-_yub5A,Queen of Katwe - Official Trailer,Prove that Disney isn't racist unlike the other Big Six Studios.,2016-05-16T13:02:00.000Z,0
2016-05-10T16:02:06.000Z,z4l3-_yub5A,Queen of Katwe - Official Trailer,I'm watching this !!!,2016-05-16T10:23:27.000Z,0
2016-05-10T16:02:06.000Z,z4l3-_yub5A,Queen of Katwe - Official Trailer,"So amazing, I want see this film!!!",2016-05-16T06:59:41.000Z,0
2016-05-10T16:02:06.000Z,z4l3-_yub5A,Queen of Katwe - Official Trailer,NAME OF THE SONG PLS? OH MY THIS IS PERFECT! LEONA LEWIS!!!!!,2016-05-16T02:40:27.000Z,4
2016-05-10T16:02:06.000Z,z4l3-_yub5A,Queen of Katwe - Official Trailer,Madina Nalwanga is so incredible and emotional. I hope she will became a wellknown actress.,2016-05-15T21:19:26.000Z,2
2016-05-10T16:02:06.000Z,z4l3-_yub5A,Queen of Katwe - Official Trailer,Lupita is Disney's child rn,2016-05-15T21:12:23.000Z,0
2016-05-10T16:02:06.000Z,z4l3-_yub5A,Queen of Katwe - Official Trailer,thanks to Disney,2016-05-15T20:39:11.000Z,0
2016-05-10T16:02:06.000Z,z4l3-_yub5A,Queen of Katwe - Official Trailer,more like queen of etest,2016-05-15T20:11:31.000Z,0
2016-05-10T16:02:06.000Z,z4l3-_yub5A,Queen of Katwe - Official Trailer,atlast a ugandan filmed movie is selling,2016-05-15T20:10:04.000Z,0
2016-05-10T16:02:06.000Z,z4l3-_yub5A,Queen of Katwe - Official Trailer,"Get rid of the recycled 'believe in yourself' pop song, and this looks like a great movie.",2016-05-15T18:26:05.000Z,0
2016-05-10T16:02:06.000Z,z4l3-_yub5A,Queen of Katwe - Official Trailer,I smell oscars here,2016-05-15T16:09:21.000Z,20
2016-05-10T16:02:06.000Z,z4l3-_yub5A,Queen of Katwe - Official Trailer,I realy want to watch it.,2016-05-15T13:44:58.000Z,0
2016-05-10T16:02:06.000Z,z4l3-_yub5A,Queen of Katwe - Official Trailer,I can't wait to see this.,2016-05-15T12:46:26.000Z,51
2016-05-10T16:02:06.000Z,z4l3-_yub5A,Queen of Katwe - Official Trailer,Disney isn't making AFRICA look poor or poverty stricken but Uganda IS poor/poverty stricken. Actually a lot of African countries to have problems with poverty. Africa  is quite corrupt.,2016-05-15T12:41:36.000Z,0
2016-05-10T16:02:06.000Z,z4l3-_yub5A,Queen of Katwe - Official Trailer,Can't wait til this comes out!! Woop woo,2016-05-15T09:12:53.000Z,1
2016-05-10T16:02:06.000Z,z4l3-_yub5A,Queen of Katwe - Official Trailer,Yay for Uganda and her,2016-05-15T08:36:16.000Z,0
2016-05-10T16:02:06.000Z,z4l3-_yub5A,Queen of Katwe - Official Trailer,song is amazing...😘😘,2016-05-15T08:06:42.000Z,1
2016-05-10T16:02:06.000Z,z4l3-_yub5A,Queen of Katwe - Official Trailer,Definitely gonna watch this movie. Hopefully it'll come out in Israel.,2016-05-15T04:13:12.000Z,5
2016-05-10T16:02:06.000Z,z4l3-_yub5A,Queen of Katwe - Official Trailer,"i don't usually watch movies in cinemas  but this is definitely a must watch in the cinemas when it comes out come September, i can wait any more.",2016-05-14T22:24:57.000Z,0
2016-05-10T16:02:06.000Z,z4l3-_yub5A,Queen of Katwe - Official Trailer,"oyelowo's accent was n't a typical ugandan accent anyway i loved the trailer.
DISNEY COMES TO KAMPALA.",2016-05-14T22:20:04.000Z,0
2016-05-10T16:02:06.000Z,z4l3-_yub5A,Queen of Katwe - Official Trailer,Disney goes to Africa YYYYYEEEEEESSSSSSS LET ME WWWAAAAAATTTTTCCCCHHHHH NOOOOOWWWWW,2016-05-14T19:47:54.000Z,19
2016-05-10T16:02:06.000Z,z4l3-_yub5A,Queen of Katwe - Official Trailer,Inspiring & a Must Watch for me !!,2016-05-14T19:08:30.000Z,0
