publish_time,Video ID,Title,Comment,updatedAt,likeCount
2016-05-10T16:02:06.000Z,z4l3-_yub5A,Queen of Katwe - Official Trailer,"wow its really happening ,the film industry is changing for the better",2016-05-14T19:02:36.000Z,2
2016-05-10T16:02:06.000Z,z4l3-_yub5A,Queen of Katwe - Official Trailer,I am already excited to see this film!!:):) I have to see it opening weekend.,2016-05-14T18:39:47.000Z,0
2016-05-10T16:02:06.000Z,z4l3-_yub5A,Queen of Katwe - Official Trailer,I already wanna cry... Can't wait!!,2016-05-14T17:35:23.000Z,1
2016-05-10T16:02:06.000Z,z4l3-_yub5A,Queen of Katwe - Official Trailer,Nice movie. Shows that Africans are capable of so much more. I'm in the country where it was filmed. All scenes are real. 😧. But it's awesome,2016-05-14T16:40:21.000Z,23
2016-05-10T16:02:06.000Z,z4l3-_yub5A,Queen of Katwe - Official Trailer,What's the song at 0:06,2016-05-14T15:17:01.000Z,0
2016-05-10T16:02:06.000Z,z4l3-_yub5A,Queen of Katwe - Official Trailer,I wish they'd speak in Luganda and give sub titles yeah you'd lode lupita but of be more natural,2016-05-14T14:46:14.000Z,0
2016-05-10T16:02:06.000Z,z4l3-_yub5A,Queen of Katwe - Official Trailer,"That accent though.. I am Ugandan, and when someone asks me how my life is, I don't say ""it is fine"". I say ""It's fine""
I can't wait to see the movie anyway",2016-05-14T12:39:03.000Z,0
2016-05-10T16:02:06.000Z,z4l3-_yub5A,Queen of Katwe - Official Trailer,love it,2016-05-14T09:54:37.000Z,0
2016-05-10T16:02:06.000Z,z4l3-_yub5A,Queen of Katwe - Official Trailer,"I love the background song! 

It's thick skin by leona Lewis",2016-05-14T08:48:32.000Z,10
2016-05-10T16:02:06.000Z,z4l3-_yub5A,Queen of Katwe - Official Trailer,Cant wait to see this.... Another one telling an African Story.... Plus of course our own girl Lupita Is gracing it....,2016-05-14T08:44:58.000Z,10
2016-05-10T16:02:06.000Z,z4l3-_yub5A,Queen of Katwe - Official Trailer,I'm so proud to be African!!!,2016-05-14T07:28:57.000Z,2
2016-05-10T16:02:06.000Z,z4l3-_yub5A,Queen of Katwe - Official Trailer,I don't know! I mean the cinematography looks beautiful and the story seems interesting but the way they talk! I'm not sure if this is how it feels to see your culture and language on screen but it kinda takes me out of the movie!,2016-05-14T06:03:00.000Z,0
2016-05-10T16:02:06.000Z,z4l3-_yub5A,Queen of Katwe - Official Trailer,That amazing feeling you get after watching an epic trailer.,2016-05-14T04:31:56.000Z,7
2016-05-10T16:02:06.000Z,z4l3-_yub5A,Queen of Katwe - Official Trailer,They got the accent right. 👏,2016-05-14T03:32:23.000Z,15
2016-05-10T16:02:06.000Z,z4l3-_yub5A,Queen of Katwe - Official Trailer,"Excellent! 
**shared**",2016-05-14T03:32:20.000Z,3
2016-05-10T16:02:06.000Z,z4l3-_yub5A,Queen of Katwe - Official Trailer,Can't wait!,2016-05-14T02:58:57.000Z,1
2016-05-10T16:02:06.000Z,z4l3-_yub5A,Queen of Katwe - Official Trailer,They chose the right song for the trailer. Very affecting. Will definitely be watching.,2016-05-14T00:15:40.000Z,29
2016-05-10T16:02:06.000Z,z4l3-_yub5A,Queen of Katwe - Official Trailer,"I wish all these people would stop complaining about how they hate the trailer for showing her growing up in the slums and that Disney is trying to make all of Africa look poverty stricken. This is based on a true story, depicting her in a rich environment would have been disrespectful to the girl and would have made them liars. Nowhere in this trailer did I see Disney saying all of Africa is poor. So just chill out and enjoy the trailer",2016-05-13T23:35:55.000Z,346
2016-05-10T16:02:06.000Z,z4l3-_yub5A,Queen of Katwe - Official Trailer,Proud to be associated with Uganda,2016-05-13T21:49:13.000Z,0
2016-05-10T16:02:06.000Z,z4l3-_yub5A,Queen of Katwe - Official Trailer,"#captionthis

Auto captioning is no good. Disney can afford to caption all videos put on YouTube.",2016-05-13T21:37:28.000Z,0
2016-05-10T16:02:06.000Z,z4l3-_yub5A,Queen of Katwe - Official Trailer,i am here crying. this is amazing cant wait to watch it,2016-05-13T21:31:23.000Z,19
2016-05-10T16:02:06.000Z,z4l3-_yub5A,Queen of Katwe - Official Trailer,Finally- a film worthy of Lupita Nyong'o's talents. I can see why she waited for a film like this.,2016-05-13T21:29:25.000Z,23
2016-05-10T16:02:06.000Z,z4l3-_yub5A,Queen of Katwe - Official Trailer,"This looks amazing, but did they tell the whole story in the trailer?",2016-05-13T20:57:15.000Z,0
2016-05-10T16:02:06.000Z,z4l3-_yub5A,Queen of Katwe - Official Trailer,Am Ugandan and this is Amazing. Am absolutely humbled Disney.,2016-05-13T13:44:00.000Z,9
2016-05-10T16:02:06.000Z,z4l3-_yub5A,Queen of Katwe - Official Trailer,"Looks amazing (like all Disney films) but gave away too much of the plot :/
Don't get me wrong, I'm still going to watch it, it looks outstanding.",2016-05-13T12:39:19.000Z,11
2016-05-10T16:02:06.000Z,z4l3-_yub5A,Queen of Katwe - Official Trailer,anyone know which  song is playing  in the background ?,2016-05-13T12:39:14.000Z,3
2016-05-10T16:02:06.000Z,z4l3-_yub5A,Queen of Katwe - Official Trailer,THIS IS GONNA BE SO GOOD. I REPEAT THIS IS GONNA BE SO GOOD. K BYE,2016-05-13T11:59:33.000Z,1
2016-05-10T16:02:06.000Z,z4l3-_yub5A,Queen of Katwe - Official Trailer,OH MY GOD THIS TRAILER IS SO BEAUTIFUL CANT WAIT FOR THE FILM TO COME OUT :'D,2016-05-13T10:52:15.000Z,8
2016-05-10T16:02:06.000Z,z4l3-_yub5A,Queen of Katwe - Official Trailer,Never has a trailer made me feel so emotional.,2016-05-13T06:06:18.000Z,16
2016-05-10T16:02:06.000Z,z4l3-_yub5A,Queen of Katwe - Official Trailer,"waww,, song name??",2016-05-13T04:51:53.000Z,7
2016-05-10T16:02:06.000Z,z4l3-_yub5A,Queen of Katwe - Official Trailer,what is this song!,2016-05-13T02:35:27.000Z,9
2016-05-10T16:02:06.000Z,z4l3-_yub5A,Queen of Katwe - Official Trailer,what us the name of the soundtrack?,2016-05-13T01:10:42.000Z,6
2016-05-10T16:02:06.000Z,z4l3-_yub5A,Queen of Katwe - Official Trailer,I liked that one movie where it was a war and the kid avenged hid family,2016-05-12T23:50:12.000Z,0
2016-05-10T16:02:06.000Z,z4l3-_yub5A,Queen of Katwe - Official Trailer,Name of the songs?,2016-05-12T23:44:48.000Z,1
2016-05-10T16:02:06.000Z,z4l3-_yub5A,Queen of Katwe - Official Trailer,OMG Disney is so pretty!,2016-05-12T23:37:10.000Z,0
2016-05-10T16:02:06.000Z,z4l3-_yub5A,Queen of Katwe - Official Trailer,"""Sometimes the place you are used to is not the place you belong. You belong where you believe you belong. Where is that for you?"" - And at this moment, my friends, I cried.",2016-05-12T23:30:10.000Z,91
2016-05-10T16:02:06.000Z,z4l3-_yub5A,Queen of Katwe - Official Trailer,I didn't come here for you to make me cry @ Disney.,2016-05-12T23:26:23.000Z,2
2016-05-10T16:02:06.000Z,z4l3-_yub5A,Queen of Katwe - Official Trailer,Anyone know the song used for the trailer.  ? It's amazing !,2016-05-12T23:09:19.000Z,4
2016-05-10T16:02:06.000Z,z4l3-_yub5A,Queen of Katwe - Official Trailer,So the African version of Pawn Sacrifice?,2016-05-12T21:36:55.000Z,2
2016-05-10T16:02:06.000Z,z4l3-_yub5A,Queen of Katwe - Official Trailer,OMG that song is incredible. Leona Lewis always delivers!!!! #ThickSkin,2016-05-12T21:23:20.000Z,22
2016-05-10T16:02:06.000Z,z4l3-_yub5A,Queen of Katwe - Official Trailer,So...She plays chess?,2016-05-12T21:12:24.000Z,0
2016-05-10T16:02:06.000Z,z4l3-_yub5A,Queen of Katwe - Official Trailer,Lupita got disney out here making motion pictures in Uganda! This is why representation matters.,2016-05-12T20:41:52.000Z,0
2016-05-10T16:02:06.000Z,z4l3-_yub5A,Queen of Katwe - Official Trailer,I WANT TO SEE THIS!!!!,2016-05-12T20:17:44.000Z,3
2016-05-10T16:02:06.000Z,z4l3-_yub5A,Queen of Katwe - Official Trailer,So Akeelah and the Bee 2?,2016-05-12T20:05:43.000Z,0
2016-05-10T16:02:06.000Z,z4l3-_yub5A,Queen of Katwe - Official Trailer,Does anyone know the name of the song that started at 0:25,2016-05-12T19:53:07.000Z,4
2016-05-10T16:02:06.000Z,z4l3-_yub5A,Queen of Katwe - Official Trailer,This is so not how to make a trailer because watching this is as good as seeing the movie. No suspense!!!,2016-05-12T19:51:05.000Z,0
2016-05-10T16:02:06.000Z,z4l3-_yub5A,Queen of Katwe - Official Trailer,I LOVE THIS!! Even though it gave away the story. Damn these onion ninjas...,2016-05-12T19:47:38.000Z,2
2016-05-10T16:02:06.000Z,z4l3-_yub5A,Queen of Katwe - Official Trailer,"I LOVE THIS!! Even though the trailer gives away the whole story, I still really want to see it",2016-05-12T19:44:34.000Z,3
2016-05-10T16:02:06.000Z,z4l3-_yub5A,Queen of Katwe - Official Trailer,"I LOVE THIS!! Even though the trailer gives away the whole story, I still really want to see it",2016-05-12T19:44:28.000Z,0
2016-05-10T16:02:06.000Z,z4l3-_yub5A,Queen of Katwe - Official Trailer,"I LOVE THIS!! Even though the trailer gives away the whole story, I still really want to see it.",2016-05-12T19:44:10.000Z,0
2016-05-10T16:02:06.000Z,z4l3-_yub5A,Queen of Katwe - Official Trailer,"I LOVE THIS!! Even though the trailer gives away the whole story, I still really want to see it.",2016-05-12T19:44:05.000Z,0
2016-05-10T16:02:06.000Z,z4l3-_yub5A,Queen of Katwe - Official Trailer,Disney xd black person would never become international chess champion.,2016-05-12T19:42:47.000Z,2
2016-05-10T16:02:06.000Z,z4l3-_yub5A,Queen of Katwe - Official Trailer,Disney xd black person would never become international chess champion.,2016-05-12T19:42:34.000Z,0
2016-05-10T16:02:06.000Z,z4l3-_yub5A,Queen of Katwe - Official Trailer,this is so different. i really never saw a Disney movie like this. i like it :),2016-05-12T19:34:53.000Z,325
2016-05-10T16:02:06.000Z,z4l3-_yub5A,Queen of Katwe - Official Trailer,I cried,2016-05-12T19:32:18.000Z,0
2016-05-10T16:02:06.000Z,z4l3-_yub5A,Queen of Katwe - Official Trailer,"I'm too hype this looks so good. I can't wait, this trailer got me teary eyed and sh*t",2016-05-12T19:12:47.000Z,6
2016-05-10T16:02:06.000Z,z4l3-_yub5A,Queen of Katwe - Official Trailer,OMG I WANNA WATCH IT,2016-05-12T19:09:29.000Z,2
2016-05-10T16:02:06.000Z,z4l3-_yub5A,Queen of Katwe - Official Trailer,"I'm loving the setting, and it looks like I'll love the characters. Plus Mira Nair directed this! Will definitely be supporting this.",2016-05-12T18:35:10.000Z,0
2016-05-10T16:02:06.000Z,z4l3-_yub5A,Queen of Katwe - Official Trailer,I can't wait until this movie comes out ❤,2016-05-12T18:04:00.000Z,0
2016-05-10T16:02:06.000Z,z4l3-_yub5A,Queen of Katwe - Official Trailer,This is looks like it's going to be good! Checkmate,2016-05-12T17:49:00.000Z,1
2016-05-10T16:02:06.000Z,z4l3-_yub5A,Queen of Katwe - Official Trailer,I'm crying for trailer,2016-05-12T16:54:23.000Z,1
2016-05-10T16:02:06.000Z,z4l3-_yub5A,Queen of Katwe - Official Trailer,"So, this is what the liberals wants us to see? I'll pass.",2016-05-12T16:18:52.000Z,0
2016-05-10T16:02:06.000Z,z4l3-_yub5A,Queen of Katwe - Official Trailer,"omg o.o looks so amazing, i almost fricken cried",2016-05-12T16:14:25.000Z,9
2016-05-10T16:02:06.000Z,z4l3-_yub5A,Queen of Katwe - Official Trailer,couldn't just get an African artist to do the soundtrack? you know they are also good at singing. not just white people. As a white male I am ashamed,2016-05-12T16:02:03.000Z,13
2016-05-10T16:02:06.000Z,z4l3-_yub5A,Queen of Katwe - Official Trailer,it's a must watch,2016-05-12T15:53:45.000Z,0
2016-05-10T16:02:06.000Z,z4l3-_yub5A,Queen of Katwe - Official Trailer,I'm such a cry baby....ugh. This is beautiful.,2016-05-12T15:47:27.000Z,0
2016-05-10T16:02:06.000Z,z4l3-_yub5A,Queen of Katwe - Official Trailer,I have to see this,2016-05-12T15:40:03.000Z,0
2016-05-10T16:02:06.000Z,z4l3-_yub5A,Queen of Katwe - Official Trailer,This made me cry,2016-05-12T15:12:52.000Z,0
2016-05-10T16:02:06.000Z,z4l3-_yub5A,Queen of Katwe - Official Trailer,this film is definetly not gonna win an oscar,2016-05-12T14:43:05.000Z,0
2016-05-10T16:02:06.000Z,z4l3-_yub5A,Queen of Katwe - Official Trailer,LOVE IT!!!!!!!! I cannot wait for this movie!  It is about time DISNEY OPENED UP TO AFRICA!!!!!!  LOVE IT!! Lupita my GOD!  BEAUTIFUL !!!!,2016-05-12T14:37:47.000Z,0
2016-05-10T16:02:06.000Z,z4l3-_yub5A,Queen of Katwe - Official Trailer,looks pretty good,2016-05-12T14:07:26.000Z,2
2016-05-10T16:02:06.000Z,z4l3-_yub5A,Queen of Katwe - Official Trailer,Seems really I mean REALLY boring...,2016-05-12T13:45:59.000Z,0
2016-05-10T16:02:06.000Z,z4l3-_yub5A,Queen of Katwe - Official Trailer,Oyelowo is very good at doing accents.,2016-05-12T13:18:44.000Z,0
2016-05-10T16:02:06.000Z,z4l3-_yub5A,Queen of Katwe - Official Trailer,I am so pumped for this. Looks so inspiring,2016-05-12T13:18:23.000Z,1
2016-05-10T16:02:06.000Z,z4l3-_yub5A,Queen of Katwe - Official Trailer,얼른 보고 싶어요!,2016-05-12T12:59:47.000Z,0
2016-05-10T16:02:06.000Z,z4l3-_yub5A,Queen of Katwe - Official Trailer,this looks amazing,2016-05-12T12:41:28.000Z,2
2016-05-10T16:02:06.000Z,z4l3-_yub5A,Queen of Katwe - Official Trailer,I want to see that,2016-05-12T12:33:42.000Z,1
2016-05-10T16:02:06.000Z,z4l3-_yub5A,Queen of Katwe - Official Trailer,2:08 lol,2016-05-12T12:19:54.000Z,0
2016-05-10T16:02:06.000Z,z4l3-_yub5A,Queen of Katwe - Official Trailer,Why not show an aftican girl in an affluent area? Why does it always have to be the child in the slum? There are a much greater amount of people that live in the rest of the city outside the slums. But here we have the same narrative of the starving african child and the only promise to become something is to go to the west.,2016-05-12T11:23:36.000Z,0
2016-05-10T16:02:06.000Z,z4l3-_yub5A,Queen of Katwe - Official Trailer,"Is this real? Have I lived to see the day when American media will properly represent an African country, not make a caricature out of it, or even acknowledge the distinction between a country in Africa and the continent of Africa??",2016-05-12T11:21:57.000Z,2
2016-05-10T16:02:06.000Z,z4l3-_yub5A,Queen of Katwe - Official Trailer,Disney knows how to do trailers don't they. Looks good :),2016-05-12T11:20:50.000Z,2
2016-05-10T16:02:06.000Z,z4l3-_yub5A,Queen of Katwe - Official Trailer,Love this!! Someone know the name of the song?,2016-05-12T11:08:22.000Z,4
2016-05-10T16:02:06.000Z,z4l3-_yub5A,Queen of Katwe - Official Trailer,I'm crying from the trailer so the movie is going to have me in pieces,2016-05-12T10:40:44.000Z,14
2016-05-10T16:02:06.000Z,z4l3-_yub5A,Queen of Katwe - Official Trailer,awesome,2016-05-12T10:29:57.000Z,0
2016-05-10T16:02:06.000Z,z4l3-_yub5A,Queen of Katwe - Official Trailer,first time i ever got the goosebumps from a disney movie.,2016-05-12T09:34:25.000Z,0
2016-05-10T16:02:06.000Z,z4l3-_yub5A,Queen of Katwe - Official Trailer,Can't wait to watch this!,2016-05-12T09:34:10.000Z,0
2016-05-10T16:02:06.000Z,z4l3-_yub5A,Queen of Katwe - Official Trailer,Looks shit this,2016-05-12T09:25:24.000Z,0
2016-05-10T16:02:06.000Z,z4l3-_yub5A,Queen of Katwe - Official Trailer,looks good,2016-05-12T09:16:36.000Z,0
2016-05-10T16:02:06.000Z,z4l3-_yub5A,Queen of Katwe - Official Trailer,Could anyone tell me What's the song number in the background?,2016-05-12T08:28:20.000Z,2
2016-05-10T16:02:06.000Z,z4l3-_yub5A,Queen of Katwe - Official Trailer,WE,2016-05-12T08:24:06.000Z,1
2016-05-10T16:02:06.000Z,z4l3-_yub5A,Queen of Katwe - Official Trailer,This trailer just showed me the whole movie tf!! I already seen it now shiiiiiiit..,2016-05-12T08:05:09.000Z,0
2016-05-10T16:02:06.000Z,z4l3-_yub5A,Queen of Katwe - Official Trailer,HOL UP SO U BE SAYIN THAT WE WUZ DISNEY PRINCESSES N SHIEEEEEET,2016-05-12T07:57:52.000Z,14
2016-05-10T16:02:06.000Z,z4l3-_yub5A,Queen of Katwe - Official Trailer,I love lupita she's gorgeous..this is a must see,2016-05-12T07:53:36.000Z,44
2016-05-10T16:02:06.000Z,z4l3-_yub5A,Queen of Katwe - Official Trailer,I am proud to be ugandan,2016-05-12T07:52:53.000Z,0
2016-05-10T16:02:06.000Z,z4l3-_yub5A,Queen of Katwe - Official Trailer,Ohhh...We are going to get introduced to a new Black Queen named Madina. Move over Lupita and also; thank you as well!,2016-05-12T07:51:33.000Z,0
2016-05-10T16:02:06.000Z,z4l3-_yub5A,Queen of Katwe - Official Trailer,When I was a little kid my parents did this program where they took care of some kids from Uganda for a few months. It was super fun. Now I love kids from Uganda 😊,2016-05-12T07:36:54.000Z,0
2016-05-10T16:02:06.000Z,z4l3-_yub5A,Queen of Katwe - Official Trailer,"this is so inspiring.. ""sometimes the place you are used to is not where you truly belong, you belong where you believe you belong""",2016-05-12T07:12:07.000Z,0
2016-05-10T16:02:06.000Z,z4l3-_yub5A,Queen of Katwe - Official Trailer,"this is so inspiring.. ""sometimes the place you are used to is not where you truly belong, you belong where you believe you belong""",2016-05-12T07:11:55.000Z,0
2016-05-10T16:02:06.000Z,z4l3-_yub5A,Queen of Katwe - Official Trailer,We wuz kangs and shit nigga I swear to god,2016-05-12T07:04:09.000Z,1
2016-05-10T16:02:06.000Z,z4l3-_yub5A,Queen of Katwe - Official Trailer,we wuz kings n shit fam,2016-05-12T06:49:21.000Z,1
2016-05-10T16:02:06.000Z,z4l3-_yub5A,Queen of Katwe - Official Trailer,basic,2016-05-12T06:27:17.000Z,0
2016-05-10T16:02:06.000Z,z4l3-_yub5A,Queen of Katwe - Official Trailer,Wonderful trailer.,2016-05-12T06:06:31.000Z,0
2016-05-10T16:02:06.000Z,z4l3-_yub5A,Queen of Katwe - Official Trailer,I really want to watch this! 😖,2016-05-12T06:05:23.000Z,4
2016-05-10T16:02:06.000Z,z4l3-_yub5A,Queen of Katwe - Official Trailer,What song was playing in the background?,2016-05-12T06:00:59.000Z,0
2016-05-10T16:02:06.000Z,z4l3-_yub5A,Queen of Katwe - Official Trailer,why do they constantly give off the ideal that the majority of Africa is povert stricken. Google Search Africa and go to Images everyone. Richest and most beautiful land on Earth(Though it was fucked up a little by war and Greedy ass white people it still stands as a sight for those who seek beauty),2016-05-12T06:00:50.000Z,4
2016-05-10T16:02:06.000Z,z4l3-_yub5A,Queen of Katwe - Official Trailer,I'll never be sick of their accent through the movie. I love it so much,2016-05-12T05:53:56.000Z,0
2016-05-10T16:02:06.000Z,z4l3-_yub5A,Queen of Katwe - Official Trailer,"wow...so fast, Disney made a jungle Book sequal",2016-05-12T05:47:05.000Z,1
2016-05-10T16:02:06.000Z,z4l3-_yub5A,Queen of Katwe - Official Trailer,OMG CAN'T WAIT <3,2016-05-12T05:45:06.000Z,1
2016-05-10T16:02:06.000Z,z4l3-_yub5A,Queen of Katwe - Official Trailer,Inspirational. Worth watching.,2016-05-12T05:06:20.000Z,14
2016-05-10T16:02:06.000Z,z4l3-_yub5A,Queen of Katwe - Official Trailer,Captain Alex > this,2016-05-12T04:54:01.000Z,0
2016-05-10T16:02:06.000Z,z4l3-_yub5A,Queen of Katwe - Official Trailer,"Wo Mira Nair film.. 🎥
It will rock again👑",2016-05-12T04:45:09.000Z,0
2016-05-10T16:02:06.000Z,z4l3-_yub5A,Queen of Katwe - Official Trailer,damn and i can't even get a text back,2016-05-12T04:36:44.000Z,0
2016-05-10T16:02:06.000Z,z4l3-_yub5A,Queen of Katwe - Official Trailer,2:08 I almost jumped out of my seat when I saw that kid click their fingers together like that. That's so African lol. Only thing that bothers me about the film--and quite frankly I expected this--is the perpetuation of the idea that Africa is a poverty-stricken continent. The main character does not have to go to another country or continent to know or see luxury.,2016-05-12T04:35:53.000Z,5
2016-05-10T16:02:06.000Z,z4l3-_yub5A,Queen of Katwe - Official Trailer,Mean while in Hollywood,2016-05-12T04:17:04.000Z,0
2016-05-10T16:02:06.000Z,z4l3-_yub5A,Queen of Katwe - Official Trailer,I know a young woman from Nigeria I'd like to take with me to see that.,2016-05-12T04:15:51.000Z,0
2016-05-10T16:02:06.000Z,z4l3-_yub5A,Queen of Katwe - Official Trailer,"This looks so good , I'm hyped",2016-05-12T04:12:03.000Z,0
2016-05-10T16:02:06.000Z,z4l3-_yub5A,Queen of Katwe - Official Trailer,wow,2016-05-12T04:11:33.000Z,0
2016-05-10T16:02:06.000Z,z4l3-_yub5A,Queen of Katwe - Official Trailer,Can't wait for this!!!!!!!,2016-05-12T03:52:07.000Z,0
2016-05-10T16:02:06.000Z,z4l3-_yub5A,Queen of Katwe - Official Trailer,must see!,2016-05-12T03:46:01.000Z,2
2016-05-10T16:02:06.000Z,z4l3-_yub5A,Queen of Katwe - Official Trailer,Obama in this movie?,2016-05-12T02:58:01.000Z,0
2016-05-10T16:02:06.000Z,z4l3-_yub5A,Queen of Katwe - Official Trailer,i remember reading something like this. beautiful story,2016-05-12T02:39:54.000Z,1
2016-05-10T16:02:06.000Z,z4l3-_yub5A,Queen of Katwe - Official Trailer,Omg Leona Lewis voice in the background. I almost died hearing the angels voice.,2016-05-12T02:26:04.000Z,12
2016-05-10T16:02:06.000Z,z4l3-_yub5A,Queen of Katwe - Official Trailer,"I love how this movie is based on something school kids stereotype as nerdy. When this movie becomes big, everyone's probably gonna want to play chess.",2016-05-12T02:20:45.000Z,3
2016-05-10T16:02:06.000Z,z4l3-_yub5A,Queen of Katwe - Official Trailer,I definitely want to watch this. The trailer is already inspiring. Can't wait for this. :),2016-05-12T02:16:02.000Z,0
2016-05-10T16:02:06.000Z,z4l3-_yub5A,Queen of Katwe - Official Trailer,Ah ah! Ah ah! The lion is cumming Ah Ah!,2016-05-12T02:04:35.000Z,2
2016-05-10T16:02:06.000Z,z4l3-_yub5A,Queen of Katwe - Official Trailer,I got the chills,2016-05-12T01:56:09.000Z,0
2016-05-10T16:02:06.000Z,z4l3-_yub5A,Queen of Katwe - Official Trailer,This looks beautiful and i am definitely watching it,2016-05-12T01:50:49.000Z,27
2016-05-10T16:02:06.000Z,z4l3-_yub5A,Queen of Katwe - Official Trailer,I'm watching this first thing,2016-05-12T01:39:33.000Z,0
2016-05-10T16:02:06.000Z,z4l3-_yub5A,Queen of Katwe - Official Trailer,Can't stop crying!!!,2016-05-12T01:31:00.000Z,0
2016-05-10T16:02:06.000Z,z4l3-_yub5A,Queen of Katwe - Official Trailer,beautiful,2016-05-12T01:21:13.000Z,0
2016-05-10T16:02:06.000Z,z4l3-_yub5A,Queen of Katwe - Official Trailer,Wow this is the first movie I've seen without white people in it,2016-05-12T00:31:45.000Z,0
2016-05-10T16:02:06.000Z,z4l3-_yub5A,Queen of Katwe - Official Trailer,YOU ALREADY KNOW IM IN THIS THEATRE DAY ONE,2016-05-12T00:27:36.000Z,0
2016-05-10T16:02:06.000Z,z4l3-_yub5A,Queen of Katwe - Official Trailer,wow.. I need to see this.,2016-05-12T00:16:41.000Z,1
2016-05-10T16:02:06.000Z,z4l3-_yub5A,Queen of Katwe - Official Trailer,Love it already!,2016-05-12T00:12:50.000Z,8
2016-05-10T16:02:06.000Z,z4l3-_yub5A,Queen of Katwe - Official Trailer,Really looking forward to this one!,2016-05-11T23:38:02.000Z,0
2016-05-10T16:02:06.000Z,z4l3-_yub5A,Queen of Katwe - Official Trailer,"oh wow , so nice to hear Leona Lewis's Thick Skin being used as the soundtrack. fits perfectly with the them of the film.",2016-05-11T23:31:27.000Z,2
2016-05-10T16:02:06.000Z,z4l3-_yub5A,Queen of Katwe - Official Trailer,Better than that Birth of a Nation shit,2016-05-11T23:13:21.000Z,0
2016-05-10T16:02:06.000Z,z4l3-_yub5A,Queen of Katwe - Official Trailer,This movie is gonna be awesome,2016-05-11T23:12:51.000Z,19
2016-05-10T16:02:06.000Z,z4l3-_yub5A,Queen of Katwe - Official Trailer,YES IN LOVE,2016-05-11T22:58:52.000Z,0
2016-05-10T16:02:06.000Z,z4l3-_yub5A,Queen of Katwe - Official Trailer,Watching! WATCHING!,2016-05-11T22:56:29.000Z,0
2016-05-10T16:02:06.000Z,z4l3-_yub5A,Queen of Katwe - Official Trailer,The 2nd Oscar for Lupita Nyong'o.,2016-05-11T22:51:26.000Z,0
2016-05-10T16:02:06.000Z,z4l3-_yub5A,Queen of Katwe - Official Trailer,I encourage every one to tell there friends to watch this movie; We need to show Disney that we care about movies that discuss real issues and cast diverse people.,2016-05-11T22:38:11.000Z,14
2016-05-10T16:02:06.000Z,z4l3-_yub5A,Queen of Katwe - Official Trailer,Love Uganda,2016-05-11T22:37:56.000Z,0
2016-05-10T16:02:06.000Z,z4l3-_yub5A,Queen of Katwe - Official Trailer,"""You can throw your daggers you can sink them in, it don't matter I got thick skin""",2016-05-11T22:28:28.000Z,0
2016-05-10T16:02:06.000Z,z4l3-_yub5A,Queen of Katwe - Official Trailer,"I kinda cried , how am I going to get through this movie",2016-05-11T22:27:17.000Z,2
2016-05-10T16:02:06.000Z,z4l3-_yub5A,Queen of Katwe - Official Trailer,I have to watch this...,2016-05-11T22:16:03.000Z,0
2016-05-10T16:02:06.000Z,z4l3-_yub5A,Queen of Katwe - Official Trailer,when will the movie open?,2016-05-11T22:12:33.000Z,0
2016-05-10T16:02:06.000Z,z4l3-_yub5A,Queen of Katwe - Official Trailer,"we're really supposed to believe Lupita is old enough to be that girl's mom?

nah",2016-05-11T21:51:07.000Z,15
2016-05-10T16:02:06.000Z,z4l3-_yub5A,Queen of Katwe - Official Trailer,ÁAH TITCH YU HAAH TUH MEIK ÁAHH PLÃAAN,2016-05-11T21:39:01.000Z,0
2016-05-10T16:02:06.000Z,z4l3-_yub5A,Queen of Katwe - Official Trailer,Sounds good! Can't wait!,2016-05-11T21:36:25.000Z,1
2016-05-10T16:02:06.000Z,z4l3-_yub5A,Queen of Katwe - Official Trailer,What's the actress name ?? She's amazing,2016-05-11T21:29:19.000Z,2
2016-05-10T16:02:06.000Z,z4l3-_yub5A,Queen of Katwe - Official Trailer,Travel to Uganda from the States just increased.,2016-05-11T21:18:47.000Z,1
2016-05-10T16:02:06.000Z,z4l3-_yub5A,Queen of Katwe - Official Trailer,ayee. I just know this film is gonna be good.,2016-05-11T21:17:03.000Z,43
2016-05-10T16:02:06.000Z,z4l3-_yub5A,Queen of Katwe - Official Trailer,disney is doing good with making roles for PoC. the new animated movie about a hawaiian girl is actually going to be voiced by a hawaiian girl. hopefully other studios will follow and open up more roles to poc and not whitewash,2016-05-11T21:01:57.000Z,4
2016-05-10T16:02:06.000Z,z4l3-_yub5A,Queen of Katwe - Official Trailer,black panter,2016-05-11T20:58:40.000Z,0
2016-05-10T16:02:06.000Z,z4l3-_yub5A,Queen of Katwe - Official Trailer,"Finally, Disney makes an African movie! Now, an African Disney Princess—and preferably not something tribal like Lion King..",2016-05-11T20:50:59.000Z,0
