publish_time,Video ID,Title,Comment,updatedAt,likeCount
2016-05-10T16:02:06.000Z,z4l3-_yub5A,Queen of Katwe - Official Trailer,"""Sometimes, the place you are used to is not the place you belong. You belong where you believe you belong""",2019-11-18T00:06:37.000Z,0
2016-05-10T16:02:06.000Z,z4l3-_yub5A,Queen of Katwe - Official Trailer,Love this movie! Super inspiring!,2019-11-18T00:04:55.000Z,0
2016-05-10T16:02:06.000Z,z4l3-_yub5A,Queen of Katwe - Official Trailer,This is such a feel good movie and so relevant. Disney. I have not heard anything about this now come to YouTube only to find that it was out YEARS ago. Shame on you! Where was the promo team??,2019-11-02T19:33:34.000Z,1
2016-05-10T16:02:06.000Z,z4l3-_yub5A,Queen of Katwe - Official Trailer,"What a movie? Hats off to this determined girl, the coach n her brave mother who never gave up on her children.",2019-10-26T21:03:20.000Z,1
2016-05-10T16:02:06.000Z,z4l3-_yub5A,Queen of Katwe - Official Trailer,I love this movie my teacher showed it to us,2019-10-24T21:57:56.000Z,1
2016-05-10T16:02:06.000Z,z4l3-_yub5A,Queen of Katwe - Official Trailer,Hum sub africans movie sirf complexion ki wajah se nahi dekhte hain but in ki kahani achi hoti hy,2019-10-24T11:28:19.000Z,0
2016-05-10T16:02:06.000Z,z4l3-_yub5A,Queen of Katwe - Official Trailer,من أجمل الافلام التي شاهدتها,2019-10-21T23:18:36.000Z,0
2016-05-10T16:02:06.000Z,z4l3-_yub5A,Queen of Katwe - Official Trailer,Just watched this it’s a great movie recommend it 👍,2019-10-12T04:20:57.000Z,0
2016-05-10T16:02:06.000Z,z4l3-_yub5A,Queen of Katwe - Official Trailer,One of the best movies I have watched.,2019-09-30T10:16:05.000Z,1
2016-05-10T16:02:06.000Z,z4l3-_yub5A,Queen of Katwe - Official Trailer,"This inspired ne to play 
Chest
But then i played.............
I BAIL",2019-09-28T17:15:26.000Z,0
2016-05-10T16:02:06.000Z,z4l3-_yub5A,Queen of Katwe - Official Trailer,Why wasn't this showed in Thailand? Would've watched it. More of these types of movies please!!!!!,2019-09-07T17:07:54.000Z,0
2016-05-10T16:02:06.000Z,z4l3-_yub5A,Queen of Katwe - Official Trailer,I love this movie❣Why Netflix remove it?,2019-08-27T12:02:44.000Z,2
2016-05-10T16:02:06.000Z,z4l3-_yub5A,Queen of Katwe - Official Trailer,hey shweta maams english class!!1,2019-08-14T07:59:06.000Z,0
2016-05-10T16:02:06.000Z,z4l3-_yub5A,Queen of Katwe - Official Trailer,This is results of European,2019-08-10T23:33:37.000Z,0
2016-05-10T16:02:06.000Z,z4l3-_yub5A,Queen of Katwe - Official Trailer,Hello how is your life?,2019-08-09T15:18:11.000Z,0
2016-05-10T16:02:06.000Z,z4l3-_yub5A,Queen of Katwe - Official Trailer,حلوة الروسية كوين اوف,2019-08-07T22:21:43.000Z,0
2016-05-10T16:02:06.000Z,z4l3-_yub5A,Queen of Katwe - Official Trailer,gives me hope that I should keep on struggling too one day I shall shine too just like her#film@ug*we the futrelets not give up my fellow actors in uganda,2019-08-02T11:52:26.000Z,1
2016-05-10T16:02:06.000Z,z4l3-_yub5A,Queen of Katwe - Official Trailer,I am,2019-07-22T16:22:43.000Z,0
2016-05-10T16:02:06.000Z,z4l3-_yub5A,Queen of Katwe - Official Trailer,I'm proud of Uganda,2019-07-13T18:40:30.000Z,0
2016-05-10T16:02:06.000Z,z4l3-_yub5A,Queen of Katwe - Official Trailer,This is what made me love Africa so much,2019-06-03T22:51:00.000Z,0
2016-05-10T16:02:06.000Z,z4l3-_yub5A,Queen of Katwe - Official Trailer,Oh no one seems to know Mira Nair here... She's from India married to an African.. She s the director of this movie.,2019-05-28T11:55:52.000Z,0
2016-05-10T16:02:06.000Z,z4l3-_yub5A,Queen of Katwe - Official Trailer,I cried watching this Film,2019-05-26T17:06:43.000Z,0
2016-05-10T16:02:06.000Z,z4l3-_yub5A,Queen of Katwe - Official Trailer,This is a great movie....Lots of love from India👌👌,2019-05-21T16:37:32.000Z,1
2016-05-10T16:02:06.000Z,z4l3-_yub5A,Queen of Katwe - Official Trailer,Just beautiful!,2019-05-16T11:57:03.000Z,1
2016-05-10T16:02:06.000Z,z4l3-_yub5A,Queen of Katwe - Official Trailer,I love love..this movie,2019-04-26T19:25:09.000Z,1
2016-05-10T16:02:06.000Z,z4l3-_yub5A,Queen of Katwe - Official Trailer,That was really an osm trailer... For d first tym I saw any trailer showing the culture and tradition of an African Country .... Truly loved it.... And i guess whole  India is going to lyk it.... ❤️❤️❤️,2019-04-26T09:49:29.000Z,1
2016-05-10T16:02:06.000Z,z4l3-_yub5A,Queen of Katwe - Official Trailer,cried a bit😢but it's lovely😉😉good...hope to see more..,2019-04-24T09:37:59.000Z,0
2016-05-10T16:02:06.000Z,z4l3-_yub5A,Queen of Katwe - Official Trailer,What's her fide rating?,2019-04-03T17:17:14.000Z,0
2016-05-10T16:02:06.000Z,z4l3-_yub5A,Queen of Katwe - Official Trailer,🇺🇬🇺🇬🇺🇬🇺🇬❤❤❤,2019-03-24T19:02:25.000Z,0
2016-05-10T16:02:06.000Z,z4l3-_yub5A,Queen of Katwe - Official Trailer,I love this filmmm,2019-03-22T21:05:25.000Z,0
2016-05-10T16:02:06.000Z,z4l3-_yub5A,Queen of Katwe - Official Trailer,"La acabo de ver en 2019 y es de los mejor esa película, increíble como promueve el lograr los sueños y hacerlos realidad.  La verdad me marcó mucho👏👏👏👏👏👏",2019-03-19T15:26:29.000Z,1
2016-05-10T16:02:06.000Z,z4l3-_yub5A,Queen of Katwe - Official Trailer,LEONA LEWIS THICK SKIN :),2019-03-07T01:15:41.000Z,0
2016-05-10T16:02:06.000Z,z4l3-_yub5A,Queen of Katwe - Official Trailer,"I can't imagine Uganda is endowed with a lot of beautiful sceneries, good places but someone can choose to market only ghetto as if when they come they sleep in ghetto just at the end to be called shit hole. I wish I can dislike this shit a thousand times. At to all if you who pretend that you like it, no you don't. This is another fake CNN in Africa that wait for fries to go on babies and take that picture and make a documentary when in return they call us shithole they pretend like they are hurt. Fuck you",2019-03-01T22:44:13.000Z,0
2016-05-10T16:02:06.000Z,z4l3-_yub5A,Queen of Katwe - Official Trailer,"This movie is so sad, being concern about chess in such a poverty, she should choose better roles",2019-02-21T08:28:28.000Z,0
2016-05-10T16:02:06.000Z,z4l3-_yub5A,Queen of Katwe - Official Trailer,Amazing movie,2019-02-07T03:58:38.000Z,0
2016-05-10T16:02:06.000Z,z4l3-_yub5A,Queen of Katwe - Official Trailer,"I have just watched the movie. Until the end tears from my eyes. Salute to Uganda from Kyrgyzstan, Central Asia.",2019-02-05T18:37:13.000Z,2
2016-05-10T16:02:06.000Z,z4l3-_yub5A,Queen of Katwe - Official Trailer,"i saw the dvd jacket cover at a movie rental place and thought i will see it next week,,it looks really well done ,,,will see it saturday
thank you Disney for making a wonderful film showing other parts of the world,,looks to be a interesting film",2019-01-25T01:06:57.000Z,1
2016-05-10T16:02:06.000Z,z4l3-_yub5A,Queen of Katwe - Official Trailer,The most wanted...from the first time i watched it with Giovanna my language teacher at college in phoenix arizona,2019-01-24T03:59:44.000Z,1
2016-05-10T16:02:06.000Z,z4l3-_yub5A,Queen of Katwe - Official Trailer,"1: 39 after a hand shake that boy cleans his hand, what's wrong? People stop seeing others as animals. She is also human.",2019-01-01T16:37:21.000Z,0
2016-05-10T16:02:06.000Z,z4l3-_yub5A,Queen of Katwe - Official Trailer,😭😭😭😭😍😍😍😍😍😍😍😍😍😍😍😍😍😍😍😍😍😍😍😍😍😍i loooooove this film,2018-12-21T02:46:14.000Z,0
2016-05-10T16:02:06.000Z,z4l3-_yub5A,Queen of Katwe - Official Trailer,Es muy hermosa ❤️❤️❤️❤️❤️,2018-12-04T16:12:25.000Z,0
2016-05-10T16:02:06.000Z,z4l3-_yub5A,Queen of Katwe - Official Trailer,"I actually really enjoyed this movie, I didn’t even knew it existed, I just came across it and thought I’ll just put it on, I rewatched it at least 8 times, It’s such a great story with amazing characters and actors",2018-12-03T23:23:04.000Z,1
2016-05-10T16:02:06.000Z,z4l3-_yub5A,Queen of Katwe - Official Trailer,I watch this movie and become a chess player,2018-11-29T14:47:47.000Z,1
2016-05-10T16:02:06.000Z,z4l3-_yub5A,Queen of Katwe - Official Trailer,Why do SJW's want everything to be racist?,2018-11-27T10:32:32.000Z,0
2016-05-10T16:02:06.000Z,z4l3-_yub5A,Queen of Katwe - Official Trailer,"I love this movie, I'm inspired by this story ♥️",2018-11-11T21:07:56.000Z,1
2016-05-10T16:02:06.000Z,z4l3-_yub5A,Queen of Katwe - Official Trailer,Is it showing in the UK? When?,2018-11-10T23:05:19.000Z,0
2016-05-10T16:02:06.000Z,z4l3-_yub5A,Queen of Katwe - Official Trailer,Totally love this movie very much💯💯💯💯💯💯💙💙💙💙💙💙💙,2018-11-07T00:46:22.000Z,1
2016-05-10T16:02:06.000Z,z4l3-_yub5A,Queen of Katwe - Official Trailer,BRAVE,2018-10-20T13:52:37.000Z,0
2016-05-10T16:02:06.000Z,z4l3-_yub5A,Queen of Katwe - Official Trailer,Omg can't believe that was 2 years ago. I really loved this movie,2018-09-26T02:03:53.000Z,0
2016-05-10T16:02:06.000Z,z4l3-_yub5A,Queen of Katwe - Official Trailer,This was one of the best movies I've seen in a long time,2018-09-21T02:09:03.000Z,0
2016-05-10T16:02:06.000Z,z4l3-_yub5A,Queen of Katwe - Official Trailer,"This was one of the most underrated Disney movies ever. It might have the tropes of a sports film/underdog film, but the story and acting were good, and the cast looked exactly like their real life counterparts.",2018-09-21T01:44:36.000Z,0
2016-05-10T16:02:06.000Z,z4l3-_yub5A,Queen of Katwe - Official Trailer,AMAZING MOVIE! i only got choked up about 10x times as i watched it. recommend to all! phenomenal!,2018-09-01T18:55:15.000Z,0
2016-05-10T16:02:06.000Z,z4l3-_yub5A,Queen of Katwe - Official Trailer,A movie about an African cannot be complete without numerous slum scenes.,2018-08-25T15:09:03.000Z,0
2016-05-10T16:02:06.000Z,z4l3-_yub5A,Queen of Katwe - Official Trailer,"What song is this? Beautiful! I wanna watch this movie, gave me bumps",2018-08-22T02:58:21.000Z,0
2016-05-10T16:02:06.000Z,z4l3-_yub5A,Queen of Katwe - Official Trailer,Black panther,2018-08-05T19:37:16.000Z,1
2016-05-10T16:02:06.000Z,z4l3-_yub5A,Queen of Katwe - Official Trailer,Watched this movie last night. It was inspiring and awesome. Made me appreciate my life more.,2018-07-29T05:46:00.000Z,0
2016-05-10T16:02:06.000Z,z4l3-_yub5A,Queen of Katwe - Official Trailer,I just saw the movie i love it thank u Disney 👍🤗,2018-07-26T03:39:48.000Z,0
2016-05-10T16:02:06.000Z,z4l3-_yub5A,Queen of Katwe - Official Trailer,"this is so amazing,a very nice story",2018-07-24T16:19:23.000Z,0
2016-05-10T16:02:06.000Z,z4l3-_yub5A,Queen of Katwe - Official Trailer,The song is beautiful! 🎼💕,2018-07-23T02:47:26.000Z,1
2016-05-10T16:02:06.000Z,z4l3-_yub5A,Queen of Katwe - Official Trailer,"the most inspirational and the best true story movie ever.. it is very realistic... thank you so much ""my queen of katwe""......we love you from the philippines.. FHHHIONAAAAAAA!!!!!!!",2018-07-16T06:46:22.000Z,0
2016-05-10T16:02:06.000Z,z4l3-_yub5A,Queen of Katwe - Official Trailer,I have seen this multiple times. It is so heartwarming.,2018-07-15T19:18:04.000Z,0
2016-05-10T16:02:06.000Z,z4l3-_yub5A,Queen of Katwe - Official Trailer,"This is one of the best and most beautiful movies I have ever watched. It littery dropped me to tears.

Now to reply to those comments below. I have been in Uganda 5 times. Amazing place, an amazing culture, its a place you will always wanna visit over and over again. I adapted to their way of living, learnt one of their language Kiganda which they very much use in the movie. They speak English everywhere especially the youth and I mean everywhere even in the villages. It is so full of life. Happiness comes from within, they truly know how to keep it at its best. That place is just full of life, worth visiting especially if you wanna cleanse your soul.

For those tourist maniacs, You will get way way way way way more than you need. Plus weekends don't exist there. The party life is so incomparable to anywhere in the world and I have been to lots of places. So party till you die, just make sure you pick you grave before hitting the maniac button.",2018-07-02T20:58:10.000Z,0
2016-05-10T16:02:06.000Z,z4l3-_yub5A,Queen of Katwe - Official Trailer,"Oh gosh! Even though its just a trailer, I can already feel myself tearing up",2018-06-29T13:24:36.000Z,0
2016-05-10T16:02:06.000Z,z4l3-_yub5A,Queen of Katwe - Official Trailer,I watched it yesterday she is a champion at chess and it's 2hours long that will keep you busy it's mostly about how she loves chess she the best and her coach is training her to be better and her mom don't have alot of money but phiona gave her a house and her sister is pregnant and her brother got hit with a motorcycle,2018-06-26T15:53:22.000Z,0
2016-05-10T16:02:06.000Z,z4l3-_yub5A,Queen of Katwe - Official Trailer,❤️❤️,2018-06-24T15:52:59.000Z,0
2016-05-10T16:02:06.000Z,z4l3-_yub5A,Queen of Katwe - Official Trailer,You could tell it's Disney just by listening to the soundtrack,2018-06-17T21:01:16.000Z,1
2016-05-10T16:02:06.000Z,z4l3-_yub5A,Queen of Katwe - Official Trailer,"To critics, yes she's not a strong player by international or even local club standards but she is by Ugandan standards. It's about her struggle against overwhelming odds and intense poverty, devotion and love for family.
If you don't get the feels from this movie you're a robot.",2018-05-02T07:41:24.000Z,0
2016-05-10T16:02:06.000Z,z4l3-_yub5A,Queen of Katwe - Official Trailer,1:10 *WHY ARE YOU RUNNING?*,2018-05-01T05:14:30.000Z,0
2016-05-10T16:02:06.000Z,z4l3-_yub5A,Queen of Katwe - Official Trailer,UGANDA FOREVER!,2018-05-01T05:10:16.000Z,0
2016-05-10T16:02:06.000Z,z4l3-_yub5A,Queen of Katwe - Official Trailer,I watched the movie at my school and I enjoyed it,2018-04-28T05:36:22.000Z,0
2016-05-10T16:02:06.000Z,z4l3-_yub5A,Queen of Katwe - Official Trailer,Lupita Nyongo!!!,2018-04-23T04:34:33.000Z,0
2016-05-10T16:02:06.000Z,z4l3-_yub5A,Queen of Katwe - Official Trailer,I am trying to find the name of the song that plays at around the 21:20 mark on Netflix... it's playing in the background when she is playing chess with her brother. Does anyone know the song? I don't think it is in the soundtrack. :-(,2018-04-22T22:06:24.000Z,0
2016-05-10T16:02:06.000Z,z4l3-_yub5A,Queen of Katwe - Official Trailer,This Movie It amazing Like all the people Are so friendly And Clothes are colorful Wow I can Imagine a Movie like that it make me happy and the mother It so Gorgeous,2018-04-15T06:30:49.000Z,0
2016-05-10T16:02:06.000Z,z4l3-_yub5A,Queen of Katwe - Official Trailer,This movie moved world wide to the extent that we can still replay,2018-04-10T05:59:06.000Z,0
2016-05-10T16:02:06.000Z,z4l3-_yub5A,Queen of Katwe - Official Trailer,Watched it on Netflix with family yesterday we are African it was really sad and happy,2018-04-10T00:31:56.000Z,0
2016-05-10T16:02:06.000Z,z4l3-_yub5A,Queen of Katwe - Official Trailer,More n more better than black panther... really inspiring. Respec from Indonesia,2018-03-25T05:34:06.000Z,1
2016-05-10T16:02:06.000Z,z4l3-_yub5A,Queen of Katwe - Official Trailer,"Now this is how to make a movie: good story, good acting, no nonsense.
Wonderful!",2018-03-18T02:39:19.000Z,0
2016-05-10T16:02:06.000Z,z4l3-_yub5A,Queen of Katwe - Official Trailer,Why am I crying?,2018-03-12T08:52:09.000Z,0
2016-05-10T16:02:06.000Z,z4l3-_yub5A,Queen of Katwe - Official Trailer,Please someone tell me what the name of the song is because i love it lol,2018-03-12T06:34:02.000Z,0
2016-05-10T16:02:06.000Z,z4l3-_yub5A,Queen of Katwe - Official Trailer,"I took the time to watch this movie and must honestly say that it was beyond beautiful.  Not only is it a true story, but an exceptionally emotional story as well.  Racial bias is actually evoked into the movie, however, not Black/White but more so classed.  To those that haven't seen it, or must always tend to find some racial curbs to every event and movie, I ask that you watch this one for yourselves.  It's a beautiful movie.  Thank you.",2018-03-08T12:31:05.000Z,0
2016-05-10T16:02:06.000Z,z4l3-_yub5A,Queen of Katwe - Official Trailer,How come I'm only now in 2018 hearing about this movie? And only because I was looking at trailers for a different film? This looks like an amazing and uplifting story. I WILL be buying this.,2018-03-07T18:37:12.000Z,0
2016-05-10T16:02:06.000Z,z4l3-_yub5A,Queen of Katwe - Official Trailer,"This movie was robbed of an #Oscar!!!! The storyline, the cast, the scenery just truly impeccable. If the movie was filmed in europe, with the same storyline and an all white cast of they would've crushed the box office and won hella awards.",2018-03-07T01:06:58.000Z,1
2016-05-10T16:02:06.000Z,z4l3-_yub5A,Queen of Katwe - Official Trailer,I watched this in my first period! I loved this so much!,2018-03-07T00:00:55.000Z,0
2016-05-10T16:02:06.000Z,z4l3-_yub5A,Queen of Katwe - Official Trailer,Is her mother from Wakanda?,2018-03-02T10:58:30.000Z,0
2016-05-10T16:02:06.000Z,z4l3-_yub5A,Queen of Katwe - Official Trailer,i watched this film and it’s AMAZING im really upset it didn’t get much hype,2018-03-01T14:41:05.000Z,0
2016-05-10T16:02:06.000Z,z4l3-_yub5A,Queen of Katwe - Official Trailer,Such a good movie,2018-02-25T18:46:46.000Z,0
2016-05-10T16:02:06.000Z,z4l3-_yub5A,Queen of Katwe - Official Trailer,"Damn I forgot how to play checkers, thanks to chess😂😉",2018-02-21T23:55:07.000Z,0
2016-05-10T16:02:06.000Z,z4l3-_yub5A,Queen of Katwe - Official Trailer,Uganda is a shithole. I prefer chess players from Norway 😱,2018-02-21T10:28:27.000Z,0
2016-05-10T16:02:06.000Z,z4l3-_yub5A,Queen of Katwe - Official Trailer,"This is da way my bruddas, we must protect da queen!",2018-02-13T06:57:11.000Z,1
2016-05-10T16:02:06.000Z,z4l3-_yub5A,Queen of Katwe - Official Trailer,Soo happy that I got to meet her about 5 years ago 🙏🏽,2018-02-10T21:33:39.000Z,1
2016-05-10T16:02:06.000Z,z4l3-_yub5A,Queen of Katwe - Official Trailer,"I was actually one of the fist people who watched this movie before it was released, at Giffoni Film Festival in July. Such a beautiful and empowering movie",2018-02-10T18:55:29.000Z,0
2016-05-10T16:02:06.000Z,z4l3-_yub5A,Queen of Katwe - Official Trailer,She clearly knows da wae,2018-02-02T17:00:04.000Z,0
2016-05-10T16:02:06.000Z,z4l3-_yub5A,Queen of Katwe - Official Trailer,*Do you know da we?*,2018-01-21T04:22:03.000Z,1
2016-05-10T16:02:06.000Z,z4l3-_yub5A,Queen of Katwe - Official Trailer,Y los knuckles de uganda?,2018-01-18T16:26:55.000Z,0
2016-05-10T16:02:06.000Z,z4l3-_yub5A,Queen of Katwe - Official Trailer,this is not the tru queen,2018-01-16T18:51:22.000Z,0
2016-05-10T16:02:06.000Z,z4l3-_yub5A,Queen of Katwe - Official Trailer,Looks great!,2018-01-13T21:35:03.000Z,0
2016-05-10T16:02:06.000Z,z4l3-_yub5A,Queen of Katwe - Official Trailer,What's the music at the very beggining?,2018-01-13T19:35:04.000Z,0
2016-05-10T16:02:06.000Z,z4l3-_yub5A,Queen of Katwe - Official Trailer,"so much fucking raw talent is buried in Africa, so much resources, so much potential but it will come out one day.",2018-01-11T03:49:46.000Z,0
2016-05-10T16:02:06.000Z,z4l3-_yub5A,Queen of Katwe - Official Trailer,Which is the song that is playing,2018-01-10T04:11:37.000Z,0
2016-05-10T16:02:06.000Z,z4l3-_yub5A,Queen of Katwe - Official Trailer,This is the way,2018-01-09T12:08:51.000Z,1
2016-05-10T16:02:06.000Z,z4l3-_yub5A,Queen of Katwe - Official Trailer,Hola soy Ariana  marelys moyna vasquez soy de la escuela lago agrio y me gusto la pelicula porque siona es una persona muy valiente  y  ase que sus hijos se sientan orgullosas de  ella ❤😁,2018-01-08T20:29:30.000Z,0
2016-05-10T16:02:06.000Z,z4l3-_yub5A,Queen of Katwe - Official Trailer,ZULUL,2018-01-06T23:33:41.000Z,0
2016-05-10T16:02:06.000Z,z4l3-_yub5A,Queen of Katwe - Official Trailer,"Kampala child fund
Joe uses his funds wisely
some day a pilot",2018-01-04T23:04:17.000Z,0
2016-05-10T16:02:06.000Z,z4l3-_yub5A,Queen of Katwe - Official Trailer,Best movie rate it 100 out of 100 u lot have to watch dis,2017-12-29T21:36:30.000Z,1
2016-05-10T16:02:06.000Z,z4l3-_yub5A,Queen of Katwe - Official Trailer,I read the book a few years ago and now i cry for the film.,2017-12-29T11:02:06.000Z,0
2016-05-10T16:02:06.000Z,z4l3-_yub5A,Queen of Katwe - Official Trailer,Looks like a great movie.,2017-12-27T21:08:53.000Z,0
2016-05-10T16:02:06.000Z,z4l3-_yub5A,Queen of Katwe - Official Trailer,small one can become big one ...,2017-12-27T20:05:56.000Z,0
2016-05-10T16:02:06.000Z,z4l3-_yub5A,Queen of Katwe - Official Trailer,Name of the song please.,2017-12-24T22:05:50.000Z,0
2016-05-10T16:02:06.000Z,z4l3-_yub5A,Queen of Katwe - Official Trailer,Eu pensava que o filme foi feito n Nigeria! Afinal é n Uganda.,2017-12-16T09:26:19.000Z,0
2016-05-10T16:02:06.000Z,z4l3-_yub5A,Queen of Katwe - Official Trailer,I saw the movie 3 times and I cried. Now I'm looking this and I cried too 😭,2017-12-02T13:56:41.000Z,0
2016-05-10T16:02:06.000Z,z4l3-_yub5A,Queen of Katwe - Official Trailer,I am from Uganda. This movie means a lot❤,2017-11-10T04:45:01.000Z,1
2016-05-10T16:02:06.000Z,z4l3-_yub5A,Queen of Katwe - Official Trailer,Her accent is so adorable 😊,2017-11-06T13:04:53.000Z,0
2016-05-10T16:02:06.000Z,z4l3-_yub5A,Queen of Katwe - Official Trailer,"My summary of the movie (ENTIRE MOVIE, CONTAINS SPOILERS)
Phiona lives poorly with her mother, and her younger brother Richard. Her mom's enemy, Night, who is also Phiona's sister, hangs out with a man named Theo, who is seen as a bad character. Phiona walks and stumbles upon a playgroup that specializes in chess. When the teacher, Robert, notices her standing outside, he invites her. She kept coming, where she even got fed. Phiona was treated badly by the other kids by how bad she smelled,  but hung around to learn not to play chess. She soon discovered that she was slowly devoting her life to chess. She began to play more games and beat the #1 player in the playgroup. She continues to play, and beats everyone she plays with. She gets entered into contests with older kids, until she was to be found at a worldwide serious match of chess. Phiona tries hard to beat the enemy and ends up losing. She then starts to regret everything. She runs outside in the snow and cries. Robert comes outside and comforts her. ""I acted too soon, you were not ready."" He said. When they arrived back home, she starts to get more practice. When she gathers her courage, she goes to another contest, with a full grown adult from Russia, who she managed to somehow beat. Everyone cheered. Back at home, the next day a gloomy storm ran over Uganda. Harriet (Phiona's mom) had unknowingly asked Night to watch over Richsrd while she ran a few errands. The storm flooded the streets about 3 feet up. Richard remained on a hammock, screaming for help. Harriet runs in to save a Richard. When she meets Night, Night confesses she was out with Theo. Then Phiona came along. Harriet and Night fought for good 5 minutes until Night exclaimed ""I'm pregnant."". The next days after, every house was destroyed, causing Phiona and her family to live on the streets again. As for Phiona, she never gave up. She kept winning against others, and every time she won, she got some sort of money. That brought Harriet to buy a house for the family. Then, after that happened, Phiona became greedy, she got her hair done every time she got an award and she was too lazy to do anything. Robert confronted her. ""You must get up"" he commanded. Phiona listened. She did not like her greedy self either, but she had fallen into that hole. She began to quickly change. Night had her baby, and after doing loads of praying to the gods, her and Harriet became friendly. Everyone became friends.",2017-11-05T20:54:41.000Z,1
2016-05-10T16:02:06.000Z,z4l3-_yub5A,Queen of Katwe - Official Trailer,What a wonderful movie. An inspiring life story with many beautiful life messages. Loved it! Thank you all for making this such an amazing movie.,2017-11-01T23:31:03.000Z,0
2016-05-10T16:02:06.000Z,z4l3-_yub5A,Queen of Katwe - Official Trailer,Whos is here for leona,2017-10-03T14:53:09.000Z,0
2016-05-10T16:02:06.000Z,z4l3-_yub5A,Queen of Katwe - Official Trailer,omg she's so pretty though ;-; <3 can't wait to see the movie looks like a heart warmer,2017-09-06T11:50:41.000Z,0
2016-05-10T16:02:06.000Z,z4l3-_yub5A,Queen of Katwe - Official Trailer,"I love it! The movie, mmmmh, lupita nyong'o my Country mate",2017-08-31T08:18:21.000Z,0
2016-05-10T16:02:06.000Z,z4l3-_yub5A,Queen of Katwe - Official Trailer,I REALLY WANNA SEE THIS MOVIE!!!!!!,2017-08-10T14:20:38.000Z,0
2016-05-10T16:02:06.000Z,z4l3-_yub5A,Queen of Katwe - Official Trailer,beautiful,2017-07-31T09:46:09.000Z,0
2016-05-10T16:02:06.000Z,z4l3-_yub5A,Queen of Katwe - Official Trailer,Wаtch Queеn оf Kаtweее onlinе in hd quаlitу hеrе => https://twitter.com/ebf277f813c32758f/status/822756794648784897,2017-07-30T03:58:43.000Z,0
2016-05-10T16:02:06.000Z,z4l3-_yub5A,Queen of Katwe - Official Trailer,What is the title of the song on the background?,2017-07-23T13:52:24.000Z,0
2016-05-10T16:02:06.000Z,z4l3-_yub5A,Queen of Katwe - Official Trailer,Finally I've found hd Queeeeen of Кatwe moviе herе => https://twitter.com/ebf277f813c32758f/status/822756794648784897,2017-07-23T02:54:07.000Z,0
2016-05-10T16:02:06.000Z,z4l3-_yub5A,Queen of Katwe - Official Trailer,"I just watched it and it is so good, it's now my favorite movie",2017-07-12T04:32:27.000Z,0
2016-05-10T16:02:06.000Z,z4l3-_yub5A,Queen of Katwe - Official Trailer,This looks very good,2017-07-11T19:05:46.000Z,0
2016-05-10T16:02:06.000Z,z4l3-_yub5A,Queen of Katwe - Official Trailer,"0:37 
- What's your name?
- Uvuvwevwevwe Onytevwevwe Omebumen Osas
- 😐",2017-07-10T11:13:57.000Z,0
